product_id,ratings,reg_date,article_headline,article_content,help_count,is_photo_review
4364300386,5,2021.03.05,헤드부분에 쿠션이 있는것 처럼 불빛이 빛춰서 시켰더니,"헤드부분이 나무였네요.불빛이 헤드에 쿠션있는것처럼 사진을 찍어서 있는것인줄 알고 시켰더니 나무라네요.
as도 12개월로 적혀있지만 2년으로 계약이 되어있다네요·
반품비 비싸서 그냥 씁니다.
나무라고 설명좀 해 주셨으면 선택 안했을텐데 아쉽네요 ㅠ
제가 잘 못 본 것이라니 쩔수 없네요

상품평 고칩니다.
며칠을 써보니 참 좋습니다..
헤드부분 쿠션 아니어도 아무 상관이 없네요~
머리 부딛치고 박을까봐 염려했는데 그럴리도 없네요~

요즘 꿀 잠 자고 있습니다.
감사합니다.

AS확실하게 해 주셔서 감사합니다.

추천합니다.

이 가격에 정말 좋은 제품입니다.",0,False
4364300386,5,2021.03.04,쇼파겸침대경 사용중입니당!,저는흙침대랑카우치 같이 구매해서 사용하다 넘좋아서 우리시엄마두 사드렸어요ㆍ가성비도좋고 넘 무맘에들고 후휘안하네요ㆍ설치기사 님께서도 친절하세요ㅡ적극 추천합니다ㅡ후회안하실거에요ㅡ,0,False
4364300386,5,2021.01.22,,침댐싸이즈도 생각보다 더 넓고 쿠션감도 적당해서 매우만족합니다^^감사합니다,0,False
