product_id,ratings,reg_date,article_headline,article_content,help_count,is_photo_review
4529393727,5,2021.05.14,,"침대가 생각보다 훨씬 이쁘네요~
냄새도 많이 안나요ㅎ
전체적으로 깨끗했어요~
기사님이 너무 친절하게 설명을 잘해주셔서 정말 감사했습니다~~~!!
사진만보고 매트리스가 밑에도 낮은거라 생각했는데
배송온거보고 두꺼워서 놀랐네요
위에 선택사항에 추가 목록이 있었으면 싶어요
그래도 우리 큰딸이 자기 자리라고 좋아해서 다행이네요~!!
번창하세요",2,False
4529393727,5,2021.04.29,조립식이라 이가격에 허약해보이나 튼튼함. 매트좋음^^,,0,False
4529393727,5,2021.03.27,흔들리고 냄새난다하여 걱정했는데 괜한걱정이였네요,"기사님이 친절히 설명해주시고 뚝딱 설치
아이들이 너무좋아하고 떨어지지않을것 같은 아이들이 바로 자서 너무좋으네요",3,False
4529393727,5,2021.03.18,,,0,False
