product_id,ratings,reg_date,article_headline,article_content,help_count,is_photo_review
1831465812,1,2021.01.27,망가짐,확인두 안하구 조립하고나니 사진처럼...조립후는 교환이 안된다하여 반품은 못하나 영 찝찝하네요(그래두 새건데) 조립설명서두 인쇄가 넘 연해서 보는데 힘들었음요,4,False
1831465812,3,2021.05.17,전당드릴 필요해요. 단단하게 조립이 안되요,,0,False
1831465812,4,2021.05.27,좋아용< 잘쓰고 있습니닷~,,0,False
1831465812,4,2021.03.13,,"물건 좋습니다. 튼튼하고 색상도 좋아요.
심지어 예쁘기도 하구요.


다만, 28일 수령하여 확인하니 주문한 화이트가 아닌 베이지 색상이 와서 반품신청을 했습니다.
하지만 예정된 수거일에 수거를 하지않으셔서 쿠팡측과 업체에 두세번 문의를 하였습니다.

그 후, 쿠팡과 업체의 답변을 들은 후 생각하게 되더군요.
문의한 날로부터 재회수까지 7일이 더 소요된다고 하고....그러면 거진 한달....
사실 급하게 사용해야하는 책상이 었는데 제품이 잘못왔으니 사용도 못하고, 교환하고 싶어도 교환은 안되고 반품만 되어서 반품 신청한건데..........
회수까지는 시간이 걸리고, 그렇다고 반품안한 상태로 다시 구매하고 반품할 물건은 수거때까지 집에 두는것도 제품이 어디 망가질까봐 불안하고 집도 복잡할 것 같아 이래저래 고민이 되더라구요.
그래서 반품신청 13일만에 반품접수 철회하고 제품 조립해서 사용하기로 했습니다.


제품은 진짜 좋아요. 튼튼하고 색상도 괜찮구요. 하지만 역시 화이트로 맞추기 위해서 일부러 화이트를 선택했는데 그렇게 사용하지못하니 좀 아쉽습니다.

그리고 조립시 바퀴다실 때는 전동드릴이 필요하실거에요. 드라이버로는 힘들어요....
전 부품도 한개 없고, 바퀴에 나사박는 구멍쪽 철판 4개중 1개가 찌그러져서 와서 편다고 고생 좀 했습니다.
세대주께서 철공소 하셔서 왠만한 공구가 있어서 쉽게했습니다만, 사실 이래저래 아쉬운 부분이 많습니다.



근데 물건 진짜 예뻐요ㅠㅠㅠ
너무 예뻐서 화가 날 정도루요...
그러니 다른 분들에게는 잘 부탁드립니다.
오배송안되도록.......ㅠㅠㅠㅠㅠ",1,False
1831465812,5,2020.12.13,,,0,False
