product_id,ratings,reg_date,article_headline,article_content,help_count,is_photo_review
1504536593,1,2020.10.20,사진을 보세요,"헤드 있는거 헤드없는거 각각 1개씩 두개를 주문했는데
10월 8일 주문 10월 17일 도착 급해서 로켓으로 주문했건만
일반 주문보다 훨씬 늦어 미치는줄 알았음다 . 한진택배로 오구여...
제품은 두놈다 말이 안나올정도로 엉망입니다
온통 천지가 쇳가루에다 틀 자체는 녹이 누렇게 붙어있고
페인트는 다 벗겨져있고 구매하고자 하시는 분은 사진을
한번 보시면 웃음만 나올겁니다
세상에 어떻게 이런 제품을 판매할 생각을 했는지 어이가
없어 그냥 웃음만 나옵니다
살짝만 건드려도 페인트가 벗겨질 정도로 허술합니다
어쩔수 없이 1개는 사용 합니다만, 언제까지 쓸수있을까요?
싼것은 인정합니다만, 제품이 어느정도는 쓸수 있어야
하는것 아닙니까?",16,False
1504536593,3,2021.03.13,,,0,False
1504536593,4,2021.03.20,가성비는 좋아요!,"다만 쇳가루가 정말 많이 떨어져요... 리뷰보고 마스크쓰고 청소기들고 조립했어요ㅋㅋㅋㅋ 그리고 많이 무거워요...게다가 가구조립 정말 잘 하는편인데도 불구하고 설명서가 너무 뒤죽박죽이라 성인 여성 혼자 조립하는데 한시간 걸렸습니다,, 안보이는 부분들이 페인트칠이 조금씩 까져있었지만 사용하는거에 큰 불편은 없었어요!",2,False
1504536593,5,2021.05.30,,,0,False
1504536593,5,2021.05.16,,,0,False
