product_id,ratings,reg_date,article_headline,article_content,help_count,is_photo_review
2035042653,2,2021.04.03,,"침대는 정말 마음에 드는데
로켓 설치라고 해서 저는 다음날 받을 수 있을거라고 생각 했는데
설치 기사님들 스케줄을 못 맞추면 아예 못 받을 것 같더라구요
그리고 시간도 저한테 몇시에 갈 건지 통보하시고 대답하기 전에 전화를 끊어버리시더라구요ㅎㅎ
침대는 정말 맘에 드는데 설치 기사님의 스케줄을 맞드려야 침대를 받을 수 있다는게 아쉬웠어요ㅎㅎ
그리고 고객센터에서는 제가 원하는 시간대로 해주신다고 했으면서 막상 설치 기사님은 제가 원하는 시간에 안됀다고 하셔서 제 돈으로 사고 회사 사정 기사님들 사정을 다 맞춰 드리고 구매하고 대략 일주일 뒤에 받았어요
그리고 약속한 시간보다 늦게 오셨어요

암튼 잘 쓰겠습니다ㅎㅎ",1,False
2035042653,4,2021.03.20,,,0,False
2035042653,5,2021.05.05,,,0,False
2035042653,5,2021.01.16,내 인생 첫 침대마련,"기사님 엄청 친절하셨고 말한 시간까지 딱 와주셨어요
전등이나 충전안된다는 후기가있어서 많이 걱정했는데 잘 돼구요 리뷰대로 좀 콘센트가 헐거운것같긴해요 잡아당기지많으면 될것같아요 그리고 생각보다 침대가 낮았어요 참고하세용",1,False
2035042653,5,2020.12.30,,"진쨔 좋아서 후기남겨요
설치, 배송 다 완벽해요 ㅠㅠ기사님들 수고에 감사했어요!!
무엇보다 침대도 진쨔 좋고, 매트리스도 좋은 품질에
다 맘에 듭니다",1,False
2035042653,5,2020.12.11,너무 깔끔하고 예뻐요.냄새도 거의 없고 만족합니다.,,0,False
