product_id,ratings,reg_date,article_headline,article_content,help_count,is_photo_review
207860496,4,2020.07.30,,,0,False
207860496,5,2020.12.11,제가 편백나무를 너무 좋아해서 구매한거예요 후회 없습니다,제가 편백나무를 너무 좋아해서 구매했어요 후회 없습니다,0,False
207860496,5,2020.11.12,향기 솔솔 자연에 잠드는기분,"배송은 기사님이 시간보다늦게와서 엄청 기다렸는데 금방 뚝딱뜩딱 하시고 가시네요
나무항이 솔솔 넘 좋아요
매트없이 둘이자도 충분한 크기라서 ~~^^
좀 큰듯했는데 싱글매트 깔고 옆은 비워서 화장대와 책상 의자대용으로 딱입니다",0,False
207860496,5,2020.10.23,건강해지는 느낌이 듭니다 감사합니다 잘받았습니다,"넘넘 좋아요 건강해지는 느낌이듭니다.
퀸사이즈 주문했는데 약간 여유있는 크기로 제작되어 왔습니다
잘받았습니다 감사합니다",0,False
207860496,5,2020.08.08,,"박스포장되어 와서 넣을자리 지정 해드리면, 기사님이 지정한 곳에 다리 조립 하시고 잘 뒤집어 주십니다. 설치는 10분이면 끝나요. 박스에서 꺼내자마자 편백 냄새가 퍼지는게 너무 좋네요. 평상형 퀸사이즈 프레임만 샀고, 사진에 위에 매트는 별도로 구매한 제품입니다. 퀸사이즈 토퍼인데 침대가 좀더 넉넉해요. 좋네요!",0,False
