product_id,ratings,reg_date,article_headline,article_content,help_count,is_photo_review
4939498238,1,2021.03.29,,"기사님이불친절해
좀짜증났어요.",0,False
4939498238,5,2021.04.28,이 가격에 이정도 퀄리티라니...제품미쳤어요~,"제품 잘 받았습니다. 제품이 튼튼하고 퀄리티가 좋네요!!
무엇보다 이 가격에 이런 성능이라니, 아이들이 두명이나 있어서 서랍장 모서리에 다치면 어떡하나 했는데, 모서리 부분이 다행이 굉장히 라운드형으로 되어 있어서 아이들이 생활하는데도 다치지 않을것 같아 염려를 내려놓았어요.

이번 구매는 잘했다고 생각이들어요~ 조만간에 추가 구매 해야할것같아요!!

배송 기사님도 친절하셨고 저희 집이 2층이라서 들고 올라오시기 힘드셨을텐데 끝까지 웃으시면서 설치해주시는데,
아무튼 전 너무 감사했어요~

저희 별 5개 펑펑 드립니다. 혹시 다른 고민하시는 분들 계시면 제가 쓴 리뷰가 도움이 되시길 바래요~^^",1,False
4939498238,5,2021.04.27,상품 좋습니다. 무겁고 이쁩니다.,"견고하구 배송기사님이 친절하십니다.

상품이 무겁긴 한데 안정감이 있어서 아이가 있는 집에는 가벼운 서랍보다는 좀 무게가 있는 서랍장이 더 안전해보입니다. 아내가 잘 샀다고 합니다.",2,False
