product_id,ratings,reg_date,article_headline,article_content,help_count,is_photo_review
1947609529,4,2021.03.04,조립이 어렵지만 해냈다는 뿌듯함을 줍니다 ㅋ,"하나 이미 쓰고 있어 이만한게 없다 싶어 주문했습니다
먼저번거는 조립된거였어서 이렇게나 조립이 어렵고 오래 걸릴지는 몰랐습니다

이인 일조가 되어 몇시간을 조립하고 잘못 된거 다시 하고 하기를 일박 이일!~ ㅋ
마지막 문짝에서는 집중력이 떨어져서 못하겠기에 놔두고 유투브로 조립기 보고 다음날 했는데도 한참 걸렸습니다.

이리 저리 움직이며 조립하다 벗겨지고 기스나고..ㅠㅠ

조금 더 잘 알아 볼 수 있는 조립설명서가 필요합니다.
동영상으로 만들어 두심 너무나 도움이 되겠고요
유투브도 카메라를 이리 저리 움직이며 보기 쉽게 힌게 이니거든요

어쨌든 완성하고 나니 무언가 해냈다는 성취감은 있습니다
이만한 크기에 주방가전 수납을 깔끔하게 할만한걸 제주에서 찾기 쉽지 않기도 하구요

이걸 주문해서 조립 하실 분들은 유투브에서 공부 좀 하시고 조립하시길 권합니다
머릿속에 순서도 같은 혹은 흐름을 알고 하면 훨씬 시간도 절약 되고 쉬울거에요",0,False
1947609529,4,2021.01.30,화면에 속지말라✔️크다✔️딱내가찾던바로그!수납장!,"뚝딱뚝딱 잘 만드는 신랑 덕분에

간만에 맘에드는 가구 구매해보아요

신랑아니었음 구매못했을듯요;;;

가격도 가격이지만 조립이라는 무거운 짐이라는것✔️

어깨빵가질듯요✔️전동드릴없으면요 ㅠㅠ...


신랑왈: 저땜에 손에 물집생겼데요 (드릴도있으면서)

그만시키래요;; 조립할꺼있음

한건당 조립비 계좌로 붙이라네요...

으....ㅠㅠ;;; 전 드라이버 파라 전동드릴은 잘 다룰줄 모릅니다

오로지 드라이버 하나로 모두 해결하는지라...

그래요 도면은 빨리 봅니다 그런데 드라이버 돌리는 시간이

오래걸려요

내일도 6개의 원목함 조립이 남아있는데...

드라이버하나로 열심히 나사 조여야겠네요,..

아무튼 너무 이쁘고 또 생각보다 너무너무✔️크고✔️

튼튼해서✔️

깜짝✔️놀랬습니다

일단 가구는 두번째 제품구매인데

두번다 성공이네요✔️✔️",0,False
1947609529,5,2021.04.04,,"배송도 빠르고 여기가 가장 저렴하네요 짱 예뻐요
조립하는데 1시간 반 걸렸어요 !",0,False
1947609529,5,2021.03.04,,"대존예....... 집에 전기드릴 있으시고 조립 익숙하시면 조립 별로 까다롭지 않습니다 다만... 구조가 한번 조립하면 돌이킬 수 없는 형식이에요. 설명서가 친절하지는 않습니다. 위 아래 구분 잘 하셔서 홈 위치 잘 파악하셔야 해요ㅠㅠ 저는 판 하나 거꾸로 조립해서 다시 뜯는데 어마무지하게 고생했습니다ㅠㅠㅠㅠㅠㅠ
그런데 진짜 예쁘네요",0,False
1947609529,5,2020.12.20,,사진그대로 넘 이뻐요~조립하기에는 좀힘들지만 보람을 느끼고 더애착이 가네요~,1,False
