product_id,ratings,reg_date,article_headline,article_content,help_count,is_photo_review
4533467300,2,2021.05.30,서랍이 뻑뻑해요 옮겨봐도 똑같아요 ㅠㅠ,,0,False
4533467300,2,2020.09.26,서랍 안쪽에 피스로 연결하지 않고 총으로 박음,"생각보다 별로 입니다. 인터넷으로 구입하는 상품이라구 완전 날림입니다. 이사 한번하면 모두 망가질것 같음
서랍 안쪽도 나사를 이용해 연결하지 않고 그냥 총으로 쏴서 연결해서 서랍 열고 닫다보면 앞 판넬 떨어질것 같습니다.
옷장 바닥도 틀어져 있고 약함 어린아이들 숨박꼭질 한다고 들어가면 그냥 꺼질것 같음",8,False
4533467300,4,2021.01.26,가격대비 굿 / 단 냄새가 있음,"설치해주시는 분도 친절하고 가구도 가격대비 좋은 거 같습니다.
하지만 4일째 가구 냄새가 아서 빼고 있지만...
조금 심해서 ㅠㅠ 별 하나 뺍니다.",4,False
4533467300,4,2020.12.30,,,0,False
4533467300,5,2021.01.29,,,0,False
4533467300,5,2021.01.28,문도 부드럽고 튼튼해보여요,배송이 넘 오래걸린거 빼면 상품은 아주맘에 듭니다,6,False
4533467300,5,2020.10.18,,,0,False
4533467300,5,2020.09.20,,실물이 더 예쁘고 튼튼해보여요.설치기사님이 친절하게 잘 해주셨어요.,6,False
4533467300,5,2019.12.03,무료배송이라서 주문했는데 2층이라고 또 돈을받아가네요,,0,False
