product_id,ratings,reg_date,article_headline,article_content,help_count,is_photo_review
4590091938,3,2021.04.08,,"가구가 싼 이미지가 확실히 있네요.
문닫는 소리 심해요.
약해서 오래 사용은 못 할 것 같아요",0,False
4590091938,3,2021.04.04,가격만큼 합니다,"좋은제품을 저렴하게 사는건 어려운것 같아요..
삼익가구이니까 좀 더 낫지 않을까 기대가 있었는데 저렴한 가격만큼 가볍습니다
좋고 튼튼한걸 원하신다면 더 투자를
해야 할것 같습니다~",0,False
4590091938,3,2021.04.02,,,0,False
4590091938,4,2021.04.07,,,0,False
4590091938,4,2021.03.11,잘 받았어요..,"근데 원래 이리 속이 보이나요??
옷장문이 서로 맞닿지 않아 안이 보이고,
가운데 서랍장도 위에서 보면 안이 보여요",2,False
4590091938,5,2021.05.25,디자인은 괜찮고요 제품이 좀 얇은감이 있네요,,0,False
4590091938,5,2021.02.10,,"맘에드네요 색도예뻐요
감사합니다,",1,False
