product_id,ratings,reg_date,article_headline,article_content,help_count,is_photo_review
19388269,2,2021.05.15,,,0,False
19388269,5,2021.04.05,,,0,False
19388269,5,2021.03.14,생각했던것보다 고급져 보여요 만족합니다~,,0,False
19388269,5,2020.12.20,,,0,False
19388269,5,2020.09.08,장롱 후기,"여긴 대전이구 9일정도 걸렸어요!
설치기사님 혼자서 오시기 때문에 꼭 인력이 필요합니다!!
크기가 살짝 큰편임에도 방이 넓어보여서 좋구요 세련되어보여요
안에도 넓은 편이고 구매 잘 한것같습니다~",7,False
19388269,5,2020.04.28,,"실물로 보니 더더 이쁩니다..
신속, 정확, 친절.. 배송기사님의 왕친절 설치까지 퍼펙트입니돵..
혹여나 새가구냄새 걱정에 공기청정기까지 새로 한대 더 구입해놨는데 냄새도 전혀 하나도 안납니다.. 엄마와 언니를 대신해 대리주문 해주었는데 손품,눈품, 시간품.. 투자한보람이 있네요.. 보면볼수록 이쁘다고 칭찬이 마르도록 합니다.. 업체측의 특별주문제작, 친절전화상담, 배송기사님의 완벽한설치까지.. 번창하세요.. 감사합니다~^^",13,False
