product_id,ratings,reg_date,article_headline,article_content,help_count,is_photo_review
4569827825,1,2021.05.15,,,0,False
4569827825,1,2021.02.03,,"구매완전 비추....... 일단 검정색 부분 막 조립하면서 그냥 까짐.
이미지 보고 구매하면 사기 임.
이미지 보고 구매했다가 이미지대로 오지도 않고 다 따로 다시 구매 해야함.
ㅋㅋㅋㅋ이럴줄 알았으면 다른데서 설치해주는
제품 구매할걸 그랬음.
고객센터 전화해서 그럼 옵션 상품 구매 가능하게끔 만들어야되는거 아니냐니까 다른데도 다 똑같아서 그렇게 못하겠다고함. 즉, 그냥 이미지대로 낚아서 구매하게끔 하겠단 소리....... 조심하세요....",13,False
4569827825,3,2021.04.21,드레스룸으로 사용하기 좋아요,"일단 전에 구입한 제품보다 코너장이 확실히 조립이 어렵네요
조립하는데 한시간정도 걸린듯해요
뻑뻑해서 끼우는데 시간이 좀 걸렸고 나사가 불량으로 비스듬하게 되어 있어 아귀 맞추느라 힘즐었어요
상판도 기스가 있더라구요
퇴근후 조립하느라 기운을 다 빼긴 했지만 완성된 옷방보니 뿌듯합니다
단점은 바닥에 가루들이 많이 떨어져요",5,False
4569827825,4,2021.05.22,내고성이너무약해서선반거치대가떨어졌네요.,,0,False
4569827825,4,2021.04.20,조립할때 욕나오지만 너무 튼튼해서 만족!,"참 이게 제가 조립한 결과물이라서 정이가는 건지 뭔지 모르겠지만 구성품도 너무 많고 무거워서 26살 튼실한 여자가 하기엔 뭐 5-7시간은 걸린 것 같아요 ㅎㅎ

특히 코너형은 가운데 뼈대잡는게 힘들어서 가능하면 2명 정도 사람과, 전동드릴이 꼭 있는게 좋을 것 같아요.

조립과정이 어렵진 않아요. 제가 최근에 이사오고 나서 행거, 책상 등 조립하는 가구를 많이 샀고 이번 행거가 마지막 조립이었거든요. 여러가구들 중에서 이 행거 조립이 제일 쉬운 것 같았네요!

하나 팁을 드리자면 x자 지지대가 짧은 게 있고 긴 게 있는데, 위에가 짧은거 밑에가 긴 거에요. 이게 안맞으면 선반 무거워 뒤지겠는데 아구가 안맞아서 진짜 ㅎㅎ 욕나오더라구요. 나름 잘 보고 설치한다고 했는데.. ㅎㅎ

밑에 구매 비추한다는 후기 보고 조립하면서 속으로 약간의 공감과 함께.. 그렇지만 구입할까 하시는 분들, 혼자서 할수있긴 있고(시간이 오래걸리지만요..작은 부품조립이..있거든요.. 행거봉이라던가..행거봉이라던가..행거봉이요..) 완성본이 만족스러워요.

저는 이전에 쿠팡에서 구입한 만삼천원짜리 흔들거리는 행거(지금은 품절 되었더라구요)랑 같이 매치해놨어욭ㅋㅋㅋㅋㅋㅎ

보라색 벽지에 월넛 색 너무 예쁘져?
엄마랑 같이 행거쓸 예정이에요 ㅎㅎ 엄마가 너무 좋아하시고 방 분위기가 확 좋아져요 ㅎㅎㅎ흐흐흐흐흐흐흐흐

그럼 이만..ㅎㅎ",5,False
4569827825,4,2021.01.10,,조립은 조금 힘들었지만 만족합니다~,8,False
4569827825,5,2021.05.18,,,0,False
4569827825,5,2021.04.21,,,0,False
4569827825,5,2021.01.04,품질 굿! 가격 및 배송비 굿! 공간 활용률 굿!,"제품 설치햇더니 사진 그대로이며, 워내쓰던 행거보다 훨씬 공간을 덜차지함. 배송비도 싸고 배송 빠르고 품질 매우 굿입니다. 믿고사세요 ! 그런데 철제 다리 받침나사 한개가 모자라 보내달라고 요청한 상태임. 다른 나사는 넉넉히 왔고 설치하니 방이 달라졋음 ㅎ",4,False
