product_id,ratings,reg_date,article_headline,article_content,help_count,is_photo_review
1826398524,2,2021.04.03,,"역시나 배송은 완전히 늦습니다.
고객이 이걸 구매한걸 까먹을정도로 늦게까지 만든 다음 갑자기 배달간다고 연락오는 무자비한 배달 서비스...

고객의 사정은 전혀 염두에 두고 있지 않는 최악의 서비스
제대로 하세요 진짜.",0,False
1826398524,5,2021.05.07,,,0,False
1826398524,5,2021.01.11,,,0,False
1826398524,5,2020.11.14,이가격에 괜찮은 제품인건맞아요.,"아이들이 커서 기존주니어장 빼고 바꿔주었습니다.
3,4년 사용예정이라 저렴하면서 괜찮은제품 찾느라 검색 엄청하고 주문했어요.
가격이 저렴이라 보이는곳은 깔끔하고 좋은데 문짝밑이나 문짝위부분등 안보이른곳은 거칠어요.
먼지 닦다 손에 가시박혔어요.(너무 힘주고 닦았나봐요ㅠ)
새가구 냄새는 심하지않아서 배송받은 당일부터 방에서 자는데 무리없었구요.
화이트라 정리다하고나니 깔끔해보이고 다른방이 되어버려서 아이도 맘에들어합니다.",4,False
