product_id,ratings,reg_date,article_headline,article_content,help_count,is_photo_review
1713601406,1,2021.05.21,나무 젓가락인줄....,"ㅋㅋㅋ세상에 나무젓가락인줄 알았어요
겨울옷은 절대 못 걸듯 하고요
왜 상품평을 안보고 그냥 샀나 후회막급입니다
역시 아무리 사소한거라도 가구는 직접 보고 사는게 맞네요
다시는 인터넷 구매 안하렵니다",0,False
1713601406,1,2021.04.20,얇다.옷몇개거니 봉이 휘어진다 ㅋㅋ,,0,False
1713601406,2,2021.05.14,너무너무 부실 옷박스을 올리면 부러질것 같아,여테 본중 최하,0,False
1713601406,4,2021.03.22,바퀴의 나사못크기와 행거의 구멍 사이즈가 안 맞아요,,0,False
1713601406,5,2021.05.15,,,0,False
1713601406,5,2021.04.18,옷 많이 걸기면 옷걸이가 휘어요.,,0,False
1713601406,5,2020.11.22,,,0,False
1713601406,5,2020.11.04,,,0,False
1713601406,5,2020.10.16,,,0,False
