product_id,ratings,reg_date,article_headline,article_content,help_count,is_photo_review
155972113,4,2020.03.09,,,0,False
155972113,5,2020.12.26,,칼라 아이보리인데 고급지고 사이즈 사진보다 크고 넉넉하고 단단합니당. 강추에용,2,False
155972113,5,2020.10.19,,"냄새가 많이 나지 않고 색상도 좋고 뒷마강처리도 괜찮아요
귀엽고 은은한 분위기를 연출해 아들이 좋아합니다",2,False
155972113,5,2020.09.19,,,0,False
155972113,5,2020.06.21,,이불장으로 쓰려고 구매했는데 너무 좋네요,5,False
155972113,5,2020.04.29,,,0,False
155972113,5,2019.05.30,"디자인, 수납 모두 만족합니다",디자인이 깔끔해서 방안 분위기가 살고 크기에 비해 여유 있는 수납이 가능합니다,6,False
155972113,5,2019.03.27,운동복 속옷등을 보관하기 위한 거실에 둠,"색감, 디자인 너무 마음에 듭니다.",3,False
