product_id,ratings,reg_date,article_headline,article_content,help_count,is_photo_review
4945582010,1,2021.05.14,파손이 된 상태로 와서 교환했습니다.,,0,False
4945582010,2,2021.05.15,,,0,False
4945582010,3,2021.05.24,,,0,False
4945582010,4,2021.04.13,,"각모서리부분에 스티로폼이 끼워져 제품 그대로 상자안에 담겨져 배송이 되었어요.
비닐포장이 없다보니 걸레로 닦아보니 먼지랑 톱밥이 제법 많이 묻어져 나오네요.

뒷판 윗부분 서랍장 윗부분 마감처리가 좀 많이 미흡하고 뒷판엔 얼룩이 좀 많았어요(사진 참고)
그리고 서랍은 레일이 아니고 고정 나무라 열고 닫을때 뻑뻑하고 좀 불편해요.(서랍장열고 닫을때마다 톱밥도 조금씩 떨어져서 서랍장에는 자주 안쓰는 물건만 보관^^;;)
특히 밑서랍장은 열고 손을 놓으면 앞부분이 뚝 떨어지면서 식탁이랑 부딪혀요. 조심해야해요~^^;
쓰다보니 안좋은점만 적은듯~^^;;

제품의 냄새는 별로 없었고 디자인은 꽤 많이 마음에 들어요~
며칠 사용해본 결과 지인들도 예쁘다하고 요리보고 조리보아도 우리집과 너무 잘 어울리고~
서랍장깊이도 있어서 제법 많이 들어가고 서랍장 2개나 있는 선반이 3만원초반이면 원목의 퀼리티를 바라는건 욕심이 아닐까 싶기도 하고~
그래서 가격대비 전 좋아요~^^
하지만 호불호는 좀 많을듯~
서랍 사용하기는 좀 불편하고 마감이 좀 미흡하지만 가격보고 예쁘게 막 사용하실분은 괜찮을듯 하고 내가 조금이라도 예민하다 싶으신분들은 고민을~~ㅎㅎ
이상은 지극히 제개인적인 상품평이었습니다~^^

쿠팡체험단 이벤트로 상품을 무료로 제공 받아 작성한 구매 후기입니다.",0,False
4945582010,4,2021.04.12,깔끔한 디자인^^그렇지 못한 마감ㅠㅠ,"전체적으로 연베이지?회베이지? 톤의
나무결 무늬 MDF 수납장입니다.
디자인 자체로는 깔끔하고 예뻐서 어디에나
무난하게 어울리는 서랍장이였어요.
처음 들어보고 무게가 꽤나 나가는지라
수납까지 하니 더더더 무거웠어요 ㅎㅎ
먼지나 분진 등이 많이 붙어있으니
사용 전에 한번 싹 닦아주세요.

2단 서랍으로 되어있고 상단 윗부분은
오픈되어있는 구조라 인테리어용품이나
자주 열고 닫는 약병 등등 수납할 물건에
키가 커도 제약을 받지 않아 다양한
활용이 가능할 것 같아요!!
손잡이가 없는 구조라 튀어나온 부분이 없어
더욱 깔끔하고 걸리적거리지 않아요~

제일 아쉬운 점은 마감이랑 뒷면 합판인데요.
전체적으로 판울 붙일 때의 재단이 일자로
깔끔하게 되어있지 않은데다가 본드도
좀 지저분하게 붙어있어서 다소 지저분해보여요.
서랍 2개의 합판 소재와 색 등이 달랐는데
자투리 목재를 이용해 만든것 같은게
서랍은 바닥도 그렇고 다 조금씩 다르네요...

가장 아쉬웠던거는 뒷면 합판 두께입니다.
약 2mm 정도의 아주 얇은 합판으로
되어있는데 상단은 오픈 구조인데다가
너무 얇아서 손으로 흔들면 움직이는데다가
잘 못 디디거나 실수라도 하면 쉽게
파손될 정도의 내구성이라 걱정이지만
벽에 딱 븥여 사용한다면 덜 하지 싶네요.

그리고 이미 받은 날 서랍 표면에 눈에띄게
도드라지는 스크래치가 있는데가 본드로
붙여놓은 겉판이 들려서 뜯겨 있었어요.
교환고민을 했으나 귀차니즘이 저를 이겨버렸고
그 부분만 들여다 보고 있을 생각도 없는지라...
사실 굉장히 신경쓰여서 고민 많이했네요ㅎㅎ
무게도 나가서 택배기사님들도 고생이구요ㅠㅠ

디자인도 색상도 너무 맘에 들었지만
마감이 깔끔하지 못한 점이 너무 아쉽네요.
뒷면 내구성 및 무게도 좀 아쉬웠어요.
미니 화장대 정도의 서랍장으로
간단한 소품이나 잡다한 물건들 안보이게
정리하는데 사용하면 좋을 듯하고
상단 오픈장을 어떻게 활용하느냐의 따라서
인테리어나 분위기도 달라져서 사용하기 나름!!

쿠팡체험단 이벤트로 상품을 무료로 제공 받아 작성한 구매 후기입니다.",2,False
4945582010,5,2021.05.07,,,0,False
4945582010,5,2021.04.30,,,0,False
4945582010,5,2021.04.26,수납공간 굳 재질 굳 손잡이 없어서 안전해용,이거 아주 요물입니다... 우선 흔들리거나 하지 않을 정도로 무게감 있구요 색도 너무 이뻐요 저는 처음에 사실 오 예쁘넹 이렇게만 생각했는데 할머니께서 보시고 만져보시더니 탄탄하고 좋다고 하셨어용 할머니들께서 이런 말 하시면 뭔가 암묵적으로 검증되는 거 뭔지 아시죠.. 그리고 튀어나온 손잡이가 없고 오른쪽 윗부분에 잡고 열 수 있도록 설계가 되어있어서 진짜 좋은 거 같아요 뭔가 보기에도 그렇고 딱 깔끔한 느낌?? 그리고 저는 서랍 위에 공간을 화장대처럼 만들어서 스킨로션을 올려뒀어용 수납공간도 넘 좋구.. 정말 감사합니다 이거 진짜 좋은 거 같아요!!,0,False
4945582010,5,2021.04.22,,"쿠팡체험단으로 선정되어 이제품선택^^ 받았구요
포장박스에서 꺼내자 완제품으로 손댈거없이 왔구요 박스안에 모서리 부분마다 폼이 끼워져 있었구요 손상없이 배송되어 좋았어요
나무라 묵직하긴하네요
갠적으로 서랍여는게 불편하네요ㅠ 서랍에 붙이는 손잡이 구입해서 붙혀야겠네요
이제품이 깔끔하긴하나 안보이는 서랍속이라던지 마감처리가 조금 아쉬운점은 있으나 나쁘진 않아요 저희집에 굴러다니는 차나 커피 넣으니 딱 좋네요 주방이 깔끔해지긴 하네요^^ㅎ
감사히 잘 사용하겠습니다^^~",0,False
4945582010,5,2021.04.18,,"미니 서랍장이라서 침대옆에 둬도 되고 기존 서랍장에 위에
더 얹이는것도 가능하네요
소소한 잡동사니를 정리할때 좋아요
크기가 적당하고 화이트우드라 맘에들었어요
그러나 실상에서 써보니까 서랍이 잘 안열려요
따로 문고리나 손잡이같은게 없고 오른쪽 모서리로
손가락을 넣어서 서랍을 열어야해요
그게 너무나 불편한데 1단은 그래도 열리긴 해요
문제는 밑에 2단 ㅠㅠ
거긴잘 안열려요
성격급한사람은 안될듯 합니다
크기보시라구 폰케이스를 넣어봤는데요
세로로는 안들어가네요 아담한 크기의 미니 서랍장이에요
잔잔하게 폰이나 시계 올려두는 용으로는 갠찮고
많이 수납하는 용은 아니에요 ㅎㅎ

쿠팡체험단 이벤트로 상품을 무료로 제공 받아 작성한 구매 후기입니다.",0,False
4945582010,5,2021.04.11,,"택배도 파손없이 잘 왔어요!!!

화이트톤이라 깔끔하고, 마침 수납장 필요했는데 ㅠ 넘 좋아요!!!
서랍도 2단이라서 분리해서 보관이 가능하고!
손잡이 부분이 오른쪽위쪽에 구멍 뚫려있어서 열기도 쉽네요

제일 위에는 뚫려있어서 화장품이나 악세사리나 자주 사용하는 것들 올려두고 사용해도 좋을 거 같아요!!
조금 무겁지만 그만큼 튼튼해서 오래쓸 수 있을 거 같아영

쿠팡체험단 이벤트로 상품을 무료로 제공 받아 작성한 구매 후기입니다.",0,False
4945582010,5,2021.04.08,,"브랜드 BANDI 반디

http://m.bandimall.co.kr/
생활용품 제조ㆍ판매


사이즈 mm
가로 385 세로 235 높이 355


컬러 위시 ( 옅은 베이지 색 )


재질 MDF
[ Medium Density Fiberboard ]
중밀도 섬유 판재
원목과는 달리 수축과 팽창이 없고,
휘어짐도 없으며 단단하다

규격 2단서랍 & 상단 빈 공간
검게 보이는 부분이 손잡이 역할하는
구멍이고요.
공기 순환 역할을 합니다.


용도 크기가 크지않고 작지않아
다양하게 이용할 수 있어요

출입문 앞에 KF94 ㆍ80 마스크 보관
화장실 안에 비누ㆍ치약ㆍ수건 보관
거실 안방에 자질구레한 것들 보관
양말ㆍ 생리대ㆍ 팬티 등등
어린이 방에 각종 학용품

그리고
상단 빈 공간에는
각종 소품을 놓아서 장식 가능해
인테리어 효과


가격 31,400원

단순 서랍장의 2만원대 제품들도 있어서
약간 비싼 듯하나
용도가 다양해 쓸모가 있어요",1,False
4945582010,5,2021.04.08,가격대비 깔끔한 외관!! 만족☺️,"⭐️쿠팡체험단 리뷰입니다⭐️

장점::
저렴한 가격
외관상 깔끔하고 우드톤 인테리어와 찰떡. 심플하니 어디에나 다 잘 어우러진다.
조립식이 아닌 완제품!! 조립식은 귀찮기도 하지만 어딘가 모르게 완성하면 어설퍼서 완제품 선호하는데 만족이었어요
생각보다 작은 사이즈! 침대옆에 간이 화장대를 만들고 싶었는데, (매트리스만 깔아서 작은 화장대가 좋아요) 딱 적당해요!!
새 가구지만 이상한 냄새 안나구 그냥 딱 나무냄새나요!!
손잡이 튀어나와 있지 않아서 종아리나 발목에 손잡이땜에 긁힐 일 없고 디자인 상으로도 이뻐요

단점::
뒷부분 찍었는데 좀 허술해요! 난 뭐 가격대비 만족이다만..
그리고 서랍이 바퀴로 연결이 안되어있구 그냥 빼다보면 다 나오는?? 아예 분리가 되는? 애더라구요.
조금 아쉬웠어요! 바퀴달린애가 안정감이 있어서..


그래도 전반적으로 만족하고 잘쓰겠습니다!!!! 딱 필요했던 차에 받아서 좋네용

쿠팡체험단 이벤트로 상품을 무료로 제공 받아 작성한 구매 후기입니다.",2,False
4945582010,5,2021.04.07,완전 좋아요 빠른배송에 좋은 품질,"고1 여고생입니다 :>
우선 저는 제 방 장롱 서랍에 무게는 생각 안하고 속옷이랑 옷이랑 속바지랑 다 넣어서 사용하고 있었는데 역시 무게를 못 버티고 밑으로 가라앉아버렸어요...

그래서 안그래도 마침 속옷 속바지 담을 적당한 서랍을 구매하려했는데
쿠팡 체험단에 초대되었다는 알림을 보고.. 헉
제가 안그래도 구매했어야했던 서랍을 쿠팡 체험단에 초대받아 로켓배송으로 빠르게 받아볼 수 있었습니다 ☺️

우선 배송! 배송은 스티로폼으로 안전하게 도착했습니다 :D

그리고 서랍 사이즈가 너무 크면 놔둘데가 없고 너무 작으면 또 다 안들어갈까봐 걱정했는데 속옷 넣을 저한텐 딱 적당해요! 위에 서랍아닌 공간도 있어서 다른 통같은거 위에 올려놔도 좋을것같아요 :)
제 책상 아래에 보관통이 몰빵..? 좀 쌓여있어서 보기 안좋았는데
이 서랍 위에 작은통같은거 몇개 올려놓고 사용해야겠어요!

그리고 한 서랍 다 차면 아래서랍이 남아있는데 거기에도 따로 자잘한것들 모아놔도 괜찮을것같구요

무게도 저한텐 너무 가볍지도않고 무겁지도 않아서 딱 적당한 것 같아요! 튼튼한 것 같네요

그리고 위에서 말했듯이 서랍 위 공간에 암것도 올릴거 없으신 분들은 인형같은 거 장식해도 이쁠것같아요
덕질하시는분들은 위에 인형이랑 슬로건 그런거 올려놔도 될것같구요!

서랍크기가 너무 크지도 않고 물건 조금 넣을수있는 거 찾으시는 분들은 이 서랍 사셔도 될 것 같아요!

쿠팡체험단 이벤트로 상품을 무료로 제공 받아 작성한 구매 후기입니다.",1,False
4945582010,5,2021.04.07,아이 학용품 정리대로 사용.,"책장옆 공간에 공간박스를 두고 위에 학용품들을 꼽아두고 자그마한 플라스틱통엔 지우개나 풀같은걸 놓아두고 사용해요. 아직 따로 책상이 없이 거실테이블에서 공부를 하거나 그림을 그립니다.
위에 그림물통이 3칸으로 나뉘어있어서 거기 연필 볼펜같은걸 나눠 담고 다른통들을 재활용해서 가위나 짜투리 색연필같은 것도 꼽아두는데 공간박스 위애 통들로 올려두니 아이가 급히 꺼내다가 통을 몇번 엎은적이 있어서... 이 서랍장은 제일 윗칸이 옆에 칸막이가 되어있어서 더이상 통을 엎을 일은 없을꺼 같네요. 둥근 처리는 아니지만 손을 급히가다가 손을 찔릴만큼 그냥 네모모양 모서리가 아니고 살짝 깍여있어서 손 다칠 위험도 좀 줄어들꺼 같아요~ 서랍장 공간이 두칸 있어서 플라스틱통을 치울까했는데 통들과 사이즈를 맞춘거마냥 딱 올라가서 플라스틱통도 그대로 두고 서랍장 안에는 아이가 좋아하는 색종이나 테잎같은걸 널어뒀고 밑칸에는 작은 수첩들을 넣어뒀어요. 나중에 따로 수납공간은 크게 없는 기본적인 책상을 사줄려했는데 거기 위에 올려서 사용하면 좋을꺼같아요ㅡ 기존에 있던 공간박스보다 가로길이가 길어서 조금 삐져나와요. 이건 제가 사이즈를 제대로 체크를 못했네요
무게는 꽤 무겁게 안정저이고 깔끔합니다. 서랍장에 바퀴 안달린 원목을 처음 써보는 아이는 처음엔 문이 슝 나와서 놀랬어요 조금히 열어야된다고 알려주면 될꺼같아요 서랍장이 생기기 전과 후 정리사진도 올려봅니다 ㅎ 근데 서랍장 옆부분 못질?같은게 삐져나오진 않았는데 흉이 보여서 그건 좀 아쉽네요...

쿠팡체험단 이벤트로 상품을 무료로 제공 받아 작성한 구매 후기입니다.",0,False
4945582010,5,2021.04.07,인테리어에 적합한 색감과 쾌적한 수납공간,"주문일 4/6 (화) 오후 5:30경
배송일 로켓배송으로 4/7 (수) 12:15분경

배송 상태 & 포장 상태 : good
색감 : 사진과 같음
크기 : 매우 아담함

방을 예쁘게 꾸미는 거에 관심이 많아서 작은 수납장을 사볼까 생각만 하고 있었던 찰나 쿠팡체험단에 선정되어 둘러보던 도중 마침 사이즈도 딱 맞고 예쁜 수납장을 발견하게 되어 구매하게 되었어요.

로켓배송이라 하루만에 와서 기다릴필요없이 받을 수 있었고, 안전하게 상자에 스티로폼으로 고정된 채 배송이 와서 조금의 흠집도 없이 받을 수 있었네요.

색깔은 약간 우드톤의 베이지 색깔이라 화이트 톤의 방과 어울려요. 튀지 않는 색감이라 어디에도 어울릴 듯 해요.

미니 2단 우드 서랍장이라 공간울 많이 차지하지 않는데 비해 수납은 윗부분까지 3단으로 가능하니까 너무 좋아요.

처음에 포장박스에서 꺼냈을 때 약간의 냄새가 나긴 하는데 심한 정도가 아니라서 괜찮아요. 잠깐 문 열어놓고 환기시키고 나면 안날 것 같아요.

서랍장도 잘 열려요. 부드럽게 열리는대신 허술하게 열리지 않는다는 점이 정말 좋네요.

아이들 침대 옆이나, 좌식책상 옆에 두고 사용하면 정말 유용하게 사용할 수 있을 거에요.

색감은 사진에서 보는 것과 같고, 높이도 높지 않고, 폭도 좁아서 굉장히 아담하니 사용하기에 좋네요.

서랍장 위에 작은 화병이나 인테리어 소품으로 꾸며도 보기 좋을 것 같아요. 저도 이것저것 올려두었는데도 너무 보기 좋아요.

더군다나 색감이 따뜻해서 인테리어 용으로도 손색없네요.

서랍장 내부도 굉장히 넓어서 여러가지 수납해놓아도 될 것 같아요. 서랍장이 좁고 불편하면 수납도 안되고 안 좋잖아요
그런데 이건 서랍장도 폭이 넓고 수납장이 두개나 있으니까 부담없이 아무거나 담아도 될 것 같네요.

인테리어를 어떻게 하느냐에 따라 느낌이 달라질 것 같아요.


-쿠팡 체험단의 체험후기입니다-

쿠팡체험단 이벤트로 상품을 무료로 제공 받아 작성한 구매 후기입니다.",4,False
