product_id,ratings,reg_date,article_headline,article_content,help_count,is_photo_review
4355637567,1,2021.03.29,배송 느림 설치 상품 설치 안 함 서비스 불친절 비추,"이쪽에서 몇~달을 기다려도 배송을 안하길래 어쩔 수 없이 월요일 피해서 배송해달라 했는데 월요일에 배송옴 + 설치 공간 마련해달라했는데 그냥 물건만 띡 놓고 감. 그럴거면 왜 배송기사 일정에 맞춰 오매불망 기다려야하는지도 모르겠고 배송기사가 오는 시간에 없으면 반품비용? 왜 내야하는지도 모르겠네요. 어차피 설치도 안하는 상품 놓고 가면서 배송기사 일정에 굳이 맞춰서 기다려야 할 이유가 있는지? 서비스 매우 불친절하네요 ^^

거기에 문짝 안 맞음. 까진 부분도 있네요 ㅋㅋ 다른 곳에서 마감 안좋고 상태 불량인 파손상품들 막 보낸다더니 맞는 얘기였네요 ^^; 물건 검수를 하고 보내는 건지 그냥 막 되는대로 보내는 건지도 의문인데요ㅋㅋ

굳이 여기서 사야할까요? 괜히 여기서 사지 말라는 평이 있는게 아니에요 다른 곳에서 다른 상품 사시길 추천드립니다~^^ㅋㅋ",1,False
4355637567,1,2021.03.13,여기서 사지 마셈,,0,False
4355637567,5,2021.02.17,,,0,False
4355637567,5,2021.02.06,배송도 빠르고 가구도 넘 이뻐요~,,0,False
