product_id,ratings,reg_date,article_headline,article_content,help_count,is_photo_review
92592130,2,2021.01.31,글쎄요..쏘~쏘~합니다,"서랍장 아랫쪽 발이랑 손잡이는 플라스틱입니다.
그리고 배송이 정말 최악입니다..
요즘같은 시기에 벨 누르기 전 올라온다고 사전 연락없이 오셨구요
얼결에 급하게 문 연다고 마스크 착용 안한 상태에서 맞이하게 되서 기분 별로 안좋더군요.(배달 오신분도 마스크 안한 상태였던거 같아요..너무 경황이 없어 지금 정확히 기억은 안나지만..)
또한 서랍장 한개당 배송료 25천원씩인데 손잡이 설치 안해줍니다.
서랍 손잡이는 직접하라고 하시더군요. 물론 손잡이 다는 방법은 알려주시는데..이런 가구 배송은 처음 겪어서 서비스 점수 빵점 주고 싶습니다",1,False
92592130,4,2020.12.29,배송은 늦었지만 상품은 맘에들어요,,0,False
92592130,5,2021.01.10,,가성비비교에좋은물건같아요ㆍ깨끗하게마무리되어좋아요,0,False
92592130,5,2020.12.16,,,0,False
