product_id,ratings,reg_date,article_headline,article_content,help_count,is_photo_review
70098214,4,2019.02.10,,"사진으로는 잘 안보이는데 광택이 있어요~
그래서 고급스러운 나무 느낌은 아니지만 가격이 저렴하니 감수하고 쓸 만 합니다~
아기용품 담는 용도로 잘 사용하고 있어요^^
아기 있는 집이라 서랍장 라운딩 처리된 부분과 손잡이가 따로 없는 부분이 참 마음에 들어요! 마감은 깔끔하게 잘 되어 있고 서랍도 부드럽게 열리고 닫히네요~
아쉬운점은 서랍 깊이가 좀 얕은 편이에요 차라리 3단이나 4단으로 깊이가 깊은 걸 선택하는 게 더 좋았겠다는 생각은 듭니다. 치수 잘 보고 선택하세요~",0,False
70098214,4,2019.01.22,,깔끔해요 후기에 작다고 해서 걱정했는데 생각보다는 커서 수납이 많이 됩니다. 다만 배송이 엄청 오래걸렸습니다,0,False
70098214,4,2018.09.16,튼튼하고 좋아요 배송기사님도 완전친절하셨음,,0,False
70098214,4,2018.09.16,튼튼하고 좋아요 두개붙여놓으니 이쁨,,0,False
70098214,4,2018.05.05,,"태어날 아가꺼 수납장으로 이케아 가구백화점 다돌다가 발견한거에요
사이즈도 좋고 디자인도 집에있는 가구들과 잘어울려요
다만 가구냄새가심해서 3일정도열어놨어서 별하나 뺐어요",0,False
70098214,5,2021.05.22,,,0,False
70098214,5,2019.03.12,단단하고 아담하고 ..원하던 사이즈...맘에들어요,,0,False
