product_id,ratings,reg_date,article_headline,article_content,help_count,is_photo_review
2280768425,1,2021.04.20,가성비 좋아요,"다만 딱 그가격정도의 퀄리티? 보다 못한 느낌
금고 안에 서랍 문이 플라스틱 재질이라서 힘으로 좀 당기면 떨어질것 같은느낌.
어짜피 금고 안에 있는 수납이라 크게 상관은 없지만....
밖에 열쇠 구멍막는 로고는 자력이 약해서 툭치면 떨어지구요.

조금...많이 허접한 느낌",2,False
2280768425,1,2021.01.30,,,0,False
2280768425,3,2021.01.10,,还可以吧！就是那个商标根本贴不上 ～,0,False
2280768425,5,2021.05.26,,,0,False
2280768425,5,2021.02.20,,굿굿,0,False
2280768425,5,2021.01.04,너무 이쁜디자인이네요 깔끔합니다 많이 파세요,,0,False
2280768425,5,2020.11.20,"이쁜디자인, 지문의 편리성, 견고함",,0,False
