product_id,ratings,reg_date,article_headline,article_content,help_count,is_photo_review
1692714102,4,2021.05.22,,,0,False
1692714102,4,2021.05.20,S자 고리는 많을수록 좋지요,"납작한 S자 고리가 저는 편해서 벌써 몇개째 사는지 모르겠습니다.
이런 용품은 다다익선이예요.
감사합니다.",0,False
1692714102,5,2021.05.15,유용합니다,정대칭형이아닌 짝짝이 사이즈니 참고하세요,0,False
1692714102,5,2021.05.11,,"양쪽 고리사이즈가 달라요.
대와 중 고리입니다.
일반다이소에서 구매하는 고리와는 차원이 다르네요.
단단한 느낌 녹이 안생길것같은 스텐소재입니다.",0,False
1692714102,5,2020.11.21,소재가 스테인레스304라 일단 만족!~,"주방의 정리는 언제나 끝나지 않는 숙제 같아요.
해놓고 보면 뭔가 좀 아쉽고..
그렇다고 필요한 걸 다 갖추려고 하면 넘 꽉 차버리고요.
그래도 그동안 몇번이나 사야지 했던 S자걸이를 결국 구매했어요.

주방에 정리용 봉이 있는데 한쪽 공간은 비어 있지만 S자걸이가 없어서 검색을 했는데..
역시 종류가 넘 많아요..^^;;

다양한 크기와 소재, 가격 비교를 좀 해 본 후에
아이메이트 S자걸이를 선택했어요.
우선 후기가 아주 좋았고요.

무엇보다 소재가 스테인레스304!
스테인레스 304는 좋은 재질이라 선호해요.
물론 그래서 가격은 좀 있었지만
이왕이면 주방에서 사용하는데 녹이 슬면 안되니까요~

크기에서 한참 고민을 했는데 소 사이즈는 크기가 같아서 혹시나 안맞으면 사용하기 어려울 것 같고
대 사이즈는 S자의 위아래 폭이 달라서 어느 곳에나 사용하기에 실용적일 것 같아서 선택했는데
역시나 잘 한 것 같아요!

묵직하고 마감고 괜찮은 편이고
주방에 있던 조리도구를 걸어두니 보기 좋고 사용하기 좋아요~",0,False
1692714102,5,2020.11.20,그냥.믿고 쓰는 제품입니다,"다른 s자 고리를 써봤는데 도금되어 있던거라 녹이 쓸고 그랬는데 이제품은 백프로 스텐이라서 녹이 없네요 그리고 두께도 두꺼워서 정말 단단해요 잘쓰고 있습니다

또 구매 할께요 ㅎㅎ",0,False
1692714102,5,2020.11.08,,,0,False
1692714102,5,2020.08.03,이케아 후크 대용엔 딱 이거,"행거에 쓰던 이케아 후크가 단종 됐는데
그나마 한 쪽 사이즈가 같은 걸 찾아서 다행이에요.

넘 만족합니다.",1,False
