product_id,ratings,reg_date,article_headline,article_content,help_count,is_photo_review
108461763,1,2020.02.18,실망,쿠팡.첫거래부터 어긋나더니..어지간하면 저렴해서 걍 쓰려고했는데 상다리 한쪽이 불량입니다. 계속빠져서 강제로 비스듬히 다시박아서 새상이 헌상됐어요 두번구매는 못하겠습니다!(솔까.저렴하다고 대충 떠넘기면 되는식으로 소비자 우롱하는거같음.),0,False
108461763,1,2018.10.26,,,0,False
108461763,2,2020.02.07,,상 박스안에 물건만 덜렁 속지정도는 있어야하는거 아닌가요? 각 모서리 보호캡은 되어있는데 그 보호캡이 파손되어 상까지 훅 파였네요..교환신청했어요.재배송 되는것은 제발 깨끗한 상품이길 바랍니다,0,False
108461763,3,2020.04.14,딱 가격 정도의 품질,다리가 좀 흔들리고 냄새가 심한 편입니다. 며칠 지났는데도 아직...,0,False
108461763,3,2019.10.03,,,0,False
108461763,3,2018.09.15,,,0,False
108461763,4,2020.12.31,,"마침 아이 공부상이 필요했는데 잘됐어요.
모서리 조심하라고 모서리가드까지 장착해서 왔네요.
꼭짓점들은 둥글었음 좋겠는데 너무 각이 져서..
지나치다 부딪히게 되면 되게 아플것이고 분명 타박상 입을 각이죠.
그래서 가드 안빼고 사용하기로 했습니다.
정사각 테이블이라 직사각보다 활용도가 더 높겠고,
서로 앞뒤로 앉아서 색종이 접기를 하기에도 정사각이라 넓어서 더 나아요.
나무라서 그런지 덩치는 작아도 무게가 많이 나가요.
플라스틱 캐릭터 상만 들다가 이거 드니 무거워요.
요즘 코로나로 온라인 학습을 하는데,
제대로 된 공부상도 없이 학습을 한게 맘에 걸렸는데,
이거 덕에 바른자세로 앉을 수 있게 되었네요.
책상이 생기기 전까지 공부상으로 잘쓰겠습니다.

쿠팡체험단 이벤트로 상품을 무료로 제공 받아 작성한 구매 후기입니다.",0,False
108461763,4,2020.06.11,적당크기에쓰기가볍고좋네요,,0,False
108461763,4,2019.10.28,,크기적당하고 좋아요,0,False
108461763,4,2019.10.20,별하나만 깎을게요,가격대비 단단하고 좋아요,0,False
108461763,4,2019.10.05,,"공간도 덜 차지하고 깔끔함.
3~4인이 쓰기에 적당함.",0,False
108461763,4,2019.08.30,,,0,False
108461763,4,2019.08.18,깔끔하고 색깔 이쁜데 ... 좀 무거워요,,0,False
108461763,4,2019.07.24,,,0,False
108461763,5,2021.05.13,배송도 빠르고 상품도 튼튼하고 혼자나 둘정도쓰기엔 딱인,,0,False
108461763,5,2021.02.05,,"직사각형 상만 사용했었는데 정사각형 상도 맘에 드네요

상품질도 좋아요 견고하고",0,False
108461763,5,2021.01.05,요것,"12/30 쿠팡체험으로 상품을 받았어요.

집이 좁다보니 식탁에 이것저것 많이 올려져 있어요.
하루 세끼 밥먹을 때, 야식을 먹을 때, 친구가 집에 놀러올 때 등등 항상 치워야하는게 부담이 돼서 작은 협탁이 있었으면 했거든요.

이 제품은 완전 정사각형이구요. 색상은 나무 결이 살아있는 나무 색이라 예뻐요. 아! 포장도 꼼꼼히 싸져서 왔고, 나무의 모든 면과 모서리 부분에 보호캡이 싸져있어서 좋았어요. 그리고 다리부분에도 전혀 흡없이 잘 왔구요. 살짝 누르면 호ㅁ을 따라서 접히고 펴져요.

쓰기전에 상판부분을 좀 닦아보니 먼지인지 나무색인지 약간 밤색으로 묻어나오는 게 있어서 서너번 닦으니 없어졌구요.

일주일 좀 안되게 사용해본 결과, 여자가 한손으로 들기에 살짝 무게감이 있지만 너무 만족하며 잘 쓰고있어요. 일단 이것저것 올려놓기에 넓어서 안정감이 있구요. 보통 직사각형 많이 쓰잖아요. 그게 눈이 보이는 부분에만 음식을 올려놓을 수 있으니 약간 좁아보이는데, 꽤 넓은 정사각형이다보니 음식을 마음껏 펼쳐놔도 자리가 비좁은 느낌이 없어요.
내구성도 좋고 꽤 탄탄한 편인것 같아요.
다만 동행분은 이 상의 다리부분이 스텐으로 된걸 처음봐서 고급스러움을 떨어뜨린다고 했어요. 뭐 다리보고 먹을거 아니니까요. 저렴한 가격에 잘쓸수있을것 같아요. ㅎㅎ

쿠팡체험단 이벤트로 상품을 무료로 제공 받아 작성한 구매 후기입니다.",0,False
108461763,5,2021.01.04,가성비 좋은 상,"집에 쉽고 편하게 사용할 작은 상이 필요했는데
아주 마음에 들어요.

가볍게 TV 보면서 밥먹을 때
아이들 간식 상차림
간단한 간식거리 올려놓고 책 읽을 때
사용하기 적당한
상이에요

우선 접고 펴기 아주 쉽고
가볍고
크기도 아주 크거나 너무 작지 않아
적당합니다
가격도 참 착하구요.

거의 매일 사용하고있어요.

쿠팡체험단 이벤트로 상품을 무료로 제공 받아 작성한 구매 후기입니다.",1,False
108461763,5,2021.01.02,색이 예쁘고 모서리 안전 보호캡이 있어서 참 좋아요,"일단 색상이 밝은 나무 색이라고 해야 할까요?(개인적으로 워너비 방바닥 색)
집에 있는 교자상이랑 비교했을 때 서우 다용도 상이 좀 더 컸어요
집에서 쓰던 상다리가 부실해 사용은 안 하고 방치한 했었거든요
특히 저는 밥을 먹을 때도 반 강제로 바닥에서 먹곤 했는데 이젠 허리 곧게 펴고 먹을 수 있어 참 좋을 것 같아요

주문을 하고나서 다른 분이 올린 동영상 후기를 봤는데 상 다리를 팔 때 소리가 꽤 크게 들렸었거든요
그래서 아예 펴놓고 써야 할까 생각하면서 받자마자 상다리부터 펴봤어요
웬 걸?
소리가 거의 안 나네요!!!
안 그래도 소리에 예민한데 너무 다행이었어요
사진 보심 알다시피 색이 다릅니다!!!

밥 먹을 때 써도 좋고 공부할 때 써도좋겠네요

○ 제품명: 서우 네추럴 다용도상

● 주문일자 : 2020. 12. 29 17:03

○ 도착일자 : 2020. 12. 30 12:00

● 배송 : 로켓배송

○ 규격 : 60*60*27.5(± 5mm)

● 재질 : 비닐시트, PB, 스틸다리

○ 색상 : 오크 (나무색)

● 원산지 : 대한민국

○ 판매 금액 : 14900원

★물티슈로 스윽 닦아내도 묻어나는 게 거의 없어요 ★

쿠팡체험단 이벤트로 상품을 무료로 제공 받아 작성한 구매 후기입니다.",1,False
108461763,5,2021.01.01,가격대비 최상의 제품,"* 사이즈

괜찮네요 두 세명 앉아서 밥먹어도 충분한 정도의 크기입니다
높이도 적당합니다 160성인 여성이 앉았을 때 전혀 불편하지 않은 높이

* 색

컬러 예쁩니다
한 번 닦고 사용하세요
정말 어디든 무난하게 잘 어울립니다
생각보다 색이 살짝 밝긴 해요
그래서 더 이쁘다고 생각합니다

*튼튼함

다리 한 쪽 붕 뜨는 것도 없네요
네 다리 모두 균형 잘 맞고
퍽퍽 물건 올려놓고 처버려도 굳건합니다
이건 더 오래 써봐야 잘 알 것 같아요

*배송

잘 포장 되어서 왔어요 모서리 부분과 그 외
다 검은색으로 잘 가려져서 왔네요 마음에 듭니다


*접이식
저기 다리부분 접다가 끼이면 아픈 그런 형태입니다
끼이지 않도록 합시다

*디테일
옆 부분 아랫 부분 모두 꺼시러시가 없습니다
나무 제품을 사면 가끔씩 질 안좋게 꺼스러기 일어나는 것들이 있는데
전혀 그런 것 없이 매끈해서 좋네요

쿠팡체험단 이벤트로 상품을 무료로 제공 받아 작성한 구매 후기입니다.",0,False
108461763,5,2020.12.31,,"사이즈는 제 발이 240인데 가늠할 수 있도록 발 올렸어요 :)
제가 원하는 사이즈라 만족해요
한 면당 하나씩 모서리까지 아주 꼼꼼하게 포장 되어 와서 깨짐 없이 하자 된 곳도 없이 잘 와서 좋아요

상다리쪽에 발이 플라스틱으로 감싸져서 바닥을 잘 지지할 수 있도록 되어있는 것도 좋아요
무엇보다 상 펼 때 부드럽게 펴지고 다른 제품 같은 경우에는 탁탁 소리가 나잖아요 소리도 안 나요

판 마감처리도 잘 되어있더라고요 ㅎㅎ 만족스럽습니다

쿠팡체험단 이벤트로 상품을 무료로 제공 받아 작성한 구매 후기입니다.",1,False
108461763,5,2020.12.31,,"빠른배송 굿!
상자를 개봉해보니 검은 플라스틱의 파손방지커버가 쫙! 덕분에 파손없이 잘 받았습니다.
정사각형의 모서리가 라운드 처리되어있는 깔끔한 디자인입니다
색도 밝아 나쁘지 않아요 바닥이랑 색 무늬 똑같아서 깜놀 했다는... ㅋㅋ 딱 우리집 꺼 였나? 싶었어요
다리도 접혔다 폈다 부드럽게 잘 됩니다

다만 단점이 상판이 얇아 무게있는 사람이 누르면서 일어나면 다리가 휠꺼 같아요 ㅋㅋ 다리밑도 미끄럼방지 처리가 안되어있고 고무가 아니라...바닥종류에 따라 다르겠지만 미끄러지니 조심해야할듯 합니다
그래도 가격대비 요정도면 1-2인용 밥상이나 작업용으로 사용해도 좋을 꺼 같아요

쿠팡체험단 이벤트로 상품을 무료로 제공 받아 작성한 구매 후기입니다.",0,False
108461763,5,2020.12.31,메인으로도 서브로도 활용하기 좋은 제품,"기존에 사용하고 있는 테이블이 있는데 손님이 온다거나 버너를 놓고 전골이나 고기를 구워먹을 때 기존 상만으로는 부족해서 요 상품을 선택해봤습니다.

우선 모서리와 각 변에 안전캡이 씌워진 채로 배송 왔습니다.
안전 캡이 생각보다 부실한게 아닌 튼튼하고 견고하게 만들어져 있어서 버리기 아까운 정도입니다.

평소에도 끼워서 보관 및 사용하고 싶다 하시는 분들은 간단히 세척 후 끼워서 사용하셔도 될거 같아요.
저는 깔끔한 게 좋아서 벗겨서 따로 보관 중입니다.
나중에 이사할 때 끼워서 이동하면 좋을 거 같아요.

상의 깨짐이나 다리의 뒤틀림 없이 온전하게 와서 무척 만족스럽네요.
다리가 무척 부드럽게 접었다 펴져서 손끼임 사고 같은 건 안날꺼 같네요.

다만 사용하시기 전에 상의 윗면 뿐 아니라 전체적으로 두세번 닦아내고 사용하시는 게 좋을 거 같습니다.
만질 때 손에 먼지같은 게 묻어나는 기분이라 가볍게 한번 닦았는데 시커멓게 먼지가 묻어나내요.
저는 윗면, 아랫 면, 다리 모두 세번 정도 물티슈로 닦아준 뒤 사용했습니다.

컬러는 무척 깔끔한 밝은 나무색이라 밥상용도 뿐 아니라 어느 용도에 사용해도 깔끔하게 어울립니다.
사용과 보관 시에 미관을 해치지 않는다는 건 요즘엔 큰 메리트 인 것 같아요.

크기는 넓직한 사각이라 혼자는 물론 간단한 차림이라면 서너명도 가능할 정도로 활용도가 좋은 넓이 입니다.
제가 이 상품을 선택한 이유처럼 버너나 불판을 올려놓고 식사해도 넓직할 듯 합니다.

★제 후기가 도움이 되셨다면 <도움이 돼요> 한번만 꾹! 눌러주세요 ★

쿠팡체험단 이벤트로 상품을 무료로 제공 받아 작성한 구매 후기입니다.",1,False
108461763,5,2020.12.30,,"집에 원래쓰던 상이 낡았는데 마침 체험해보게 됐네요.
색상이 깔끔하고 튼튼해보여서 마음에 듭니다.
책상이다보니 튼튼하고 내구성 좋은게 물건을 살때 가장 중요하게 여기는 부분이잖아요. 이 상은 저렴한 가격에 비해서 매우 튼튼한 상 같습니다. 상 다리부분도 쉽게 부러지거나 부셔지지 않을 것 같고.. 만원대에 판매중인 제품이 맞나 싶어요.
그만큼 가성비가 갑이고 품질이 좋다는 얘기죠.
예전에 비슷한 상을 구입했는데.. 냄새가 너무낫거든요. 자재때문인 것 같은데 , ㅠㅠ 이건 역한 냄새도 덜나서 편백수 한번 뿌려서 사용했네요. 집에 책상이없어서 공부상으로 쓸건데 튼튼한 공부상이 생겨서 기분이 좋네요 ㅎ 감사합니다.

쿠팡체험단 이벤트로 상품을 무료로 제공 받아 작성한 구매 후기입니다.",0,False
108461763,5,2020.12.30,큼직하고 이쁘고 튼튼해요!!,"날씨가 영하 15도까지 떨어져서 매우 추운대도
배송을 하루만에 해주시고 쿠팡맨님들
너무 고생이 많으시네요 건강잘챙기세요

배송 사용후기) 테이블은 사이즈가 60*60사이즈입니다
정사각형이고 생각했던 거보다 큼직하고
깔끔하고 이쁩니다
책상 용도로도 쓸수 있고 밥상으로도
쓸수있고 메인밥상옆에 붙여서
보조 밥상으로도 쓸수도 있습니다
디자인도 정사각형이라서 안정감이 있고
실용적이에요 ^^
다리도 생각보다 견고하고 튼튼해서
배송 받자마자 이것저것 올려놓고
사용을 했습니다
나무 색상도 은은해서 저렴한 느낌은
나지 않기 때문에 보기도 좋아요
참고로 상 다리는 붙어서 오기 때문에
별도로 조립을 할 필요는 없어서
편합니다
잘쓸게요


*가격이 저렴하고 품질도 좋습니다
다용도로 사용할수 있어 실용적입니다
엄마가 잘시켰다고 하시는거보니
좋은제품입니다 !!

쿠팡체험단 이벤트로 상품을 무료로 제공 받아 작성한 구매 후기입니다.",3,False
108461763,5,2020.05.27,,,0,False
108461763,5,2020.03.21,,정사각형은 안써봐서 살짝 고민했는데 저는 이제 정사각형만 쓸것같아요 ㅋㅋ 색상도 못박음도 모두 만족입니다,0,False
108461763,5,2019.09.01,,,0,False
108461763,5,2019.08.27,,,0,False
108461763,5,2019.08.13,,,0,False
108461763,5,2019.05.27,크기별로 사서 회사 기숙사에서 잘쓸듯,서우 상 맘에 들어 두번째 구매,0,False
108461763,5,2018.12.27,,생각보다 큰데 잘쓰고 있어요..깔끔하고 좋고요..,0,False
108461763,5,2018.09.28,,좋아요. 잘 쓸게요. 모서리 부분에 덮개가 있어서 아이들이 있는 집에 위험하지 않을 것 같이요.,0,False
108461763,5,2018.09.17,,,0,False
108461763,5,2018.07.31,,,0,False
108461763,5,2018.07.25,,"잘 받았고 가성비 대비 품질이
기대보다 훨씬 좋아서 만족함
상 깨끗하고 무늬 색 깔끔함
밥상 용도였지만 활용도 높은듯

그리고 제일 중요한건
내 고양이가 미친듯이 귀엽다",10,False
