product_id,ratings,reg_date,article_headline,article_content,help_count,is_photo_review
1448700049,1,2021.04.21,예뻐요.하지만 상다리가 너무너무 약해서 다른제품 샀어요,,0,False
1448700049,1,2021.04.13,상품 상태가..영,"일단 품절 되서 그냥 쓸까 싶은데... 보내실때 상품 검수도 안하시는건지..??
받자마자 얼룩있길래 아 닦이겠지 했는데 안지워지네요 ㅋㅋ
그리고 액자 위는 왜 누런거죠??? 싼값 제대로 하네요 ㅋ",0,False
1448700049,1,2020.09.02,,"별로에요..
모서리도 찍혀서 왔고, 바닥부분 수평도 하나도 안맞아서 덜컹덜컹.. 내구성도 약해보여요. 예쁘기만하네요.",4,False
1448700049,2,2020.12.22,,,0,False
1448700049,3,2021.05.21,,"거실에서 밥먹을때 사용할려고 구매했어요

처음에는 화이트의 민무늬 테이블 살려다가

액자 테이블 사서 사용하지 않을때는

액자처럼 세워두면 이쁘겠다 싶어서 구매했어요

흠집없이 배송 잘 와서 좋은데

테이블 다리가 이상해요

테이블 끝부분 부터 다리 조립된 부분까지 길이가 달라요(사진첨부)

저거때문인지 테이블 펼쳤을때 한쪽 다리 약간 떠있어요ㅠ

그리고 테이블 다리펼친채로 옆으로 세워두면

한쪽 다리 떠있어서 다리 두쪽이 대칭에 맞지않게 조립된게

확실히 잘 보여요

테이블은 마음에 드는데 다리가 별로라 찾아보니

테이블 다리만 따로 판매하길래

이런 얇은거 말고 네모 모양의 두꺼운 다리 구매해서

새로 조립할 예정이에요

혹시나 뜨거운거 올렸다가 다리 힘없어서 무너지면 큰일나니,,,

다리 말고는 이쁘고 좋아요",0,False
1448700049,4,2020.12.08,,"예뻐요 세워두면 그림같구
한달정도 썻는데 기스 많이나네요 ㅠ",0,False
1448700049,4,2020.10.03,,,0,False
1448700049,4,2020.08.23,,"상판은 하이그로시라 닦기만 하면 새제품처럼 깔끔해요.
다만 다리가 약해서 팔 올리고 살짝만 눌러도 기우뚱해요.
다음에 다리만 사서 교체하렵니다.",1,False
1448700049,5,2021.05.23,상 안쓸때 보관이 고민이었는데 괜찮네요!,,0,False
1448700049,5,2021.05.21,,,0,False
1448700049,5,2021.05.17,,,0,False
1448700049,5,2021.04.28,,"진짜 너무 너무 잘산거같아요
가격도 너무 좋고 크기도 딱좋고 색감도 너무 이쁘고
제일 잘샀다고 생각하는것중에 하나가 액자 테이블!
고민하지말고 사세요 너무 이뻐요 튼튼하기까지합니다
정말 튼튼해용
번창하세요",1,False
1448700049,5,2021.03.08,굿,,0,False
1448700049,5,2021.02.21,가볍고 이뻐요,"아이들 공부상으로 구매한건데 넘 이쁘네요
가벼워서 들고 이방저방 옮기기 편하구요 그림도 이뻐서 만족합니다",1,False
1448700049,5,2020.12.11,가족들 마음까지 휘어잡음,"처음에 산다했을 때 뭣하러 사냐며 구박했던 가족들이
오히려 더 좋아합니다 ㅋㅋㅋㅋㅋㅋ
세워두면 분위기가 살고 펼치면 커서 많이 둬도 남네요
너무 좋습니다",2,False
1448700049,5,2020.11.24,,"실물이더이쁘네요
사진보고 망설였는데 진짜액자같아요
모던하우스에서배송했던대 모던하우스제품많이사용해봤는데
믿을만해요 이쁩니당",1,False
1448700049,5,2020.11.22,,,0,False
1448700049,5,2020.11.13,,,0,False
1448700049,5,2020.11.13,,,0,False
1448700049,5,2020.10.13,,"역시 쿠팡..
어제밤에 주문했는데 13일에 바로 받았어요!
급하게 필요했는데 빠른배송 감사합니다:-)",1,False
1448700049,5,2020.10.08,좋아요좋아요,,0,False
1448700049,5,2020.09.04,,,0,False
1448700049,5,2020.09.02,,"생각보다 커서 좋았고 보호필름(?) 떼라고해서 뗐더니
그림 선부분이 원래그런건지아나면 추상화자체에 일부러ㅜ선이 선명하지않은건지 저누일반인이라 모르겠더라고요
걍 전체샷 찍어서 보이는것처럼 깔끔하고 디자인효과있어
너무좋아요 다리접고피는데 부드럽고 이 가격에 만족하겠어요!
음식 올리고 찍어도 이쁘게나와서 넘 좋습니다!",4,False
1448700049,5,2020.08.30,,,0,False
1448700049,5,2020.07.18,,넘 이뿌네요^^ 한쪽에 그냥 세워두 분위기가 다르네요 ㅎㅎ,4,False
1448700049,5,2020.06.09,이뻐요.,"이뻐요. 살짝 무게감 있어서 막 쓰러지지 않아요

그냥 액자로 쓰려고 샀는데 급하면 테이블로도 쓰조모 ㅋㅋ",6,False
1448700049,5,2020.04.27,상품정말 예쁘네요^^,"마니앤솔 액자 테이블 너무 이뻐요^^

쿠팡에 빠른 배송 감사드려요!!!!!!!

상품포장이 깨끗하게 왔네요~
박스를 버리기 아까운정도로
그래서 우선 창고에 넣어 놨어요
나중에 어디 가져 갈수 있을것 같아서 잘 보관 해 놓았습니다.

상면에 보호테이프를 벗겨내라는 문구가 있구요
상품이 깨지지 말라고 보호 캡도 있더라구요 ~

보호캡을 빼내고 비닐을 벗기니
정말 생동감 넘치는 그림액자 테이블이 되었네요~ ㅎㅎㅎㅎ

식탁이 있긴 한데 밥사겸 노트북겸 / 커피도 한잔
티비보면서 쓸만한 테이블을 찾다가 엄청나게 괜찮은 상품을 찾은것 같아요^^

집 벽면에 한폭의 그림처럼 해놓아도 이쁠것 같고 사이즈도 작지 않아서
가벽대비 너무 맘에 드네요~

좋은상품 감사해요
많이 많이 파시구요 대박 나세요^^",9,False
1448700049,5,2020.04.27,짱이쁩니다요 ^^,"마니앤솔 액자 테이블 너무 이뻐요^^

쿠팡에 빠른 배송 감사드려요!!!!!!!

상품포장이 깨끗하게 왔네요~
박스를 버리기 아까운정도로
그래서 우선 창고에 넣어 놨어요
나중에 어디 가져 갈수 있을것 같아서 잘 보관 해 놓았습니다.

상면에 보호테이프를 벗겨내라는 문구가 있구요
상품이 깨지지 말라고 보호 캡도 있더라구요 ~

보호캡을 빼내고 비닐을 벗기니
정말 생동감 넘치는 그림액자 테이블이 되었네요~ ㅎㅎㅎㅎ

식탁이 있긴 한데 밥사겸 노트북겸 / 커피도 한잔
티비보면서 쓸만한 테이블을 찾다가 엄청나게 괜찮은 상품을 찾은것 같아요^^

집 벽면에 한폭의 그림처럼 해놓아도 이쁠것 같고 사이즈도 작지 않아서
가벽대비 너무 맘에 드네요~

좋은상품 감사해요
많이 많이 파시구요 대박 나세요^^",10,False
