product_id,ratings,reg_date,article_headline,article_content,help_count,is_photo_review
88514401,1,2020.03.22,추.천.안.함.,"쿠팡을 애용하고 있지만 이제품은 저렴한 이유를 알겠네요. 아니면 복불복인가여..?? 제품상태가 많이 좋지 않고 상품받자마자 기분이 썩 좋지 않네요. 하나만 그런것도 아니고 거의 대부분 페인트가 까져있거나 조립구멍도 상태가 안좋고 이런걸 받고 누가 좋아하겠나요. 상태가 괜찮은건 상판말고는 없었습니다. 기분좋게 신청해서 그다지 추천하고 싶지 않네요.
사진 첨부합니다",0,False
88514401,1,2020.03.22,,"별 하나도 아까움
페인트 칠은 군데군데 벗겨져있고 가격만큼도 못하는 느낌입니다.
바퀴도 삐그덕 거리고 일단 수평이 안 맞아서 테이블의 기본 역할도 잘 못해요. 돈 좀 더 주고 이케*거 사는 거 추천드립니다. 도색이나 수평 문제를 다른 분들 후기에도 언급했듯이 기본적 검수도 안하는듯해요 비추비추비추 왕비췌",0,False
88514401,1,2020.03.20,,너무 부실합니다.,0,False
88514401,1,2020.03.20,바로 버리고싶을정도......,어무실망,0,False
88514401,1,2020.03.17,,"성질급한탓에 이만한 가격에 빠른배송 기대하며 구매했는데
힘들게 조립하고보니 양쪽 기울기가 달라서 흔들거리네요
줄자로 길이 재보며 이유를 찾다보니 ㄴ자 파이프의 각도가 다르게 만들어진걸 찾게 됐네요 ㅠ..
항상 상품평후기를 읽어보는 스타일인데 이상품은 후기를 읽지도 않고 급하게 구매를 한게 오류였어요
조립하고 이상해서야 상품평을 보니 같은 평들이 올라와 있네요
싸다고하지만 제대로 만들어서 보내주시길 바랍니다",0,False
88514401,1,2020.03.16,최악중에최악,"별점 0이있으면 0을주겠네요 진짜 최악중에 최악이에요
절대사지마세요 녹슬고 누가쓴거같고 그러네요",0,False
88514401,1,2020.03.16,허접한 제품은 팔지도 사지도 말아야죠,,0,False
88514401,1,2020.03.15,,너무 양심불량,0,False
88514401,1,2020.03.15,인건비 재료비 택배비 하면 딱 이가격임,"상품평을 읽어볼걸 ㅡ.ㅡ
기스야 그렇다 해도 조립후~ 책상이 기울어짐~
ㄴ 자 파이프가 더 휘어져서 그런듯요.
싼 맛에 써요",6,False
88514401,1,2020.03.15,,,0,False
88514401,1,2020.03.14,백원짜리라도 성심껏 제작하세요,"딱 돈값만큼하는 제품 이에요 제품을 출고할적에는 검수를 하시던가 파이프의 각도가 90도가되야 상판이 수평을 이루는데 83도로 제작이되어서 볼트를 철물전에서 구매를하고 각도가 맞게 와사도 삽입해서 조립을 완성했네요
제품좀 잘만들어서 납품을 하십시요 다시는 이런제품이 세상에 나오면 안됍니다 명심하세요",0,False
88514401,1,2020.03.13,,어딜봐서 새제품이냐,0,False
88514401,1,2020.03.10,사지마세요,"이런거 리뷰 안다는데 사람들 속지 말라고 올립니다
시발 중고가구에서 산것도 아니고 고물상에서 가져온것도 아닌데
사용감 잇고 칠은 다까져잇고
이사한집에 설치하다 열받아서 이딴 좆같은거 그대로 박스채 던져버렷네요 이런거 사지마세요",50,False
88514401,1,2020.03.04,,"넘하셨죠 그냥 씁니다 ㅡㅡ
코로나 힘든시기에 고생해주신 배송기사님 때문에 ㅡㅡ",0,False
88514401,1,2020.03.04,진짜 별로..,나무는 가루가 엄청많이 떨어지고 구성품들도 설명서와 너무 다르고 처음보자마자 반품상품이 온건지..더럽고 닦아도 뭐가 자꾸 묻어나고 기스도 엄청많고..그래도 사용하려고 조립하려해봤지만 터무니없게 볼트들이 다른제품게 온건지 짧아서 연결도 안되고 커서 들어가지도 않고...진짜 쿠팡에서 주문한것중에 이렇게 맘에 안드는 제품은 또 처음보네요...바로 써야해서 로켓와우로 주문했지만 진짜 화만 나네요,0,False
88514401,1,2020.02.29,,"볼트하나가 다른게 들어와서 판받침4개를 3개만 끼웠습니다ㅜㅜ
높이조절은 조절하는홈이 없어서 약간불안합니다.",0,False
88514401,1,2020.02.28,,"우선 이제품 판매안했으면합니다
배송도착하자마자 조립했고
조립결과 페인트 벚겨지고 다리는 수평이 안맞으며
더이상 아니다 싶어서 쓰레기통에 넣었습니다
사진찍어놓을걸 아쉽지만 화가나서 기냥버렸습니다",0,False
88514401,1,2020.02.27,,,0,False
88514401,1,2020.02.27,,얼마나 일하기가 쳐 싫으면 나사에 쳐 맞지도 않는 드라이버를 쳐 넣었을까 존나 짜증나네 ㅋㅋㄱㄱ 아오 씨발진짜,0,False
88514401,1,2020.02.26,시작은 기분상하지만 괜찮네요 검수 후 판매 강츄,"판매하시는 상품이 맞는건지 의구심이 드네요
반품 온것을 보내신건 아닌지
도장까짐은 기본이고
용접튐(똥)에
닦아도 묻어나는 먼지
상판엣지에 묻어있는 본드까지
최소한의 검수를 하시긴 한건지
반품하기에는 너무 무거워서
제가 재도장해서 사용하는게 나을거같네요
조립을 시작도 전인데
무슨일이 더 있을지 여자인 제가 하기엔 벌써지치네요

철재이니 홀 위치야 가조립하면서
너서트있는 부분은 작지만 힘줘서 조립하니 나사가 들어가긴하고
다리 앞 막는부분 나무 사알짝 홈 위치만 체크되어있는곳만
부서질까 걱정한거빼곤 조립은 쉬웠네요
제품만 용접이랑 도장만 잘되었다면 먼지따위야 날리든 말든
기분좋게 사용했을거같네요
높이 조절하는부분 안쪽에 홀이 없는게 맞는지는 궁금하네요
제가 구멍내서 높이 조절해서 사용해야하는건가요?",53,False
88514401,1,2020.02.21,,"받자마자 짱남 야기저기 쇠파이프가 뜯기져 있고 조립하기가 힘이 들어가서 힘듬 왜 가격이 45프로할인인지알겠음
하....",0,False
88514401,1,2020.02.20,,별 하나도 아까운 제품이네요. 균형이 안 맞아 절뚝거리고 상판도 기울고 얇네요. 쓸수가 없어요. 너무 흔들거려서. 조립한 상태라 반품할수도 없고 정말 화가나네요.,0,False
88514401,1,2020.02.19,,"사지마세요 진심
이거 사면 완제품의 중요성을 알게됩니다
돈더주고 완제품으로된 튼튼한 물건 사세요",0,False
88514401,1,2020.02.19,,"가격이 저렴하긴 하지만 너무 싼티나고 설명서도 없어 처음에 좀 헤맴 나사 조일때마다 칠이 부스러져 나오고 다리도 잘 안 맞아 흔들거리고
상판이 기울어져서 아무리 맞춰도 똑바로
되지가 않음 돈 더 주고 다른거 사세요
후회 막심 다시 풀어서 포장 하기 싫어 반품 안하고
대충 쓰려고 합니다
사무실서 쓸거라 그냥 쓰지만
집에선 절대 쓰지 마세요",0,False
88514401,1,2020.02.17,2~3개월 정도 뒤에 폐기물배출 스티커 구매 예약...,상판에 고정너트가 힘없이 빠짐 조금만 무거운 물건은 못 올려 놓음,0,False
88514401,1,2020.02.15,,,0,False
88514401,1,2020.02.13,,,0,False
88514401,1,2020.02.12,부품을 누가 사용하던거 보내주신것 같네요...,,0,False
88514401,1,2020.02.01,,품질 관리 필수인듯 물건받고 이리 기분나쁘긴 처음이네요,0,False
88514401,1,2020.01.25,,"누가조립해보고 실패해서 휘고
칠다벗겨지고 나사마모까지있는걸
검수도 안하고 그냥보내서
성질나서 반품하려다
이걸로 반품출고 무한반복할까봐
그냥 내가 쓰기로한다
품질은 저급 막쓰다버릴란다",0,False
88514401,1,2020.01.22,,"왠만하면 리뷰안남기는데 아무리 저렴하지만 책상이 수평은 맞아야하는게 아닐까요? 상판만 보면 수평인거같은데 조립하면 들려서 연필이 굴러가서 떨어질정도로 들려있어요 사용하기도 불편하구요
이거 드림하고 더 비싼거 사야겠어요 너무 별로네요",0,False
88514401,1,2020.01.15,별로 불량이 온듯함,조립이 잘안됨 다리부분과 받침부분연결해주는곳에 나사 잘끼워지라고 플라스틱 먼가가들어있는데 이게 헛돌고 자리 이탈함 그래서인지 책상 무지하게 흔들림 키보드쓰는것조차힘들정도로흔들림 버릴예정임,0,False
88514401,1,2020.01.14,프로토타입 상품인듯,"싼게 비지떡이라고 불량왔습니다.
집에 반품보낼사람도 없고해서 대충 있는재료가지고 땜질해서 쓰기로했어요.
다른 고객들한테는 제대로된 제품 보내시길바래요.

상판 고정피스 하나 빠져서왔고
포장도 굉장히 더럽게왔는데, 공장에서 갓 생산된 아이인줄 알았네요.
모든 구성품에 먼지가 뽀예서 물티슈로 닥고 티슈로 한번 더 닦았는데도
나와서 몇번이나 닦았는지 모르겠어요.
연결 부위 땜질대충해서 제대로 연결도 안되있고
높이조절하는것도 고정 홀이 있는게 아니라 그냥 나사로 꽉 물려놓는방식이라
얼마나 버틸지 의문이네요.
아 그리고 상하판 꽂는 구멍도 막혀있어서 드라이버로 직접 깨부쉈습니다.

제품 제재시 모양만 만들고 마무리를 전혀 안하시는거같네요..
모양도 좀 튼튼하게 만드시지..
적당히 쓰다가 바꿔야겠어요.",0,False
88514401,1,2020.01.09,,제품 품질 최저네요...ㅡ.ㅡ 싼것만 찾은 잘못....,0,False
88514401,1,2019.12.28,,상판 균형이 안맞아아요,0,False
88514401,1,2019.12.18,,"작은 나무는 나사랑 안맞아서 조립이 절대 안되구요 다 까져 있는상태로 오고 고정 발판에 플라스틱도 다 찌그러 져있었어요 나사 끼우고 휘어서 부러져서 결국 쓰지도 못하고 버립니다,, 너무 불량상품이에요,,",0,False
88514401,1,2019.12.08,조립하기힘듬,여자들은조립하기 힘들것같음그리고 상판받짐프래임이 너무약함 볼트가너무 짧다,0,False
88514401,1,2019.11.16,,"조립해서 반품하기 그렇네요..

흔들리고 그런건 다 참겠는데

마감이 쓰렉이라서 손목 다 베일거 가테요",0,False
88514401,1,2019.09.06,,질도별루구힘도없구 쓰다가버리겠슴다,0,False
88514401,1,2019.08.25,혼자 사지마세요 사고보다는 니가알아서 나힘들었어,,0,False
88514401,1,2019.08.12,배송을 빠르나 내구성 엄청약하며및 파손품입니다,"구성품인 바퀴없었으며 파손되어있습니다
추천안합니다",1,False
88514401,1,2019.08.12,,,0,False
88514401,1,2019.07.03,,,0,False
88514401,1,2019.05.07,,"별 한개도 아깝다.
왠만하면 고쳐쓰고, 귀찮아서 잘못 주문해도 그냥 쓰는 성격인데 이 사이드테이블은 16,000원도 아깝다
모서리 마킹은 들어가지도 나오지도 않은 에매한 상태고, 높낮이를 조절하는 나사는 짝이 맞지않아 헛돌기만하고 조여지지가 않아 고정을 절대 시킬수 없다. 결국엔 한치수 큰 나사를 사와서 고정시킴.
제품을 제품답게 만들으려는 의지가 1도 안보이는 이상한 물건임.
완전 빡치는 제품",3,False
88514401,1,2019.04.24,,,0,False
88514401,1,2019.04.20,,사용이 편리하나 너무 약해요ㅠ,0,False
88514401,1,2019.04.19,,,0,False
88514401,1,2019.04.08,,지금까지 이런 제품은 없었습니다. 급하게 필요했고 가격이 너무 싸고 로켓배송으로 토요일까지 받을 수 있다는 것만 생각하고 리뷰도 보지 않고 바로 구매했습니다. 제가 너무 경솔하고 오만했다는 생각을 하게 되었습니다. 제 잘못이기에 원망도 불만도 하지 않겠습니다. 혹시 구매를 하시려는 분이 이 글을 읽으신다면 꼭 조언드립니다. 타인의 리뷰에 귀를 기울이세요. 건승을 빕니다.,0,False
88514401,1,2019.03.23,택배뜯고좀그랫다..,스티로폼이 나는 바다에서 주워온 스티로폼쓰는줄알았음 손대니까 다 바스락거리면서 가루되길래.. 드라이버도 서로안맞는 드라이버들어있고 가구에스티로폼가루엄청묻어있고 가구자첸 가격대비나쁘지않은데 저문제점좀 보완좀해주세요,0,False
88514401,1,2019.03.10,,,0,False
88514401,1,2019.03.09,,"나사와 구멍의 위치가 조금씩 틀어져있어서 나서 돌리기 너무 힘들었고 설명서도 없고 겨우 완성했는데 상판의 지지대가 튼튼하지 않은거 같아서 조심조심해야합니다
결국 오래못쓰고 부숴졌습니다",0,False
88514401,1,2019.03.06,,,0,False
88514401,1,2019.03.04,상판 고정이 안되네요. 나사가 헛돌아요.,,0,False
88514401,1,2019.02.19,,"몸체는 스틸이어서 좋은데 상판이 12mm MDF(저가용)인데 재질 자체가 너무 약합니다. 설치중 깨져버렸어요.
상판이 얇다보니 고정나사로 상판고정시 상판 상부에 돌출현상 발생함.
이동시 상판을 잡고 들면 절대 안됩니다.

모서리 엣지부분도 접착이 약해서 떨어집니다.

현재 상태라면 추천하고 싶지 않습니다.
상판을 좀더 두꺼운걸로 교체하면 괜찮은 상품이 될 듯 합니다.",1,False
88514401,1,2019.02.19,,,0,False
88514401,1,2019.02.16,만들어 쓰는데 편하려고 샀다가 망했습니다^^,"복불복 뽑기를 잘못 한듯 하네요.
너무 허접합니다.
판자 깨져와 반품 하려다 아이가 실망한표정으로 엄마가 고쳐주면안되요..하여 그래 그냥 고치자 이까이꺼 저렴하게 샀으니 하며 안맞는균형 마추고판 깨져온 판자 집에있는 판자로 교체 그뒤 실리콘으로 마감처리해 씁니다.
어짜피 밑쪽이라 대충. 쓸만은 합니다.
무엇보다 아이가 좋아하니 다행이죠..

안전하게 배송해준 쿠팡맨님 감사^^
판매자님이 고객이라고 생각해보세요. 기분 안나쁘신가!",10,False
88514401,1,2019.02.13,,,0,False
88514401,1,2019.02.10,,"진짜 싸구려 제품 입니다 지금까지 쿠팡 사용하면서 이런 최악 리뷰는 처음이네요 높이 조절나사 헛돌아요 이유는 나사 들어가는 안쪽 플라스틱 구멍이 없어요 직접 뚫어야해요 그리고 뚫어도 나사가 싸구려라 고정이 안되고 좀 돌리다보면 손잡이 부분 플라스틱 망가져요 ㅋㅋㅋㅋ 그리고 제품 포장상태 촤악입니다 스티로폼 부서져있어서 가루 날리고 들어있는 공구 녹슬어있고 반품 성가시고 싸구려라 그냥 절연테이프 엄청 감아서 높이조정했네요 진짜 사지마요

그리고 쿠팡님 제발 싸구려라도 아무거나 팔지마요 좋은 이미지 망가져요",57,False
88514401,1,2019.02.06,정말 포장도 최악이고 살다살다 이런 허접한 상품은 처음,살다살다 이렇게 허접한 상품은 처음 입니다 포장 스티로폼 가루가 마구 날리고 정전기에 부스러기가 떨어지지도 않고 싼티 줄줄 납니다 테이블 가장자리는 군데군데 벗겨져있네요 쿠팡에서 산 상품중 가장 최악입니다 반품하기엔 다시 포장도 불가능해보이네요,1,False
88514401,1,2019.01.03,덜컹덜컹 휘청휘청,"덜컹덜컹 휘청휘청
손올리면 무게만큼 책상이 내려감. 다리가 |_ 이렇게 있으면 저 구부러지는 부분이 휘청거려서 책상이 기울어짐.
무서워서 음료수는 한번도 못올려봄",9,False
88514401,1,2018.12.11,최악,나사하나가크기도안맞고 그덕분에 겁나 흔들리네요 집중해서공부하라는건가,0,False
88514401,1,2018.09.20,상품평을 유심히 살필것을...,"허접...ㅠㅠ
역쉬 그 가격만큼의 퀄리티..ㅠㅠ",0,False
88514401,2,2021.05.26,,,0,False
88514401,2,2021.05.25,,,0,False
88514401,2,2021.05.24,,"테이블이 너무 덜컹거려요,한 쪽으로 지지되다 보니
한쪽에 팔응 디디면 상판이 흔들흔들 해요

가격이 저렴해서 마감도 깜끔한 편은 아닙니다
둥근 쇠파이프 끝이 마감이 안되어 있어서 파이프 안이 다 보이네요

포장은 괜찮았습니다

식사하는 정도.책 읽는 정도는 괜찮지안
노트북을 사용하거나 공부를 하기엔 적당하지 않습니다",0,False
88514401,2,2021.05.04,,"상품이 왔을 때 박스도 손실 되어있었고 상품도 손실되어 있었습니다..나사를 넣는 구멍도 나사 위치에 맞지 않아서 다시 구멍을 뚫어서 조립했구요. 절대로 사지 마세요..! 딱 가격 그대로 상품이 안좋아요. 상품에 노트북을 올려놓으면 질 부러질것 같았고, 힘이 너무 없었어요 제발 다른거 사세요 다른거ㅓㅓ",1,False
88514401,2,2021.04.22,싼맛에 구매했는데 내구성이 넘 약해요,,0,False
88514401,2,2021.04.18,견고성이 떨어짐,책상위에 책을 보거나 필기른 할 때 흔들거림이 있음.,1,False
88514401,2,2021.04.14,,,0,False
88514401,2,2021.04.04,내겐 40점,"디자인은 나름 괜찮음.
조립도 그리 어렵지 않았음.
하지만 너무 약함. 한 5키로 정도만 올려도 앞으로 부러질거 같음. 아래부분 삼각지지대만 추가로 붙혀도 쓸만하겠는데...",2,False
88514401,2,2021.03.29,그냥그래요,"밑에 나무 받침이 허술해서인지 너무 흔들거립니다~
금방 부서질것 같아요",1,False
88514401,2,2021.03.28,,"쓸만은 한데............높이조절나사 어쩔 볼트와 너트가 같은 방향으로 돌아서 조이지가 않네요
결국 롱노즈 갖고와서 잡고 조이는 이 현실...
조힙하면서 손바닥 아파서 죽는줄
근데 필요하지 않은 연장하나는 왜 넣어놓은건지...
아직도 의문입니다.

구매한 다음날
상판이 기울어져서 수평을 맞추려 했으나......
빠지직.....
새로 다른거 사야겠습니다.",2,False
88514401,2,2021.03.26,,,0,False
88514401,2,2021.03.16,,"사용하기는 좋습니다.높이 조절도 되고 허나 검은 페인트를 분사한거처럼 지저분하게 되어 있는데 굳어서 닦이지도 않는데 조립하고 다시 풀러서 반품하기도 귀찬아서 그냥 쓰긴 합니다.
침대에서 쇼파에서 먹거나 노트북할때 요긴하긴 합니다.",2,False
88514401,2,2021.03.14,책상이 ㄷ자가 아니고 기울어져있어요,,0,False
88514401,2,2021.03.02,,볼트끼우자마자 부러짐 겨우본드접착 실패,1,False
88514401,2,2021.02.18,상판이 넘 휘어있어여,"차라리 돈 조금 더주고 좋은거 사는게 낫겠어요
상판이 휘어서 물건올리기도 불편하고
하부도 부실합니다 ㅠㅠ

제품의 상판은 원래 이렇게 비스듬한게 맞는건가요?
뭘 올려둘수가 없어여 ㅜㅜ",0,False
88514401,2,2021.02.16,,안에 내용물 꼭 확인하세요,0,False
88514401,2,2021.02.15,,,0,False
88514401,2,2021.02.15,,그냥 싼맛에 쓰는중 테이블 수평도 안맞고 바퀴로 허술함 좀더 비싼거 사시길,0,False
88514401,2,2021.02.08,,,0,False
88514401,2,2021.01.31,상품의 길이가잘 안맞아요 .다시는 구입안하고싶네요,,0,False
88514401,2,2021.01.20,,,0,False
88514401,2,2021.01.18,싼맛에 그냥 쓸랍니다,조립이 쉽고 공구도 들어있긴 합니다만 상품보고 깜짝 놀랐습니다. 기스에 얼룩에 기포에 작지만 튀어나오는 등 여기저기 많았어요. 반품하려다 시간도 없고 밝은 색이라 탁자를 자세히 안쳐다보면 됩니다. 아예 하자품을 쎄일한다고 했으면 그런가보다 하겠습니다. 싸긴하니 그냥 쓸랍니다,0,False
88514401,2,2021.01.09,,,0,False
88514401,2,2020.12.23,,"구매후기

장 점
1.착한가격
2.빠른배송
3.조립공구가 들어있음

단 점
1.나사가 하나 덜 옴
2. 테이블 높낮이 움직이는게 생각보다 힘듬
3. 테이블 기둥이 있는 앞쪽은 높고 없는쪽은 낮음
4. 생각보다 불안함 무거운거 올려두면 부러질것같음",0,False
88514401,2,2020.12.23,모서리가 너무 날카로워서 위험해요,그리고 품질도 별로에요,2,False
88514401,2,2020.12.17,불량이네요.,높이조절볼트가떨어져서사용못하고높이조정없이쓰고있네요.,0,False
88514401,2,2020.09.22,,,0,False
88514401,2,2020.09.20,사진에선 조금 낮아보이는데 오면 좀 높아요,빨리옴,0,False
88514401,2,2020.09.15,조금만더 견고했으면 딱인데...아쉽,"재택근무 중인데 책상은 이사하느라 버려서 리프트 업 거실 테이블을 샀다가
그나마도 불편해서 어제 부랴부랴 검색해서 구매, 밤중에 조립함.
사진과 모양은 동일하나 어찌이리 부실한지 ㅎㅎㅎ
그나마 가격이 저렴하고 소파와 높이가 얼추 맞아 허리 아프지는 않을 듯 합니다만
키보드 두들기는 지금도 끌렁꿀렁합니다.

그나마 가볍고 이동이 편해서 마음엔 들지만
조립할 때 진짜 많이 웃었네요.

다리 고정하는 판대기 나사는 장갑 끼고 호랑이 기운이여 솟아나라 하며 고정했습니다.

딱히 추천 드리고 싶지는 않지만 일단 이동식 테이블은 처음인지라 이것이 아주
사악한 제품 수준이라고는 판단 보류입니다.

더 써보고 괜찮다 싶으면 후기 다시 올려볼게요.

큰 기대 없이 코로나 시기를 차분히 극복하는 제품이라 생각하면 될 것 같습니다.",1,False
88514401,2,2020.09.05,,색이 까져있고 싼티가 좀 납니다..감안하고 쓰셔용,0,False
88514401,2,2020.09.04,"허접함
잔기스.까진게 너무많음","허접함
잔기스.까진게 너무많음
세제품이라 하기엔 돈이 아까븜",0,False
88514401,2,2020.07.24,,"진짜 가격만큼만 하는 상품이네요
꽉 조여지질 않아 자꾸 흔들거리고 움직임니다.",0,False
88514401,2,2020.07.13,,,0,False
88514401,2,2020.06.30,,,0,False
88514401,2,2020.06.22,,"침대에 앉아서 노트북 보기엔 사이즈는 괜춘하나 내구성은 의문
조립할땐 상판과 고정대 홀 간격이 안맞아 욕하면서 꾸역꾸역 조립
테이블 위에 무거운거 올려놓거나 책깔고 머리대고 잠깐 눈부칠시 파손의 위험이 있으니 주의 필요
돈 좀 더 보태서 틀실한거 구매하는게 정신건강에 이로움",1,False
88514401,2,2020.06.07,,,0,False
88514401,2,2020.05.20,,일단....뭐 가격대비 그냥 쓰긴 합니다~ 나름 뽑기 운이 좋은 편인데 이번껀 실패에 가깝네요~ 뜯기전에 청소하셔야하구요 톱밥 같은거 거의 그댜로 오는듯 합니다~ 페인트 칠도 여러군데 벗겨져있네요~ 그래도 가격보고 딱 알맞게 만족합니다,0,False
88514401,2,2020.05.13,진짜 별로에요..ㅜㅜ 밑에 기스다나있고 먼지에 ㅜㅜ,,0,False
88514401,2,2020.05.10,수평 하나도 안맞아요. 계속 흔들림 ㅡㅡ,"예쁘긴 한데 수평 1도 안맞고 튼튼하지가 않네요,,, 수평 안맞는게 제일 큰 문제입니다.",1,False
88514401,2,2020.04.15,혹시 저처럼 쓸분들한테 비추드림니다 그냥 책상바침요으로,"책받침 책상으로 추천합니다 전 개인적으로

저렴한걸로 컴뷰터 놓고 쓸려했는대 판단 미스했내요
ㅎㅎ 쓸만해요
단점 잘흔들림니다!!!!!!",2,False
88514401,2,2020.04.14,,부모님이 제꺼보시고 하나 똑같은거 구매해달래서 부모님 집으로 배송시켜드렸는데 잘받았냐고 확인해보니 나사 2개가 없다고 합니다.아버지가 그냥 나사 구해보고 사용하신다곤 했는데 제품보내기 전에 그런건 꼼꼼히 체크바랍니다.,0,False
88514401,2,2020.03.20,,"나무판 부분이 한쪽은 저 색인데 다른 한쪽은 빨간색이에요;
빨간 부분이 자꾸 눈에 거슬려요..세상에나...
조립은 여자인 제가 혼자 할만큼 쉬운 난이도에요.
제품 포장지를 뜯었을때 먼지가 엄청 많았어요.
제품을 모두 닦고 조립을 시작해야 했습니다.
빨간색은..하아..계속 거슬려요..
아직 무거운것들을 올려놔보진 않아서 튼튼함의 정도는 감이 잘 안오지만 가격 자체가 저렴해서 크게 기대는 하면 안될것 같아요.",1,False
88514401,2,2020.03.14,,,0,False
88514401,2,2020.03.13,,우선 쓰던 것이 온듯 바닥쪽 많이 까여있고 지저분합니다. 책상다리 연결 mdf는 앞뒤판 색이 다릅니다. 책상높이조절용 파이프 마감도 없고요. 대체로 허접합니다. 큰 기대없이 가격만큼이라 생각하심 됩니다.,8,False
88514401,2,2020.03.09,,,0,False
88514401,2,2020.03.08,,"가격이 싸서 그럭저럭 쓰려고하는데
공구 없이 조립하기 편하게 만드신거면
책임있게 만들어주셨으면 좋겠습니다..
설명서 없어도 만들수 있는정도로 간단한데
헷갈려서 리뷰로 참고해서 만드려고 했는데
다른분들도 똑같이 높낮이 조절하는 검정큐브모양의
플라스틱 조립기구가 한쪽만 구멍이 뚫려있는건
불량아닌가요? 다행히 집에 드릴이 있어서
뚫었지만 자취하는분들은 같이 온 송곳으로 뚜셔야할꺼같아요. 그리고 높낮이 조절하는 철부분에 구멍에 고정되있어야할 나사가 빠져있어서 구멍뚫고 플라스틱이 밀려서 구멍안보이고 그와중에 검정바퀴모양 플라스틱안에 나사는 왜 박혀있는지 빼다가 참았던 짜증이 한번에 밀려왔네요
그리고 맨아래 바퀴가 수평이 안맞아서 그런지
들리네요 이동하는데는 지장없어서 그냥씁니다.",5,False
