product_id,ratings,reg_date,article_headline,article_content,help_count,is_photo_review
2298569955,3,2021.05.14,이쁘지만 흔들려요,"두개째구매!!!

첫번째 구매 완전 만족!! 무겁고 견고하고 가격좋고!!!

매찌도 맞았고 흠잡을때가 없었는데

두번째 구매......


우와..... ㅋㅋㅋㅋㅋㅋ

매찌 안맞음 귀찮아서 그냥써요

왜냐!! 이렇게 무거운거 가져오신 쿠팡맨님에게 죄송스러워서

감사해서 ㅡㅡ반품은 아닌것같아서 그냥써요

그런데 가격이 올라있어서 헛웃음만나네요

그래도 딸냄이의 최애 아이템입니다

여기서 밥도 먹고 그림도 그리고 다~~합니다",0,False
2298569955,4,2020.12.07,예쁘고 가성비 아주 좋은 제품,"가성비가 아주 좋습니다.
쇼파 앞에 두고 쇼파에서 쓰기도 좋고,
좌식으로 사용하기에도 높이가 높지않습니다.
조립도 간단했습니다.",0,False
2298569955,5,2021.05.24,,"아들냄이 방 책상주문했는데 ㅠㅠ 너~~~무 안와서

임시로 간식도 먹고 책도보고 만응 테이블이어요",0,False
2298569955,5,2021.05.14,이쁘지만 아구가 안맞아 흔들거려요,"무거워요.. 아구가 안맞아 흔들거려요.. ㅠㅠ

처음에 주문한건 단단하고 매찌가맞거든요

그래도 이뻐요 무지 이뻐요

저 두개째 구매했어요 ^ㅡ^ 가격은 많이 올랐네요....
3만7천원대에 구매했는데.. 아이들 미술용품 올려놓을용도로 하나더
구매할려고 보니 가격이 꽤 올랐네요 ㅠㅠ
다른색상 구매하고싶어요",0,False
2298569955,5,2020.12.02,거실 협탁으로 좋아요 :-) 가격도 좋아요^^,내추럴이 주는 따뜻한 느낌이 좋아요.,0,False
