product_id,ratings,reg_date,article_headline,article_content,help_count,is_photo_review
4884271683,1,2021.03.21,,,0,False
4884271683,3,2021.03.30,약해서 벌써 부셔짐,,0,False
4884271683,3,2021.03.22,,"리뷰는 잘 안쓰는데 다른분들 위해 남겨드립니다

제품 로켓이라 하루만에 왔고 조립은 직관적으로 가능합니다
사진과 마찬가지로 마감이라던지 이상한 기스등 제품의 퀄리티가 굉장히 낮아요 상판만 깨끗하길 바랫는데 하얀점들이 붙어서 안떨어져요 군데군데 상처도 엄청 많구요 제꺼만 그런게 아니라 제조 큐씨가 따로 없으신듯합니다

배송간에 이렇게까지 될리는 없을꺼고 그냥 딱 2만원짜리책상이에요
좁은집에 베드테이블정도로 사용하기엔 무리가 없을듯하고 공부용이라던지 데스크탑을 올리기엔 수평도 잘 안맞으니 참고하세요
저는 리뷰보고 퀄리티가 최하급인건 알고 삿고 필요하니 그냥 쓰는데 무리는 없네요

구매하시고 리뷰보신분들은 후회 하실 수 잇을 듯 합니다

나름 크기가 컴팩트해서 그럭저럭 만족합니다",0,False
