product_id,ratings,reg_date,article_headline,article_content,help_count,is_photo_review
157560546,5,2021.03.14,,,0,False
157560546,5,2020.12.12,,나무의 재질과 색상 그리고 상세한 사용설명을 해주셔서 너무 만족합니다,0,False
157560546,5,2020.04.29,가격대비 좋아요,튼튼하고 멋있어요. 색상도 맘에 들어요.,0,False
157560546,5,2020.03.06,,"색도 이쁘고 사이즈도 딱 원하는 거라 너무 좋아요.
다른 사이트보다 저렴하게 샀어요.
원목좌탁 여러 개 비교했는데 해찬솔 좋으네요. 감사합니다.",0,False
157560546,5,2020.01.21,다음에 또 구매하고싶네요,넘 이뿌고 좋으네요 생각했던거 보다 더좋아요~~,0,False
157560546,5,2020.01.10,,,0,False
157560546,5,2019.09.24,친절!! 제품!! 매우만족합니다,매우 만족합니다~~~~^^,3,False
157560546,5,2019.04.30,대만족 입니다,,0,False
