product_id,ratings,reg_date,article_headline,article_content,help_count,is_photo_review
5428391926,2,2019.01.21,,,0,False
5428391926,4,2019.03.09,노트북만 올려놓기 쓰기 좋은 가성비 테이블,"가격대비 좋네요. 너비도 적당해서 노트북 사용 시 마우스패드 놓을 자리도 됩니다.

근데 나사로 완벽히 고정이 안돼 쓰면서 약간 힘 들어가면 각도가 조금 기우니 이점 유의하시기 바랍니다.

그렇다고 무거운 걸 못 버틸정도로 힘없는 건 아녜요.

여기에 세트로 팔걸이받침대 하나 사서 부착시켜 놓으면 좋습니다.

조립 및 분해도 쉬워 이사가거나 할 때도 좋을 듯 싶습니다.",0,False
5428391926,4,2018.10.29,,그림그릴 때 정말편안함 그런데 조립식임,0,False
5428391926,4,2018.06.19,,,0,False
5428391926,5,2021.04.22,,,0,False
5428391926,5,2019.07.03,,"서있늘때는 조금 낮아요

아마도 아빠키가 커서 그런듯해요",0,False
