product_id,ratings,reg_date,article_headline,article_content,help_count,is_photo_review
248278848,4,2020.11.19,,"튼튼하고 배송포장도 단단하게 잘왔어요.
사이즈도 적당하고 매장에서 잘쓰고 있어요",1,False
248278848,4,2020.11.01,추천합니다 든든해요,"조립형 행거샀다가 거의 실패해서 완제품으로 샀어요 조립은 흔들거리고 약하더라구요
매장용이라서 그런지,역시 든든하고 많이 걸리네요
별 하나를 뺀 이유는 아랫쪽에 받침대가 하나 있었으면 개킨 옷도 올려놓을수 있지 않을까 하는 아쉬움에...",1,False
248278848,4,2019.12.30,길이 조절 가능해서 편해요,"옷갯수에 비해 옷걸이가 작아서 큰걸 사려고 알아보는데 이게 완제품이고 좋아보여서 샀어용 ㅎㅎㅎ
일단 완제품이라서 너무 좋았어요
문앞에 배송이 됐는데 너무 무겁더라구요
포장은 뽁뽁이로 꽁꽁 감겨있었어요 테이프로 단단히 포장 돼있어서 뜯기 너무 힘들었죠 ㅠㅠ
길이 조절이 가능해서 편했어요
재구매 의사있습니당",2,False
248278848,5,2021.03.31,정말 튼튼해요,,0,False
248278848,5,2020.09.27,,,0,False
248278848,5,2020.05.18,,,0,False
