product_id,ratings,reg_date,article_headline,article_content,help_count,is_photo_review
70021305,4,2018.09.30,,"어머님댁에 필요하시다하셔서 주문해드렸어요
제일 높은거 하려다가 집 천장 높이가 안되서 좀 낮은걸로 했는데 어머님 키가 작으셔서 높이는 잘 맞고 좋아요
근데 부품 하나가 안와서 엄청 번거롭게 됐어요 ㅠㅠ
부품 하나 없는데 부품만 받을 수 있는게 아니라 제품 통째로 받아야한다네요 ㅜㅜㅜㅜ 그 무겁고 큰걸.......
부품만 빼고 다시 쿠팡맨한테 돌려주라고....
참으로 번거롭고 불편합니다...
설치할때 가보지 않아서 실물은 못봤는데 사진처럼 대충 저런 모양이고 저희가 한거는 몬스*랙?그건데 그게 이쁘고 엄청 튼튼해서 같은걸로 해드리고 싶었는데 높이가 낮은게 없어서 이거 선택했는데 신랑이 설치해보니까 몬스*랙보다 덜 견고하다고 하네요
사이즈는 방 사이즈에 잘 맞아서 좋아요",0,False
70021305,5,2021.01.18,,겁나편함,0,False
70021305,5,2020.01.12,,"설치도 어렵지 않고 생각보다
깔끔해서 좋아요.",0,False
