product_id,ratings,reg_date,article_headline,article_content,help_count,is_photo_review
1929949534,3,2021.01.21,,,0,False
1929949534,3,2020.11.28,파이프길이가짧고길고 안맞음 그림으로만된설명서 개선필요,,0,False
1929949534,4,2021.03.14,,"상품은 이쁘고 좋습니다만, 조립설명이 너무 부실합니다.
하단 선반부분 10개 중 짧은 봉4개는 가장자리,
긴 봉 6개 가운데쪽에 조립해야 맞습니다.
다 같은 사이즈인 줄 알고 조립했다가
중간에 푸르고 다시 조립했습니다
그리고, 바퀴꽂는 양쪽지지대? 위쪽 나사구멍2개가
꼭 안쪽으로 오게 조립하셔야 저처럼 고생안하십니다.
옆에 고리는 첨부한 사진처럼 4개 한쪽으로 일렬고정입니다. 판매상품이미지와 다릅니다.",0,False
1929949534,5,2020.12.06,재구매 의사있어요,,0,False
1929949534,5,2020.11.19,,,0,False
1929949534,5,2020.10.28,디자인 색상 크기 가격 전부 마음에 들어요. 감사합,제 생각대로 크기도 모양도 튼튼해서 마음에 듭니다. 색상도 Red Good.,1,False
