product_id,ratings,reg_date,article_headline,article_content,help_count,is_photo_review
5493740,3,2020.02.08,조립전에 꼭 설명서보고 연습해보세요ㅠㅠ두번하지말고,"조립은 저는 조금 어려웠어요.
혼자하려니 생각보다 커서 좀 힘들고 동봉된 도구가 좋지않으니 손가락도 아프고
나사구멍의 옴폭 패인 부분이 당연히 안쪽일줄알고 설치했는데....그곳이 바깥쪽이라 다시 재조립......
거의 다 조립하고 발견한 저 흠..... 봉만 교환되면 좋겠어요
풀고ㅜ다시 조립할수 없어요.......

조금의 약해보이고 흔들면 흔들리는 느낌이라 불안했는데
성인여자패딩, 롱패딩, 아기들패딩, 유치원가방 두개걸고도 끄떡없어요. 은근 튼튼한거같기도 해요.

조금 아쉬운건 코팅된거라 저렇게 코팅부가 떨어질수도 있다는거..?

조립이야 제가 잘 못한거고
검수 잘 해서 보내주시면 좋겠어요",2,False
5493740,3,2020.02.02,제품 하자 확인후 보내주세요,,0,False
5493740,3,2020.01.30,바퀴가 다 부셔져서 왔어요,,0,False
5493740,3,2020.01.24,불량이 있을 수 있음 아주 튼튼해보이진 않음,"한번 불량이 와서 교환했어요
많이 넣으면 휘청거리긴해요",1,False
5493740,3,2020.01.21,좋아요,,0,False
5493740,3,2020.01.14,,"배송은 빠르네요, 색도 이뿌구요~ 근데 불량이 왔네요... 서랍장 위에 나무 판때기 한쪽 모서리가 찌그러져 있어요...",1,False
5493740,3,2019.12.20,약간부실 부품 방향다른게있어 무시하고 그냥씀,,0,False
5493740,3,2019.12.16,괜찮아요~~~,"가격대비 괜찮아요
조립도 그닥 어렵진않은데 여자라 좀걸렸어요
좀 약한데 만족합니다",0,False
5493740,3,2019.12.13,좋긴한데 불량이왔네요,,0,False
5493740,3,2019.12.11,가성비최고,"가격대비 좋아요
단 사소한 부품이 잘못온다던가 하는 실수는 있습니다
가성비는 최고
3.5 주고 싶었어용",0,False
5493740,3,2019.12.09,,살 때 사람들의 후기 보고 걱정하긴 했는데 나름대로 괜찮네요~ 여자 30대 혼자서도 잘 조립하고 있고 잘 사용있어엄~ 이것 잘 산 것 같아욤,0,False
5493740,3,2019.12.06,서랍장이높아서 코트가구겨지네요,다른건 만족하는데 서랍상판을밑에받치는피스가한쪽은아예붙일생각없이 그냥붕대감듯이칭칭감겨서왓더라구요한쪽은용접해서붙어잇고 순간 짜증이 낫엇는데 그나마 나사못을연결해서 고정이됫으니 다행인거죠 그래서별점을뺏고 코트를 걸엇을때 서랍이좀높아서 밑에가약간구겨지는현상이 잇네요 좀더서랍높이를 낮게햇으면긴코트도 딱떨어지게 걸려서 보기좋앗을텐데 그래서별하나더뺏어요 구매하실때 참고해 주세요,1,False
5493740,3,2019.12.03,,"잘쓰고 있습니다
쓰다보니 서랍이 약하고 틀어져서
그게 아쉽네요",0,False
5493740,3,2019.12.02,,조립하는데 너무 어려웠어요.....ㅠㅠ,0,False
5493740,3,2019.12.02,튼튼하지 못해서 별루입니다,"튼튼할거같아 주문했더니 다 조립해도 흔들흔들
튼튼하지 못하네요
서랍은 천 접은거로 넣고 빼기 뻑뻑하고 옆에 쇠가 날카로워 천 바로 찢어지고...ㅠㅠ...
별루입니다. 비추...",0,False
5493740,3,2019.11.29,,"다 좋아요 크기도 작다는평 보고 사서 그렇게 많이 놀라진않았지만 살짝 낮은 느낌이구요
그런데 서랍장은...사이즈가 서랍이 더 커서 잘 닫히지도 열리지도 않네요.. 넣고 첨 빼자마자 저리 찢어졌어요..
조립다하고 귀찮아서 그냥 씁니다..",0,False
5493740,3,2019.11.28,,"그냥 딱 1년정도 쓰고 버리기 좋은 제품인것같아요.
보이는것처럼 생각보다 견고하진 않습니다.",0,False
5493740,3,2019.11.25,,"첨엔 튼튼하고 좋았는데 겨울옷들 좀 걸어두니 바퀴가 약간 들린거같은 느낌이드네요
그래도 아직까진 괜찮은거 같아요",0,False
5493740,3,2019.11.20,,안에 나사가 헛도는 부분이 있어서 조립하는데 고생했습니다,0,False
5493740,3,2019.11.18,,"상품은 괜찮은 것같아요
그런데 부품이 다 있네없네하시던데 걱정하며 개봉했죠
설명서대로 부품은 다 있어요
있는데 설명서대로 조립하면 부품들이 모자라요
이거 만드신 회사관계자분들 조립한번해보셨으면합니다",0,False
5493740,3,2019.11.18,,"너무 기대가 커서 그런가 생각보다 아쉬웠습니다
하지만 일단 저희 아이방 가구 놓아둘 위치에 사이즈가 딱 맞고
선반의 높이나 서랍형 수납이나 원하던 활용도가 딱 맞아서 잘 써볼께요


아쉬웠던 부분에 대해

1.사진에 첨부된것처럼 흠집이 있었는데 모서리부분을 아래로 하면 되어서
약간의 눌린자국이 있는 아랫면(메이드인 스티커붙어있었던 부분이 아랫면맞는거죠?)을 위로 향하게 했습니다

2.걸이봉부분이 조립 완성된 뒤에도 뭔가 불량품인가 하는 찜찜한 기분이였습니다
철제 아래위 부분 연결되는 부분때문에
다른방향으로 해봐도 나사머리 들어가는 부분이 곡선을 그리면서 통일되지는 않았습니다
걸이봉을 판매사진처럼 바깥으로 (ㅕㅑ ) 이런식으로 해야되는데
걸이봉이 (ㅑ ㅕ) 이런식으로 안쪽으로 하기엔 옷거는것에 대한 활용도가 떨어지잖아요

3.무엇보다 조립완료후 옷을 걸어두니 튼튼함이 좀 부족합니다
철제봉을 잡아보면 흔들거리는 느낌이라고 해야되나..
바퀴는 고정되어있는데 옷을 많이 무겁게 올려두면 바퀴가 부서질것 같구요
무겁게 올려두거나 하진 않겠지만 조금만 더 튼튼했으면 좋았을것 같아요",6,False
5493740,3,2019.11.16,,,0,False
5493740,3,2019.11.04,깔끔하고 예뻐요,,0,False
5493740,3,2019.11.01,아주 좋습니다.,"배송 빠르고 친절하시고
바퀴파손으로 교환신청했는데 다음날 바로 교환해주시고
감사합니다.",0,False
5493740,3,2019.10.29,,깔끔하고 사용도 좋습니다...단 두개 시켜서 그 중 하난 스크래치에 녹이 쓸고 페인트가 오래되서 다 뜨고 나사가 불량인지 구멍이 불량인지 조여지지가 않고 헛 돌아서 열 받음...하자품 같았는데 그냥 조립해서 닦아서 사용...,0,False
5493740,3,2019.10.12,가격도 괜찮고 다 좋은데 설명서 전혀 없고요 볼트 불량,,0,False
5493740,3,2019.10.08,,조립하기가 너무힘들어요~설명서 보고 한시간 넘게보냈네요,0,False
5493740,3,2019.10.06,,"상품은 빨리 배송되어 잘 받았습니다.
맨 윗줄 연결할 때 너비가 맞지않아 결국 나사를 연결하지 못하는 아쉬움이 있네요.
이 가격에는 만족하지만 , 앞으로 물품 검수 잘하셔서 보내주셨으면 좋겠습니다.",0,False
5493740,3,2019.09.09,"녹슬고, 깨지고..","기둥은 녹슬고, 나무 선반은 깨져서 왔어요.
저렴한거고, 반품 귀찮아 그냥 쓰지만..
후회되네요",0,False
5493740,3,2019.08.24,,,0,False
5493740,3,2019.08.18,,"방에 싸이즈 맞추어 사서 만족합니다
조금 아쉬운점 밑에 서랍을 반복으로 물건을 끄내다보니 앞 손잡이 부분에는 괜찮은데 옆에 천이 찍어 찌네요 ㅜㅜ 보와하시면 좋겠어요",0,False
5493740,3,2019.07.11,,"상품 이물질 너무 많이 묻어있고, 특히 한쪽에만 누가 반품한걸 넣었는지 더럽네요
철가루 나사 조립할때마다 계속 흘러내리고
균형도 안맞고 바퀴고정해도 계속 헐떡거리고..
조립을 했으니 반품할 수도 없어서 그냥 씁니다
옷 걸어두고 물건좀 올려놓으니 헐떡거리는개 좀 덜 하지만 균형이 너무 안맞네요
바퀴는 고정풀어도 제대로 돌아가지도 않고...
평생 천년만년 쓸꺼 아니니까 그냥쓰긴 하지만 담엔 돈좀 더 주고 좋은걸 사야겠어요",0,False
5493740,3,2019.07.08,,,0,False
5493740,3,2019.07.02,,"나사크기가 안 맞아서 끝까지 조여 지지 안았던 것이 있고
위 걸이대 길이가 조금 찗아서 나사 중간까지만 들어갔네요.
교환신청 귀 찮아서 그냥 씁니다.",0,False
5493740,3,2019.06.25,조립이 간단하네요.바퀴가 잘 안굴러요,바퀴가 잘 안돌아요~~,0,False
5493740,3,2019.06.23,,행거 바퀴가 하나 누락되어 왔습니다 그래서 바퀴없이 그냥 지지해놓은 상황입니다..크게 불편한것은 없지만 다음부터는 부품이 누락되는 일이 없도록 해주십시오,0,False
5493740,3,2019.06.23,,,0,False
5493740,3,2019.06.23,,,0,False
5493740,3,2019.06.19,,,0,False
5493740,3,2019.06.16,,상품 자체는 만족이에요 근데 조립이 뭔가 설명서가 정확하게 나와있지 않아서 조립했다 풀어서 다시 했네요 상품 자체는 만족입니다,0,False
5493740,3,2019.06.16,,"이음새부분도 떠서 마감이 제대로 안되어 있고 여기저기 색 벗겨진곳도 있고...
서랍위에 판에 조금 무거운것 올리면 양기둥도 휘청휘청~
그리 튼튼해보이진 않아요.
바퀴도 잘 안 굴러가고...
나름 까사마루라 기대했는데 아쉽네요.",0,False
5493740,3,2019.06.13,가성비..가격은 저렴하지만 추천은 안해요,"저렴하게 잘 샀어요.
근데 불량이네요.
중간에 끼우는 구멍이 잘못 뚫린건지 안맞아요.
나사가 안들어가서 한참 애먹다가 그냥 구멍 안끼워도 무너지지 않을거같아서 교환안하고 쓸게요.
조립도 쉽고 간편한데 가격이 저렴한 만큼 기대는 안하는게 좋아요.",0,False
5493740,3,2019.06.10,,,0,False
5493740,3,2019.06.04,,,0,False
5493740,3,2019.05.22,,,0,False
5493740,3,2019.05.20,,딸아이방에 옷걸이가 필요해서 구매했는데 이쁘고 편해요 잘선택한듯 해요~,0,False
5493740,3,2019.05.20,,,0,False
5493740,3,2019.05.09,,제일밑단 받침대 한쪽용접 떨어져서 왔네요...귀찮기도하고 천년만년 쓸건아니니 그냥 사용합니다...,0,False
5493740,3,2019.05.06,,"작년 10월 구매 / 5월 아작난 기념으로 리뷰씁니다
중간 부분 나무가 -왜 그래야 하는지 모르겠지만- 상당히 무거워서
장기간 쓸 시 나무에 박혀있는 암나사 부분이 하중을 못 버티고 나무 조각들과 같이 튀어나오기 시작합니다
그리고 바닥을 지탱하는 가로봉의 맨 끝 부분은 한번 빠지면 계속 빠져서 지탱의 효과가 없습니다
한쪽으로 휘기 시작하면 하중이 계속 그쪽으로 작용하여 점점 뒤틀림이 심해집니다
겨울 패딩 한두개를 못 거네요
가벼운 옷들만 거실거면 저보다 오래 쓰실 수 있을겁니다
저도 더 오래 쓸 수 있었는데 괜히 약한 부분 보수하려다가 더 아작났네요 슬픕니다",0,False
5493740,3,2019.05.02,,조립식이라 좀 그렇지만 나름 조립하니 보기엔 깔끔하네요,0,False
5493740,3,2019.04.29,,지지대가 힘이 없나봐요 한쪽으로 기우네요 싼티 팍팍...,0,False
5493740,3,2019.04.28,생각보다 튼튼하지는 않음.,다 조립했는데는데도 조금 흔들리길래 왜그런가 봤더니 판 나사가 판에서 빠져있더라구요... 이거 어떻게 처리해야되는지.. 풀러서 반품하면 또 조립해야되고...,0,False
5493740,3,2019.04.24,,"제품은 아주 좋습니다... 제가 설명서를 제대로 안읽고 조립했는데...
조립 후에 발견한 불량은...교환이 불가능 하다고 적혀있더군요...코팅이 다 까져있던데...나중에 알아버려서 그냥씁니다....",0,False
5493740,3,2019.04.20,,"첨 박스 뜯을때부터 재포장 한거 처럼 보이게 테이프로 엄청 둘둘 말아 놨어요 뜯어서 하나 하나 조립 하는데 아니나 달라 나사가 삐꾸 였네요 조립 하는데 크게 어렵진 않았어요
근데 옆에 꼬맹이가 번잡시렵게 구찮게 하는 바람에 시간이 좀 걸렸을뿐 다 하고선 나사가 삐꾸인걸 알아서...박스 싸기도 귀찮고 고객 센터에 연락 하기도 귀찮고 그냥 고리 두개 빼서 쓸람니다
근데 저 나사 넣을때 한번 확인이나 하고 넣어주셨으면 좋겠어요
제품은 괜찮아요 널부러지게 걸려있던 게 깔끔하니 정리는 됐네요
공간은 좀더 차지하지만요",0,False
5493740,3,2019.04.15,,,0,False
5493740,3,2019.04.14,,"바퀴가 깨져서 왔는데..
귀찮아서 그냥 씁니당",0,False
5493740,3,2019.04.10,,"아 정말 아쉬워요 ㅠ 두 군데가 불량입니다. 조립을 다 해놓고 보니 그냥 교환할까 그랬나 살짝 후회도 돼요. 디자인도 좋고, 브라운색도 고급스러워 만족해요.
젤 맘에 든 건 실용성입니다. 여러 사이트를 뒤지다가 가장 실용적으로 잘 나와서 구매했어요. 서랍이 있어서 옷에 먼지도 안묻고, 선반이 있어서 모자나 수납함 올려 놓기도 좋아요.
근데 ㅠ 선반 한쪽 나사 구멍이 맞질 않아요ㅠ 어케든 잡아당겨도 보았지만 철을 어찌 제가 ㅠㅠㅠ 그리고 가방 거는 보조걸이도 걍 빠지네요ㅠ 이거 아니면 별 다섯인데.. 나사는 전선 잇는 걸로 이었답니다. 에휴 아쉬워라.. 담엔 무조건 교환해야겠어요!!
이젠 어떤 제품을 사도 불안감이 생기는 건 어쩔수없네요..",0,False
5493740,3,2019.04.05,,,0,False
5493740,3,2019.04.04,,,0,False
5493740,3,2019.04.01,,깔끔합니다 ~,0,False
5493740,3,2019.03.25,조립이 어려워요ㅠㅠ 힘있는 남자가 해야 되요,,0,False
5493740,3,2019.03.21,,,0,False
5493740,3,2019.03.21,,"조립도 쉽게했지만
나무선반하나가 찍혀져왔음",0,False
5493740,3,2019.03.20,,,0,False
5493740,3,2019.03.19,,무거운거걸때어떨지모르지만.봄가을옷걸때는.약하다는느낌은없네요~만족해요,0,False
5493740,3,2019.03.17,,혼자 조립은 절대로 못하지만 완성해 놓고나면 정말 쓸모있고 튼튼하게 쓸수있는 제품이다.,0,False
5493740,3,2019.03.12,,설명서보고 조립하면 어렵지않아요 혼자조립해서 좀걸리긴했어요 조립다하고 모자걸이하나가 나사에 연결이안되서 그것만보내달라고 문의글남겼는데 전체교환해야한다네요 아쉽 그냥안걸고 사용하고있어요 수납함은 냄새가 많이나네요 튼튼하긴하나 불안불안해요 흔들려요 바퀴가있어서 편리하긴해요,1,False
5493740,3,2019.03.11,"예쁘나, 부실합니다. 조립과정에서 부서지기도 했습니다.","완성하니 좋습니다.

조립과정에서 재료가 너무 부실하고 급하게 짜여져 있어서
부서지기도 하고... 잘 안맞고...

암튼 이러저러한 경우의 수가 있겠구나.. 하고 구매하시길..
완성하고도 보기는 좋으나.
좀 부실하니, 튼튼하지는 않습니다.",0,False
5493740,3,2019.03.10,,위에 못을 넣는곳이 안맞아서 짜증났어요,0,False
5493740,3,2019.03.08,그냥 보통입니다,"혼자 조립하는데 조금은 어려움을 겪을 수는 있을 것 같습니다.

서랍장에 냄새도 별로 안좋구요

만족할만한 수준은 아닐 수도 있는데 그냥 저냥 쓸라면 쓸 수 있을 것 같습니다.",0,False
5493740,3,2019.03.08,,"설치를 다 하고 나니 맘에들어요
그런데 밑에 수납하는 부직포가 밑부분이랑 사이즈가 안맞았던지 한쪽이 좁아서 힘으로 밀어넣다가 찢어졌어요 한쪽은 부드럽게 잘 되는데
그리고 한쪽이 우그러져서 와서 힘으로 펴서 설치를 했네요",0,False
5493740,3,2019.03.04,부품별 사이즈가 안맞음,"혼자 조립하기에 조금 버거울수 있습니다.
그리고 각 부품별 사이즈 규격이 정확히 맞지 않아 완벽한 조립은 어렵습니다. 대충 조립해서 그럭저럭 사용 할만합니다. 그러나 추천 하지않고 저렴함 행거가 훨씬 나은듯 합니다.",0,False
5493740,3,2019.03.02,,"딱히 이동식으로 쓰려고 산게 아니라 한 곳에만 두고 사용했는데
겉옷을 많이 걸어서 그런지 몰라도 무게를 못 버티고 부서짐",0,False
5493740,3,2019.02.28,,"상품은 정말 좋습니다
조립하기도 쉽고 설명도 잘 나와있네요.
그런데 서랍 넣는 부분의 막대가 찌그러져서 왔네요..ㅠ
서랍을 넣어서 보이지는 않지만 그래도 기분이 썩 좋진않아요.
그부분만 빼면 나머지는 정말 좋습니다
색상도 마음에 들고요.
견고하고 잘 쓸것같습니다.",2,False
5493740,3,2019.02.28,,,0,False
5493740,3,2019.02.26,,"이케아보다 못한듯 싶네요..
바퀴조립하라고 넣어둔건데, 무용지물 이네요.
저렴하단 생각이 안드는 디테일입니다.",0,False
5493740,3,2019.02.24,상품은 괜찮은데 파손되어왔어요 바퀴 상판부 교환해주세요,,0,False
5493740,3,2019.02.23,전체적으론 만족합니다,나사 하나가 머리가없는 불량이왔네요ᆢ 그래도 전체조립을 마치니 깔끔하니 좋네요,0,False
5493740,3,2019.02.22,약간 부실 하지만 무거운건 올리지 마세요.,,0,False
5493740,3,2019.02.21,,,0,False
5493740,3,2019.02.20,나사하나 불량이라서 별세개,"다른분들은 나사 몇개 없이 왔다고해서 걱정했는데
나사 하나 부러진거말고는 다 알맞게 왔네요
부러진 나사도 어찌어찌 하니 조여지긴해서 그냥 씁니다
생각보다 헹거도 크고 이뻐서 만족해요",0,False
5493740,3,2019.02.17,적당하지만 어렵다.,"아래 판이 헐렁헐렁해요ㅜㅜ
처음조립해서 그런지 무지 어려워요ㅜㅜ",0,False
5493740,3,2019.02.15,튼튼하지않음. 나사가 아~주 잘풀림. 계속 기운다,전혀 견고하지 않음. 나사를 조여도 다음날 한쪽으로 기울어져있음. 옷무게때문이 아니라 빈 상태에서도 기웁니다 ㅠ,0,False
5493740,3,2019.02.13,,,0,False
5493740,3,2019.02.13,,배송은 빠르게 와서 좋았는데 조립은 혼자할려니 1시간 넘게 걸렸네요..근데 다하고 나니 마지막으로 봉을 조립할려 보니 나사구멍이 수평이 맞지않게 뚫려 있어 교환할려 해도 설치한거 다시 풀고 또 새로이 조립하려니 엄두가 안나 그냥 쓰기로 했네요.ㅠㅠ.........,0,False
5493740,3,2019.02.11,,"다 조립 했는데 바퀴 볼트 하나가 아무리 시도해도 안조여집니다.

브레이크 바퀴만 바꾸면 될것 같은데 이것만 따로 보내주세요.

구매 후기에 사진도 남겼어요.",1,False
5493740,3,2019.02.10,,"좋긴한데 한군데 나사구멍 안맞아서 남편이 힘써서
겨우억지로 껴넣음",0,False
5493740,3,2019.02.09,,"제품은 만족스럽습니다
그런데 나무봉 고정 볼트 한개가 요상한게 들어있습니다
나무봉 4개 , 볼트 4개 이어야 하나 볼트 하나가 엉뚱한게 들어있어요


사진 첨부하겠습니다",0,False
5493740,3,2019.02.09,가격대비 튼튼하진 않아요,"사진이나 후기보고 약간 망설이다 사긴했지만 좀 실망스럽긴 하네요
조립도 허술하고 나사도 잘 안맞고 특히 바퀴가 있는 하단부는 제대로 고정도 안되서 억지로 연결해 설치했어요
몸체도 그럴싸한 페인팅이 쉽게 벗겨지기도 하고요
그래도 조립완성하고 나니 쓸만은 합니다
여기저기 이동시키면서 쓴다던지 무거운걸 걸지 않으면 괜찮을것 같습니다
튼튼한걸 원하시는 분께는 비추",0,False
5493740,3,2019.02.09,,나사를 꽉 조여도 자꾸 풀어지는 느낌..,0,False
5493740,3,2019.02.07,,,0,False
5493740,3,2019.02.03,,,0,False
5493740,3,2019.02.03,,대체로 좋음 ..,0,False
5493740,3,2019.02.01,조립하다 실패했어요,지인은 무척 좋다는데 저는 조립하다계속 실패했어요.,0,False
5493740,3,2019.01.28,,"크게 기대는 안했지만 가격대비 괜찬아요
작은듯 하면서 쓸모있어요",0,False
5493740,3,2019.01.27,,,0,False
5493740,3,2019.01.24,,흔들 거려요 ㅜㅜ,0,False
5493740,3,2019.01.22,,"불량이여서 재배송받았는데...같은곳이 또 불량이였어요
그냥 어거지로 끼워서 사용중입니다
수납공간많아 실용적이다 흔들림이 좀 있습니다",0,False
5493740,3,2019.01.21,,불량이 왔으나 아버지께서 수리해주셨습니다. 예쁘고 튼튼합니다. 불량인 점만 빼면 완벽..,1,False
5493740,3,2019.01.18,좋아요,"크기도 적당하고 예뻐요! 수납할 수 있는 곳이 적당히 있어 좋네요, 다만 바퀴 한쪽 끼워넣는 부분이 기스난건지 끝까지 안들어가서 살짝 기울어졌어요",0,False
5493740,3,2019.01.18,,"조립하기도 편리하고 단단해서 사용하기엔 좋은것 같아요~
단지 흠이 있다면 연결 부위(납땜)이라고 해야하나 그부분에 녹이 조금 쓸어 있어서 조금은 불쾌했어요..",0,False
5493740,3,2019.01.17,,생각보다는 조금 허접해요,0,False
5493740,3,2019.01.16,,제품 마음에드네요..짱짱하니~~근데 바퀴가 다부서진 상태로 배송이되었네요..요거 다시 배송해주세요,0,False
5493740,3,2019.01.14,,용접부위가 한군데 떨어져있긴했는데 사용상 불편은 없어서 그냥 사용합니다 전반적으로 괜찮은듯,0,False
5493740,3,2019.01.14,약해요,약해요,0,False
5493740,3,2019.01.13,,생각보다 단단하지가 않네요,0,False
5493740,3,2019.01.10,,"철제 밸런스가 맞지 않고 서랍부분이 부직포라 시간이 지남
떨어질것 같아요~저렴한 가격에 만족하고 그냥 사용합니다",0,False
5493740,3,2019.01.10,,,0,False
5493740,3,2019.01.09,디자인은 이쁜데ㅠㅜ 나사를 끼워도 고정이 안 됩니다.,,0,False
5493740,3,2019.01.08,,"좋음 근데 조립하고 물건 올려놓은상태로 이동하지는마세요

바퀴믿고 밀다간 나무판자에 박힌 나사 빠져서 답없음

나무에 박혀있는 암놈이 빠짐",0,False
5493740,3,2019.01.07,,,0,False
5493740,3,2019.01.05,ㄱㅊ,ㄱㅊ네,0,False
5493740,3,2019.01.03,,,0,False
5493740,3,2019.01.03,,,0,False
5493740,3,2018.12.28,조금만 튼튼하게 해주세요,"쓰기에는 넘 좋습니다
하지만 너무 흔들흔들 약하네요
무게감이 없어서 아쉽네요",0,False
5493740,3,2018.12.28,그냥 그래요,"3달째 이용중입니다
긴 옷을 걸어둘 생각으로 샀는데 아래쪽에 서랍 때문에 긴 옷을 걸면 끌립니다.

처음엔 괜찮았는데
3달만에 행거 옆으로 이동하다가 휘청하길래 살펴보니 아래쪽 이음새가 끊어졌네요..
조심히 이동시켜야 하는 모양입니다. 그럴거면 바퀴는 왜 있는 건지 의문이긴 하네요.

나쁘진 않은데 엄청 견고한 행거는 아닙니다",0,False
5493740,3,2018.12.27,부품이 모자름,다 좋은데 나사 4개가 없어서 맨위에 망으로 된 부분을 조립을 못 하고 있는데 나사 4개 따로 보내주세요,0,False
5493740,3,2018.12.25,,,0,False
5493740,3,2018.12.24,,,0,False
5493740,3,2018.12.22,,,0,False
5493740,3,2018.12.20,찌그러진 제품은 팔지 말아주세요 ㅠ ㅠ,아담하고 디자인도 딱인데 ~~ㅠ 조립하려는데 찌그러져 있어서 조립이 안되더군요 ㅠㅠ 싼가격에 주문햇기에 치그러진 부분 펴서 끼우느라 ㅠㅠ 너무 힘들었어요 다까져서 보기도 않좋구요 나사하나가 조여지지 읺고 헐렁 거려서 그냥끼워만 놨습니다 당연히 바품해야되지만 ㅠ무게가 꾀 나가더라구요 배달해주신 분께 또 힘들게 할까봐 그냥 씁니다 제품 포장하면 당연히 눈에 뛰었을텐데 ㅠ 회사는 싼제품이라고 함부로 팔지 않았으면좋겠어요 ㅠ,0,False
5493740,3,2018.12.17,,상품은 쓰는 용도와 맞는데 너무 약하고 제품이 도장이 까져서 녹이슨 제품이 왔어요 실망입니다,0,False
5493740,3,2018.12.13,보통,"사진대로 이쁩니다
근데 좀 힘이 없는거 같고
양쪽 크기가 안맞는건지 뭐빼고 뭐빼고
맞추느라 고생했네요",0,False
5493740,3,2018.12.12,,"좋은데 나사 불량이 와서 아쉽네요.
조립 전에만 교환이 가능하다고 써있는데
조립을 안해보고 불량인지 어찌 알겠습니까.
하단의 이너나사가 자꾸 튕겨나와서 결국은 보기싫게 철사로 조였다는..
나사 불량만 아니었다면 최고점 줬을 겁니다.
가격대비 괜찮았는데 하아.. 나사불량..",0,False
5493740,3,2018.12.11,,"생각보다 부실
배송이 제대로 안되서 물건이 모잘랐음
그래서 새로 받아서 했어요


그리고 잘 깨져요
조립할때 합판부분 살살 돌려 끼우세요",0,False
5493740,3,2018.12.09,,,0,False
5493740,3,2018.12.09,,,0,False
5493740,3,2018.12.08,괜찮다 한번 맞는지 체크좀...,"조립 물건은 다있었는데 위에 뭐 올릴수있게 되있는거 있자나요
그거 나사 할려했는데 안맞더라구요 그래서 2개는 맞길래 2쪽만 끼우고 반대는 그냥 나사위에 올렸어요 위에 무거운건 안되겠더라구요
적당히 올릴래구요",0,False
5493740,3,2018.12.07,,,0,False
5493740,3,2018.12.06,좋아요,생각포다 튼튼하고 수납도 많이 할수 있어서 좋아요,0,False
5493740,3,2018.12.06,,다 좋은데 조립할때 서랍쪽 나사가 헐렁해요 부품하나가 덜온것같지만 그래도 괜춘,0,False
