product_id,ratings,reg_date,article_headline,article_content,help_count,is_photo_review
200282014,1,2021.05.22,,"일어로 구성되어 있는 설명서라 잘 모르겠어요.

나사로 조립하라는거 같은데, 나사는 왜 미포함인가요?",0,False
200282014,3,2020.10.05,,생각보다 약할거 같아요,0,False
200282014,3,2020.08.17,,,0,False
200282014,3,2020.06.15,,"디자인이며 색상이며 아주 마음에 듭니다...
아쉬운점은 사진과 같이 수건 걸이 수건 쫙 펴서 널수 있는 넓이가 아니에요...ㅜㅜ",1,False
200282014,4,2020.10.23,,다좋은데 조립설명서가 일어로 되어있어서 그림보고 조립했넉요 그리고 기스가 넘 많았어요,0,False
200282014,4,2020.09.14,알뜰하고 실용적인 셔츠행거입니다.,"설명서가 일본어로 되어 있어서 정말 매우 당황했습니다만 그림 보고 따라하니까 15분 내로 조립할 수 있었습니다. 여자 혼자 조립하기에는 은근히 힘이 많이 들어가서 어려웠어요. 봉 끼우는 게 잘 안돼서 남동생에게 도움을 요청했습니다. 다른 건 크게 어렵지 않았고 디자인도 사진에서 본 그대로라서 좋았어요. 크기도 적당하고 좋아요. 재질이 약간 좀 까끌거리는데 칠이 금방 벗겨질 거 같아서 조금 걱정되고, 봉에 거는 고리 같은 게 스르륵 잘 내려가서 아쉬운 점입니다.",0,False
200282014,4,2019.12.21,추천할만 합니다. 나름 만족,"마감처리가 별로에요.
살짝 벗겨진 부분들이 있어요.
내구성은 괜찮다고 생각해요.

두개중 한 제품의
옷걸이 봉에 뭐가 들어가 있어서
드르륵 소리가 나서 불편하지만
감안할게요.

철가루와 코팅 부분 가루가 좀 많이 나와요.
조립하고 청소 필수에요.

내구성은 좋다고 생각합니다.
건조대 + 행거
2 in 1 제품이라 눈여겨보다가 이제서야 구매하네요.
좋습니다. 추천 할만 해요.",0,False
200282014,5,2021.02.01,,사용 6개월째인데 잘사용중 조립할때 부품 안잃어버리게 조심해야함,0,False
200282014,5,2020.12.17,,정말 마음에 들어요 튼튼한도 마음에속,0,False
200282014,5,2020.09.03,,원룸에서 쓰려고 샀는데 예쁘고 튼튼하고 좋아요 조립설명서가 일본어로 되어있는데 구글 번역기 갖다대면 다 알수있고 그림보면 잘 조립할수있습니다.,0,False
200282014,5,2020.08.08,,,0,False
200282014,5,2020.07.30,,가격에 비해 질도 좋고 너무 실용적이예요~,0,False
200282014,5,2020.06.26,행거도 스타일리쉬하게~~♡,"《행거 빨래건조대》

☆ 사이즈 : 폭 64 X 깊이 49.5 X 높이150cm
☆ 금 액 : ₩39,900
☆ 건조량 : 셔츠10장, 수건5장
☆ 재 질 : 스틸, 스테인레스

행거가 필요했었는데, 눈에 딱 띄었네여~^^

우선 가장 좋아하는 무광블랙컬러, 옷걸이봉 부분만
브라운이라 조금 아쉽긴해요ㅠ
올블랙 완젼 간지템!!!!

우선은 고장나서 제기능 못하는 대용량건조대를 대신
해서 빨래 널었어요~

옷걸이에 걸어서 널어두니 바람에 살랑이며 금방
마르네요^^

행거로 사용하면 따닥따닥 붙여서 걸면 20벌이상은
걸수 있을거같네요. 워낙 견고해서 까딱없겠어요ㅎ

핀치행거고리에는 모자 걸기 안성맞춤이고요~
매쉬선반엔 양말박스나 속옷박스 올려놔도 좋을듯
하네요^^

왠지 스타일리쉬한 스타일이라 깔끔하고 많이 걸어도 튼튼해서 걱정없어용^^

2가지 기능이 가능한 행거예요~
신중한 선택에 도움이되시길~^^

쿠팡체험단 이벤트로 상품을 무료로 제공 받아 작성한 구매 후기입니다.",3,False
200282014,5,2020.06.24,"건조대 + 행거, 다용도의 자취 추천템","아이가 두 명이라서 매일 빨래를 하다보니 건조대가 부족하던 차에 건조대를 하나 더 사자니 둘 공간이 없기도 하고 빨래가 많지 않을 때는 밖에 입고 다녀온 자켓 등을 걸어둘 수 있는 행거 등 다용도로 활용할 수 있을 것 같아서 선택했습니다. 우선 박스를 보니 일본어로 제품이 설명되어 있습니다. 회사 홈페이지를 보니 일본 모기업의 자회사가 맞긴 하나 글로벌한 기업으로 한국 제품을 수출하는 역할도 하고 있는 것으로 보이네요. 설명서도 일본어로 되어있는데요. 그림으로 잘 설명이 되어있기 때문에 큰 어려움은 없었습니다. 나사로 결합할 때 플라스틱 부품을 끼워줘야하는 부분과 아닌 부분이 있는데 그것만 잘 보시면 되고 그게 봉에 딱 맞게 조립하시면 됩니다. 전동드릴 사용했고 박스 뜯고 조립하는데 10분 정도 소요되었습니다. 옷걸이 거는 봉은 구분되게 색이 다르니까 헷갈리지 않고 조립할 수 있습니다. 봉 자체도 튼튼하고 도장 상태도 비싼 느낌이 나는 깔끔함이 돋보였습니다. 저렴이 행거의 잘 벗겨지는 도장이랑은 달랐어요.
조립해놓고 보니 사이즈가 적당하고 맘에 들었어요. 무겁지 않아서 베란다나 옷방 등으로 이동하기 어렵지는 않을 것 같습니다. 옷방이나 베란다는 지저분해서 그나마 가장 깨끗한 배경에서 사진은 찍었습니다. 아래쪽은 바퀴가 아니라 바닥보호 부직포 테이프를 붙이는 형태입니다. 아이들이 끌고 다니면서 안에 의자를 넣고 빨래 걸이를 펼쳐놓고 거기서 간식을 먹겠다고 하고 재밌어하면서 끌고 다닐 정도로 잘끌어집니다. 하지만 아이들에게만 맡겨놓기에는 옆으로 넘어질 수 있어서 조심해야 하구요. 특히나 3살 배기 어린이는 아래쪽 망에 발을 집어넣었다 끼기도 해서 망은 빼서 다른 데 두었습니다. 며칠 사용하고 보니 낮에는 빨래 건조대로 저녁에는 외출옷 걸어놓는 용도로 요모조모 활용도가 역시나 높아서 좋구요. 혼자 자취를 하고 있다면 특히 쓸모있는 제품일 것 같아서 추천하고 싶네요.

쿠팡체험단 이벤트로 상품을 무료로 제공 받아 작성한 구매 후기입니다.",0,False
200282014,5,2020.06.23,원룸에 사용하기에 딱 적합한 행거겸 빨래건조대에요♥,"동생 원룸에 사용하려고 선택했는데 정말 괜찮네요.
동생집에 빨래건조대도 기존에 하나가 있긴 하지만
사이즈가 너무 작아서 좀 불편했거든요.
이 행거겸 빨래건조대와 같이 사용하면 좋을 것 같아요.
===================================================
디자인도 심플하니 넘 이뻐요.
원룸집에 둘 꺼라 인테리어에는 딱히 신경을 안쓰지만
인테리어로도 완전 만족스럽구요.
무엇보다 굉장히 실용적이라서 더 만족했답니다.
===================================================
이 제품은 직접 조립을 하셔야 하는 제품이에요.
조립할 때 설명서가 전부 다 일본어라서 조금은 당황했네요.
그림을 보면서 조립을 했답니다.
혼자서도 충분히 조립을 할 수 있어요.
저도 혼자서 조립했거든요. (동생 안도와줌)
(+)십자 드라이버만 있으면 돼요.
===================================================
행거 아랫부분에는 철판선반이 있어서
그 위에 이불이나 옷상자나 가방 등
뭐 이런 거를 둬도 될 것 같아요.
===================================================
그리고 수건을 널어놓는 건조대부분에는
수건보다는 양말이나 속옷 등
정말 간단한 걸 널어두는 게 좋을 것 같아요.
수건을 널어놓기에는 좀... 별로. (수건은 진짜 건조대에서만)
===================================================
원룸에서 사용하기에 진심 딱이에요.
활용도도 높고 진짜 실용적이에요.
너무 만족하는 제품입니다. 재구매의사 100%
===================================================

쿠팡체험단 이벤트로 상품을 무료로 제공 받아 작성한 구매 후기입니다.",1,False
200282014,5,2020.06.18,생각보다 너무 좋아요,"기대이상으로 좋아요☺️
마감처리가 부드럽게 되어있어서 까끌거리는 부분이 한 곳도 없었어요 , 포장도 잘 되어왔고 녹슨 곳도 없구

옷이 많아서 행거가 가득 찼었거든요
그래서 스커트류, 모자, 가방 놓을 공간없이
남편옷이랑 제 옷이랑 다 섞여있었는데

이 제품 조립해서 새워놓는 순간 아 여기에는 내 옷 놔야겠다 싶더라구요.
막상 디피하고 보니 너무 깔끔하고 예뻐요.

왜 있는지 모르겠던 선반?과 고리는 아주 유용하게 모자 놓는곳으로
활용중입니다.

장농없이 붙박이장과 행거로 살다가
모자,가방놓는곳 생기니 좋아요 ^^

ㅡㅡㅡㅡㅡㅡㅡㅡㅡㅡㅡㅡㅡㅡㅡㅡㅡㅡㅡ

원룸사는 저희 친오빠 하나 사주고싶네요

자취할때 제일 짜증나는게 옷 깔끔하게 수납하는 건데

이건 이동할때도 가볍고 여자가 조립하기도 쉽고

밑에 받침대 위에다가 바구니 같은거 두고 양말이나 속옷 수납하면

먼지도 안들어가고 넘 좋을거같어요

건조대 보다는 행거로 사용하기 딱 좋을듯

쿠팡체험단 이벤트로 상품을 무료로 제공 받아 작성한 구매 후기입니다.",1,False
200282014,5,2020.06.18,바람부는날에 빨래건조를 잘 부탁해~,"날씨가 좋은 날엔 무조건 햇빛에
빨래건조시키는 걸 좋아하는데 건조기와는
다르게 햇빛건조된 빳빳한 수건마저
소독(?)되는 느낌이 좋더라구요.

근데 바람 부는 날에
빨래건조대가 자꾸 넘어지는횟수가
은근 많아
빨래 건조되는 시간이 기분좋다가도

넘어지는 빨래건조대를 보며 속상하기도
했었는데

이렇게 행거 빨래건조대 밑에
약간 무게감 있는 것을 놓을 수 있는 제품이
딱 눈에 띄여 구매하게 됬어요.<<<구매한결정적이유입니다

빨래안많을때는
간단히 미니건조대 밑부분엔 물채운 물통
놓으면 안넘어지게 쓰곤했는데

빨래가 많은 날엔 기존 빨래건조대에
밑부분에 먼가 무게감있는곳을 놀 수 없어서
""이정도 바람에 안넘어지겠지""
했는데 넘어지기일쑤 ㅎㅎ


1.행거로는
.며칠 더 입을 수 있는 옷,
.고기 먹고와서 냄새가 배긴 옷,
.옷장에 바로 넣기 찝찝한 옷[미세 먼지 많을때
등등]

또, 전날 내일 입을 옷 간단히
코디해서 미리 걸어 둘 용도

적어놓으니 은근 많네요 ^^

✅간단한 옷종류 몇벌걸용도로 딱이예요
많은수납X.

예전에 이사할때 이삿짐센터아저씨가
무슨이유인즉슨...
웬만하면 행거에 옷걸어놓지 말라하더라구요!



2.빨래 건조대로는
바람에 넘어지지않게 밑에
무게감 있는 걸 놓을 수 있는 선반이
있기에


일석이조가 너무나 잘되서
아직까지 대만족이예요


사기전 상품평 대충 읽어보니
일본어로만 되있다해서 그런가보다했는데
정말 다 일본어설명서밖에없네요.

제조국은 중국인데
일본수출용으로 만든건가싶었어요.
모델분도 일본분같이 생겼네요 ㅎㅎ

제가 직접 조립하려했는데
잠시 외출한사이 신랑이 다 만들어놨네요

일본어로만되도 어려운건 없었다하네요.

집에 드라이버를 찾지못해 일단 드라이버
없이 완성했는데
찾고 나사를 좀 더 쪼여줬네요.


.수건 놓는곳은
수건건조는안될듯싶어요
전 주방서 쓰는 행주 한번 놔봤는데
수건보다 행주,간단한속옷
놓는용도로 적합하였습니다!


.평소 빨래널대 수건제외하고
옷은 꼭 옷걸이/바지집게로 걸어서
건조시키는데 전 옷건조대로 아주
잘써질것같아요 좋은제품 감사합니다

**수건,속옷은 기존건조대에놓고
옷종류만 걸면서 분리해서 잘 쓰고있어요!^^

쿠팡체험단 이벤트로 상품을 무료로 제공 받아 작성한 구매 후기입니다.",0,False
200282014,5,2020.06.17,심플하고 가벼운 행거,"스타일러를 구입했는데, 옷장 옆에 스타일러를 두지 못해 항상 이방 저방 왔다 갔다 하며 불편했습니다.
스타일러 바로 옆에 간이 행거 하나를 두면 좋겠다 싶어서 선택한 제품입니다.

이제품과 동일한 디자인인데 넓이가 90cm인 제품의 경우 너무 넓을 것 같아 공간을 차지 하는 면이 조금 좁은 모델을 선택했습니다.
스타일러 옆에 간단하게 옷을 걸어 두고 관리하는 용도 또는 잠시 걸어두고 건조하는 정도의 용도가 목적이었습니다.
결론 부터 말하자면, 위에서 언급한 목적에 잘 맞기 때문에 매우 만족스럽습니다.

항상 이런 DIY류의 조립 제품을 구입할때마다 스트레스가 있습니다.
조립 부품의 마감이 좋지 못해 나사가 안들어간다던지, 이격이 너무 심해 강제로 제품의 일부 변형을 해야한다던지 하는 상황말이죠.

일단 아이리스사의 제품은 이런 걱정을 하지 않아도 될 것 같습니다.
조립을 하기위한 부품 마다마다 마감이 훌륭하여 이격이 나는 것도 없고
나사도 모두 원할하게 잘 돌아가고 들어갑니다.

크게 힘들이지 않고 약 15분 정도 조립을 완성하였습니다.
남자 혼자서 충분히 작업 할수 있는 정도이고,
여성분이라면 한명 정도 옆에서 손을 거들어 주면 전혀 힘들이지 않고 조립이 가능 합니다.

64cm가 좁지는 않을까 싶은데 생각보다 좁지 않습니다.
오히려 이 사이즈 보더 더 크면 공간만 많이 차지 할 것 같아서 지금이 딱 좋은 듯 합니다.
좌측이나 우측에는 본인의 선택에 따라서 위치를 변경가능 한,
간이 선반을 접고 펼수도 있어서 운동화라던지 간단한 세탁물을 올려두고 건조하기에도 안성맞춤입니다.

저는 건조대로 활용하기 보다는 행거로 사용을 하기 위함으로 구입을 하였습니다.

조금 아쉬운 부분은 설명서가 모조리 일본어로 적혀 있어서 당황했습니다.
일본어를 조금 할줄 알아서 그냥저냥 조립했습니다만, 한국어 설명서가 있어야 다른 분들 조립시 원할 할 듯합니다.
사실 설명서의 그림만으로도 충분히 조립을 할 수 있는 수준이긴 합니다.
그리고 설명서의 내용 수준이 매우 세세하고 충실한데 이걸 한국어로 번역이 안되어있으니 아쉽다는 이야기 입니다.

아무튼 가볍고 심플하지만 역할에 충실한 행거라고 생각하고요,
조금 더 사용해보고나서 추가 후기를 남겨보도록 하겠습니다.

쿠팡체험단 이벤트로 상품을 무료로 제공 받아 작성한 구매 후기입니다.",3,False
200282014,5,2020.06.17,,"아이리스2in1 행거 빨래 건조대는 말 그대로 행거도 되고 빨래건조대로 사용이 가능한 제품이예요..저는 옷걸이 행거용으로 사용할 예정이구요
타 사이트에서는 5만원대에 거래되고 있는데 쿠팡에서 세일 들어가 3만원대에 구입하게 되었습니다..
더 저렴한 행거들도 있는데 가격이 어느 정도는 해야 내구성이 튼튼한 녀석이 오더라구요.
색상은 화이트와 블랙 선택 가능하나 이번에 저는 블랙으로 도전~
제품 사이즈는 폭이 64cm 깊이 49.5cm 높이150cm 으로 적당합니다.
전체 무게는 13.5kg로 여자분 혼자 충분히 설치 및 이동 가능하구요.
재질은 스틸 스테인레스이며 아래 부분 선반은 내하중 3kg 가능한 매쉬선반이 추가되어 있습니다.
설치하면서 보니 봉에서 약간 페인트가 벗겨지는게 보이기는 하나 블랙이라 눈에 띄는 정도는 아닙니다.
가구 한개만 바꿔도 뭔가 방안이 확 달라진것 같아 기분이 좋아요~^^♡♡

쿠팡체험단 이벤트로 상품을 무료로 제공 받아 작성한 구매 후기입니다.",7,False
200282014,5,2020.02.11,,사진으로 보는 것 보다 더 튼튼한 재질이라 좋습니다. 만들기도 걍 드라이버만 있으면 똥손이어도 사진보고 뚝딱뚝딱 만들수 있습니당ㅋ 원룸에서 사용하기에 크기도 너무 딱이고 무엇보다 디자인이 너무 예쁩니다ㅠㅠㅠㅠ 원룸에서 일반적인 빨래 건조대 펼쳐 놓고있으면 안그래도 비좁은데다가 진짜 별루거든뇨... 그리고 무엇보다 좋았던건 옆 날개 수건거는 살(?)이 튼튼해서 너무 마음에 들었습니다~^^ 많이 파세용ㅎ,3,False
200282014,5,2019.10.16,작은방에 딱이에요 아주 튼튼하고 좋아요,튼튼하고 좋아요,1,False
200282014,5,2019.06.27,예쁘고 실용적이고 튼튼합니다.,,0,False
