product_id,ratings,reg_date,article_headline,article_content,help_count,is_photo_review
1271060761,1,2021.04.22,이게무슨 공간활용입니까,공간. 더마니차지해요. 옷도마니 안걸리고 버리는데 돈들어서 분해해서 처박아둔상태입니다. 사실분 그냥 저한테 가져가서요 새거니까,1,False
1271060761,2,2021.02.20,,"아구가 안맞아서 억지로 끼우다 보니

검은 철가루가 오지게 나옴

조립하니 디자인은 이쁘지만

굉장히 무지하게 약해보임

균형도 잘 안맞음",0,False
1271060761,3,2021.03.04,,,0,False
1271060761,3,2021.01.30,,,0,False
1271060761,3,2020.12.17,,,0,False
1271060761,3,2020.07.13,,무게중심을 잘 잡아주지 못함.. 무거운건 걸수없을듯....,6,False
1271060761,3,2020.03.29,,,0,False
1271060761,3,2020.03.15,,,0,False
1271060761,4,2021.04.22,,"옷장은 있는데 간단한 옷 걸어두려고 샀어요
기본 행거는 방도 좁은데 더 좁아보여서 싫고
이거 좋을거 같아서 킵해두고 이것저것봐도 이게 제일 난거같아서 샀는데 좋아요
가격이 생각했던거보단 좀 높지만 그만큼 만족도가 있어서 기본 행거는 싫으시면 이거 괜찮아요 아이디어 상품같음
다만 위에 옷거는 부분 조립할때 너무 뻑뻑해서 조립하기 너무 힘들었는데 밑부분은 할만했어요 어렵진 않은데 손힘이 필요해요 쓰면서 아직도 엄지 부분이 아려요...튼 만족",1,False
1271060761,4,2021.04.18,괜찮아요,,0,False
1271060761,4,2021.03.24,작은방좁은방에 딱맞춤헹거ㅡ조으다튼튼함,,0,False
1271060761,4,2021.03.17,부족한 공간에 딱이네요~^^,"딸아이가 자기만 쓸수있는 행거를 가지고 싶다고 한참전부터 얘기를 했었는데 방에 침대도있고 책상도 있다보니 행거까지 놓을 공간은 없고 요즘바닥부터 천장까지 설치하는 행거도 있긴하지만 안그래도 작은방에 그렇게 설치하면 많이 답답해 보일꺼같아서 생각도 못하고 있는차에 코너행거를 보게되었어요.
보는 순간 침대 모서리쪽에 설치하면 딱이겠다 싶었지만 가격도 저렴한건 아니다보니 장바구니에 담아만두고 한참을 생각하고 생각하다 구매했는데 새벽배송으로 일찍 도착되어 아침에 일어나자마자 설치했어요.
박스안에 따로 비닐 포장도 되어있고 스티로폼으로 흔들리지않게 잘 포장되어 도착했어요.
설치하는데는 3분도 안걸린거 같아요.
포장 뜯어서 그냥 각자 위치에 끼워 연결만하면 끝!
옷을 걸수 있는부분이 아주 긴건 아니지만 그래도
보통 6~7벌 좀 붙여걸면 10벌은 걸리지않을까 싶네요.
설치하고보니 괜히 고민했다 싶었어요. 좀 더 일찍 살껄...하는 생각이 들었네요^^",2,False
1271060761,4,2021.01.13,,가격대비 별로에요,0,False
1271060761,4,2020.11.29,,,0,False
1271060761,4,2020.11.13,,"약간 조립하는게 애매 ㅎㅎ/했지만ㅋㅎㅋ
뜸새 굿 인정 합니다",1,False
1271060761,4,2020.10.24,,,0,False
1271060761,4,2020.10.10,,인테리어적으로도 훌륭하고 예쁩니다. 다만 많은 옷을 걸 수 없고 7벌 정도가 최대인 것같습니다. 양 끝은 벽에 옷걸이가 간섭되는 점이 아쉽네요.,1,False
1271060761,4,2020.09.29,,"자리 차지 안하고 작은 방에 좋습니다~
너무 싼티 안나고 적당합니다~",0,False
1271060761,4,2020.08.05,,"무거운 옷을 걸면 어딘가로 무게가 잘 쏠릴 것 같고 조립할 때 겉에 코팅 된 부분 벗겨질 수 있으니 조심하는게 좋을 것 같아요

그것 외에는 확실히 조립도 간편하고 공간이 많이 필요하지 않아서 자취하시는 분들한테 좋을 것 같아요

쿠팡체험단 이벤트로 상품을 무료로 제공 받아 작성한 구매 후기입니다.",3,False
1271060761,4,2020.06.16,,"깔끔하고 적당한 사이즈는 좋은데
조금 다리힘이 약해요",2,False
1271060761,4,2020.05.21,,,0,False
1271060761,4,2020.04.27,,괜찮아요,4,False
1271060761,5,2021.05.25,,,0,False
1271060761,5,2021.05.24,,,0,False
1271060761,5,2021.05.21,,,0,False
1271060761,5,2021.05.19,,,0,False
1271060761,5,2021.05.18,,,0,False
1271060761,5,2021.05.15,,,0,False
1271060761,5,2021.05.12,,,0,False
1271060761,5,2021.04.25,,,0,False
1271060761,5,2021.04.22,생각보다 작지만 코너형이라 좋다,,0,False
1271060761,5,2021.03.27,,많이 튼튼하진 않지만 디자인도 괜찮고 지금 한 8벌 걸고 있는데 사용하기 괜찮아요,0,False
1271060761,5,2021.03.27,,,0,False
1271060761,5,2021.03.24,,,0,False
1271060761,5,2021.03.19,,아 가격 너무너무 비싸서 고민 하다가 답정너라 구매 했는데 넘넘 이쁘고 공간 차지도 많이 안하고 조립도 쉽고 걍 대만족 고민 하신다면 당장 구매하세요!!!,1,False
1271060761,5,2021.03.13,,,0,False
1271060761,5,2021.03.08,,쓸만함,0,False
1271060761,5,2021.03.07,,,0,False
1271060761,5,2021.03.03,너무 마음에 들어요 봄되서 기분 전환할려고 주문했거라여,배송 빨랐고 이쁘네용,0,False
1271060761,5,2021.03.02,감성적인 느낌의 행거를 찾으시나요? 당장사세요!,"실용적이면서 예뻐서 굿!!!
옷이 많아서 행거가 필요했는데 찾아보니
다 너무 싼티나고 공간도 많이 차지하고 별로였어요ㅠ

근데 요 아이는 모서리에 놓을 수 있어서 공간차지가 덜하고
무엇보다 디자인이 갬성적이었습니다
화이트에 곡선적이면서 옷걸이 부분에 살짝 우드 느낌도 주고 딱 제가 찾는 것이었죠!

요즘 인테리어에 관심을 많이 갖고 있는데
이 행거를 시작으로 방을 예쁘게 꾸며보려구요
지금도 행거하나 놨을 뿐인데 방이 좀 더 꾸며진거 같은
느낌적인 느낌...!

적당히 옷을 걸면서 자리차지 많이 안하는
감성적인 디자인의 행거를 사고 싶다! 하시는 분들은
바로 요 행거 추천합니당~~!",1,False
1271060761,5,2021.02.24,,"코너에 세울수 있어서 너무 좋습니다.
사이즈는 작지만 코너에 냅둘거 생각하면 적당한거 같고 패딩 ,코트 4-5벌 정도 걸어놔도 끄떡 없는거 보니 튼튼한거 같습니다.",1,False
1271060761,5,2021.02.22,,,0,False
1271060761,5,2021.02.22,,,0,False
1271060761,5,2021.02.21,,,0,False
1271060761,5,2021.02.18,,이전 살던 집에서 구매하여 몇개월동안 무척 잘 썼습니다. 생각보다 옷 많이 걸리고 좋았어요,0,False
1271060761,5,2021.02.16,방 코너에딱 자리않차지하고 좋와요 경울옷은 마니 못걸음,,0,False
1271060761,5,2021.02.14,모서리 활용하기 좋고 편리하고 깔끔합니다,모서리 활용하기 좋고 깔끔하고 이뻐요,0,False
1271060761,5,2021.02.13,,,0,False
1271060761,5,2021.02.02,,,0,False
1271060761,5,2021.02.02,,공간을 효율적으로 쓸 수 있어 좋아요. 그리고 튼튼해요.,0,False
1271060761,5,2021.01.27,,,0,False
1271060761,5,2021.01.26,좁은방에 최고입니다,,0,False
1271060761,5,2021.01.25,,공간 활용하기 너무 좋아요 만족도 100!!,0,False
1271060761,5,2021.01.20,,,0,False
1271060761,5,2021.01.16,,,0,False
1271060761,5,2021.01.10,,,0,False
1271060761,5,2021.01.07,,벽에 ㄱ 자 모양으로 세울 수 있어서 공간을 많이 차지하지 않은 점이 가장 좋았어요. 조립도 간단해서 혼자서 10~20분 안에 한 것 같아요. 무엇보다 너무 싸보이지 않은 점이 맘에 들어요,1,False
1271060761,5,2021.01.07,,,0,False
1271060761,5,2021.01.02,,,0,False
1271060761,5,2021.01.01,많은 옷은 안걸리지만 깔끔하고 이쁘네요 !,,0,False
1271060761,5,2020.12.18,설치간단 이뻐요,,0,False
1271060761,5,2020.12.15,,"공간활용하는데 정말 좋은 상품이예요!
강추합니다ㅎㅎ",0,False
1271060761,5,2020.12.06,,,0,False
1271060761,5,2020.11.18,조립이 쉽고 튼튼하게 잘 걸려요.,"주말이 끝나고 출근하기전날 밤에는 일주일치 옷을 미리 정해서
걸어놓고 마무리하는 버릇이 있어요.

일주일 행거라고 저는 부르는데 그래서 흔치 않은
행거로 찾던중 디자인도 마음에 들고 공간도 많이 차지
하지 않을것 같아서 구매하게 되었어요,
결론으로 말하면 아주 마음에 들어요!

조립하기도 어렵지 않고 공간활용하기도 좋아서
어느 공간이든 쏙쏙 잘 들어가네요
한쪽으로 기울어질 염려도 없고
겉옷까지 포함한 일주일치 옷이 잘 걸려요!

디자인회사에 다니는 지인이 집으로 놀러와서
보고는 예쁘다고 독특하다고 말해 주어서
괜히 뿌듯하고 더 마음에 쏙 들게 되었네요~

지인들에게도 추천하는 제품입니다.
고민말고 주문하세요!",0,False
1271060761,5,2020.11.02,,코팅부분이 서로 부딪치면 벗겨지지만 색도 예쁘고 맘에 듭니다,1,False
1271060761,5,2020.11.02,,,0,False
1271060761,5,2020.11.01,,,0,False
1271060761,5,2020.10.31,,조립도 쉽고 심플하니 이뻐요! 침실에 잠옷걸이로 쓰려고 샀어요,1,False
1271060761,5,2020.10.27,,나조립소질없어서오래걸렸지만 좋음,1,False
1271060761,5,2020.10.12,,,0,False
1271060761,5,2020.10.11,,,0,False
1271060761,5,2020.09.17,,,0,False
1271060761,5,2020.09.15,데일리 옷 걸어놓기 좋아요,복층이라 왓다갓다 하기.버거웠는데 가을 겨율 옷은 어느정도 편항 곳에 놔두고 싶었는데 이 모서리 행거가 짱이네요,0,False
1271060761,5,2020.09.14,,,0,False
1271060761,5,2020.08.14,추천,"가격은 좀 있는편있데 공간활용 너무 좋구요
의외로 옷도 많이 걸려서 좋은데
행거 자체가 아주 살짝 흔들거리는데 신경쓸만큼은 아니에요",0,False
1271060761,5,2020.08.09,공간 차지 안해서 좋아용ㅎㅎ,"제가 이 제품을 선택한 목적은 아빠 옷 걸어두려고 엿어요..ㅋㅋㅋㅋㅋ 거실한쪽애 옷을 내팽개쳐두셔서...ㅋㅋㅋㅋㅋㅋㅋ
물건받고 같이 조립하는데, 아빠가 조립허시는 내내 크기만 엄청 크고 걸 곳은 너무 작다고...ㅋㅋㅋㅋ 왜케 비효율적이냐고 투덜대셨어용....ㅋㅋㅋㅋ

다행히 조립은 너무 간단! 그냥 슝슝 몇번 끼우면 끝입니당ㅋㅋㅋㅋㅋㅋㅋ

그 후 거실 구석에 제가 세워서 설치했더니 처음엔 응? 하시더니 한 시간 지나서 제 방에 오시더니 좋은거 같다곸ㅋㅋㅋㅋㅋㅋㅋㅋㅋㅋㅋㅋ 좋아하셨어욬ㅋㅋㅋㅋㅋ

첨앤 거는 곳애 비해 바닥이 크고 하니까 부피 차지할 거라 생각하셨는데 그런거 전혀 없어요! 진짜 부피차지 안함...

모서리에 두니까 있는 듯 없는 둣 옷 걸어놀 수 있어서 넘 좋아옄ㅋㅋㅋ 가족 다들 만족!!


솔직히 거는 곳이 넓은 게 아니라 그렇게 많은 옷은 안걸려요! 근데 옷걸이는 필요하고 방에 한 모퉁이는 비어 있고 방에 자리 차지하는거 싫으시는 분껜 강추!!

옷 여럿 걸어도 아까 말했다시피 바닥부분이 넓어서 넘어질 위험은 없는고같더라구용~~

그래서 결론은 추천합니당ㅋㅋㅋㅋㅌ

쿠팡체험단 이벤트로 상품을 무료로 제공 받아 작성한 구매 후기입니다.",2,False
1271060761,5,2020.08.08,,공간활용에 용이합니다,0,False
1271060761,5,2020.08.06,,"배송 빠르게 받았습니다~~
우선 이 행거는 공간활용이랑 인테리어에 좋은거같아요
보통 행거는 해놓으면 되게 지저분하고 안예쁜데 이건 고급스러워서 옷방아닌곳에도 남는 자리에 공간활용을 잘할수있을거같은 제품이라 선택했어요~~

색상포인트도 이쁘고 생각보다 튼튼해서 자주 입은 옷이랑 가방 위주로 걸어놓으려구요!!
거실활용해도 지저분하지 않을거같아요

마음에 듭니다 !

쿠팡체험단 이벤트로 상품을 무료로 제공 받아 작성한 구매 후기입니다.",2,False
1271060761,5,2020.08.06,,"블랙 색상으로 구매했습니다!

코너 쪽은 활용하기가 어려운데 코너용 행거 사용하니까
공간 활용하기가 더 좋네요 ㅎㅎ
블랙색상이라 깔끔하고 무난해서 좋아요 :)


조립은 드라이버가 필요 없이
간편하게 조립 할 수 있어서 편하고 좋긴 한데,
몇몇 부분은 잘 안들어가서 좀 고생했습니다 ㅠㅠ
힘으로 막 넣으려다가 까진 부분도 좀 있었어요ㅠㅠ
그래도 티가 많이 안나서 괜찮더라구요 ~

다 조립하고나니 생각보다 크기가 좀 크긴했는데
코너 쪽에 활용하기는 괜찮더라구요 !
높이도 많이 높지 않고 모자나 가방같은 것들도 걸어놓을 수 있어서
저는 주로 다음날 입을거 미리 걸어놓거나
입은 옷 다시 걸어놓는 용도로 주로 활용하고 있습니당 ㅎㅎ
편하고 좋아요 !!

쿠팡체험단 이벤트로 상품을 무료로 제공 받아 작성한 구매 후기입니다.",0,False
1271060761,5,2020.08.05,코너 공간활용에 딱♥,"비좁은 코너 공간에 딱이에요 ˃ᴗ˂ ♥

솔직히 바닥이 일자형은 무조건
각이 있는곳에 둬야해서 활용도에 비해 부담이어서
코너형 쓰니 넘 좋네요.

무게감이 여자가 들기에 약간 묵직한 정도고
딱히 무겁거나 또는 가벼워 쓰러지겠다 싶진 않아요.
중심이 잘 잡혀서 안정감이 있네요♥

보통옷 5~6벌
겨울에는 두꺼운 외투1개와 일반1~2개 가능할듯 해요.

조립이 넘 쉬워서 금방 했어요(˘ㅂ˘ )
손가락 안전을 위해 핀을 눌러줄 도구가 필요하니
참고하세요!

밝은 색상도 나온다면 더 구매하려고 해요.
활용도가 좋아서 주변에 추천할거에요˃ᴗ˂

고민할 필요 없을듯..추천 꾸욱~~~

쿠팡체험단 이벤트로 상품을 무료로 제공 받아 작성한 구매 후기입니다.",1,False
1271060761,5,2020.08.02,,"자취할때 쓸거라 지금 주문해서 받아서 본가에서 쓰고있는데 대박
우선 조립이 쉬움 나랑 여동생이랑 뚝딱만들어버림!
첨엔 못해서 뭐지 했는데 수평으로 세우서 끼우니까 바로 끼워짐!

그리고 세워놓으니까 많이 흔들리지도 않고 기장감있는 옷들 걸어도 끌리지도 않고 괜찮은듯
사진은 아빠 양복세트랑 그냥 일반 90cm기장 바지인데 기장여유엄청 많음!
밑에 박스같은거 보관해도 괜찮을듯

분해해서 보관해도 되고 집에 모서리부분 이용할수있게 만들어진거라 용도도 좋고 넘 잘쓰고있음~!
동생도 탐난다고 동생집꺼도 주문했음ㅋㅋㅋㅋ아그리고 생각보다 옷많이 걸어짐!

쿠팡체험단 이벤트로 상품을 무료로 제공 받아 작성한 구매 후기입니다.",9,False
1271060761,5,2020.07.30,모서리에 안성맞춤,"장농이 있음에도 공간이 부족해서
자주 입는옷 걸어두기 좋을것 같아서
주문~~ 조립방법도 간단하고
생각보다 짱짱하고 무거운 옷 많이 걸어져서
만족스럽네요~~
조립할때는 공간 많이 차지하겠다 싶었는데
막상 설치해두고ㅈ나니 모서리에 쏙 들어가는게
공간활용하기 좋아요.
원룸이나 작은방 옷장 사기 애매할때
딱인듯 싶어요.저는 신랑 자는방에 두고 쓰려고요~~
남자들이 그때그때 정리를 잘못하는데
보이는곳에 있으니 대충이라도 잘 걸어두더라고요~ㅎㅎ
모서리 공간활용 옷걸이 자투리공간에
딱입니당^^

쿠팡체험단 이벤트로 상품을 무료로 제공 받아 작성한 구매 후기입니다.",3,False
1271060761,5,2020.07.30,,"정말 아이디어 상품입니다✨
모서리를 이용할 생각을 하다니요-!

우선 드라이버와 같은 공구가 필요없이 두 손만 있으면 5분만에 완성 !

모서리 부분에 요렇게 행거를 두니 오히려 안정감이 드는 느낌입니다
요즘같은 장마철에 겉옷이 필요한 날도 있는데,
이렇게 모서리 행거를 이용하여 간단히 사용할 옷들을 걸어두니 좋네요-

특히 옆부분에 모자나 가방을 함께 걸어둘 수 있어서 좋은 것 같아요
잠시 놔둘건데 붙박이장이나 펜트리옷장 안에 두기가 애매했거든요
손님들 옷 걸어두기에도 짱짱이고
가격대도 생각보다 비싸지 않아 좋은 것 같아요

조립하는데 제가 생각했던 길이보다 길어서 놀랬는데
겨울에 입는 롱패딩이나 롱원피스가 질질 끌리지 않게끔 걸 수 있는 길이라 좋은것같네요 !

감성만 잘 살리면 갬성 인테리어 제품으로도 제격일 듯 합니다:-)

바닥에 붙일 찍찍이(?)도 함께주셔서 금방 쓰러질 걱정은 안해도 될 것 같으네요-

쿠팡체험단 이벤트로 상품을 무료로 제공 받아 작성한 구매 후기입니다.",6,False
1271060761,5,2020.07.29,자취하시는 분들이나 겉옷 보관용으로 추천!,"붙박이장을 사용하곤 있는데 자주 입는 옷들은 넣었다 뺐다 그마저도 귀찮더라고요.
그래서 준비해본 스타일 행거! 다리미질 하고 여유있게 행거에 걸어두기 좋고, 다음날 입을 옷들을
미리 꺼내두면 구김없이 입을 수 있어서 좋아요.

조립할 때 (여자임) 워낙 똥손이라 혼자 버벅 거렸는데 정말 쉬운 조립이었고요
여자가 하기에도 많은 힘이 필요치 않아서 다음에 한다면 2분컷으로 끝낼 수 있을 거 같아요.


다만 단점을 꼽자면 음.. 뭔가 약해보이긴 해요.
쉽게 넘어질 것만 같은 느낌. 그리고 무거운 걸 잔뜩 걸어두면 행거가 많이 힘들어 할 것 같습니다.

그외 가볍게 자취하시는 분들이나 겉옷 보관용으로 사용하기 좋은 아이템 같습니다.


마지막으로 은근 자리차지해여 ㅋㅋㅋㅋㅋㅋ

쿠팡체험단 이벤트로 상품을 무료로 제공 받아 작성한 구매 후기입니다.",1,False
1271060761,5,2020.07.29,튼튼하고 고급스러워요,"입었던 옷을 바로 옷장안에 넣기가 조금 찝찝해서 구매했습니다.

⭐️설치 : 쉬워요
조립형인데 나사없이 그냥 끼우기만 하면 돼서 혼자서도 금방 조립할 수 있어요.
잘 안빠지게 하려고 너무 꼭 맞는건지 끼울 때 도장칠이 벗겨지네요.
끼우면 안보이는 부분이니까 상관은 없었어요ㅎㅎ

⭐️기능 : 튼튼하고 예뻐요
가격대가 조금 있어서 그런지 튼튼하네요.
옷 거는 부분은 나무무늬로 돼있고 봉도 고급스러워요.
옷도 많이 걸 수 있을 것 같고 높이도 꽤돼서 롱원피스도 땅에 닿지않고 걸 수 있어요.
너무 많이걸면 안예쁠거같아서 저는 4-5개정도만 걸어두려고 합니다ㅎㅎ
봉 끝에는 가방 걸어두기 좋아요~
코너형이라 공간 활용도 좋네요.

⭐️단점 : 가격
제품은 너무너무 마음에 들어서 제품의 단점은 없지만 살짝 아쉬운 부분은 가격이에요.
조금만 더 저렴했으면 좋았을 것 같아요.

쿠팡체험단 이벤트로 상품을 무료로 제공 받아 작성한 구매 후기입니다.",5,False
1271060761,5,2020.07.01,,"조립 간편하고 가볍고 공간활용 정말 좋습니다.
가벼운 의류들 많이 걸어도 괜찮아요.",8,False
1271060761,5,2020.06.13,,이거 레알 진짜 혁명임! 꼭사세요 진짜 .. 자리없을때 쓰기 개좋음 ㅜ 꼭짓점활용도최강,3,False
1271060761,5,2020.05.23,,,0,False
1271060761,5,2020.05.06,,,0,False
1271060761,5,2020.04.25,,,0,False
1271060761,5,2020.04.21,,,0,False
1271060761,5,2020.04.16,,,0,False
1271060761,5,2020.03.26,,빈공간 활용하기 좋습니다 원룸엔 좋네요,4,False
1271060761,5,2020.02.29,간편하고 예쁩니다,,0,False
