product_id,ratings,reg_date,article_headline,article_content,help_count,is_photo_review
4320525912,4,2021.04.10,,,0,False
4320525912,5,2021.05.15,오트밀 쇼파 깔끔하고 예뻐요!,"5/10 에 주문해서 5/14 에 받았어요.

집에 사람이 없어서 걱정했는데
알아서 잘 설치해주시고 가셨어요.

아주 만족합니다~
감사합니당!

첨부 사진 참고 하세요 ~",0,False
4320525912,5,2021.05.02,사진과 같아요 색상 걱정해었는데 예뻐요,,0,False
4320525912,5,2021.04.29,색상이 밝아서 걱정했는데~인조가죽이지만 싸보이지 않아요,,0,False
4320525912,5,2021.04.20,배송이 한달넘게 걸렸지만 제품은 너무마음에 듭니다.,좋은가격에 좋은제품 구매했네요~ 설치기사님도 친절하시고 공간에 잘 어울립니다^^ 잘쓸께요!,1,False
4320525912,5,2021.01.06,,"원래 가구들을 자주 바꾸는 편이라 가격도 착하고, 디자인도 맘에 들어서 구매했어요.
배송은 주문한지 이틀 뒤 바로 받았는데..
소파 가죽 색깔들이 조금씩 달라서 두번이나 교환했어요ㅜㅜ

그래도 문의할때마다 친절하게 대응해주시고, 또 제가 요청하는대로 다 교환해주시고, 교환때문에 기사님 세분이나 다녀가셨는데.. 세 분 모두 너무 친절하게 잘 해주고 가셔서 너무 감사했어요^^

쿠션감이 살짝 딱딱한 느낌이 없지않아 있지만^^;;
이 가격에 너무 만족합니다.",9,False
