product_id,ratings,reg_date,article_headline,article_content,help_count,is_photo_review
146698116,1,2020.08.06,,"(필독) 당 제품 사시려는 분 참고바랍니다

최초 설치후 한번 커버를 빨아서 사용하려고 세탁기에 돌렸습니다
이후 다시 커버를 씌우는 과정에서 상담사의 표현으로는 '물리적 힘'을 가했기에 사진처럼 지퍼가 분리되고 지퍼고리가 파손되었습니다

지퍼를 여닫은 횟수는 2회이고 세탁 방법에 있어서도 세탁기에 돌리면 안된다는 내용은 없었고요

그런데 이게 무상 교환이 안된다네요
50kg이 채 되지 않는 40대 여성의 힘으로 2회 여닫은 지퍼가 파손된 것인데도요.
꼭 참고하시고 사세요",9,False
146698116,3,2020.09.13,침대는 누워보고 쇼파는 앉아보고 삽시다,"쇼파의 디자인이나 패브릭컬러는 최고만족합니다만
앉았을때 쇼파가 너무 딱딱한느낌으로 편안함이나 안락함과는 거리가멀어요
식탁보조의자에 앉은것보다 편안함이 없으니 이걸어째요
빚좋은 개살구라는 표현이 딱맞음
상품평도 괜찮고 배송해주시는분들도 너무 친절하신데
너무기대가 컷엇나봅니다
앉아있고싶어 산 쇼파인데 앉으면 허리가 아파요
쇼파가 날밀어내는 느낌이니 어쩜좋을런지",1,False
146698116,5,2021.02.26,,,0,False
146698116,5,2021.02.25,컴팩트하고 딱 좋아요^^,딱 맘에 들어요 컴팩트하게 거실공간 많이 인차지하고 놓을 수 있네요,0,False
146698116,5,2021.01.26,정말 탁월한 선택을 한거 같아요 이뻐요 굿굿굿,딸 방을 1인쇼파에서 2으로 바꿔주었는데 일 끝나면 창가에서 편히 산멍때릴수 있을거 같아요 튼튼하고 이뻐요 리바드기사님께서 배송과 설치도 해주셔서 흠집없이 튼튼하게 잘 사용할수 있을거 같아요,0,False
146698116,5,2019.12.13,무난하게 쓰기엔 좋음. 다음엔 3인용 살 예정,,0,False
146698116,5,2019.05.13,,,0,False
146698116,5,2019.05.05,편안하게 잘쓰고 있습니다,,0,False
146698116,5,2019.03.14,,"정해자 날짜에 배송해주셔서 좋았어요
설치기사님도 꼼꼼하게 잘 해주셨구요
무엇보다 원목상태나 쿠션이 정말 맘에들어요",4,False
