product_id,ratings,reg_date,article_headline,article_content,help_count,is_photo_review
1680537924,2,2020.11.30,색상이 다크브라운으로잘못왔어요,"왜 다크초코로 주문했는데..다크 브라운으로 배송온건지..
조립도 다 해야하고 설명서도 없고..ㅠ 이미신랑이 힘들게 조립해버려서 어쩔 수 없이 그냥 사용합니다.
쿠팡에서 가구 주문은 다음부터 안하려구요.",1,False
1680537924,3,2020.12.17,,"직접조립을 해야 하는 먼거러움이 있어요
그리고 너트가 하나 빠져 배달이 되어 아직 조립을 하지 못하고 있네요 ㅠ ㅠ",2,False
1680537924,4,2021.04.15,,"조립하는 렌치(?)가 너무 허접합니다
계속 헛돌다가 닳아버려서 갖고있던 다른 도구로 겨우 조였습니다.",1,False
1680537924,4,2021.02.08,,,0,False
1680537924,4,2021.01.03,카페의자를 사무실에 놓으니 분위기 쨩!!,예쁘고 분위기 나요 로켓배송으로 빠르게 받고 사무실 분위기가 살아났어요 설치는 동영상 참고하세요,3,False
1680537924,4,2020.07.11,튼튼하고 쿠션도 좋아요,쿠션도 짱짱하고 푹 파묻히는게 아니라 카페처럼 일하기 좋네요. 안정감 있고요. 조립하게 왔는데 안내서가 없어서 좀 헤맸습니다.,8,False
1680537924,5,2021.05.10,,,0,False
1680537924,5,2020.07.18,튼튼하고 좋이요,,0,False
