product_id,ratings,reg_date,article_headline,article_content,help_count,is_photo_review
4792532400,4,2020.10.29,,"첨엔 사이즈가 너무 커서 놀랐는데 계속 사용해보니 좋네요~~^^
이뻐요...깨끗하고...배송기사님 너무너무 친절하시구요(별 다섯개 드림)",2,False
4792532400,5,2021.05.13,강추 사계절 강추,"쿠션감이 탱탱하고 넓직하니 제2의 침대 같은 느낌을 받았어요! 디자인도 괜찮고 색깔도 청량감 넘치는 민트색이여서 너무 만족스럽고 실물 보니까 더 좋은 것 같아요 후회 안 해요
강아지를 키우는데 내려올 생각을 안 하네요 ㅋㅋㅋㅋ
당분간은 소파에서 살 것 같아요 :)",0,False
4792532400,5,2021.04.18,,"새로 이사오게 되면서 3인용 쇼파가 필요하게 되었는데 적절한 쇼파를 잘 구한거 같아요 색상과 편안함, 깔끔함 모두 다 좋네요. 가족들이랑 만족하면서 쓰고있는 중입니다^^",0,False
4792532400,5,2021.01.25,너무맘에 드네요 배송하신 기사분님도 친절하구요,,0,False
4792532400,5,2020.12.28,마음에 들어요~,색상이 부담스러울까봐 고민을 많이 하다 구매했는데...생각보다 부담스럽지 않고 은은한 민트색이라 오래두고 사용해도 질리지 않을것 같아요~그리고 친정 엄마가 허리수술을 하셨는데 너무 단단하지도 너무 푹신하지도 않고 딱 적당한것 같네요~무엇보다 제일 맘에 드는건 일반 소파는 앉으면 뒤로 눕듯이 기대어져서 오래 앉아있으면 허리가 불편한데 쿠션이 받쳐주는 느낌으로 허리를 세워줍니다~구매하길 잘했네요~^^,1,False
4792532400,5,2020.11.17,,전 사실 후기 잘 안올리는 사람 입니다 그런데 버즈 소파 너무너무 맘에 들어서 후기 올려봐요 디자인 너무 깔끔하고 저희집은 애견들이 많아서 가죽 소파를 못 들이는데요 직물 소파 번번히 실패하고 사실 별 기대없이 산건데 집에 들이자 마자 너무 이뻐서 기분 너무 좋았습니다 제 동생도 소파 너무 이쁘다고 구매 한다고 하네요~이 소파 구매하셔도 후회 하시지 않을겁니다~^^,4,False
4792532400,5,2020.10.27,실물이 훨씬 이쁘네요,,0,False
4792532400,5,2020.06.17,,"정말 이쁘게 잘빠졌네요. 쿠션감도좋고
누워도 편해서. 잠도오네요
원단 느낌도. 아주좋아요",1,False
