product_id,ratings,reg_date,article_headline,article_content,help_count,is_photo_review
310251660,1,2020.06.27,못쓰는거,그지같네요,0,False
310251660,3,2020.01.05,쓰기 괜찮아요,"만드는건 어렵지 않았어요.
본체에 긁힌 자국이 꽤 있었어요.
발 245 사이즈로 1줄에 신발 3켤레 정도 넣을 수 있어요.
문에 거는 부분이 헐거워서 좀 고생했어요.
꽉 채워도 멀쩡해서 다행이네요

엄청 실망한건 아니지만 그렇다고 엄청 만족하지는 못했어요.

오래 두고 쓸 물건은 아닌것 같아요.
하지만 이사를 자주 한다면 이 제품 나쁘지는 않아요

별 -1는 스크래치 때문에, 나머지 -1은 문 거는 부분이 헐거워서 살짝 고생한것 때문에",5,False
310251660,5,2021.03.02,,,0,False
310251660,5,2020.12.17,굿,배송이 늦은가 빼곤 나무좋아여,0,False
310251660,5,2020.02.01,,손재주가 없으신 분들은 조립하는데에 시간 좀 들 것 같아요~,2,False
