product_id,ratings,reg_date,article_headline,article_content,help_count,is_photo_review
289681019,3,2021.02.09,,,0,False
289681019,3,2020.07.07,,"마감이 부실한데 대나무라서 가시박힐것같아요.
나사 구멍이 살짝 어긋나서 조립후 살짜기 틀어지는 느낌이 들고,
얇고 가벼워서 안정감은 많이 떨어집니다.
신발이 무겁진않아 신발장으로 사용하기엔 큰 무리는 없어보여요.
칸칸이.. 좌우 지지대에 사이즈가 딱 맞지않아 자세히 봄 허접한데 그냥 생각없이 봄 깔끔하고 나름 괜찮아요~~",0,False
289681019,3,2020.05.01,,조립시 주의해서 해야합니다 나무가 가볍고 약합니다,0,False
289681019,3,2019.12.04,,,0,False
289681019,5,2020.05.05,,,0,False
289681019,5,2020.04.23,착한가격에 장난감정리대로 사용하구잇어요 최고예요,,0,False
289681019,5,2020.04.23,넘 좋아요 저는 애 장난감 정리대로 씨구잇어요 최고예요,,0,False
289681019,5,2019.12.20,이쁨,"옷가게 신발진열 하려고 주문했어요
조립도 쉽고 짱짱하고 나무결도 좋네요
나름 이쁩니다",0,False
