product_id,ratings,reg_date,article_headline,article_content,help_count,is_photo_review
5412636006,1,2021.05.12,,"과대광고..
고객이 변심했다고?요
이런식으로 고객을 우롱하는건 아니죠",1,False
5412636006,1,2021.05.09,솔직히 돈 좀 더 추가해서 좋은거 사시길 추천합니다.,"네이버 블로그에서 보고 평이 좋길래 구매 했습니다.
저렴한 가격에 정리함을 구매할수 있는건 좋았지만

1. 뽁뽁이 까지는 아니더라도 충격을 완충할수 있는 상자 같은 것에 포장되어 올줄 알았는데 송장 붙이는 비닐에 12세트가 그냥 담겨서 왔네요. 여기저기 스크래치가 나서 배송 되었습니다.

2. 배송중에 뭐가 뭍었는지 원래 그런건지 먼지나 검은것들이 묻어서 왔네요
+ 사진에 검은 반점들은 곰팡이인지 닦아도 지워지질 않습니다..

3. 배송 때문인지는 몰라도 문이 잘 안닫히기도 하고 유격이 생겼는지 문의 틀이 다소 휘어졌네요..

4. 고양이가 위에 올라가면 푹푹 들어가는데 견고한거 맞겠죠??

반품하기 어렵고 이미 다 조립해 버려서 사용합니다. 구매를 알아보시는 분들께는 추천드리기 어렵네요.",1,False
5412636006,5,2021.05.26,★★★★ 무조껀 사야됨 ★★★★★,"주문일 : 2021 . 05 . 24
배송일 : 2021 . 05 . 25

만족도 : ★★★★★


로켓배송도 아닌데 다음날 바로 받았습니다

처음에 받자마자 제일먼저
파손되거나 기스난곳도 없나 확인했는데 아주 깨끗하게 잘왔네요

조립방법도 상세페이지 보고 하니까 어렵지도 않고 여자 혼자서도 금방 조립 잘할수있을거같아요

가격도 저렴하고 완성해두니까
탄탄해 보여서 신발 막 벗어두는거보다
깔끔하게 정돈 되기도 했구요

나비모양 연결핀 같은걸줬는데
그걸 끼우니까 흔들리지도 않고
생각보다 너무 고퀄이에요

소형이라고 해서 작으면 다용도 서랍으로 쓰려고헀는데 여성운동화 정도면 소형도 나쁘지 않을거같네요

가족들 운동화도 넣어야 되니까
대형이랑 소형 섞어서 더 사야할거같네요

딱 원하던 사이즈 라서 부모님도 잘샀다고 좋아하셔서 더 좋았던거같아요

배송부분도 꼼꼼하게 포장을 해주셔서
상품에 문제가 없었고 로켓배송을 제외하고
최근주문한 택배중에 제일빨리 왔어요
(거희 로켓배송 수준 ..)

최대한 솔직하게 쓰려고 하는데
거희 장점 밖에 안보이네요

실패없이 잘산거같아요
집에 신발 많으신 분들 강추합니다",0,False
5412636006,5,2021.05.24,가성비 제품 찾으시면 이거 사세요!,"집에 신발이 너무 쌓여서ㅠ 신발은 하나둘 사다 보면 은근 많이 쌓이거든요ㅠㅠ
여름되면 샌들 사고 구두 사고 해야 되자나여?? 그래서 버리고 싶진 않고 정리는 해야겠어서 한번 사봤어요!
가격도 워낙 싸고 그래서 크게 기대는 안 했는데 집에 온 거 보니까
생각보다 엄청 괜찮아서 가성비 대비 대대대만족 중입니당
오히려 싸서 더 개이득 하고 기분 좋아지는 거 같아요ㅋㅋㅋ

허접한 정도의 수준은 아니구여 신발이나 소품 몇가지 보관하기엔 안성맞춤인 거 같아요
만약 무거운 거 넣으시거나 하시려면 여러개 연결해서 쓰시면 더 튼튼하고 안정적으로 잘 버텨줄 거 같아여
저는 전에 다른 데서 이런 거 샀었는데 위에 뭐 올려두려니까 살짝 휘는 경향이 있더라구여
그래서 위에 음 작은 상?? 판자?? 면적이 동일하게 닿는 그런 거 위에 올리고
그 위에 소품이나 그런 거 올려주니까 튼튼하더라구여
요번에 산 거 조금 남아서 원래 갖고 있던 거랑 같이 연결해서 위에 판 올리고 테이블보 깔아서 소품 올려두려구요!
아무리 신발정리함으로 신발이나 물건 다 넣어놔도 창이 투명해서 조잡해보일 수 있는데
테이블보 깔면 분위기도 잡고 정리는 정리대로 돼서 좋더라구요
침대 옆이나 근처에 한 두개 정도 조립해서 둬도 협탁 대신으로 편하게 쓸 수 있을 거 같아여
이거 뭐 정리함 하나 사서 여기저기 다 쓸 수 있어서 가성비는 따질 필요도 없는 듯,,

아 저는 작은 사이즈 사서 신발 목이 높거나 사이즈가 좀 큰 건 안 들어갈 거 같은데
제가 가진 신발들 정리하기엔 딱 좋은 사이즈에용
구매 전에 실측 한 번 재두면 절대 실패 ㄴㄴ합니다 좀 귀찮아도 실측하시는 거 추천드려염

디자인은 뭐 심플하고 깔끔해서 군더더기 없구요
저는 먼지타는 거 청소를 부지런히 못 하는 편이라 그냥 블랙으로 샀는데 나쁘지 않은 거 같아요

아 그리고 이게 가벼워서 청소하실때 진짜 편해요
그냥 옆으로 슥 밀고 청소기 돌리고 물걸레질 하고 다시 슥 땡겨오면 되거든요
막 열댓개씩 쌓는 거 아니고서야 가볍고 청소도 편합니당

친구가 신발 거치대 걸이 이런 거 찾길래 그런 거 말고 정리함으로 사라고 여기 링크도 보내줬어욬ㅋㅋㅋ
생활스타일마다 다르지만 걸이보단 전 정리함 더 추천드리고 갑니당

아 사진은 제가 급하게 찍느라 좀 별로처럼 찍혔는데 물건과 제 사진실력 중 별로인 건 제 사진 실력 뿐입니다..,,",0,False
5412636006,5,2021.05.20,,,0,False
5412636006,5,2021.05.11,,,0,False
