product_id,ratings,reg_date,article_headline,article_content,help_count,is_photo_review
335717221,1,2020.12.01,,"나쁨이라고 준 이유는
솔직히 제품상태가 너무 안좋아요
말 할 것도 없이 기스나있고
조립 설명서도 안 나와있는 거 같구요
저는 괜찮은데 제품 하자 못 넘어가시는 분이면 비추!
너무 대충 대충한 거 같아요 ...
동영상은 어떻게 보내는지 몰라서 댓으로 남겨요
자석도 하나 안 붙고 하나 붙고 이렇게 따로 노네요 ㅋㅋ
힘들게 모아서 쓴 돈인데 신경 써주시면 감사하겠습니다
수고하세요.",0,False
335717221,4,2020.02.13,,,0,False
335717221,4,2020.01.03,,,0,False
335717221,5,2021.05.19,,"잘 받았습니당
항상 블랙만 시키다가 화이트가 왔는데 서로 엇갈려서 놓으니 이쁘더라구요~! 앞으로 이렇게 둘 예정인데 다 화이트로 왔는데...혹시 블랙은 없는건가요?ㅠㅠ",0,False
335717221,5,2020.11.24,i love it,,0,False
335717221,5,2020.03.29,,,0,False
335717221,5,2020.03.19,뿌듯하하네요 퀄도 나쁘지않고 만족합니다,,0,False
335717221,5,2020.03.03,,"크기가 커요 ㅎㅎ 치수 안보고 샀더니
아기 신발 정리함으로 샀어요
커서 못신으면 보관해 주려고도 샀어요
아기 신발 네개는 들어가겠어요
조립도 해보니 쉽고 마음에 듭니다 :)",0,False
335717221,5,2020.01.31,,,0,False
