product_id,ratings,reg_date,article_headline,article_content,help_count,is_photo_review
2305176760,3,2021.03.17,여닫기 너무 힘드네요,"튼튼하고 그래선지 살짝 무게감 있습니다.
자잘한 장난감 분류해서 정리하려고 하는데
다 좋은데 아랫단 고정장치가 너무 뻑뻑해요.
아이 혼자 절대 못열고 엄마가 발로 잡고 낑낑해야 겨우 열려요. 양쪽 동시 여는게 너무 힘들어서 한쪽 낑낑열고 다른쪽 기울여서 열고 있어요. 사용하다보면 좀 느슨해지길 기대해 봅니다... TT",0,False
2305176760,5,2021.05.26,,튼튼하고 좋은데 열기힘들어요,0,False
2305176760,5,2021.05.12,,기존에사용했던건 칸막이가 너무 잘빠져 제기능을 하지못했는데 이건 튼튼해요 정말 만족 이백프로 다만아쉬운건 터닝메카드 자동차를 넣기엔 조금작다는거였어요 조금더 큰 크기로 만들어주세요~~ ㅎㅎ(중간사이즈 만들어주세요ㅎ)그리고 포장이 많이 아쉬웠어요 배송종이박스안에 비닐포장도 없이 통만 덩그러니 왔어요ㅠ,0,False
2305176760,5,2021.01.05,레고 정리하려고 샀는데 좋아요 ㅎㅎ,,0,False
2305176760,5,2020.11.20,"레고, 가베 정리함으로 강추합니다","아이가 무거운 가베 원목 박스를 들고다니는게 불안해서 플라스틱 수납함을 사서 바꿔줬습니다. 사이즈도 적당하고 깔끔하고 좋아요! 좀 모자라서 오늘 하나 더 추가구매했습니다. 3단수납이라 저도 한번에 꺼내고 넣기도 편하고, 보기에도 깔끔하고 좋네요",0,False
