product_id,ratings,reg_date,article_headline,article_content,help_count,is_photo_review
1267760497,5,2020.10.19,자유롭게 구성하는 모듈식 슬라이딩 수납,"안 쓰는 방이 창고화 되어서 요즘 수납제품을 많이 보고 있었어요
수납장도 좋지만 사이즈 딱딱 맞는 제품, 옮기기 쉽고 모듈화가 된 제품이
공간을 구성해가며 쓸 수 있어서 좋더라구요

색상은 아이보리에
사이즈는 세 가지가 있고 사이즈는 높이만 차이가 있어요
밑면은 동일하기 때문에 칸칸이 옮기기도 쉽고
무엇보다 조립이라고 할 것도 없이 거의 원터치라서
장바구니 펼치듯 다 펼치고 딱 딱 소리가 나도록 끼워서 고정만 해 주면 되니까
정말 편리했어요 ㅎㅎ

슬라이딩이 부드럽게되어서 앞으로 빼기가 편해요
가장 하단에 무거운 것을 담고 가장 윗단에 가벼운 것을 담으면
서랍처럼 쓸 수가 있어요

또 옆면과 밑면이 딱 맞게 버텨주고 있기 때문에
많이 쌓아도 무너지지 않고 튼튼한 구조에요
플라스틱 제품은 조금만 무거운 것 담아도 휘청거리게 마련인데
두께도 두툼하고 제법 튼튼해요

이 제품은 4단 구성인데
제품을 추가로 구매해서 원하는 만큼 쌓아도 되고
일반 서랍장의 절반 너비라서
서랍장이나 장 안에 인서트로 넣어서 수납해도 되니까
용도가 참 다양하고 좋네요 ㅎㅎ

저는 일단 집에 지저분하게 널려있던 신랑의 취미용품들을 정리했어요
노린 것은 아니었는데 대형에 헬멧이 들어가고
중형 소형에 남는 잔 짐들을 착착 넣으니 딱 맞더라구요 ㅎㅎ
정말 놀랐네요

대형옆에 중형소형을 쌓아서
주방팬트리처럼 과일이나 잡곡 감자 같은 것을 넣을 생각이었는데
널부러 놓은 꼴이 보기가 싫어서 바로 정리해버렸어요 ㅎㅎ

추가로 더 구매해서 창고방이랑 주방, 벽장 내부를 정리해야겠어요

쿠팡체험단 이벤트로 상품을 무료로 제공 받아 작성한 구매 후기입니다.",16,False
1267760497,5,2020.10.19,부피크면서 자질구레한 물건 정리에 딱~!,"이 아이는 정말 활용도 면에서 별 10개도 주고 싶은 아이예요 ㅋㅋ

같은 회사 제품 진한 회색 칸칸이를 이미 사용하고 있었는데 폭이 엄청 깊고 칸도 큼직큼직해서 자질구레한 물건들 (물티슈, 휴지, 키친타올, 수세미, 쓰레기봉투, 마른걸레, 각종 영양제, 일회용 비닐 장갑, 티, 김치통 등등) 넣어두기 진심 완전 짱~!!

무엇보다 이사할때 차곡차곡 접으면 부피도 많이 차지하지 않고 조립도 (조립이랄것도 없음;) 그냥 찰칵 끼운뒤 차곡차곡 쌓으면 완성이라 단순심플하고 넘나 좋아요~~

그리고 튼튼한 플라스틱으로 되어 있어서 아주 무거운 물건들 보다는 가벼우면서 부피는 많이 나가는 물건들 위주로 넣어두시면 반영구적으로 사용가능 할 듯해요~ 완전 굿~~

쿠팡체험단 이벤트로 상품을 무료로 제공 받아 작성한 구매 후기입니다.",4,False
1267760497,5,2020.10.18,,,0,False
1267760497,5,2020.10.17,,,0,False
1267760497,5,2020.10.14,,,0,False
1267760497,5,2020.10.13,,,0,False
1267760497,5,2020.10.13,좋아용,"올리빙 접이식 슬라이딩 리빙박스 특대 + 대 2p + 중 세트

수납장과 서랍장은 있으면 있을수록 좋은거 같아요

요즘 미싱에 푹빠져서서 살고있는사람인데 해도해도

부족한 수납에 허덕이고 있더중 슬라이딩 리빙박스를

알게됬어요

수납과동시에 서랍장용도로 쓸수있어서 다방면으로

용이한 물건이네요

저는 지금 미싱 부자재를 지퍼백에 담아 차곡차곡 정리

중이에요

특대1개 대2개 중1개 요렇게 왔는데 충분히 많이 담을

수 있네요

도착해서 깨끗히 닦고 접어도 봤는데 쓰다가 필요가 없

어지면 납작하게 접어서 보관도 부피가 적어서 좋아요

다만 슬라이딩 형식인데 아무래도 지탱하는힘이 적어서

조심히 빼야한다는점 말고는 정말좋아요

주방에서 써도 좋을것 같아요

식자재나 과자같은 음식 같은걸 담아놔도 좋을듯 하네요

사는걸 고민중이시면 사시길 바래요

저는왕왕추천드려요

쿠팡체험단 이벤트로 상품을 무료로 제공 받아 작성한 구매 후기입니다.",1,False
1267760497,5,2020.10.10,베란다 물건정리 끝!♡♡♡,"☆ 주문일 2020. 10. 6 화요일
☆ 배송일 2020. 10. 7 수요일(1일소요)
☆ 상품명 올리빙 접이식슬라이딩 리빙박스
☆ 구성 특대+대2p+중 1세트
☆ 색상 크림톤 화이트
☆ 사이즈
특대 안쪽 (W)32*(D)33*(H)35.5
바깥쪽 (W)35*(D)38.5*(H)36
대 안쪽 (W)32*(D)33*(H)20.5
바깥쪽 (W)35*(D)38.5*(H)21
중 안쪽 (W)32*(D)33*(H)14.5
바깥쪽 (W)35*(D)38.5*(H)15.5

☆ 장점
*폴딩형 리빙박스로 간편한 조립방식===>10초안에 뚝딱! 강추!
*확장시 가능하여 자유자로볘 적재할수 있어 편리하다.
*접어서 틈새로 쏘옥~^^ 사용하지 않을때 보관하기 좋다.
*서랍처럼 넣고 빼는 편리한 슬라이딩방식이라 물건을 꺼내기 좋다.

뒷베란다에 라면이며.음료수등 정리를 한다고 했지만 늘 지저분하고 사이즈가 제각각인 박스다보니 깔끔하지가 않더라구요. 택배를 받자마자 조립해봤는데 정말 식은죽 먹기네요.ㅋㅋ 영상찍으면서 한손으로도 가능할정도였으니까요.
정리를 해놓고보니 말끔한 뒷베란다가 이제는 자꾸 들락거리게 되네요.
매우 만족한 물건 오랜만에 득템했네요.
옷장도 이렇게 정리한다면 더 깔끔해지겠어요.
짱~좋아요^^*

쿠팡체험단 이벤트로 상품을 무료로 제공 받아 작성한 구매 후기입니다.",7,False
1267760497,5,2020.10.10,,,0,False
1267760497,5,2020.10.09,공간을 효율적으로 사용하고싶을때,"다용도실에 물건정리가 정~말 골칫덩이였어요ㅠㅠ
저는 위까지 공간활용을 알차게 하는게 목표여서 이제 마음이 한결 편해졌네요
저희집 다용도실 사이즈에는 한칸이 안들어가서 3칸만 넣었어요
위아래 공간 꽉꽉 쓸수있다는점이 최고좋은것같고 슬라이딩돼서 깊숙한곳에 필요한게 있을때
슬라이드해서 꺼낼수도있는게 쓰다보니 편리한것같네요
조립 자체는 조립이라고 말하기도 뭐할정도로 쉬워요!
그냥 눕혀져있는 선반들 들고 모서리부분 끼워 세우면 끗
서랍이 필요없어졌을때는 다시 모서리 끼운것들 빼서 눕혀 보관하면 부피차지도 덜할것같아서
쓸때나 안쓸때나 요긴하게 쓰일것같아요~
남편도 다용도실 정리된거보더니 눈과 마음이 편안해진다며 칭찬해주길래 괜히 뿌듯ㅋㅋㅋ

쿠팡체험단 이벤트로 상품을 무료로 제공 받아 작성한 구매 후기입니다.",4,False
1267760497,5,2020.10.08,,"생각보다 받아보니 화면보다 만족스럽고 재질도 훨씬 튼튼해요.
사이즈가 4칸인데 사이즈가 실용적으로 구성되어 있어서 보관하기 참 편해요.
때가 잘 타는 재질이 아니라 관리하기 좋구요.
아랫칸은 아이 장난감을 놓을 생각이고, 임시로 사용하는 제품들 여분제품을 올려두었는데,
집이 아이보리톤인데 화이트라 깔끔해서 집안 인테리어도 헤치지않고 좋아요.
여자 혼자서도 조립하는데 10분채 안걸린거 같아 간단하구요.
생각보다 마감도 깔끔해서 판매되는 가격 대비로는 대만족입니다.

쿠팡체험단 이벤트로 상품을 무료로 제공 받아 작성한 구매 후기입니다.",2,False
1267760497,5,2020.10.08,,"요즘 놔버렸던 정신 붙잡고 정리정돈을 시작했어요
수납공간없이 짐만 많아서 대충 쑤셔넣고 끼워놓던 공간에
부직포 수납상자들을 이용해 버릴건 버리고 정리해놨어요
슬라이딩은 가벼운 물건들만 가능합니다
하지만 제품 설명에도 써있는 내용이고
이 가격에 이정도면 갓성비라고 봅니다
플라스틱 서랍도 이제품 최소2배 가격인데..
게다가 가볍고 보관도 변하고 조립도 십초면 뚝딱인데요?

이번은 체험단의 기회로 사용해봤지만
어느정도 짐 정리를 다시하고 재배치하면서 꼭 추가 구매해볼 생각입니다

쿠팡체험단 이벤트로 상품을 무료로 제공 받아 작성한 구매 후기입니다.",1,False
1267760497,5,2020.10.07,정말 좋아요 집두깔끔해보이구요 쓰기편하네요 추천드립니다,배송두 빠르구요 포장두 깔끔하게왓어요,0,False
1267760497,5,2020.09.30,,,0,False
1267760497,5,2020.09.16,,좋아요,1,False
1267760497,5,2020.09.12,배란다 물건들 정리 깔끔하게했어요,,0,False
1267760497,5,2020.09.07,,,0,False
1267760497,5,2020.08.30,,,0,False
1267760497,5,2020.08.19,,"휘청휘청 허술하지만
옷정리는 되요.",0,False
1267760497,5,2020.08.13,,,0,False
1267760497,5,2020.08.10,,,0,False
1267760497,5,2020.08.07,,,0,False
1267760497,5,2020.07.28,,,0,False
1267760497,5,2020.07.02,,,0,False
1267760497,5,2020.06.20,깔끔하게 정리 잘 되어서 좋아요,아주 마음에 듭니당,0,False
1267760497,5,2020.06.18,,,0,False
1267760497,5,2020.06.18,한 세트 더사야 겠어요,"오 깔끔하고 좋네요
정리가 잘되는 느낌",0,False
1267760497,5,2020.06.17,,,0,False
1267760497,5,2020.05.25,,옷장 속 서랍이없는 곳에 두고 가방이든 옷이든 정리하는데 유용해요. 각각의 칸들이 앞으로 슬라이드할수있게끔 되어있어 더욱 편리하네요.,0,False
1267760497,5,2020.05.25,,생각보다 튼튼합니다. 옷장정리에 적당합니다.,0,False
1267760497,5,2020.05.15,튼튼하고 편합니다,,0,False
1267760497,5,2020.05.13,,간편하게 설치할 수 있고 앞뒤 구분없는 슬라이딩 형식이라 정리해둔 물건을 꺼내기 쉬워서 좋아요,0,False
1267760497,5,2020.05.05,,,0,False
1267760497,5,2020.04.14,,,0,False
1267760497,5,2020.03.20,,,0,False
1267760497,5,2020.03.16,,"드레스룸 서랍장이 부족해서 리빙박스로 대체했어요. 깔맞춤은 물론 각맞춤까지 해서 옷정리하는 남편에게 리빙박스가 딱이네요.
자주 입는 티셔츠는 원래 선반위에 컬러별로 정리해뒀는데 생활하다보면 아무래도 금방 흐트러지더라고요. 리빙박스안에 넣어두니 훨씬 깔끔해졌어요. 미뤄뒀던 겨울옷좀 정리하고 옷정리 다시 해야겠네요.
특대 사이즈에는 큰 책들 정리해두었어요. 활용도가 높고 깔끔하게 사용할수 있어서 아주아주 좋아요!
조립없이 그냥 펼치기만하면 되니까 간편해서 좋구요. 색상은 그레이아이보리 느낌이 나는 화이트색상이에요. 푸른빛나는 화이트 싫어하는데 저가제품이랑 차이있어요. 슬라이드되니까 중간중간 서랍처럼 열고닫고 편리하게 이용 가능해요. 아이디어 상품이네요.
나중에 더 필요하면 추가구매 의사 있어요. 만족해요 :)

쿠팡체험단 이벤트로 상품을 무료로 제공 받아 작성한 구매 후기입니다.",2,False
1267760497,5,2020.03.15,,,0,False
1267760497,5,2020.03.13,,,0,False
1267760497,5,2020.03.13,집안정리 이걸로 끝♡,"이제 좀있음 봄이오기에 옷정리를 할때가ㅜㅜㅜ 한숨 내쉬며 또 어떻게 정리를해야할까 고민하던 찰나 올리빙 크로스 리빙박스란걸 접하게되었네요..
이런신세계가~~~~~~♡♡따따 따봉임돠.

ㅡ사진에서 처럼 박스에 튼튼하고 안전하게 배송
빠름 빠름 완전 빠름이어라~~

ㅡ7살짜리 조카가 맹글어줄 만큼 간편한 조립식

ㅡ슬라이딩 방식이라 일일이 들지않아도 손쉽게 옷을 정리하고 고를수 있다는 장점

ㅡ원하는 장소만 정해서 하나하나 차곡차곡 쌓아만주면 됨

ㅡ화이트 색상으로 어느곳이든 배치가 이쁘고 잘맞음

ㅡ갯수를 나누어서 일자로 세울수도있음 나누어도 됨

ㅡ옷장이 있다면 옷장속 옷정리로 깔끔해질수있음

ㅡ아이들 장난감이나 인형 정리에도 안성맞춤

이거 정말 대박 요물입니다. 이런 신세계가 또 있을까요.. 굳이 옷을 넣지않아도 속옷이나 양말을 정리정돈해두어도 너무 깔끔하게 연출이 되네요.. 이거 하나로 아이방이 달라졌어요.
또다른 팁은 주방에 두고 손쉽게사용할수도 있고 베란다 세탁실에 세제와 유연제 쌓아두고 사용하셔도 슬라이딩방식이라 편하게 사용이 가능하네요.. 그외에도 장소만 정한다면 그어디에도 어울리며 편리하게 사용할수있다는 점에 정말 높은점수를 주고싶네요.,100점만점에 1000000점입니다♡

쿠팡체험단 이벤트로 상품을 무료로 제공 받아 작성한 구매 후기입니다.",11,False
1267760497,5,2020.03.13,,"집에 옷은 많은데 정리가 잘안되어서 정리할만한 박스종류 찾다가 구매하게되었습니다 ㅎㅎ
배송받고 뜯어 보니 조립?하는거도 아주 간단하게 그냥 펴서 꼽으면 되는거라서 평소에 조립하는거는 잘안되고 어려워서 살짝 걱정했는데 너무 편했네요 ㅎㅎ
여러단으로 쌓아서 쓸수있으니 공간활용도 괜찮고 ㅎㅎ 잘산거같습니다 ㅎㅎ 집에 걱정거리하나 던거같아서 좋네용 ㅎㅎ
가격도 괜찮고 좋아욤 ㅎ 수납장에 정리한거보니 몇개 더사서 더정리를 깔끔하게 해둘까 고민도되네요 ㅎㅎ 생각좀 해보구 더 구입하겠습니당!ㅎㅎ 완전 추천합니다 ㅎㅎ
주변에 친구들에게도 추천 많이할게요! 많이 파세요 ㅎㅎ

쿠팡체험단 이벤트로 상품을 무료로 제공 받아 작성한 구매 후기입니다.",0,False
1267760497,5,2020.03.13,집이 깔끔해졌어요 ^^,"예전부터 신랑이 쓰는 붙박이장에
리빙박스 사서 좀 깔끔하게 해야겠다 생각은
항상 하고있었는데 이번에 리빙박스도
슬라이딩으로 되 있다는 것을 처음 알게되서
바로 실행에 옮겼네요

사용해보니,

1. 역시나 붙박이장안이 깔끔해요.

한 곳은 맨 위에 칸, 맨 아랫칸 빼고 칸막이가
없어 옷 정리정돈 잘해도 먼가 딱!
각이 있었으면 좋겠다 생각했었고
압축봉, 리빙박스도 생각해 보았으나
이렇게 슬라이딩되는 리빙박스 있는 줄
알았으면 직작 샀을거예요 ^^


2.슬라이딩이 되서 너무 좋아요

특대형은 옷 부피 좀 있는거 나열했고
얇은 기능성 운동복은 맨 아래 놔서
위에 칸 중짜리 리빙박스 놔서도
슬라이딩 될때 뻣뻣하지않게 나열했어요.


3.아직 까진 대만족이예요

전 처음부터 옷정리에만 쓰려고 산거라
덕분에 깔끔해진 옷장에 보기만해도
기분이 좋네요.
흐트러지면 정리 꽝 분대신- - ; 제가 항-상!
정리했었는데 스트레스안받아요.


4.재구매 의사 10000%예요.

제일 많이 적은""슬라이딩""되서 쓰기 편할 것
같아 다른 용도로도 유용할것 같아요
기타/잡동사니.애기용품.반려견용품
다용도실정리. 등등등 활용도가 많네요

5.전 원래 흰색을 좋아해서

횐색구매했는데 역시 다이소 제품(흰색
리빙박스)과는 급이 다르네요.
다용도실에 감자/양파 놓는곳에
다이소제품 쓰는데 올리빙 제품이 있어보여요
갑자기 다이소 제품이 초라해보이는,,

6.쓰다 색 다른 색으로 구매해서

한색은 안입었던거,또 한색은 입었던 옷 구분
해도 더 깔끔 해 질것같네요
굳이 색 표시안해도 리본이나 자기만의
표시해서 써도 될 것같구요.

7.다시 리빙박스산다면,
전 올리빙 제품 쓰려구요. 가볍고 접을 수도
있고 접을 수도 있는 리빙박스 부직포로
된 제품 말고 이것도 신세계네요.
(저만 몰랐던 건지 ^^;;)

8.만족도가 높은 제품 만나면
삶의질이 올라가는것같아요
좋은제품 감사합니다

9.추천여부를 묻는다면
전 추천입니다. 처음 사용 시 한번 닦아서
사용하세요

쿠팡체험단 이벤트로 상품을 무료로 제공 받아 작성한 구매 후기입니다.",16,False
1267760497,5,2020.03.12,,"짜투리 수납공간에 들어갈 ..리빙박스 필요해서 보고 샀는데 역시! 오자마자 간단히 10초만에 혼자 뚝딱 조립해서 넣으니 딱이었어요^^ 물건정리하면서 ..크기에 맞게 하니 깔끔하게 아이가 즐겨있는 옷 장난감등이 ..보이니 아이가 직접 꺼내입고 좋아하네요♥ 슬라이딩박스라 서랍처럼 필요할때 꺼내니 아이옷도 넣으니 넘 편안하네요! 접어서 사용안할때 틈새에 쏘옥 보관가능하니 공간차지도 안하니 ...넘 좋아요! 덕분에 집이 깔끔해졌어요^^

쿠팡체험단 이벤트로 상품을 무료로 제공 받아 작성한 구매 후기입니다.",1,False
1267760497,5,2020.03.11,,"많이크네요
조립이 쉬워요
쌓아놓으니 흔들리긴하지만 안정적이고
슬라이딩이 잘되네요
완전히빠지지않게하는게 없어 아쉬워요
칸칸이 고양이 넣어 흔들어도보고 슬라이딩도 해봤는데
안정적이고 좋네요
맨아랫칸은 맘에드는지 서로차지하려고 싸워요
이것두 내줘야하나 ㅠㅠ
옷정리하려고 산건데 ㅠㅠ
큰칸은 가방정리하고
중간곳엔 티셔츠랑 바지 정리하면 될듯

밀크야 이젠 나올래 ?????? 거기 자는곳 아냐 ㅠㅠ

쿠팡체험단 이벤트로 상품을 무료로 제공 받아 작성한 구매 후기입니다.",9,False
1267760497,5,2020.03.10,,조립도 쉽고 크기도 적당합니다,0,False
