product_id,ratings,reg_date,article_headline,article_content,help_count,is_photo_review
4976360676,1,2021.05.05,배송할때 물건 깨지지 않게 조심해주세요,4개를 주문했는데 그중에서 1개가 위쪽 부분이 깨진 상태로 배송이 되었습니다. 교환하기 번거로워서 깨진 부분을 테이프로 붙여서 사용하려고 하는데 앞으로는 택배 배송할때 신경써서 조심히 물건을 다뤄줬으면 합니다.,0,False
4976360676,2,2021.05.19,,,0,False
4976360676,2,2021.05.05,,"사이즈에 비해 가격은 싼편이에요
두개만 얹어도 크고 넓고 좋아요
애들 어정쩡한 장난감 다 들어가네요
기타 장난감배드민턴채 단어공부장난감등등
하지만 그만큼 얇구요 조립하다 커팅 된 부분에 스쳐서 상처가 나기도 했어요
조립하고 나니 날카로운 느낌은 덜한데
만약에 얇아서 쉽게 깨진다면 애들있는 집은 위험할듯요",0,False
4976360676,3,2021.03.27,2셋트 시켰는데 하나씩은 깨져오네요.,"각 하나씩 빼서 교환할까 했는데 급하게 필요하고 사용하는데 불편이 없어서 교환안하는데 신경좀 써서 보내주세요
애견용품 애묘용품 때문에 구매했습니다
가벼운 제품 담는데 쓰세요.딱 좋습니다.
같은 형식의 제품 쓰고 있어서 구매한건데 좀 얇아요
싼 이유는 분명히 있어요
별 세개는 배송이 빠르고 용량이 맘에 들어서 드립니다.",0,False
4976360676,4,2021.05.24,,,0,False
4976360676,4,2021.05.24,,,0,False
4976360676,4,2021.05.14,,"용량은 표기와 같이 넉넉합니다.
약간의 가벼운 느낌이 나긴 하나,
학용품 장난감 바구니로 활용하려고 한 것이니 괜찮을거 같아요.
냄새도 없고 깨끗하네요~",0,False
4976360676,4,2021.03.12,,"생각보다 엄청 커서 놀랬어요
어디한곳 깨진곳없이 잘 왔어요
문이 슬라이딩방식이라서 너무 편하고 좋네요.
저는 위아래로 놓고 세탁실에 두고 쓰고 있어요.
생각보다 많이 들어가고 슬라이딩 방식이라서 뚜껑이 걸리지 않아서 편해요.
집이 좁아서 수납공간이 많이 필요한데 유용하게 쓸것 같아요.
뚜껑 닫아놓으면 엄청 깔끔해서 잡동사니 담아두기도 좋을꺼 같아요.

쿠팡체험단 이벤트로 상품을 무료로 제공 받아 작성한 구매 후기입니다.",0,False
4976360676,4,2021.03.10,서랍장 대신 가벼운 물건들 정리하기 좋아요.,"서랍장 같은거 한번 들여놓으면 옮기기고 어렵고
버릴때도 돈 들고 공간도 많이 차지해서 수납장 같은게
사기는 그렇고 필요는 할때 이 제품 같은거 부담없이
들여놓으면 좋을거 같아요.

1. 크기 및 용도
꽤 부피가 커서 부피 큰 옷이나 인형. 장난감 같은 것들 정리하기 딱 좋습니다. 약간 수납장 같이 생겨서 그냥 방 한 쪽에 놔둬도 어색하지 않고 안정감 있어요.
다만 플라스틱이 얇고 견고하지 않기 때문에 무거운 물건이나 중요한 물건들 넣기는 적합하지 않습니다.
옷이나 인형. 블럭이나 가벼운 장난감들 정리하기 좋고
패트병이나 종이 쓰레기 같은 재황용품 정리함으로도 좋아요. 특히 쌓아둘 수 있는 구조라 베란다에 재활용품 정리함으로도 괜찮습니다. 다만 뚜껑이 위로 있는게 아니라 옆으로 있기 때문에 내부가 잘 보이는 반면 쓰레기 같은건 한꺼번에 꺼내버리긴 좀 불편합니다.

2. 견고함
견고하진 않아요. 가볍고 얇아서 무거운 물건 넣어두면 휘거나 부러질 거 같고 받았을 때 이미 약간 깨진 부분이 있었어요. 아마 택배 오면서 깨진거 같은데 그냥 귀찮아서 교환 안 하고 씁니다. 일반 얇은 리빙박스 정도로 견고한데 요새 커다란 리빙박스는 꽤 튼튼하죠. 그런 큰 탄탄한 박스보다 약한 정도입니다.
뚜껑은 슬라이드 방식으로 편하게 열었다 닫았다 할 수 있어 편리하지만 세게 열면 빠져버리니 살살 열어야합니다. 물론 빠지면 다시 끼면 됩니다만.

3. 디자인
아주 이쁘거나 그런건 아니지만 방이나 거실 한 구석에 두기 무난합니다. 앞에서 언급했듯 위로 차곡차곡 쌓아올릴 수 있는 구조라 편리합니다. 색상은 화이트 깔끔하고 괜찮습니다만 오래 쓰면 때가 좀 타겠죠ㅡ 열심히 닦아주면 괜찮겠습니다만.

4. 배송
커다란 박스에 뽁뽁이 없어 담겨와서 편하고 쓰레기가 적어 좋기는 했지만 깨질 우려가 있습니다. 저는 일부분 깨진 걸로 받았어요. ㅜㅜ 로켓배송이라 바로 다음날 받아 빠릅니다.

가격이 착해 간단하게 정리함으로 사서 쓰기 좋습니다.

쿠팡체험단 이벤트로 상품을 무료로 제공 받아 작성한 구매 후기입니다.",1,False
4976360676,5,2021.05.21,,,0,False
4976360676,5,2021.05.21,,,0,False
4976360676,5,2021.05.10,,,0,False
4976360676,5,2021.05.04,,"사이즈 넉넉하고 좋아요
근데 한통이 뚜껑 발 부분이 깨져서 와서 교환했어요
잘 확인해야 할거 같아요. 작은플라스틱이 깨져있어요 ㅠㅠ

암튼 새하얀 화이트라 깔끔하고
다이소 보다 비싸다 생각햇는데. 다이소 젤 큰용량보다
더 깊고 많이 들어가요

근데 나란히 세워놓으면 크기는 별차이 안나요

26900원에 구입 했는데
지금 4만원대네요 헐 ;;;어떤게 진짜 가격인지요 ;;;",0,False
4976360676,5,2021.05.03,,,0,False
4976360676,5,2021.04.11,,,0,False
4976360676,5,2021.04.09,,,0,False
4976360676,5,2021.03.27,,,0,False
4976360676,5,2021.03.22,부담스러운 수납장대신 예쁘고 편리한 리빙박스,"해가 바뀔때마다 필요한 옷만 고르고 골라 남겨두고 안입는옷은 버리는데도 옷을 넣을 공간이 턱없이 부족했었습니다.

옷을 나름 정리해놓아도 잠깐잠깐 나갔다올때 입는옷이나 실내복들을 입고나서 의자나 물건위에 걸쳐놓기 일쑤였는데,
이 슬라이딩 박스에다가 넣어두니 세상 깔끔해서 너무 보기가 좋습니다.

기존에 있던 다른박스는 위에서 열어서 사용하는 박스여서 맨밑에 있는 옷을 꺼내려면 이리저리 헤집고 다 꺼내느라 금방 지져분해졌는데, 이 슬라이딩 박스는 앞에서 문을 부드럽게 열어서 바로 입을 옷을 쏙 꺼내면 되서 너무너무 편리합니다.

처음에 배송이 올때 밑바닥 윗바닥 문짝 따로따로 오는데 1~2분이면 뚝딱 조립이 쉽게 완성됩니다.
그리고 보통 이런 박스사면 냄새가 심하게 나는 경우가 있어서 냄새빼느라 고생하는 경우가 있는데 이제품은 냄새가 전혀나지 않아서 안심하고 옷을 넣어둘 수 있습니다.

그리고 외관상으로 봤을때는 옷이 얼마나 들어가려나 했는데, 은근히 많이 들어갑니다.
사용하기도 편리하고 디자인도 깔끔하니 이쁘고 튼튼해 보여서 만족스럽니다.

쿠팡체험단 이벤트로 상품을 무료로 제공 받아 작성한 구매 후기입니다.",0,False
4976360676,5,2021.03.21,만족합니다,"문여닫는 동영상 첨부했습니다.
간단한 원리인데도 부드럽게 잘 열리고 닫힙니다.
사진에서 보시다시피 어디 장 안에 넣으시려면
문이 앞으로 열리는 공간까지 생각하셔야합니다.
문 열리는 길이 줄자로 재서 사진첨부해놨으니 참고하세요.
이런 수납함은 수납하려는 물건이 딱맞게 들어갈때 쾌감느끼는거 아시죠?
두루마리휴지는 저희집꺼는 코스트코라 두꺼워서 꽉맞게 들어가는데 일반 두루마리휴지는 알맞게 잘 맞을것같아요.
물티슈도 저희집꺼는 100매짜리라 세로로 꽉맞게 들어가는디 80매짜리는 이쁘게 잘 맞을것 같아요.
수납함 윗공간도 키친타올이 알맞게 올려집니다.
너무너무 맘에 듭니다.
저는 팬트리 정리용으로 썼는데 딱 알맞은것 같습니다.

쿠팡체험단 이벤트로 상품을 무료로 제공 받아 작성한 구매 후기입니다.",1,False
4976360676,5,2021.03.21,,"▶ 구매동기
- 쿠팡체험단에 선정되어서 체험해보았습니다.

▶ 배송상태
- 배송은 빠르게 진행되었습니다.
- 뚜껑이 파손되어 교환하려고 했는데, 품절상태라서 재입고를 기다렸다가 교환성공했습니다.

▶ 주관적인 후기
- 리빙박스를 다양하게 사용해보았었는데요.
- 패브릭으로 되어있고 안쪽에 철제로 되어있는 것은 옷 이외에 무거운걸 넣기가 힘들더라구요. (금방 무너짐)
- 대용량 슬라이딩 리빙박스는 우선 용량도 짱짱하고, 플라스틱으로 되어있어서 상대적으로 견고했어요.
- 뚜껑은 2개로 분리되어있는데, 앞을 막는 부분을 끼우고, 윗쪽뚜껑은 홈에 맞게 끼워주면 완성이에요.
- 집안에 화장품이 많아서 정리가 안되었는데, 햇빛도 차단되고 슬라이딩 박스라서 커버를 열기가 쉬워서
- 보관할때 너무 간편합니다.
- 리빙박스가 2개 세트라서 옆으로 나란히 두기도 좋구요. 상하로 쌓을때 딱 맞아서 안정감이 있어요.
- 내부는 홈이 바닥 바깥쪽으로 파여진 구조라서 바닥이 (상하로 쌓기 위함인듯) 완벽하게 반듯한건 아니에요.


▶ 기타
- 수납때문에 리빙박스 고민이라면 추천드려요.

쿠팡체험단 이벤트로 상품을 무료로 제공 받아 작성한 구매 후기입니다.",1,False
4976360676,5,2021.03.18,꽤 큼직해서 보관하기 좋네요^^,"●집에 정리가 안되는 물품이 많아서 수납함 있으면 좋겠다
생각하던차에 고르게 됐어요~ㅎㅎ

●크기가 작을거라고 생각했는데 생각보다 큼직하더라구요~

●위 뚜컹과 수납 도어만 조립하면 돼서 조립은 간편했어요~

●조립후에 수납 하려고 봤더니 냄새가 심해서 냄새 빼려구
수납 도어만 열어두니 냄새가 금방 빠지더라구요^^
(냄새가 금방 빠졌지만 완전히 빠지라구 하루 이틀은 열어 두었다가 수납해서 사용하고 있어요~^^)

●수납 도어가 위 뚜껑 속으로 밀면서 들어가면서 열렸다가
다시 밑으로 내리면서 닫을 수 있게 되어 있어요~

●흰색이라 먼지는 탈수두 있을듯 해요~

●수납 도어가 막 아무렇게 휙휙 열었다 닫았다 하면
조립한게 빠질 수 있으니 부드럽게 열었다 닫았다 하면서
쓰는게 좋을 것 같아요^^;

●2단으로 쌓아올렸을때 홈에 맞춰서 올리게끔 되어 있어서
떨어지거나 쓰러지는것 없이 2단으로 사용할 수 있어서 좋아요~^^

●2단으로 쌓아올리고 나서 맨위에 물건 올려두기에두
괜찮네요~^^

●나름대로 수납두 많이 되는데 비해 공간은 좀 필요하다는게
단점아닌 단점이 될듯 해요ㅋ

쿠팡체험단 이벤트로 상품을 무료로 제공 받아 작성한 구매 후기입니다.",0,False
4976360676,5,2021.03.12,너무조아요 화이트 진리 !!,"정말루 넉넉한 용량에 심플하게 모던한 디자인으로 집에
인테리어 분위기를 전혀 헤치지않으며 조화롭게 알아서
어울어지는 이 완벽한 리빙박스좀 보고 가세요!
슬라이딩 되는 문 형식으로 정리와 수납을 다 하고나서는
지저분해 보이지 않고 정리 정돈된 느낌을 주기위해 문을
슬라이딩을 닫아두면 , 정말 집이 깔끔 해지고 공간확보도
무엇보다 엄청 되어서 옷이나 각종 화장품. 수건 과자 간식
등등 많이도 들어가서 정말 넉넉한 용량에 ㅎㅎ 수납공간까지
감동입니다. 완벽합니다!
겹겹이 쌓아 올리면 이또한 인테리어와 디자인의 완성
입니다 ㅎ ㅎ정말 한눈에 봐도 큼직한 대 점보 용량에
화이트와 베이지의 따뜻한 컬러감!!
흔들리지 않게 안정적으로 잡아주는 ~~
냄비수납 까지 되니 정말 주방이나 방이 넓어져요.4
두꺼운 겨울 옷도 가득가득 보관이 가능하고
책장으로도 쓸수있으니 이곳에 뭘 넣어야할까~~
행복한 고민에 빠지게 되네요 ㅎㅎ 쉽게 조립도되고
보관까지 겹쳐서 쉽게 되니 이사라던지 옮길떄에
전혀 문제가 되지않고요.집안에 숨은 공간까지
되찾아주니 여러개를 더 사서 쌓아두고싶네요 ㅎㅎ
공간차지도 덜되니 너무 좋ㅇㅏ욧.
정말 급할떄엔..작은 미니 식탁으로도 쓰고있답니다
쉿쉿ㅋㅋ 그러라고 만든 건 아니지만 ㅋㅋ
슬라이딩 리빙박스는 사이즈가 가로45에 세로37에
높이가 41로 꾀나 넉넉한 사이즈 입니다.
화이트와 베이지 컬러가 있고요.
따듯한 감성의 색감으로 숨은 공간을 활용해보세요
정말 시원시원 하게 큼직 큼직한 사이즈로 많은 양을
수납할수 있어요.
감성이 느껴지는 심플한 디자인 이랍니다><
적층 시에도 수납이 가능한 편리한 슬라이딩 도어가
정말로 찐매력 ㅇㅏ닐까염ㅎㅎ
정말 안전한 적층 홈으로 흔들림도 없는 적층구조라니!
매우튼튼 파워튼튼 !!넉넉한 사이즈의 용량으로
겨울옷도 여유롭게 보관해 준답니다.
심플하고 따듯한 색감으로 어느 공간에서든지 잘 어울려요
슬라이딩 도어로 간편하게 온오프까지 할수 있어요
칭찬 남발 해도 모자라요 ㅋㅋ
재활용 분리수거함으로 활용할수도 있으니 넉넉하게
생수병까지 수납하고도 튼튼해서 무너지지않아요.
사용하지 않을때에는 오픈커버를 분리후에 박스를 겹쳐서
쌓아놓으면 공간을 활용하는데 있어서 효율적이에요><

이 떨어지면

쿠팡체험단 이벤트로 상품을 무료로 제공 받아 작성한 구매 후기입니다.",0,False
4976360676,5,2021.03.12,,"마침 리빙박스가 똭! 필요한 시점에 리빙박스 받아보게 되어

넘넘 좋아요 ㅠㅠ♡

아기 짐이 많아지면서 정리를 시작했는데 짜투리 짐들을 넣을공간이 없더라구요 ㅎㅎ

요 리빙박스 두개로 정리 끝냇어요:)

일단 조립은 너무너무 쉬워요 ㅋㅋㅋㅋ

먼저 앞에 문 먼저달고 뚜껑 닫아주시면 끝!!

단점이 있다면 딴딴하고 견고하진않아서 너무 무거운걸 넣는건 무리가 있을거같아요

혹시 넣어야 한다면 맨밑상자에 넣어주면 될듯하네요 ㅎㅎ

저는 맨밑상자에 책을 넣고 정리햇슴당 ㅎㅎ

공간도 넉넉해서 쓸모가 많을듯해요 ㅎㅎ

쿠팡체험단 이벤트로 상품을 무료로 제공 받아 작성한 구매 후기입니다.",0,False
4976360676,5,2021.03.11,,"겨울옷이랑 가방 같은거 정리해 놓으면 좋을 거 같아서 골랐어요!!
만 하루도 되기도 전에 도착했어요
택배 진짜 빨라서 깜짝 놀랐네요ㅋㅋㅋ
조립하기도 엄청 쉽고
크기도 엄청 커서 보이는 거 보다도 훨씬 많이 들어가네요ㅎㅎ
열은 상태로 고정도 되어서
사용하기 편하고 아주 좋은 거 같아요
플라스틱이 가벼운 재질이라 박스가 무겁지도 않고
여기저기 이동시키기 좋은데에반해
플라스틱 자체는 튼튼해서 잘 안부서지고
오래 쓸 수 있을 거 같아요
색상도 깔끔한 화이트 색상이고
디자인도 깔끔하고 무난해서 더욱 좋은 거 같아요
잘 쓸게요 감사합니다!!

쿠팡체험단 이벤트로 상품을 무료로 제공 받아 작성한 구매 후기입니다.",0,False
