product_id,ratings,reg_date,article_headline,article_content,help_count,is_photo_review
218341459,5,2020.03.27,수건 넣기 딱 좋네요. 아주 좋습니다.,"아이리스 리빙박스는 두번째 구매네요
예전에 코스트코에서 큰 리빙박스 구매했다가 완전 만족했어서 구매했습니다.

역시 쿠팡이 배송은 정말 최고인것 같아요~ 바로 다음날 아침7시에 현관문을 열었는데 바로 앞에 와있네요
상품 또한 역시 좋았습니다.
화장실에 수건을 수납할 공간이 없어서 수건을 조금씩 보관하고 싶어서 샀어요
제가 접는 방식으로 수건을 접었더니 딱 3개씩 들어가네요.

조금 더 구매할까봐요~다른 소품들도 잘 들어갈 것 같고 투명해서 어떤 상품이 들어있는지도 바로 볼 수 있을것 같아서 아주 유용하게 사용할 것 같습니다.",4,False
218341459,5,2020.03.27,빠르고 안전 배송 깔끔 정리함 굿굿,빠르고 문제없이 배송 잘 받았습니다! 투명해서 잡동사니 마구 넣고 찾기 딱 좋네요ㅎㅎ 사이즈도 좋고 추천합니다~~,2,False
218341459,5,2020.03.16,,배송도 빠르고 어제부터 정리중인데 넘 좋네요~~계속 재주문하고 있어요 ㅋㅋㅋ,2,False
218341459,5,2020.03.12,좋습니다,"적당한 크기, 빠른 배송, 편리한 사용
잘 사용하게 되었습니다",1,False
218341459,5,2020.03.07,배송좋고 가격대비 용이함,"가격대비 맘에 듭니다 쌓기에도 좋고 투명해서 내용물도 잘보이고요
다만 뚜껑 열고닫는게 좀 신경을 써야하더라구요 가격이 저렴해서 그런건지 개페구조가 좀 편하진않아요
싸니깐 넘어갑니다~",3,False
218341459,5,2019.11.06,,,0,False
218341459,5,2019.10.08,,,0,False
218341459,5,2019.08.18,,8개나 이 가격에 받았네요. 작은 장난감 정리할려고 샀어요. 좋어요.,6,False
218341459,5,2019.06.13,재구매의사100%,"가격도저렴하고 자잘한 장난감정리에 좋아요~
한샘책장 한칸에 3개씩 쌓을수있어서 공간활용에 좋습니다",12,False
