product_id,ratings,reg_date,article_headline,article_content,help_count,is_photo_review
1267760497,1,2021.03.09,큰수납장의 뒷판이 안왔어요ㅠ 빨리보내주세요,,0,False
1267760497,1,2021.02.11,"절대 구매하시면 후회 합니다 별을 줄수 없는데,,,,","너무하군요 대는 무거운 것 올리지도 않았는데 휘었고 힘을 견디지못해요 그리고 흔들흔들 ,,,, 이것 사용하고 구매후기를꼬옥 써야겠다구 생각했어요 임시로 조립해보고 가벼운 팬잡다구리 넣었는데 대짜리는 판이 아예 휘었어요 저와 같은 피해 안봤어면해요
진짜 후기잘안쓰는데,,,,,",2,False
1267760497,1,2020.09.27,,가격이 2천원이나내렸네요.두세트샀는데 짜증,0,False
1267760497,1,2020.07.29,,"구성과 실용적인 면에서
별 하나도 아까움",1,False
1267760497,1,2020.07.25,,"제품명에서 슬라이딩은 없는게 좋겠네요.
하나 빼려면 다른걸 잡아야 하니 제대로 슬라이딩이 되지 않습니다.",3,False
1267760497,1,2020.07.20,,슬라이딩이라고 하면 안될듯...아래거 당기면 위까지 같이 올라옴...지탱능력도 별로인듯,2,False
1267760497,1,2020.06.28,,"한번은 부품빠져서 반품시키고 다시또왔는데
한쪽 부러저있네요 이런 최악은 처음이네요",1,False
1267760497,1,2020.05.22,제품이모두 다깨져서왔어요박스안에보니 부서게보여요,,0,False
1267760497,1,2020.05.03,,"처음으로 받은 상품이 파손된 상태로 와서 교환신청을 했습니다
그리고 바로 다음 날 빠르게 새상품을 받았는데 이것 또한 파손되어서 왔네요...;;
상품을 박스안에 포장도 안해주셔서 그러신거 같은데 다음부터 포장 좀 신경써 주세요 기분이 좀 그렇네요

첫번째 사진이 처음 받은 상품이고 두번째 사진이 교환된 상품입니다.",1,False
1267760497,1,2020.04.08,두번째 구매인데 피손되어서 오다니...ㅠㅠ,"배송은 잘 왔으나, 세트 구성품 증에 하나가 파손되어서 왔네요.
배달하는 중에 파손이 되었는지 파손된 상품이 처음부터 온건지는 모르겠으나, 4개 중 하나만 망가져있네요",2,False
1267760497,2,2021.01.31,그냥저냥,"판때기 하나가 없는데 부속품은 따로 안보내진다고
전체 교환만 된다고 해서 그냥 씁니다.
조립도 다하고 박스도 버려서..어쩔수가 없네요",0,False
1267760497,2,2020.12.12,"무거운짐은 비추천, 그리고 높게 쌓지말자.","무거운 짐을 보관으로는 비추천이에요~
휘더라구요..아주 휘어서 ㅜㅜ 쓴지 하루 만에 버렸습니다.
1단에 무거운짐 놓고 2층, 3층으로 올렸는데 ㅜㅜ 힘이 없어서 그대로 s자로 휘어버렸어요...",2,False
1267760497,2,2020.10.05,,"풀라스틱 공간박스... 그냥저냥이예요
자체가 불량인듯한데 조립도했고 반품도 귀찮아 그냥 씁니다만
좀 불쾌하네요",1,False
1267760497,3,2021.05.14,,,0,False
1267760497,3,2021.04.25,,"주방에 놓고 썼는데 한 3일 멀쩡하더니 주말에 나갔다 온 새에 무너져 있었습니다
얼마나 방치돼 있었는진 모르겠지만 그 상태로 판이 다 휘어서 못 쓰게 됐네요
사서 쓰실 분들은 진짜 가벼운 물건, 옷장 정리하는 용도로만 쓰기에 적합할 것 같습니다",1,False
1267760497,3,2021.03.04,,제품은간달히고 사용하기 편한데 생각보다 조금 작았어요.,0,False
1267760497,3,2021.02.26,,생각보다 흔들흔들 합니다.,0,False
1267760497,3,2021.02.25,,,0,False
1267760497,3,2021.01.18,,,0,False
1267760497,3,2021.01.11,얼마안쓰고 누렇게 변색되서 묻어나옵니다. 다버려야하네요,,0,False
1267760497,3,2020.11.15,,,0,False
1267760497,3,2020.10.09,,,0,False
1267760497,3,2020.09.30,,,0,False
1267760497,3,2020.09.06,크기가 생각보다 큼,생각보다 조금 크기가 커서 공간차지를 많이 하네요ㅠ 그래도 옷 넣을 공간이라도 생긴 의미로 사용합니다,0,False
1267760497,3,2020.09.04,공간활용도는 좋을것같은데 견고함은 ...글쎄요...,생각보다 많이 약한것같아요...,0,False
1267760497,3,2020.08.07,,,0,False
1267760497,3,2020.07.05,,,0,False
1267760497,3,2020.05.31,,슬라이딩 기능은 절대 안씁니다. 조심스럽게 하면 괜찮겠지 싶어서 메뉴얼대로 위에 잡고 살살 빼봤는데 바로 무너졌어요 그냥 옷장에 편하게 정리할수있는걸로 만족은 합니다,2,False
1267760497,3,2020.05.23,슬라이딩식 서랍은 아닌듯,슬라이딩식서랍이라는것 그거 하나보고 주문했는데 슬라이딩은 무슨 맨윗부분만 슬라이딩 나머진 안됨 두번째서랍 당기면 위에거까지 따라옴 구매평보고 샀어야 하는데 재구매는 안할듯,3,False
1267760497,3,2020.05.05,,,0,False
1267760497,3,2020.04.08,,"제품자체는 괜찮은데 깨져서 왔어요ㅠㅠ
뽁뽁이도 없이 포장되서그런지 급하게 써야되서 그냥 쓰는데 아쉽네요 ㅠ",0,False
1267760497,4,2021.05.20,약간 부실함,"쉽고 간간한디 약간 힘없어요 여러개 쌓으면 기울여져요 오랴쓰면 휘어질것 같아요
그냥저냥 가벼운물건만 놓고 쓰긴 좋아요",0,False
1267760497,4,2021.05.18,,,0,False
1267760497,4,2021.05.13,,,0,False
1267760497,4,2021.04.16,,,0,False
1267760497,4,2021.04.07,,,0,False
1267760497,4,2021.04.07,,,0,False
1267760497,4,2021.03.30,나는 정리왕,정리하는 재미에 푹!! 조아용,0,False
1267760497,4,2021.03.22,,,0,False
1267760497,4,2021.03.22,,,0,False
1267760497,4,2021.03.10,,예쁜데 슬라이딩시 아랫칸이 휘청거려 불편합니다.,1,False
1267760497,4,2021.03.07,,"옷장에 넣고 쓰기 좋아요
실측 길이 재고 꼭 사세요!!",0,False
1267760497,4,2021.02.20,괜찮아요,,0,False
1267760497,4,2021.02.17,,,0,False
1267760497,4,2021.02.10,,"방 정리하면서 옷장을 새로 구매하여
옷 정리 좀 실용적으로 해보려고 구매했어요!
서랍처럼 슬라이딩으로 밀고 넣고 할 수 있어 편리하고
크기별로 다양하게있어서 너무 좋네요
옷장에 티를 그냥 밀어넣으면 많이 수납할수도 없고
구겨지고 자꾸 마구잡이로 넣게되는데,
칸을 나누어 정리하니 확실히 더 많이 들어가고 깔끔해보여요!

한가지 살짝 아쉬운 점은 조금 흐느적? 거림이 있어서
중간칸 슬라이딩할때 좀 버겁네요 ㅎㅎ
그 점 말고는 다 만족 합니다!",1,False
1267760497,4,2021.01.13,,,0,False
1267760497,4,2021.01.10,,붙박이장속 옷이 정리가 안되어 고민하다가 쿠팡앱에서 이거다싶어 주문했는데 역시 좋습니다 지저분한 장속에 옷이 정리가 되었 어요 다른것도 더 봐서 주문해야될거 같아요,0,False
1267760497,4,2020.12.28,,,0,False
1267760497,4,2020.12.24,대2개짜리 재구매,"노리고 있던건데 쿠팡 로켓배송 상품으로 올라왔길래 고민하지 않고 바로 결제
조립이랄것도 없어요
걍 촥촥 끼우면 되네요
슬라이딩이라 적층식 수납바구니보단 훨씬 편하죠
서랍 꺼내듯이 꺼내지니까요

색상이 화이트라기보다는 아이보리에 살구색이 살짝 들어간 느낌(베이지톤 흰색)

서랍장 위에 올러놓고 가방이나 작은 소품 수납하려구요",1,False
1267760497,4,2020.12.05,,,0,False
1267760497,4,2020.11.30,,,0,False
1267760497,4,2020.10.18,공간♡정리 활용도는 좋으나 가격이 조금만 더 착했으면~,"아이들이 둘이고, 직업 특성상 만들기 재료가 많다 보니 정리장이 항상 부족했습니다~ 정리장은 어떻게든 항상 유용히 활용하기 좋은데요~ 지금의 정리장은 조립하기가 쉽고 가볍네요~ 또 슬라이딩도 되어서 꺼내기도 편하고 높이도 다르고 분리가 가능해 공간활용이 다양할 수 있을듯 합니다^^ 저는 우선 배송받고 조립만 했는데요, 옷방 리빙박스 사이에 놓고 일하는데 필요한 만들기 재료들을 넣어두려 합니다^^
아쉬운 부분은 정리장이고 재료?가 플라스틱의 소재이고 전반적으로 가격이 비싼듯 합니다~ 할인된 가격보다 조금 더 저렴해도 되지 않을까 합니다~ 그리고 가벼운 부분이 어느 곳에 어떤 물건들로 정리하는지에 따라 장점이 또는 단점이 될 수도 있을 듯 합니다~ 물건 구입 전, 어디에 배치하고 무엇을 정리하는데 사용할지 생각하시면 좋을 듯 하고요~ 저는 개인적으로 가격이 조금만 더 착하면 망설임없이 구매할 수 있을 듯 합니다 ^^;

쿠팡체험단 이벤트로 상품을 무료로 제공 받아 작성한 구매 후기입니다.",2,False
1267760497,4,2020.10.17,물건은 좋다,조립 쉽고 쓰기 편해요. 붙박이장에 서랍이 부족해서 구입했어요. 배송도 빠르고 쓰기도 좋은데 포장상태보고 택배기사님 고생하셨겠다 싶어요. 넘 허랑하게 포장했어요. 박스 속에 그냥 본품 들어있네요,0,False
1267760497,4,2020.10.08,,,0,False
1267760497,4,2020.10.07,"틈새공간정리시 좋아요, 안쓸땐 접어놀수있어요^^","체험단 선정되어 골랐네요.
3단아이리스 서랍장하고싶었지만 품절로 못사고 요거 골랐어요.
사용안할때 접어서보관할수도 있어서 괜찮은것같아요.
쌓아서 하나로 사용해도되고 따로 사용해도되네요.
그러나 하나로 다쌓아 사용시 그냥 홈에 얹어지는 형태에요.
딱 조립되거나 하는건 아니라서 앞뒤로 좀 밀림이 있네요.
저는 가로책장을 집정리하며 세로로 세웠더니 세로공간이 너무 떠서 그 공간이 아까워 책장에 넣어봤어요.
앞에 좀 튀어나오긴해도 옆에가구가 있어서 크게 걸리적대는 정도아니게 수납공간이 생겼네요.
왜이리 자질구리하게 수납할것들이 많은지ㅜㅜ버려도 자꾸 짐이 샘솟는것같아요ㅋ.
박스에접어서 배송됐는데 제일큰것이 여밈부분에 살짝 금이가서 왔네요. ..교환귀찮아 그냥써요.

쿠팡체험단 이벤트로 상품을 무료로 제공 받아 작성한 구매 후기입니다.",2,False
1267760497,4,2020.09.12,,"물건자체는 좋습니다
다만 조립할때 부사지는소리가나서 당황했고
벌레들이 죽어있어서..ㅎ 청소부터했네요",1,False
1267760497,4,2020.09.04,나쁘지 않아요,어제 주문해서 로켓배송으로 오늘 받았어요~ 조금 약한것같긴한데 그래도 옷장 크기에 거의 딱 맞아서 흔들리지는 않을듯해요. 안에 정리되어서 좋네요^^,0,False
1267760497,4,2020.09.04,,"소품 정리하기 좋아요
붙박이에 막 쌓으면 찾기 힘든데
작은박스들 정리하기 괜찮네요
다만 옆면 연결부위나
위로 쌓게 될때 생각보다 튼튼하지 않아서
무거운 물건은 안될거 같아요~
다른붙박이에 쓰게 더 사려구요",2,False
1267760497,4,2020.09.03,"제품은 사용하기엔 괜찮지만, 색감은 화이트가 아님..","사용하기 괜찮아서 구입했는데 색이(.....)
어제 받은 것들보다 더 이상한 색이에요... 아무리 봐도 화이트가 아니네요... 어차피 막 쓸 생각으로 산 거고 아무 생각없이 조립하고 닦다가 깨달아서 그냥 쓸 거긴 한데.... 아무리 봐도 화이트가 아니네여;;;;;
사진 중 하얀 건.. 전에 쿠팡 체험단으로 받은 거에요...
다른 하얀 물건이랑 비교한 것도 첨부합니다.

그래도 생각보다 튼튼한 가 싶었는데.... 조금만 균형 안 맞아도 확 휘어여 ㅠㅠㅠㅠ",1,False
1267760497,4,2020.08.25,,,0,False
1267760497,4,2020.08.08,,,0,False
1267760497,4,2020.07.17,,,0,False
1267760497,4,2020.06.22,가격은 좀 비싼감이 있지만 좋아요.,"옷장 정리가 안되서 샀는데 좋네요.
조립식이라 그런지 좀 흔들림은 있지만 사용하기 괜찮아요.
깔끔하게 정리되서 좋네요.",1,False
1267760497,4,2020.05.29,,좀흔들거리긴해도 폭도 넓고 쓰임새는 많네요~~,0,False
1267760497,4,2020.05.27,,"깨졌단 후기가 있어서 걱정했는데..
두세트중 하나 젤 큰사이즈 한쪽이깨져왔네요
끼워맞추는 한쪽이 깨진거라 덜렁거리긴하지만
옮겨다니면서 쓸건 아니라 그냥 쓰려구요
물건자체는 맘에들어요~ 제가생각한 크기와 용도에 아주딱 맞습니다",2,False
1267760497,4,2020.05.13,,,0,False
1267760497,4,2020.05.02,,,0,False
1267760497,4,2020.04.23,,"특대 대 중형 이렇고 놓앗는데 제일위엔 가벼워서 위쪽잡고 당겨야할듯해요.
그래도 쌓아둘걸 칸칸히 넣어놓으니 꺼내입기 편하겟어요.
당겨지니 옷 고르기도 쉽고..",0,False
1267760497,4,2020.04.02,,,0,False
1267760497,4,2020.03.26,,"옷장 중에 서랍이나 칸막이가 없는 게 많고 특히 원룸들 옷장은 더더욱 그래서
한번 사면 꽤 오래 유용하게 쓸 것같아 구매했습니다!!
조립간편하고 엄청 튼튼한 재질은 아니나 옷 잡아줄만큼은 튼튼하고
무엇보다 접이식이라 이사할때도 편할 것같아 주문했어요!
천으로 돼서 지퍼로 여닫는 리빙박스들은 훨씬 싸고 부피도 적어 좋지만
계절지난 옷보관에는 좋으나 자주 입는 옷은 꺼내고 넣기 불편해서 구매하게 되었습니다
옷이 자꾸 무너지면 나중에는 바쁘다고 마구잡이로 넣어놨었는데
확실히 정리하기 좋아요

다만 배송오자마자 지금 조립해서 쓰는데 저기 부셔져서 왔네요...ㅜ
교환하기 너무 귀찮고 큰 불편은 아닐 것같아 쓰지만 제품 검수 잘해주셔야 할것같아요",2,False
1267760497,4,2020.03.13,,"뒷베란다 정리가안되어 구매했는데
정리가 기존있던것보다 훨씬잘되네요
용량이커서 쌀 십키로넣어도 넉넉ㅋㅋ
좀 약해서 흔들림이있지만 제일밑에 무거운걸로두면 좀괜찮아요ㅎㅎㅎ

제가 못하는건지 사진상에 가운데꺼만 슬라이딩되는데
왜 전안될까요?^^....
바퀴가없는거라 되는게 더신기하긴한데.....ㅎㅎㅎ사진이 너무사기.....그거에..ㅠㅠ

그래도 정리가 잘되서 넘나좋은것
꺼내쓰는것도훨편해졌어요ㅎㅎ

쿠팡체험단 이벤트로 상품을 무료로 제공 받아 작성한 구매 후기입니다.",3,False
1267760497,4,2020.03.13,,"서랍장 옆에 뒀다가 편의를 위해서 서랍장 위에 올렸놨어요.
(같은영역에서쓸때)배치는 2개/2개해도 괜찮았고
쭉 쌓아올리는 것도 정돈 돼 보여서 좋았어요:)
약하진 않을까 했는데 생각보다 견고한편이었고,
맨위에는 뚜껑?역할을 하는 판이 있으면 좋겠다 생각했어요.
뚜껑없는대신 물건은 더 쌓아 올릴 수는 있어요.
설명서는 없었지만 필요없을만큼 조립이 간편했어요.
그냥 펼쳐서 쌓아올리면 끝이었네요ㅎㅎ
첨엔 한쪽만 높은게 싫어서 2개/2개 따로 뒀는데
높이가 달라 그냥 탑으로 쌓았어요ㅎㅎ
옆부분 홈에 철사고리?를 끼워서
가방도 걸어두고 하니 실용적이네요!
고리 몇개 걸어서 차키나 머플러 걸어도 좋을 것 같아요:)
슬라이딩은 물건이 무거우니 중간부분은 안당겨졌어요ㅜㅜ
대신 단독으로(2개로하거나 맨윗부분) 슬라이딩을 쓰면 슥슥 잘 당겨져요.
이렇기에 슬라이딩목적으로는 잘 사용 안할듯해요.
또 하나 아쉬운점은 뒷부분이 걸리게? 뒤로 더 안밀리게 고정하는 기능이 있었으면 했어요ㅎㅎ
벽에 대고 쓰는거라 괜찮지만 제가 길이나 틈 맞추는거 좋아해서
앞으로 조금 당겨서 배치하고 싶었는데
뒤로 밀림현상이 있어서 아쉬웠어요.
그래도 정리 안되던 잠깐 입었던 옷이라던가
서랍부족으로 쌓아놓던옷,
여기저기 걸어두던 가방,
대충 바구니에 넣어두던 드라이기 고데기 등등을
한 영역에 묶어 정리해둘 수 있어서 너무 좋았어요.
원래 뭐 꺼내놓는 성격이 아닌데
살다보니 물건은 늘고 수납은 부족하고;;
암튼 요걸로 정리하니 깔끔해졌어요:)
조립/해체가 쉬워서 이동도 보관도 자유롭고 쉬워서 또 좋네요ㅎㅎ
세로로 세운게 맘에드는데 옆이 괜히 짝이없는 느낌이라 굉장히 신경쓰이는게 같은걸로 한세트살까 고민중이네요ㅎㅎ

쿠팡체험단 이벤트로 상품을 무료로 제공 받아 작성한 구매 후기입니다.",7,False
1267760497,4,2020.03.13,생각보다 단단하고 견고해요,"원래 옷 정리용으로 구매한건데
조립해보고 일단 구석에 널부러져있는 라면이랑 이것저것 넣어봤어요
너무 깔끔하게 정리되는것이 와~ 좋다했네요

생각보다 견고하고 닦으니 더러움 묻어남 없이 깨끗했어요
홈에 딱딱 맞게 잘 끼워지고 쌓아올렸을때도
생각보다 안정감이 있었어요
물론 손으로 흔들면 흔들흔들 불안하긴하지만
굳이 건드리지 않는다면 안정감있게 잘 서 있어요

근데 앞뒤로 당기면 쉽게빠지고 분리되어서
그부분이 좀 사용상 불편할수도 있겠다는 생각이 들었어요
근데 벽쪽으로 붙여서 쓰면 그것도 크게 문제는 안될듯 합니다

바닥면도 단단해서 적당히 가정에 있는 무게감있는 물건 올려도
괜찮을것 같더라구요

지금은 일단 이렇게 두고 다른곳에 놓거나 정리물품들 고민해 봐야겠어요
4개가 다 분리되니 각각 따로 두고 써도 될것같고
활용은 원하는곳에 자유롭게하면 될것 같아요

생각보다 튼튼한 요제품 맘에 드네요

쿠팡체험단 이벤트로 상품을 무료로 제공 받아 작성한 구매 후기입니다.",10,False
1267760497,4,2020.03.12,메쉬망과 수납의 조합,"제품 조립은 특대사이즈는 일부 분리되었지만 조립은 간단했어요. 다른 크기도 펼쳐주고 끼우기만 하면 끝. 생각보다 짱짱해서 쥐어서 비틀어도 잘 빠지지않았어요.
제품 모두를 쌓아올렸을때 딱딱 맞아서 좋긴했는데 옆으로는 고정되지만 앞뒤로는 고정되지 않고 움직여져서 이건 상품 소개에도 나와있듯이 수납함처럼 빼는 느낌을 주려는 제작의도가 있는건지 모르겠지만 많이 빼면 위에 있던 물건이 쏟아지는 상황이 연출될 것 같아요. 뒷부분을 벽쪽에 붙여서 사용해야겠어요.
생수 2리터짜리를 넣어봤다니 9개가 들어가는 면적을 가졌고 특대사이즈라면 생수 높이보다 높아서 맘에 들었습니다.
이 제품이 좋은게 옆에 있는 십자모양 구멍이었어요. 메쉬망처럼 여러 물건을 걸 수 있겠더라구요. 통풍도 잘 되겠지만 물건을 걸어두는 식으로도 잘 쓸 수 있겠어요.
받침대처럼 뒤집어서도 써봤는데 장기적으로는 모르겠지만 버티더라구요. 근데 오래쓰면 푹 내려올것 같아서 포기했는데 세워서 써보니 길쭉한 물건을 넣어두기에 편했어요.

쿠팡체험단 이벤트로 상품을 무료로 제공 받아 작성한 구매 후기입니다.",6,False
1267760497,4,2020.03.05,,,0,False
1267760497,5,2021.05.25,,,0,False
1267760497,5,2021.05.24,,,0,False
1267760497,5,2021.05.20,,,0,False
1267760497,5,2021.05.19,베란다 수납용으로 굳,"뭐 튼튼하고 고정되는 느낌은 적지만..
베란다 한켠에 한 15개 구매해서 쌓아두니 좋은 펜트리 공간 됩니다.",0,False
1267760497,5,2021.05.18,,,0,False
1267760497,5,2021.05.16,,,0,False
1267760497,5,2021.05.15,,,0,False
1267760497,5,2021.05.14,,,0,False
1267760497,5,2021.05.14,,,0,False
1267760497,5,2021.05.14,,,0,False
1267760497,5,2021.05.10,,,0,False
1267760497,5,2021.04.23,,,0,False
1267760497,5,2021.04.23,,,0,False
1267760497,5,2021.04.20,,,0,False
1267760497,5,2021.04.03,,,0,False
1267760497,5,2021.04.02,,옷 선반 하려고 구매했어요 크기도 종류별로 있어서 좋아요! 한칸은 주방용품 정리했네요 부드럽게 슬라이딩 되고 수납공간으로 추천해요,1,False
1267760497,5,2021.03.25,,,0,False
1267760497,5,2021.03.08,,,0,False
1267760497,5,2021.03.07,여러모로 쓸모있어요,"옷을걸면 밑에쪽에 애매하게 공간이 남아요~
바구니 사용을 해봤지만 바구니를 꺼내야지만 내용물을 확인할수 있으니 불편하더라구요

여러제풍을 거쳐 결국 이제풍으로 정착하게 되어씁니다.
아이들 옷장에도 마치 처음에 함께 있었던것처럼 딱 맞더라구요

제 옷장에는 가방보관용으로 사용중입니다.
부피큰 박스는 따로보관하고 더스트백사용해서 정리하니
한눈에 쏙들어오고 자리도 차지하지 않고 좋으네요

여름옷 정리할때 한세트 더사서 정리늘 해봐야겠어요",2,False
1267760497,5,2021.03.01,,,0,False
1267760497,5,2021.02.26,깔끔해요,"정리하는데 큰 도움이 됫는데
뚜껑이 잇엇음 좋겟어요
추가구성이라도 판매해 주셧음 좋겟어요
위에가 자꾸 벌어져요",2,False
1267760497,5,2021.02.26,,,0,False
1267760497,5,2021.02.21,,,0,False
1267760497,5,2021.02.21,,,0,False
1267760497,5,2021.02.21,,,0,False
1267760497,5,2021.02.19,,,0,False
1267760497,5,2021.02.18,,제품도 좋구요 빠른배송 감사요~~,0,False
1267760497,5,2021.02.16,,,0,False
1267760497,5,2021.02.15,주방 수납 추천,보조 주방 펜트리 구성에 잘 활용하였습니다.,0,False
1267760497,5,2021.02.14,,,0,False
1267760497,5,2021.02.11,,,0,False
1267760497,5,2021.02.10,강추합니다 !!,깔끔해지고 더 많이 수납할수 있게되었습니다 ㅠ 너무좋습니다!!,1,False
1267760497,5,2021.02.05,,기둥은 좀 흐느적 거리는 느낌이있지만 물건 넣으면 괜찮은거같아요! 서랍움직여도 고꾸라지지않아서 좋아요,1,False
1267760497,5,2021.01.30,베리 굿굿,"옷장안에 따로 수납할수 있는 제품이 필요했는데 요게 딱이네요
엄청 튼튼하지는 않지만 플라스틱이니깐요ㅎ 리뷰에 조립 힘들다 했는데
쉽게 했어요 끼우는 부분잡고 톡 밀어주면 잘 끼워져요
깔꼬롬하게 정리했어요",0,False
1267760497,5,2021.01.27,,,0,False
1267760497,5,2021.01.26,,,0,False
1267760497,5,2021.01.25,,,0,False
1267760497,5,2021.01.19,,,0,False
1267760497,5,2021.01.17,옷정리하는데 옷장에넣으니 너무편해요,,0,False
1267760497,5,2021.01.17,,박스안에 뽁뽁이라도 넣어주시지....,0,False
1267760497,5,2021.01.15,,,0,False
1267760497,5,2021.01.12,,굿,0,False
1267760497,5,2021.01.11,쓸만해요.,수납장안에 물건들이 너무 많아 층층이 정리했네요. 뭐가 어딧는지 다 보여요,0,False
1267760497,5,2021.01.02,,,0,False
1267760497,5,2020.12.25,,,0,False
1267760497,5,2020.12.23,,,0,False
1267760497,5,2020.12.22,,공간활용을 편하게 할수있을거 같아요.,0,False
1267760497,5,2020.12.22,,,0,False
1267760497,5,2020.12.21,,,0,False
1267760497,5,2020.12.20,,,0,False
1267760497,5,2020.12.18,편리하고 좋고 서랍기능 있어서 좋음,편리하고 좋아요,0,False
1267760497,5,2020.12.17,,두터운 니트도 차곡차곡 넣으면 꽤 많이 들어가요.,0,False
1267760497,5,2020.12.13,,,0,False
1267760497,5,2020.12.09,조립 편하고 배송 빠릅니다,,0,False
1267760497,5,2020.12.07,,,0,False
1267760497,5,2020.12.06,,,0,False
1267760497,5,2020.12.02,정리짱,"병원에 입원해 있는중 협소한 사물함으로 정리좀 해보려

구입당시 금액 26,780


1. 4개짜리 특대+대2+중1 셋트와 추가 중2구매

2. 여자란 짐이 많은법 어떻케든 깔끔이 정리하고자 만족굳

3. 옆과 뒷벽이 고정해주듯 버텨주면 딱 아님 많이 흔들림

4. 병원 사물함 센티 잘재고 사야함
꿈은 사물암 안쪽 차곡차곡 깔끔이 디피할 계획이었으나
깊이가 안맞아 포기 ㅠㅠ 그래서 중2개는 비설치

5. 여자 혼자 거뜬히 완성 ㅎ

지인추천",4,False
1267760497,5,2020.11.30,,,0,False
1267760497,5,2020.11.29,좋아요!,옷장이 정리함 덕분에 깔끔해졌어요!,0,False
1267760497,5,2020.11.24,딸아이 옷장정리용으로 구입했어요~^^아주만족합니다,,0,False
1267760497,5,2020.11.11,조금더 단단했다면 아쉬움이 잘 쓰고 있습니다,,0,False
1267760497,5,2020.11.09,,,0,False
1267760497,5,2020.11.09,,,0,False
1267760497,5,2020.11.01,,,0,False
1267760497,5,2020.11.01,,,0,False
1267760497,5,2020.10.31,,조립 쉽고 튼튼해 보여요. 강추요~,0,False
1267760497,5,2020.10.31,,,0,False
1267760497,5,2020.10.29,,조립 간편하네요. 아랫칸에 무거운 걸 두고 쓰면 서랍처럼 꺼내기 좋은 것같아요. 옷장안 공간 활용이 더 용이해졌어요!,1,False
1267760497,5,2020.10.29,,,0,False
1267760497,5,2020.10.27,,,0,False
