product_id,ratings,reg_date,article_headline,article_content,help_count,is_photo_review
228640718,3,2020.09.21,,저렴한가격으로 좋은상품받아서 기분좋네요,0,False
228640718,3,2019.08.09,이불넣기마땅찮죠? 요고여요 지퍼가 앞에 있어야 함,이불 척척들어가고 상단이 때가 잘타던데 브라운이라 안심 함께 들어있는 압축팩은 쓸모있음 압축책은 두었다가 버림. ㅋ. 앞쪽으로 지퍼있는 것으로 구입하셈. 뭐 꺼낼 때마다 다 내려서 윗뚜껑열기 번거로움,0,False
228640718,4,2021.01.31,,,0,False
228640718,4,2019.09.05,,"냄새가 많이 나면 어쩌나 걱정했는데
생각보다 별로 나질 않았어요.
크기가 커서 많이 들어가요.
크기에 비해서 대가 얇고 가늘어서 지탱하는 힘이
좋아보이지 않아요.",0,False
228640718,5,2021.05.22,옷정리할때 쓰려한건데 튼튼하고 크고~너무좋아영♡,,0,False
228640718,5,2021.03.31,좋아요..,"박스 하나당 겨울 솜이불 2개, 봄가을 차렵이랑 얇은극세사이불 4개까지 들어가네요..압축비닐 안하고 제 무게로 최대한 이불을 압축한뒤 지퍼채웠어요.. 전에 압축으로해놨더니 다시꺼내쓸때 뽀송함이 없어서~~구매할때 꼭 이불장 사이즈 확인후 구매하세요..전 세로사이즈 맞춰 3개구매했고 세워놓으니 더 깔끔하고 빼기도 쉬워요..박스 지지대가 구겨지지않고 오랫동안 잘 버텨주길바라며고.. 재구매의사 있습니다..넘 진짜 좋으네요.",0,False
228640718,5,2020.05.09,,지난번에 이사올때 이불장을살까하다가 나중에이사갈때 짐이될까봐 이제품을 구입했는데 지지대도튼튼하고완전짱짱해요 용량도커서 많이들어가네요좋아요,1,False
228640718,5,2020.03.18,,,0,False
228640718,5,2020.03.12,튼튼하고 커요,,0,False
