product_id,ratings,reg_date,article_headline,article_content,help_count,is_photo_review
102336253,5,2018.02.14,최고에요~~추천이요,진짜. 최고에요. 적극추천합니다. 저렴하고. 대박이네요. 질양도. 좋와요 대대대대 만족합니다. 후회안하실거에요~~~~~~~~^^둘이. 자도. 넉넉합니다.,0,False
102336253,5,2018.02.14,구우욷,"아직 사용은 안해봤는데
배송기사분도 친절하시고 상품상태도 좋습니다.
잘쓰겠습니당",0,False
102336253,5,2018.02.14,기대이상으로 마음에 들어요!,"배송도 원하는 날짜에 와서 좋았어요!
생각보다 더 폭신하고 하루 자봤는데 매우 개운하네요~~^^!",0,False
102336253,5,2018.02.14,,,0,False
102336253,5,2018.02.14,,"일주일도 아직 써보진 않았지만 가성비 괜찮은듯 합니다
매트리스 두께도 어느정도 되고 탄성도 좋아요 !!",0,False
102336253,5,2018.02.14,,2월9일날 주문하고 2월14일인 오늘받았습니다!!! 곧 설연휴인데도 배송해주셔서 너무너무 감사드렸어요..ㅠㅠㅠㅠ 배송비가 3.5라서 조금 그랬지만 상품평을쓰면 만원할인이니까 나쁘지않은거같고 후기들도 보면 대체로 좋아서 믿고 학생인 저에게는 엄청 거금인 15만원을 질렀습니다..처음에는 슈퍼싱글로했다가 줄자(?)로 해놓고 팔을 벌렸더니 제팔이 오바되서 저는 양팔을 옆으로 펴도 널널할만큼을 원해서 퀸은 너무심하고 더블이 좋을꺼같아서 더블로 했어요!! 슈퍼싱글로했으면 더블로할껄..ㅠ이라고분명했을꺼예요ㅋㅋㅋ 배송은 5일만에 온거니까 빨리왔고 진짜 푹신푹신대박..사이즈가다행히도 적당히 큰사이즈라서 너무너무 좋고 제가 베개없이 자는게좋아서 사진에는 베개가없지만..ㅋㅋㅋ푹신해서 베개없어도 베개벤듯한 느낌이 들꺼같아요!!짱짱 다음에 이거 그럴일은 없지만 뭐..망가진다던가 부서지면 요제품으로 또구매할거같습니다 매트리스는 처음사봐서 가격이 매트리스쪽에서는 싼건지 비싼건지 모르겠지만 매우매우 만족합니다!!!!!!!!!:)♡ #너무좋아요!!,7,False
102336253,5,2018.02.14,매트리스 좋아요~,"복도가 좁아서 추가 배송비는 들었는데 안전하게 잘 왔습니다. 테두리쪽에 걸터앉으면 푹 들어가고, 누워자면 적당히 단단한 느낌이에요~너무 푹신한건 되려 허리가 불편해서 이정도 느낌이 아주 만족스럽고, 제품 표면도 부드럽습니다. 얼른 커버도 사서 씌워줘야겠네요",0,False
102336253,5,2018.02.14,전에사용하던.시몬s매트리스보다 훨씬좋은거같아요 ㅎ,가격대비 훌륭합니다,0,False
102336253,5,2018.02.13,가성비 미만잡. 대학생 자취방 이거 미만잡,"다른분들 말씀대로 10만원선에서 이정도는 찾아보기 힘들 것 같아요! 처음 자취방살아서 매트때문에 걱정이 많았는데 확실히 마감이며 디자인이며 안정감까지 가성비를 확실히 초월하네요. 나중에 진짜 집에 살때도 여기서 매트리스 살까해요

근데 진짜 배송이 너무 힘드네요.
배송이 불친절하거나 그러지는 않아요.
근데 저녁 8시~9시 이럴때 배송오는건 조금 그렇지 않나요?
처음에는 3~5시라셨는데 갑자기 5시에 전화오시더니 출발할때 연락주신다 하셔서 기다렸더니 6시쯤에 8~9시쯤 도착하신다 전화주시니 너무 화가 났습니다.

제품자체는 확실히 좋아서 만족하는데 배송문제는 조금 그렇습니다. 그래도 택배는 저녁 5~6시전에는 끝내주시면 감사할 것 같습니다.

그럼 많이 파세요 !~",0,False
102336253,5,2018.02.13,,"좋아요!! 리뷰보고 믿고 샀는데 역시
메트리스 자체가 보들보들해서 정말 커버없이 될정도에요!
쿠션감도 좋구 짱입니당",0,False
102336253,5,2018.02.13,대박나세요~~^,"작은아들 먼저 사줬는데 가격 대비 만족도가 높아서
큰아들도 추가 구매합니다~~
실수로 슈퍼싱글 구매해야 하는데 싱글로 구매..ㅜㅜ
그래도 쓸만합니다
배송도 일요일에 주문했는데 화요일에 받았어요^^
대박입니다~~^^
많이 파세요",0,False
102336253,5,2018.02.13,,"매트리스 크고 디자인도 이쁘고 너무 좋아용
너무 딱딱하지도 말랑하지않은것도 너무 좋고
퀸사이즈인데 가격대비 너무 좋은걸사서 대만족!!입니다><",0,False
102336253,5,2018.02.13,리코가 답이다.,"대학생 남 입니다 이번에 복학하게되서 새로들어온 자취방에 놓을 침대를 찾던중 리코침대를 산걸 정말 잘한것 같아요 ㅎㅎ
제가 운동을 많이해서 몸집이좀 있어서 싱글에서는 도저히 잠이 안오더라고요 ㅠ 퀸으로 주문했는데
대자로 뻗어 잘수있어서 너무 좋아요 ㅋㅋㅋㅋ
안좋은 침대에 누우면 바로 허리가 아픈데 리코침대는 정말 편하네요 ㅋㅋ 아직 침대커버랑 침구세트를 안놔서 보기는그렇지만 메트리스는진짜 가격대비 최고에요 ㅋㅋㅋ",1,False
102336253,5,2018.02.13,,"금요일에 주문했는데 월요일 낮에 도착해서 주말 끼고 4일 걸렸네요
택배기사 아저씨가 굉장히 친절하셔서 좋았고, 문앞에 두고 갔다고 문자로 사진찍어서 보내주셨습니다.
이불과 커버가 없는 상태의 옆면 디자인과 배색이 마음에 듭니다.
다른 후기들답게 매트리스 가성비도 좋고 포토후기 작성하면 만원 환급도 가능해서 강추합니다!",0,False
102336253,5,2018.02.13,완전좋아용,"매트리스 자체가 폭신폭신하고 움직여도 소리가 나거나 밑으로 꺼지거나 하지 않아서 좋아용
몸을 균형있게 감싸주는 느낌이에요!!! 저렴하게 잘 산 것 같아요!",1,False
102336253,5,2018.02.13,,"정말 괜찮네요
매트릭스에 누워봤는데
금액대비 정말괜찮습니다",0,False
102336253,5,2018.02.13,"빠른배송, 가성비 최고!",,0,False
102336253,5,2018.02.12,,10만원값은 훨씬 더하는 침대인거 같아요 ㅁ매우 만족 스럽습니다,0,False
102336253,5,2018.02.12,가성비 최고에요 퀸사이인데 넘 넉넉하고 좋네요,너무 이쁘고 편안해요 고가 매트리스 못지 않네요 마니 파세요,0,False
102336253,5,2018.02.12,가격대비만족해요,"매트리스잘받았습니다
사이즈미스로 슈퍼싱글구매했어야는데ㅠ싱글을구매했네요
냄새가 좀 나지만 누워보니 가격대비 만족~그래서 그냥 잘사용해보려구요
아이가쓸건데 좋아라하네요~감사합니다!",0,False
102336253,5,2018.02.12,이걸 쓰고 아침이 달라졋네요!,,0,False
102336253,5,2018.02.12,깔끔하게 마감처리,침구같이 중요한건 온라인제품들을 잘 신뢰하지 않는편이라 꼭 직접 보고 만져보고 사는편인데 이번에 구입하게된 매트리스는 정말 만족하네요 ㅠㅠ 가격이 엄청싼편이라 그렇게 기대하진않았는데 왜이가격인지 잘모르겠네요.. 진짜 엄청 흥했으면 하는제품입니다 감사히잘쓸게요^^!,0,False
102336253,5,2018.02.11,,넘나 좋아요~~,0,False
102336253,5,2018.02.11,,"너무 좋은거같아요 얼마전부터 고민하다가 월급받고 주문 따닥
일주일? 만에 왔어요",0,False
102336253,5,2018.02.11,남들하듯이 차로높이를 재여보니 징짜높네영.최고네요!,,0,False
102336253,5,2018.02.11,가격대비 완전 좋네요,다락방에 침대넣기 불편하여 매트 사용하기로 하고 구입합니다 온라인 구입은 첨인데 가격대비 좋은거 같네요 작은아이 방에도 하나더 구입 예정 입니다,0,False
102336253,5,2018.02.10,침대는 리코입니다,"장점=
너무 푹신하지도 않고 너무 딱딱하지도 않고
잠잘때 최적의 침대
제품 받았을때 하자나 때낀데도 없었어요!!
다른 회사들보다 택배비도 저렴해요!!!!!
냄새도 안나고요!!!



단점..?=
배송이 ....흠...그래서
문의에남겨져있는곳으로 전화드리니 다음날바로왔어용ㅋㅋ당황했어요..



★
기사님 번거로우셨을꺼에요 그시간에 제가 집에없어서 친구번호알려드리고 그무거운걸 혼자드시고2층오시고
감사합니다 전화 받으셨던 사장님도 친절하게 일사 천리로
해결해주셔서 감사합니당!♥

많이 파세용!!",0,False
102336253,5,2018.02.10,"푹신하고 가성비 최강 매트리스, 고급스럽기 까지 함 ㅎ",,0,False
102336253,5,2018.02.10,,진짜 이가격에 이 퀄리티라니...너무 좋아요 굿!,0,False
102336253,5,2018.02.10,,"싱글침대남편이쓰다가
너무좋아서 퀸 하나더 사서 붙여서 아기와 셋이쓰고있어요
너무좋아요",0,False
102336253,5,2018.02.10,,,0,False
102336253,5,2018.02.10,비용 대비 가성비 갑,"이번에 초등학교 들어가는 딸 방꾸며준다고
침대, 책상 등등 구입했습니다.

침대매트도요. 첨엔 비용이 너무(?) 저렴해서 반신반의 했는데
쿠팡에 남겨진 후기평 보고 믿고 주문했답니다.

결론은 만족스럽고요^^ 예전엔 혼자 자는게 무섭다고 하던 딸내미, 매일 자기방에서 자고요. 물론, 잠들 때까지는 같이 있어주고요~~ 너무 푹신거리지도, 너무 딱딱하지도 않아 잠자기엔 적당합니다. 오히려 탱탱한 느낌이 든다고 해야할까요?

아무튼 매우 마음에 든답니다^^",1,False
102336253,5,2018.02.10,괜찮은 메트리스 . 잘받았습니다.,"지방인데 생각보다 일찍 도착했어요. 도착한 메트리스는 큰 흠 없이 안전하게 도착했어요. 이 메트리스는 한쪽면만 사용하기보다 좌우 위치 변경해가며 사용하라고 되어 있네요.
앉았을때 딱딱한편은 아니라는 느낌은 들었으나 막상 누우니 단단한 느낌이 또 드네요. 가격대비 만족합니다.",0,False
102336253,5,2018.02.10,,"구매 일주일만에, 방금 막 받았습니다- 배송기사님께서 어제 전화오셔서 시간 정하셨구요. 이른 아침에 계단 모퉁이모퉁이가 좁고 여자 혼자라서 어떻게 올라오지 걱정했는데 앞보다 뒤에 잡는게 나을거라며 수월하게 금방 옮겼어요. 고맙습니다 기사님! 방금 새로 사논 시트 씌우고 누워봤는데 정말 편안하네요. 기다린 보람이 있습니다. 저렴한 가격에 이토록 좋은 제품 이용할수있게 해주셔서 고맙습니다. 번창하세요!",0,False
102336253,5,2018.02.10,,배송 빨리와서 좋았구요 아직 프레임이 안와서 매트만 찍었는데 저는 침대 처음 써보는거라 푹신푹신하고 마감도 잘 되어있는거같아서 좋습니다~^^잘쓸께요 감사합니다,0,False
102336253,5,2018.02.10,정말 고가의 매트리스와 비교해도 손색없어요.,,0,False
102336253,5,2018.02.09,꿀잠 매트리스,"가격대비 너무 좋은 제품 산거 같아 기분좋습니다.

매트바꾸고 바로 꿀잠~!!",0,False
102336253,5,2018.02.09,너무너무 만족해요~,"아들 매트리스를 바꿀때가 되서 정말 폭풍 검색후 상품평이 좋하서 구매했어요!! 배송은 주말빼고 5일정도 걸린거 같아요!!
매트리스는 비닐포장으로 깨끗하게 왔고요 어느정도 딱딱한것이 너무너무 편해요~
냄새가 조금 난다는 후기 읽고 페브리즈 뿌리고 매트커버 쒸우고 토퍼 올리니 냄새도 잘 모르겠어요~
워낙 예민하지 않은 사람이기도 해요...^^;;
이가격에 이 매트리스 정말 너무 좋아요~ 곧 저희부부 퀸침대 매트리스도 주문 할꺼에요~~^^",0,False
102336253,5,2018.02.09,딱 맞는사이즈 편안한 느낌 좋네요~~^^,"급하게 당분간 사용하려고 인터넷을 찾아봤는데...저렴하고 상품평 좋길래 반신반의하면서 주문했는데....우와 이틀만에 총알배송...친절한 배송기사님...배송비 지불하고 바로 포장 뜯고 설치해서 딱 누웠는데...좋다~!! 라는 느낌적인 느낌~!!
강추 강추~~^^",0,False
102336253,5,2018.02.09,매우좋습니다!,"매우 푹신하구요 깔끔하구 고급스럽네요
실제로 누워보니까 확실히 좋습니다 ㅎㅎ 가격도 착하고
참마음에드네요^^ 리코침대 굿!",0,False
102336253,5,2018.02.09,재구매의사있어요 좋아요,푹신푹신하고 좋네요~~,0,False
102336253,5,2018.02.09,,,0,False
102336253,5,2018.02.09,,,0,False
102336253,5,2018.02.09,,,0,False
102336253,5,2018.02.08,탁월한선택,"매트리스 두께도있고 적당히푹신하고 이불깔고하니 딱좋아요
딸방만 바뀠는데 부부침실도 바꿔야겠어요",0,False
102336253,5,2018.02.08,,"좋은상품 많이파세요
딸래미 매트바꿔줬는데 좋아하네요",0,False
102336253,5,2018.02.08,,일끝나고 지친몸을 이끌고 집에 도착해서 누우면 바다에 떠있는듯한 느낌을 받을수 있는 침대급입니다 그냥 사세요 일단 후회는안합니다,0,False
102336253,5,2018.02.08,대박!,"배송은 빠른편이에요~

누워보니 스프링이 비싸게 준 애들 침대거랑 별 차이가 없어요~
이사가기 전까지 막 쓸려고 샀는데..우와~대박나세요~~",0,False
102336253,5,2018.02.08,대박입니다 말그대로!,"가격대비 정말 좋습니다!!!!
보통 싼데는 이유가 있다고들 하는데 이건 그 말이
적용되지가 않는듯 합니다 정말 강추합니다ㅜ",0,False
102336253,5,2018.02.08,재구매 할예정입니다 굿~,"우선 다른분들 상품평을 읽고 구매를 하였고
아들방에 필요해서 오자마자 설치를 해줬더니 너무 좋하
하네요 매트가 누워보니 등이 편하네요
배송 아저씨도친절하고 빨라서 너무 좋네요",0,False
102336253,5,2018.02.07,편하고 조아요 아버님이 조아하시네요,,0,False
102336253,5,2018.02.07,짱이예여!!!,저는 배송이 수도권지역이여도 일주일 정도 걸릴 줄 알았는데 단 하루만에 왔어요!!! 후기믿고 사봤는데 배치하고 누워보니까 정말 편해요ㅎㅎ 잘 산거같아요!,0,False
102336253,5,2018.02.07,,아들이 사용하는 침대는 멀쩡한데 매트리스가 낡아서 구매했어요 SS 사이즈에 적당한 두께가 마음에 들었어요 받고 보니 깔끔한 마무리에 지나치게 딱딱하지 않고 적당한 쿠션감이 좋아요 냄새도 나지 않아 아들이 오면 좋아할 거예요,0,False
102336253,5,2018.02.07,,"진짜...기대 이상이당...택배기사님도 너무 친절하고 엘베없는 4층까지 혼자 들고 오셨다ㅜㅠㅠ너무 감사했다
맨날 땅에서 자다가 매트 잇으니까...굿 계속 눕고싶다...
잘쓸께여어어!!!

참고)배송비는 기본2만원이고 엘베없고 하면 추가로 2만원 생각하시면 되요! 계단으로 못옮길때는 사다리차를 불러야한다해서 더 추가 비용 발생하니까 참고하세여!",0,False
102336253,5,2018.02.07,좋아요~~,"배송도 빠르고 냄새도 심하지 않아요~
디자인도 깔끔하고 가격대비 완전 좋아요~
번창하세요~^^",0,False
102336253,5,2018.02.07,굿!!!~~좋아요,"와~ 주문한지 3일만에 왔어요~역쉬 보던대로
상품도 좋고 배송도 빨라서 정말 좋네요^^",0,False
102336253,5,2018.02.07,,,0,False
102336253,5,2018.02.07,택배 기사님 감사해요. 저렴한 가격에 잘 구입한것같아요,,0,False
102336253,5,2018.02.07,,,0,False
102336253,5,2018.02.06,배송이 빠르고 기사님이 친절해요!,"토요일에 주문하고 그 다음주인 화요일 이삿날에 딱 맞춰서 와서 기뻤어요! 집에 없었는데 기사님도 현관앞까지 친절히 가져다주셨구요. 배송이 빨라서 너무 좋네요. 아직 누워보진 않았지만, 나중에 다시 매트리스를 살 일이 있다면 여기서 사고싶어요!",0,False
102336253,5,2018.02.06,가격대비무척좋은매트입니다,"저렴한 가격에 좋은 제품의 매트리스네요
이사하게 되면서 이전에 쓰던 침대를 버리고
리코제품 슈퍼싱글매트리스와
아기와함께자려고 좀더많이비싼매트리스 퀸사이즈를
주문했는데 결론은 싼게 비지떡이란 말은 거짓입니다...ㅋ
좀더많이비싼퀸사이즈 매트리스는 사용한지 한달도 안되어서
매트원단이울어서 반품했구요
리코매트리스는 남편이 사용중인데 매우만족하고잇어요
소프트한편은아니에요
하드한편이지만 매트위에서 걸어봐도삐꺽소리 스프링소리
절대나지않네요 저렴한가격에 너무 잘사용하고잇어요",0,False
102336253,5,2018.02.06,"주문하고 다음날 받았네요ㅋㅋ
진짜 개주아유ㅠ 이거사세요","주문하고 다음날 받았네요ㅋㅋㅋ서울살아요
3-4일예상했는데ㅠ 로켓배송도 아닌것이 로켓배송으로 보내주네요ㅠ
침대는 진짜 개주아유ㅠㅠ고민많이하고 삿는데 정말잘산듯해요
조용하고 아주좋네요 배송기사님도 몹시친절하셨어요!
가격에 맞지않게 고급져보이는게 좋아요. 침대 표면무늬도 그렇고 측면 제질이 고급진 제질이더라구요. 감동. 고민말고 이거사면 후회는 안하실듯하네요 번창하세요!!!",0,False
102336253,5,2018.02.06,,"고양이가 오줌을 싸는바람에 급하게 주문햇어요

배송도 빠르고 배송하시는 분도 친절하네요

근데 엘베없는 3층이라 배송비 만원 더 붙네요

배송비 비싼거빼곤 괜찮아요

침대 푹신함도 딱이에ㅇ",0,False
102336253,5,2018.02.06,저럼한 가격격에 편하게 잠자리를 할 수 있는 메트리스,"몇 일을 사용했는데 편하고 잠도 잘 잤어요.
허리가 아파서 침대를 알아보다 구입했는데 저렴하게 잘 구입했다고 생각듭니다.",0,False
102336253,5,2018.02.06,보들보들 폭신폭신,"폭신폭신하이 좋네요 사이즈는 더블이고 저는 키가 181인데 길이도 적당하구요
배달해주시는 아저씨 혼자서 번쩍 드시길래 깜놀... 같이 들어드리긴 했지만 ㅋㅋ
저는 처음에 모르고 뒷면을 저렇게 깔았지만 다른분들은 착오 없으시길 ㅋㅋㅋ",0,False
102336253,5,2018.02.05,,,0,False
102336253,5,2018.02.05,가성비 갑 좋아요,"물품 사용후 대략 3개월은 지난것같아요.
아주 편하게 사용하고있구요, 매트리스높이도 삼다수 생수병보다 조금 작은높이로 아주 만족합니다 ㅎ
가성비 갑입니다.",0,False
102336253,5,2018.02.05,,,0,False
102336253,5,2018.02.05,가성비최고 너무좋아요!!,"너무좋아요 딱딱한 매트리스가 아니라 그냥누워도 편하고좋아요
특히 높이도 보통높이가아닌것같아서 좋습니다~!!",2,False
102336253,5,2018.02.05,,,0,False
102336253,5,2018.02.04,푹신푹신하니 좋아요 가격대비도 너무 만족합니다!,"푹신푹신하니 좋아요 가격대비도 너무 만족합니다!
침대가 하나 더 있는데 이 매트리스에서만 자게 되네요
배송도 하루만에 오고 다른매트리스에 비해 무거운감은 있지만 배송기사님이 집앞까지 안전하게 가져다 주셨습니다",0,False
102336253,5,2018.02.04,프레임없이 매트리스만두고 단기로 사용해도 뽕뽑는 제품,"74일간의 사용 후기

독립해서 첫 자취생활을 시작하면서 제일 먼저 산게 이 매트리스입니다

좀 더 제대로 사용해보고 후기 남기려고 지내다가 이제야 생각나서 씁니다

지금 두달넘게 사용중인데 매트리스 겉에는 받자마자 방수 커버 세탁해서 씌우고 그 위에 얇은 패드 하나 깔아두고 사용중이에요

예민한편이라 불편하진 않을까 많이 걱정하고 고민하며 골랐는데 후기처럼 정말 불편함 하나도없고 푹신푹신 너무 편해요

일단은 여유가없어 급하게 가성비 좋은거 샀지만 나중엔 여유가 되면 고가의 라텍스 매트리스로 업그레이드할까 했었는데 굳이 필요성을 못느끼고 있습니다

퀸사이즈로 구입했는데 넉넉해서 혼자서 대자로 뻗고 뒹굴고 아주 행복합니다 맨날 침대에만 누워있게 되는게 함정..

가성비 정말 최고에요!

2018.04.08 추가 : 그동안 몇몇 지인들이 놀러와서 자고가는데 매트리스 가격 이야기해주면 놀라더군요 잘샀다고요. 제가 평소에 늘 또래 친구들에 비해 생활용품이나 가구들에 좀 신경을 쓰는편이거든요. 더 좋은거 쓰려하고, 더 편한거 쓰려하고요. (삶의 질을 중요시 하는 편입니다) 친구들은 당연히 몇십만원짜리인줄 알았다네요. 불편한걸 정말 싫어해서 베개도 늘 템퍼만 사용합니다. (일주일이상 해외 여행 갈때는 베개도 들고감) 여태까지도 불편하다고 느낀적이 단 한번도 없습니다. 온몸이 근육통에 시달릴때 마저도요.

2018.10.18 추가 : 매트리스로 인한 불편함을 느껴본적이 전~~~혀없음 정말 맨날 누워만있어서 문제임.. 근 1년째 프레임없이 매트리스만 놓고 쓰는데도.. 정말 잘샀음 저렴한가격에 품질좋은 제품 만들어주셔서 감사합니다.

2019.03.06 추가 : 여전합니다.

2019.05.24 추가 : 벌써 사용한지 일년 반이 지났네요.
여전히 줄곧 프레임 없이 매트리스 단독으로만 사용합니다.
주로 혼자 한쪽에서 자는데도 불구하고, 매트리스가 한쪽만 주저앉는다던가 하는거 없습니다. 예민한편인데도 별다른 불편함 없이 아주 잘 사용중입니다.
처음 구입했을때부터 냄새도, 피부트러블도 전혀 없었습니다.
더이상 할말도 없습니다. 매트리스 바꾸게 되면 그때 다시 리뷰 추가합니다.

2019.07.20 : 잘 쓰고 있습니다.

2020.02.08 : 세번째 집으로 이사를 하면서도 계속 이 매트리스 사용중입니다. 이번에 침대가 있는 풀옵션 집으로 이사하게 되었는데 그 침대 그냥 2층에 두고 집이 좁아지더라도 이 매트리스 1층에 두고 사용합니다.","1,819",False
102336253,5,2018.02.04,,,0,False
102336253,5,2018.02.04,잘 구매한거 같아 좋네요.,"퀸사이즈 구매했는데 기사님 고생했어요.

정말 무겁네요.

10만원 초반대 같지않은 푹신한 느낌이고

잘 산거 같아요.",0,False
102336253,5,2018.02.04,,,0,False
102336253,5,2018.02.03,선택하길 잘한 착한 매트리스,"오랜만에 매트리스 바꾸고 넘 좋아합니다.
푸근 편안함이 좋다네요",0,False
102336253,5,2018.02.03,,배송도 빠르고 침대는 일단 너무좋아요 10마넌초반대라기에는 너무 좋네요 배송해주시는분도친절하고 감사합니다 잘쓸께용,0,False
102336253,5,2018.02.03,만족!,"배송이 조금 늦었지만 상품은 만족합니다.
기사분께서 집안까지 잘 들여주셨네요^^
추천합니다~",0,False
102336253,5,2018.02.03,,매트릭스 만족만족,0,False
102336253,5,2018.02.02,너무 맘에들어요!!!,"아이랑 바닥생활하다가 허리가 안좋아서 구매했는데
이가격에 이퀄리티가 가능한가요??^^
기대이상으로 마음에드네요~
아이도 좋은지 내려오질 않아요 ㅎㅎ",0,False
102336253,5,2018.02.02,추천할만합니다 진짜좋아요!,"한달정도 사용해보고 후기남깁니다
적당히 푹신푹신하고 여자혼자 자기에 사이즈도 괜찮은거 같아요
충분히 추천할만합니다!",0,False
102336253,5,2018.02.02,,"바닥에서만 자다가 침대를 사야겠어서 찾아보던 중에
평도 괜찮고 가격도 괜찮은 침대 같아서 상품평도 보고
꼼꼼히 확인하고 샀는데요 지방인데도 배송이 3-4일만에
아주 빠르게 와서 너무 좋았고 기사님도 친절하셨습니다
10만원초반대가 맞나싶을정도로 쿠션도 탄탄하고 정말 편안하네요~ 어제 처음으로 잤는데 꿀잠잤네요 ㅎㅎ
침대 밑받침대도 다른곳에서 사서 바로 올렸습니다~
더 있어봐야알겠지만 일단 가성비가 엄청 좋은 침대인것같아요 많이파세요 고맙습니다^^",3,False
102336253,5,2018.02.02,,,0,False
102336253,5,2018.02.01,,한달기량 써보고 후기남깁니다. 역시 가성비갑이네요. 스프링소리도 없고 편한 잠자고 있어요. 감사합니다^^~,1,False
102336253,5,2018.02.01,,"가격대비 너무 좋은 상품인거 같아요
아기랑 쓸 침대라 너무 폭신하면 어쩌나 했는데
알맞게 좋은거 같아요
사이즈는 더블을 주문했는데 제 생각보다 커서 좋았어요
택배기사님도 자주 전화 와서 몇시에 갖다 주신다 하시고
다른 상품평 보면 기사님이 불친절하다는 평도 있어 걱정했는데 전 너무 좋았어요
저희집이 오래된 3층 집이라 가파로온 계단인데 집 안에까지 배달 해주셨어요
세팅 다하고 찍는 사진이라 잘 나오진 안았지만
정말 고급져요.",1,False
102336253,5,2018.02.01,더블 사이즈인데 너무 넓구 좋네요^*^,생각보다 쿠션이 좋아 누웠을때 너무 편해요~~강추합니당,1,False
102336253,5,2018.02.01,저렴한데도 탄탄한 느낌 ~오늘부터 꿈잠을 잘거같아요^^,빠른배송 감사드립니다!,1,False
