product_id,ratings,reg_date,article_headline,article_content,help_count,is_photo_review
4313875790,1,2021.03.06,,,0,False
4313875790,1,2021.02.10,구멍,사용한지 일주일좀 넘었는데 곳곳에서 솜이튀어나오고 작은구멍이 여러개 생기네요 ㅠㅠ,1,False
4313875790,3,2021.04.28,,,0,False
4313875790,3,2021.04.23,,,0,False
4313875790,3,2021.02.14,그냥 가격값 하는느낌,"저렴한맛에 쓰는 느낌입니다 가장자리만 겁나 빵실하고 정작 내가 누울 중앙은 좀 납작해요 푹식보다는 포근합니다.
바닥에깔고 자면 잠이 아예 안올것같고
라꾸라꾸침대쓰는대 조금이라도 쿠션감있는곳에 올리니 포근해서 잠이 잘와요",2,False
4313875790,3,2021.02.01,,"가장자리만 도톰하고 중간은 얇아요.
촉감은 좋은데 전체적으로 두께가 같지않아서
아쉽네요.",3,False
4313875790,4,2021.05.18,,,0,False
4313875790,4,2021.02.24,,,0,False
4313875790,4,2021.02.16,포근포근,완전 부드럽고 푹신해서 너무 따뜻해요,0,False
4313875790,4,2021.02.04,,첫자취 아이템 바닥에서 쓰기엔 아프지만 덕분에 따뜻했습니다,0,False
4313875790,4,2021.02.04,다 좋은데 한가지,작다는 후기가 많아서 걱정했는데 생각보다 작지 않지만 한가지 아쉬운 점은 제 매트리스가 30cm인데 밴딩이 전혀안돼요.. 잘 늘어나는 재질인줄 알았더니 그냥 천입니다.. 이거 빼곤 좋아요,1,False
4313875790,4,2021.01.19,,,0,False
4313875790,4,2020.12.16,,"겨울이라서 극세사가 좋을거 같아!!
또 양면도 된다고 해서 구매했어요~
그런데 제가 건조기가 이상했는건가...
반대쪽 얼룩이 묻었어요 ㅜㅜ 힝
그래도 이정도 가격에 물건은 좋아요!",2,False
4313875790,4,2020.12.03,,,0,False
4313875790,5,2021.05.20,,,0,False
4313875790,5,2021.05.20,,,0,False
4313875790,5,2021.05.09,,,0,False
4313875790,5,2021.05.02,,,0,False
4313875790,5,2021.04.23,,,0,False
4313875790,5,2021.04.05,,,0,False
4313875790,5,2021.03.31,,,0,False
4313875790,5,2021.03.27,푹신해서 마음이 듭니다~!!!,상품은 깔끔하게 포장되어서 왔습니다~~~ 토퍼종류를 사는 걸 고민고민 끝에 평점보고 겨우 찾아 여기 와서 사게 되었는데요 제가 써본 결과 푹신하고 부드럽고 두께도 적당하며 Q 사이즈라 크기도 딱 맞아요~~!!! 또 앞 뒤로 쓸 수 있어서 좋은 것 같아요~,0,False
4313875790,5,2021.03.19,부들부들하니 좋아요,부들부들하니 잘때 너무 좋아요,0,False
4313875790,5,2021.03.04,,품질이 좋아서 편안하게 깊은 잠을 잘 잤습니다!! 일을 하루 종일 열심히 하고 이 패트 떡분에 금방 베터리를 충전하네요!!,0,False
4313875790,5,2021.03.01,,,0,False
4313875790,5,2021.03.01,,,0,False
4313875790,5,2021.02.21,,,0,False
4313875790,5,2021.02.19,,"아주 두껍고 포근하고 부드럽고... 아주아주 좋아여...
뭐 막 어떻다 저렇다 이런 리뷰 읽고 사기보다는 이제 스스로 판단하려구요 너무너무 좋네요",0,False
4313875790,5,2021.02.19,,,0,False
4313875790,5,2021.02.05,,,0,False
4313875790,5,2021.02.01,,"침대 슈퍼싱글이고 구매한 상품도 슈퍼싱글입니다.

사진은 밴드로 네 모서리 모두 다 고정해둔 상태입니다. 양옆으로 조금씩 부족하네요 싱글 크기같음 ㅠ

싱글 침대 쓰시는 분이 이 SS사이즈 구매하시면 만족도 더 올라가실듯~

그리고 여느 토퍼처럼 가장자리보다 가운데가 덜푹신합니다. 반대로 돼야하는디.. 그래도 상당히 푹신한 편이에요

색감도 이쁘고 고정을 위한 밴드가 있는 점, 계절이 바뀌면 뒤집어서 쓸 수 있다는 점, 그리고 가격을 생각하면 매우매우 만족하긴 합니다.

아 그리고 지퍼도 못열게 밀봉(?) 돼있어서 내가 받은 제품이 중고가 아니라 새 제품이 맞구나라는 걸 알 수 있었던 것도 좋았습니다!

결론은 구매 추천!

다음에 토퍼 바꿀 때 되거나 아는 사람 사줄 일 있을 때 이거 살듯요~",1,False
4313875790,5,2021.01.29,,,0,False
4313875790,5,2021.01.28,,,0,False
4313875790,5,2021.01.28,산거 후회,"으응? 이거 상품평 왜케 다들 좋게준거죠? 5cm두께요??
전 그냥 좀 두꺼운 극세사 이불인줄;; 솜 전혀 빠방하게 들어있지 않고 보기에도 흐늘흐늘 손으로 잡아보면 실제 눕는 안쪽은 1cm나 나올까 의문이 드네요. 마치 바닥에 넣고 써도 좋을만큼 상품평들 남기셨실래 손님용으로 샀는데 이건 왠..
맨 테두리 부분에만 빠방하게 넣어놓는 효과 주고 정작눕는 안쪽은 이게 몹니까. 타카타카 실망이네요.",5,False
4313875790,5,2021.01.25,,"이쁘고 부들부들 고급져요. 원단좋고 박음처리깔끔 세탁후 원형그대로 솜뭉침없어요. 양면사용 엄지척 ,디자인상 토퍼가 좁아보이는착시는 있어요.
백퍼 만족입니다",0,False
4313875790,5,2021.01.24,가격대비 너무~~좋아요 푹신하고 부드럽고 포근해요 적극,,0,False
4313875790,5,2021.01.24,너무 좋아서 재구매 했어요,"숙면 취하기 힘들어하는 딸래미 사줬는데 아들이 누워보더니 사달라고 합니다 너무 편하고 꿀잠 잘 것 같다구요 그래서 바로 주문 했지요 잠이 보약이잖아요~~^^
슈퍼싱글 침대 위에 올리면 딱 맞아요 도톰하니 적당한 두께에 양면 재질이 달라서 계절에 따라 기분에 따라 바꿔 누울 수도 있으니 더 좋구요 여름을 제외하고 봄 가을 겨울에 모두 사용할 것 같네요
21kg 트롬에 울세탁 했더니 탈수가 전혀 안돼서 강으로 탈수만 1번 더 했어요 건조기는 안쓰는 게 좋을 것 같아 패스하고 빨래대에서 자연 건조로~~
안방에도 하나 더 살까 봐요^^",3,False
4313875790,5,2021.01.22,극세사토퍼는 처음인데,너무 푹신하구 좋네요,0,False
4313875790,5,2021.01.20,푹신푹신,아주 푹신푹신,0,False
4313875790,5,2021.01.18,가성비 최고!!,"딸래미가 숙면을 취하지 못해요 침대 매트리스가 불편한 건 아닌데...
포근하게 잠 잘자기를 바라면서 구매했어요
상품평이 좋더라구요~
오자마자 세탁해서 말렸네요
도톰한 토퍼 너무 맘에 들어요
세탁 후에도 변형이 없어서 안심이에요
하루 재워보고 좋다고 하면 아들도 하나 사주려고 합니다
가격 착하고 품질 우수하고~
맘에 쏙 드네요

예전보다 훨싼 잘 잔다며 너무 좋아합니다
얼마나 다핸인지요...
고맙습니다^^",5,False
4313875790,5,2021.01.18,진짜진짜 포근하네요~~,진짜진짜포근합니다~~^^,0,False
4313875790,5,2021.01.18,,,0,False
4313875790,5,2021.01.09,,,0,False
4313875790,5,2021.01.07,"배송, 품질, 쿠션감, 박음질 모두 최고!","왜 다들 별 다섯개인지 알듯..
찜해놓고 다른색 또사게요 재구매율 9999999%",1,False
4313875790,5,2021.01.02,,"지금사용하기에 딱좋아요
푹신하고 부드럽고 색상도예뻐요",0,False
4313875790,5,2020.12.29,푹신해서 좋아요~^^,"————————————————————————————
배송⭐️ ⭐️ ⭐️ ⭐️ ⭐️
푹신함 ⭐️ ⭐️ ⭐️ ⭐️ ⭐️
재질 ⭐️ ⭐️ ⭐️ ⭐️ ⭐️

왜 사람들이 토퍼를 쓰는지 알겠더라고요 ㅎㅎ 항상 잘 때마다 등 아프고 허리아프고 했는데 사용하고나서 진짜 푹신하게 잘 자고 있어요!

포장을 뜯어보니 냄새도 안나서 바로 누웠었는데 진짜 이렇게 편할 수가 없더라고요 심지어 지금 추운날씨 두께가 있다보니 따뜻하게도 잘 수 있었어요 바닥의 한기가 올라오지도 않고 딱딱함도 전혀 안느껴지고 아프지도 않아 좋더라고요 ㅎㅎ

침대에 올려서 사용해도 될 것 같고 그냥 바닥에 깔아도 좋을 것 같아요 ㅎㅎ 심지어 침대에 고정시킬 수도 있게 잘 나와 아주 만족이였습니다!

침구류는 몸이 바로 느낄 수 있는 물건이기 때문에 겉보기와는 달리 사용감이 젤 중요한 물건인데 그런 부분에서 진짜 별점 많이 주고싶네요 ㅎㅎ
————————————————————————————

쿠팡체험단 이벤트로 상품을 무료로 제공 받아 작성한 구매 후기입니다.",2,False
4313875790,5,2020.12.24,이거 사용 해보셔요~ 여러분~,"배송이 매우 잘 왔더라고요.
포장도 엄청 깔끔하고 꼼꼼하게 잘 되어 있어서 좋았어요.

원단이 매우 좋고 부드러웠어요.
엄청 정말 뭐랄까 마음이 좋더라고요.
색상도 참 이쁘고 디자인도 좋더라고요.
사진에서 보신것과 같다고 생각을 하시면 될 것 같아요.

마감처리가 깔끔하니 실밥이 나오거나 하는 부분도 없었습니다.

누워보시면 알 거에요.
엄청 복신하고 부드러워요.
잠이 쿨쿨 잘 오더라고요.

짜임세도 참 좋고 최고에요.
엄청 고급스러운 느낌이 나니
어떠한 침구에도 잘 어울립니다.

쿠팡체험단 이벤트로 상품을 무료로 제공 받아 작성한 구매 후기입니다.",4,False
4313875790,5,2020.12.23,,,0,False
4313875790,5,2020.12.22,폭신하고 넘 부드럼,"☆제품명ㅡ타카타카 믹스매치 프리미엄 극세사 밴딩형 양면토퍼
☆색상ㅡ그레이
☆사이즈ㅡss(110×200×5cm)
☆제조국 ㅡ중국
☆이 제품은 믹스매치 극세사 밴딩형 양면토퍼로서 보온
성이 좋으며 프리미엄화이바 소재를 사용하여 먼지가 적
어 사용하기에 쾌적하다고 합니다 ☆앞면 소재로 사용할시에는 요즘같이 추운 계절에 딱 맞는 포근한 잠자리로 추천드리며 뒷면 사용시에는 늧은 봄 ,여름 ,가을이 적당할것 같네요 그리고 고정밴드가 있
어 침대위에 사용할시에는 토퍼가 움직이지 않아 편리할
것 같고 그냥 방바닥에서 주물실때도 토퍼의 쿠션감이 좋
아 대단히 만족하는 토퍼네요 그러나 단 한가지 보통 침
대매트리스나 토퍼에서 잘때는 테두리쪽보다는 가운데
(중앙)부분에서 주로 자기때문에 그곳이 먼저 꺼짐 현상
이 나타나게 마련이죠 그런데 이제품은 사용하기전부터 테두리 부분 높이가 더 높고 토퍼 중앙 부분이 더 낮아 그게 좀 아쉽네요(극히 갠적인생각임)

☆결론은 토퍼가 그레이색상이라 고급스러 보이고 포근
하니 좋으며 토퍼 테두리부분 마감처리도 정말 꼼꼼하고 바느질부분도 맘에 들어 잘 사용하고 있으며 이번 겨울 도 나의 잠자리는 이 양면토퍼로 따스히 잘 보내렵니다

쿠팡체험단 이벤트로 상품을 무료로 제공 받아 작성한 구매 후기입니다.",3,False
4313875790,5,2020.12.21,,"기존에 딱 같은 사이즈의 토퍼를 사용중이었어요.
아무래도 번갈아 가면서 세탁해서 쓰려고 같은걸 구매할까..
하던참에 눈에 띄어서 사용해보려고 선택했어요!!

일단은 제가 사용하는곳은 침대는 아니구요,
카우치 쇼파베드에요.
토퍼 요사이즈들이 3인용 쇼파베드에 딱이더라구요.
쇼파로는 거의 사용하지 않고 펼쳐서 베드로 씁니다.

일단 첨 받았을때 이불가방에 깔끔하게 배송이 왔는데
지퍼백이나 압축비닐 보단 가방에 담겨져오니
개인적으론 보관도 좋겠다 싶고 사이즈가 작으니
캠핑갈때도 훅 말아서 싸가면 너무 좋겠더라구요.

두께는 솜 토퍼 치고는 꽤 두꺼워요.
퀄팅되어 있어 솜이라도 뭉치거나 하는게 덜 할거 같으네요.
기존에 쓰던것처럼 이런 쇼파베드나 매트리스에
편하게 사용할 수 있도록 4군데 밴딩처리가 되어있어
고정시켜 좋구요.
뭣보다 벨벳처리 되어있는 겉면이 너무 부드럽고 좋아요.
지금처럼 추울땐 전기장판 깔아두고 위에 덮어놓으니
세상 따뜻하고 보드라워요!!
벨벳이라 먼지가 많이 일지는 않을까 빠지진 않을까
걱정했는데 전혀 그런게 없어요.
세탁 후에 까만옷입고 뒹굴어 봤는데 막 묻어나지 않더라구요.

일주일정도 사용해보니 전체적으로 가성비가 일단
굉장히 좋구요, 세탁후에도 솜이 뭉치거나 꺼지거나
하는게 덜해서 부담없이 세탁기에 막 돌리기도 좋아요.
솜이 심하게 꺼질지는 아직 더 사용해봐야 알겠지만
일주일째인 아직까지는 그런게 없네요 ㅎ
넘 만족합니다 : )

쿠팡체험단 이벤트로 상품을 무료로 제공 받아 작성한 구매 후기입니다.",3,False
4313875790,5,2020.12.21,,"가격대비 가성비가 짱짱하네요!!!!
쿠션감에 놀라고 부드러움에 놀랐어요~ 받자마자 고급스럽다 생각들었는데 세탁후에도 쿠션감 그대로고 양면 다 사용할수있는 리버시블 양면토퍼고 고정밴딩으로 필착고정할수있어요
고정밴딩도 기존에 보던 하얀 고무 고정밴드가 아니 뒷지와 동일한 프리미엄화이바 패브릭으로 고무밴드를 한 번 더 감싸 견고함을 높여주네요
4면을 둘러싼 파이핑 마감처리로 토퍼 모양과 중심을 잡아주어 더욱 견고하게 해줬구요
양면이 다른 소재 토퍼라 사계절이용이가능하네요
소프트밍크극세사로 부드러운촉감을 주며 한겨울 보온성을 유지해주고 먼지가 적은 프리미엄화이바 소재를 사용해서 쾌적하게 사용가능하구요
두께감과 폭신함 부드러움을 겸비한 토퍼 사용해도 꺼지지않는 쿠션감이 매력있어요 아기가 사용하고 있는데 너무 좋아해요

쿠팡체험단 이벤트로 상품을 무료로 제공 받아 작성한 구매 후기입니다.",5,False
4313875790,5,2020.12.20,정말 정말 강추 합니다~~,"아이방에 침대매트가 자주 밀려서 스트레스
받던 차에 밴드가 있는 두툼한 토퍼를 하나 사야지 하고 마음 먹고 있었어요.

타카타카 상품은 처음인데 완전 완전 만족합니다~~

1. 한 쪽은 정말 부드러운 얇은 극세사 재질이고
또 한쪽은 사계절 사용가능한
면 느낌의 마이크로 화이바 재질이에요
먼지 없는 요론 재질 참 좋아하는데
정말 만족 합니다.

2. 양쪽에 너무 예쁜 그레이 색에 부드럽고
누빔 무늬도 너무 고급스러워요~

3. 바느질도 마감처리도 너무 잘 되어 있어요

4. 밴드가 양쪽 면 다 사용하기에 이리저리 넘겨봐도
자연스러울 수 있도록 잘 부착되어 있어요

5. 포장도 박스 안에 비닐가방에 넣어져 위생적이고
고급스러워 선물 하시기도 좋을 것 같아요

6. 10kg 통돌이 세탁기에 꽉~ 들어가요
세탁 후 처음과 같이 전혀 이상없는 모습이고
생각보다 빨리 건조되어 하루만에 사용했습니다.

7. 처음 개봉했을 때부터 나쁜 냄새도 없었고
부드러운 솜이 빵빵하게 넣어져 단단한 느낌이
들었습니다.

8. 슈퍼싱글 침대에 아주 잘 맞아요~
깔아두고 보니 침대가 무척 높아진 느낌이에요
푹신하고 부드러워 아이가 좋다고 정말 좋아합니다
누워있으니 포근하고 정말 따뜻해지네요


결론~
정말 예쁘고 기능 좋은 좋은 상품 입니다~
좋게 말씀드리려하는 말이 절대 아니에요
하나 더 구입하고 싶어지는 만족도 높은 상품입니다^^
받아보시면 정말 만족하실꺼에요


단점을 말씀드리고 싶은데 단점을 아무리봐도
저는 못 찾겠네요 ㅜㅜ

타카타카 브랜드 이제 기억하고 다른 상품들도
잘 보고 구입해야겠어요~~
퀄리티가 좋아요~

밀리는 매트가 스트레스셨다면 꼭 사용해보세요
정말 강력추천합니다.

쿠팡체험단 이벤트로 상품을 무료로 제공 받아 작성한 구매 후기입니다.",4,False
4313875790,5,2020.12.18,,"보들보들 1인용 토퍼^^
양면이라 활용력 갑! 한여름빼고 사용가능!!
아이가 뒹굴뒹굴 넘 좋다고 자기가 쓰고 싶다고ㅋ 아들 차지가 되었어요. 바닥에도 침대에도 만능으로 활용가능하겠고요.
딱1인용. 세탁하기 부담스럽지도 않구요. 더블크기 토퍼 산게 있는데 세탁이 어렵더라구요. 그냥 1인 1토퍼가 관리하기 좋을거 같아요.

차가운 날씨라 비닐가방이 탄력을 잃었는지 터져왔어요. 그래도 박스포장이 되어있어서 내용물은 이상없구요. 지퍼에 잠금포장 되어있어서 믿고 쓰겠습니다~

아 이것 참 발열감이 신기해요. 온수매트위에 올려쓰는데 매트켠줄 알았어요. 앉아있는데 엉덩이가 따끈따끈해지는 느낌~신기방기
따뜻하게 겨울잘나고 간절기에도 활용하기 넘 좋은 침구. 하나 장만해보세요~추천합니다^^

쿠팡체험단 이벤트로 상품을 무료로 제공 받아 작성한 구매 후기입니다.",3,False
4313875790,5,2020.12.17,잠을 부르는 마시멜로 토퍼를 여러분께 추천드려 봅니다,"개인적으로 이 제품은 별 10개 드리고 싶네요
토퍼는 손잡이가 있는 비닐팩에 담겨서 박스포장 한번 더 해서 왔어요
극세사 좋아해서 극세사 침구 이것저것 많이 있고 자주 쓰는데요
제가 잘은 모르지만 이 제품은 이름처럼 프리미엄 극세사가 맞는 것 같아요
소재부터 너무 보들보들.. 아가들 피부처럼 보드라운 느낌이에요
포장뜯고 제가 바로 펴서 누워봤는데 마시멜로 위에 눕는다면 아마 이런느낌이지 않을까 싶어요ㅋㅋㅋㅋ
토퍼답게 아주 푹신푹신해서 진짜로 잠들 뻔 했어요 ㅋㅋㅋㅋㅋ 숙면을 부르는 숙면토퍼라고 불러도 될 것 같아요

제가 타카타카라는 브랜드는 이미 집에서 순면누빔고정밴딩패드를 쓰고 있어서 잘 알고 있었어요
(참고로 순면누빔고정밴딩패드는 여름에 강추드려요!)
이번에 프리미엄 극세사 토퍼 받아보고는 타카타카가 더 좋아졌네요

그리그 양면 모두 사용할 수 있어서 더 실용적인 것 같아요
요즘 같이 추울 때에는 극세사쪽을 쓰고 봄/가을에는 면쪽을 쓰면 될 것 같아요
밴딩도 있어서 어느쪽으로 쓰든 토퍼가 밀리지 않게끔 고정해서 잘 사용할 수 있을 것 같아요

새 제품임을 인증하듯 처음에 오픈하시기 전에 비닐팩 개봉하는 부분 보면 가위로 잘라야 오픈 할 수 있게 되어있어요
토퍼에도 마크부분에 따로 택이 붙어 있으니 꼭 제거하시고 사용하셔요^^

아참 크기는 성인1명 정도는 충분할 것 같아요
혹시 아이있는 집은 엄마나 아빠 한 분에 어린아이 한 명 정도도 괜찮을 사이즈에요

쿠팡체험단 이벤트로 상품을 무료로 제공 받아 작성한 구매 후기입니다.",7,False
4313875790,5,2020.12.17,두툼하고 부드러워요,"평소 퀸사이즈 침구류만 사용하지만 슈퍼싱글과 옆으로 한뼘정도밖에 차이가 안나더라구요.


쿠팡체험단으로 겟했지만 사이즈도 맘에 들고 무엇보다 평소에 좋아하는 그레이 색상이라 너무 맘에 들었어요!



커다란 박스에 담겨 튼튼해보이는 비닐 보관가방에 또 담겨 고이접혀 들어있었어요.


제 한뼘이 18센치쯤 되는데 비교샷 보시면 4번접은게 그정도예요~

부모님이 쓰실거라 펴서 보진 못하고 손만 넣어봤는데도 정말정말 보드랍고 폭신하다 라고밖에 설명이 안되네요ㅎㅎ


겉면 질감도 너무 부들부들 맨살에 닿는게 기분이 좋아요.



침대에 토퍼로 쓰신다는데 곧 사용후기도 추가하겠습니다~

쿠팡체험단 이벤트로 상품을 무료로 제공 받아 작성한 구매 후기입니다.",0,False
4313875790,5,2020.12.16,아 너무 기대되는....지금은 세탁중..+넘 좋은 상품,"제가 구름같은 재질 좋아하거든요.
구름같아요...대박적..

참고로 저나 아이나 전기가 들어가는 매트는 안쓰고 있어요 제 지론(?)이 자기가 발열? 해서 자야 건강하다는 생각이 있어요.

실제로 저는 전기장판에서 자고 일어나면 몸 일으키기 되게 힘들어해요.. 그리고 몸에 전기 너무 심하게 들어온 사람 피부 살짝 닿으면 지르르르 전기 느껴지는거 아시나요

아무튼 이러한 이유로 이불을 따듯한걸 쓰고 난방텐트치고 전기 안쓰고 따듯하게 재울려고 생각중이었어요.

오늘 받아보니 흔들리지 말라고 고정 고무줄이 모양 좋게 두껍게 달려있고요
겨울엔 극세사 면 날씨 따듯해지면 면쪽으로 돌려 쓸 수 있게 되어있고 극세사도 길지 않고 아주 예쁘게 커팅?되어있어서 보기에도 깔끔하고 촉감도 진짜 보드라워요
부드러운게 아니라 보드라워요 ㅎㅎ

아이 침대에 깔아주려고 해요
사진 보면 아시겠지만 두께도 두꺼워요

고퀄리티에요 한마디로

세탁 끝나고 침대에 장착하고 사진 추가로 올릴게요.

배송은 이불 투명 가방에 들어가 있고
종이박스에 넣어져서 와요
이불가방 자크끼리 택으로 묶어져서 새상품인거 확인 가능하고요.
남이 쓰던거 재판매 하고 그렇지 않을거라고 예상됩니다. 이 회사는 이렇게 표시하나봐요. 좋네요 ㅎㅎ

+침대에 끼웠어요~~ 정말 잘 맞아요!!
고정해주는 고무줄도 너무 예쁘게 처리되어 있어요 애기도 엄청 좋아해요 부드럽대요

쿠팡체험단 이벤트로 상품을 무료로 제공 받아 작성한 구매 후기입니다.",5,False
4313875790,5,2020.12.11,부드러움 발열감 따뜻합니다.,퀄리티 좋아요. 발열감 따뜻하고 고정력 좋고 특히 양면이라 사계절내내 사용할수 있어요.,4,False
4313875790,5,2020.11.27,고민말고 ㄱㄱ,"두툼하니 두께감있어서 바닥에 단독으로 써도 좋겠어요
폭신하니 맘에듭니다
포근하니 자꾸만 눕고싶어지는 침대에서든 바닥에서든 앞뒤원단도 달라서 뒤집어쓰는 재미가있네요
좋아요 고민말고 구매 ㄱㄱ",4,False
4313875790,5,2020.11.25,,"갑자기 추워져서 극세사 토퍼 구매했는데
한 겨울에 극세사 쪽으로 깔면 따뜻할 것 같아요~푹신푹신하고 따뜻해요!!
지금은 극세사 반대편으로 까니까 딱 맞는거 같아요!
베개커버도 컬러 맞추어 샀는데 잘 어울리네요~
넘 만족합니다. :)",4,False
