product_id,ratings,reg_date,article_headline,article_content,help_count,is_photo_review
1679466374,5,2021.03.23,,"구매해서 사용해보니 괜찮아서 부모님 온돌쇼파에
올려드렸어요. 어젯밤 배송 받으셨는데
냄새없어 좋다고 하셨어요 로켓배송^^",3,False
1679466374,5,2021.03.22,돌쇼파에서 잠들어서인지 어깨.뒷목이 뻐근했는데 해결됨!,"먼저 접이식.색상따라 가격차이가 많이나는게 궁금하네요.
며칠 자보고 후기쓰려고 기다렸습니다.
침대는 벨기에 라텍스코 사용합니다. 거실 온돌쇼파에서
잠들때 너무 딱딱해서 깔아봤습니다.
라텍스코에 익숙해져있는 제몸이 느끼기엔 첨엔 너무
딱딱한게 아닌가 싶었습니다.그렇다고 탄성이 부드럽지않은것도 아닙니다.며칠 자본결과 괜찮습니다.어깨.목.등 불편한곳 없고
푹 잤습니다.냄새없고 무겁지만 밀도좋으니 쉽게 꺼질것같지
않습니다.정말 궁금한건 접이식과 색상별 가격차이가 5만원이상
나는데 그것이 참 궁금합니다.",2,False
1679466374,5,2021.02.17,,,0,False
