product_id,ratings,reg_date,article_headline,article_content,help_count,is_photo_review
102336253,1,2021.05.08,,"상품금액보다 배송비를더 많이받아챙기는 경우가 어디있는지원...
상세정보 기제을 눈에 잘보이게 올려두시던지 이건좀 아닌거 같아 글남겨놨습니다..",1,False
102336253,1,2021.05.05,오지도않은 상품이을 어떻게 후기작성을 하나요?,,0,False
102336253,1,2021.03.31,상품은 좋으나 서비스센터 및 배송기사의 불친절,"침대상품은 참 좋습니다
다만....
배송전 연락안받았다고 문자연락 주시며 통화하였더니 배송 일정 맞추어 시간까지 정하여 놓고는 당일 배송기사님이 변경되면서 시간 마저 임의변경시키네요. 작은 물건이 아니라서 배송비 포함하여 집안으로 넣으려 반차까지 써가며 기다리는데 당일 2시간 늦어진다고 배송기사님이 바뀌었다고....
고객센터 연락처로 문의 하니 어쩔수 없다는 대응은 좀 아닌거 같네요",1,False
102336253,1,2021.03.24,,,0,False
102336253,1,2021.03.20,보기엔 튼실해보였는데 완전허당이네요ᆢ,"매트리스에 누울때마다 스프링이 삐끄덕소리에 짜증나요ᆢ
가격이 싸서그런가 ? 정말 버릴수도없고 ᆢ ㅠㅠ
후기보고서 선택한건데 왜이리 틀린건가요ᆢ
조금더주고 다른제품 사시길요ᆢ",2,False
102336253,1,2021.03.04,엥,"+ 일주일 정도 사용했는데
오늘 이상하게 허리가 너무 아프더라고요..
보니까 가운데 부분이 불룩하게 튀어나왔고
고객센터(070-5222-0655)에 문의해보니
패브릭에 본드칠을 안해서 그렇지 불량은 아니라고, 양면 사용하니 일주일정도 뒤집어서 사용해보라셨어요.
뭔가 찜찜은 한데.. 그래도 일주일 후에도 불룩한게 없어지지않으면 “교환은 해드려야죠 뭐..” 하시던데....

일단 일주일 정도 더 지켜봐야할 것 같아요 ㅠ

+ 그래도.. 지방이라 배송은 8일만에 받았고
택배기사님께서 친절하게 “너무 늦진 않았는지요~?”라고 여쭤봐주셔서 참 감사했어요.

+ 메트리스 뒤집어 사용하라는 안내 하에 뒤집어 쓴지 이틀차..
여전히 허리는 아프고... 자다가 깨서 보니 뒤집은 곳에서도 불룩하게 튀어골랐어요... 그리고 가운데에 누워서 자는 편인데 오른쪽부분 스프링이 꺼지는건 머 어짜라는거지

+저는 160에 47키롭니다 ㅋㅋㅋㅋㅋ...",4,False
102336253,1,2021.03.02,양파 옆이너무 푹쉬고 들어가서 조금 위험할수 있어 불안,,0,False
102336253,1,2021.02.28,,침대중앙이외 사방 테두리는 지지력이 약해서 애랑 같이 자는데 테두리에 누우면 떨어질것 같고 몸만 둥 떠있는 느낌...볼록렌즈침대에서 몸만 철판위에 겉돌며 떠있는 느낌입니다....메트리스 바꾸고 잠설치고 몸아프고...전 다시 돈주고가져가래도 거절할듯요..ㅜ.ㅜ,0,False
102336253,1,2021.02.09,,,0,False
102336253,1,2021.02.06,매트리스 중간이 불쑥 올라와있음..불량임..,동영상으로 찍어놨는데 사진밖에 첨부 안되네요.매트리스는 당장급해서 걍 사용 했씀.,1,False
102336253,1,2021.01.11,허리나가요,"몇달쓰면 금방 꺼져서 허리 개아픕니다
1년도 못쓰고 버리고 에이스40만원짜리 사고 허리가 나았어요
후기좋은건 알바인가..ㅜ10만원 여따쓴게 넘 아까움 물리치료비가 더 나감",2,False
102336253,1,2021.01.08,,쓰는데 먼지가많이나오네요 왜그런지모르겠지만요,1,False
102336253,1,2020.12.28,ㅇ,,0,False
102336253,1,2020.12.21,빠른 연락 부탁드립니다.,배송완료라 떠있는데 배송에 관한 연락도 받지못했고 배송물도 없습니다.,2,False
102336253,1,2020.12.17,"2개 주문 했는데 배송비 1개35,000원 2개7만원",,0,False
102336253,1,2020.12.10,,"배송 완전 늦고.,배송비도 3층이라 만원추가,.직원응대도..멍판이고,완전 멍짜증..ㅜ
두번다시 사고싶지않은 메트리스..그냥 매장에서 20만원주면 친절히 배송하고 대우받고..이건 돈주고 사는데도 완전 멍무시에,
나몰라라하는...멍멍멍같은 상품임",2,False
102336253,1,2020.12.01,무슨 사전에 얘기도없이 3층이라고배송비 4만원을...,사전고지도없이 무슨3층이라는 이유로 배송비 4만원을 내라고 합니까? 배송도 늦고 완전 최악이네,0,False
102336253,1,2020.11.28,,,0,False
102336253,1,2020.11.27,,"제품 사용후기를 참조하구 구매 했는데 영 별로 입니다...
첨 구매하자마자 비닐 뜻고 쿠션이 스프링이 좀 약하다는 느낌이 들었는데 비닐을 뜻어버려서 반품은 안되고 해서 사용해보기로 했는데 시간이 갈수록 꺼지고 몸을 받혀주질 못하구 매트리스 표면도 주름에 늘어나기 까지 하네요. 그래서 뒤집어서 쓰면 좀 딱딱한 면인줄 알고 뒤집었더니 양쪽이 똑같이 흐물흐물 하며 자고나면 몸이 찌뿌둥하고 피곤하며 불편합니다. 쓰레기수거때문에 그냥 버릴수도 없고...",3,False
102336253,1,2020.11.27,,,0,False
102336253,1,2020.11.17,,,0,False
102336253,1,2020.11.15,"제품의 하자가 있습니다
.모서리 부분 철사가 만져진다","제품의 하자가 있습니다
처음에는 모서리가 구멍이 있고 쓸린 자국 때문에 교환
두번째 제품이 왔는데 구멍은 없습니다.
그러나 여전히 모서리 부분이 쓸린 흔적.
만져보니 철사가 튀어 나옴.
배송 기사님 또한 그런 자국은 스프링 때문일 거라 함.
시골이라서 그냥 사용하기로 함.
그냥 저렴하니 사용하다가 버려야지 하는 생각으로 교환 신청을 안함",1,False
102336253,1,2020.11.12,,무슨 배송 오지도 않았는데 배송완료라고 뜨나요?,0,False
102336253,1,2020.11.11,딱 십만원의 가치입니다,"왜 상품평이 좋은지 이해가 안갑니다
가성비좋다는 말은 딱 십만원의 가치였다는 것을 말하는 것이었습니다 저는 이틀밤 자고난 후기입니다 스프링에서 튀는 소리 납니다 푹푹 꺼집니다
몇개월 더 써보고 후기 남기겠습니다
원래 후기 안 쓰는데 리뷰 꼼꼼히 보고 사시길 추천하는 마음에 후기를 남깁니다

한달 사용 후
목디스크가 생겨서 매트리스를 뒤집어 사용하였습니다 뒤쪽은 스프링이 없어서 인지 평평한 느낌이 들어 저에게 좀 더 맞았습니다
저처럼 디스크있으신 분들은 한번 더 고민하셨으면 하는 바람으로 적었습니다
매트리스를 손으로 누르면 스프링 튕기는 소리는 신경이 쓰입니다 식구들의 다른 매트리스는 전혀 그렇지 않었습니다",5,False
102336253,1,2020.11.11,침대 때문에 일상생활이 안되었네요,"집에 사람이 있는데 이렇게 놓고가시는사람이 어딨습니까 집에 발목 다쳐서 깁스한 사람이 있는데 병원가려고 문을 열려고 했는데 열지도 못하고 병원도 못가고 이게 뭐하는겁니까 제가 기사님한테 다른데에 있다고했지 집에 사람 없단말은 안했는데 침대를 이렇게 떡하니 놓고 가셨네요 발목이 많이 부어있는 사람인데 이거 밀다가 더 다쳤으면 어떡하려고 이렇게 두고 가셨나 하네요,,",1,False
102336253,1,2020.11.10,절대사지마세요 병원갑니다,"아들침대 예전에서 써보고 좋아서 다시 샀는데퀸 침대사서 하루딱 자보고 허리 아작나서 병원 신세 지고있 습니다 침대위에 널판지를 놓아도 마찬가지 푹 푹꺼집니다
독립스프링이 이렇게 푹푹 꺼지는 건가요 작은방 아들 침대는 1년전에샀는데 아무리 자도 허리아픈적없어요
똑같은 제품이 이렇게 차이나는 알수가없어요
스프링에 분명 문제있는 제품입니다
아들 침대는 아무리 무게있는 사람이 앉자도 누워도 뛰어도푹푹 들어가지 않아요


절대 사시면 안됩니다 업체에 전화 해봐도 소용 없네요 교환불가입니다
수십년 침대를 만들었다고 펑을칩니다
현재는 재활용 센타에 3만원주고 처리요구했습니다
왜 쿠팡 업체에서는 이런업체를 선정 해서 국민들에게 불편을 주는지 모르겠습니다",3,False
102336253,1,2020.11.04,,,0,False
102336253,1,2020.10.25,,"늦은배송...재촉해서 ...받고... 한달여정도 써보고 글올리는데...침대에서... 삐걱삐걱...소리 너무심하네요 ~~ 그리고 뭐가이리 푹푹꺼지는지
아주 짜증나요~~~ 그리고 후기가 너무좋아서 구매했는데...다시는 믿지말아야겠네요~~~",4,False
102336253,1,2020.10.25,,,0,False
102336253,1,2020.10.24,아니 20일 배송완료인데 배송받은적도 연락받은적도 어플,,0,False
102336253,1,2020.10.22,싸구려 제품 속지 마세요 반품처리 안돼서 버림,후기들 보고 샀는데 역시 싼데는 다 이유가 있었네요. 진짜 솔직한 후기 써볼게요 이런거 안쓰는데 다른 분들도 괜히 피해 보시지 말라고요.. 우선 매트리스 너무 딱딱해요. 며칠 자고 났는데 온몸이 쑤시구요 허리랑 목도 뻐근해요. 원래 잘 자는 저인데도 계속 뒤척이고 숙면을 통 취할 수가 없어요. 낮에도 허리가 아파서 일상생활이 불편할 정도에요. 두껍고 크기만 하지 안에 무엇이 들어있는지 정말 매트리스가 아닌 돌 매트 같아요. 그리고 배송도 느려서 엄청 기다리다 받자마자 아토피 있는 아기 생각에 비닐을 뜯어 냄세가 빠지도록 했더니 반품 처리 절대 불가능하다고 하시네요. 결국 돈 내고 버렸구요 다른 매트리스 주문했습니다. 이 제품 추천하지 않습니다.,7,False
102336253,1,2020.10.21,,"매트리스와 하단을 같이 구매했어요
외관상 예쁘고 관찮아보이긴한데
가격만큼의 품질입니다
쓰고있는 침대가 에이스와시몬스여서그런지
이 침대는 매트리스상하가 전체적으로 고정이 안되고 흔들리는 느낌이 있어요
매트리스위에 누웠을때도 같이 누워있는 사람의 손이 움직여도 침대움직임이 심하게 느껴집니다
반품하고싶었는데 비닐캡을 벗기면 반품이 안된다고하니 배송기사분이 포장을 뜯지않도록 해서 포장을 씌운상태에서 누워보고 결정하는게 좋을것같습니다
저는 상품평이 이렇게 좋은 이유를 잘 모르겠습니다",8,False
102336253,1,2020.10.21,1점도 아까움,1점도아까움,2,False
102336253,1,2020.10.19,지방분들 배송비 3만원 듭니다 알고 사시길,"과대광고에 속지 마세요 동급이면 라꾸라꾸 쓴다 개 slqkf끄
7일에 주문했는데 19일에 전화와서 내일배송 한다고 배송비3만원 달라는 배송업체나 배송이 너무늦다고 전화하니 개 whw같이 전화
받으신 아즘마나 상품이 배송비 포함하면 138000원 짜린데 아오
개 빡치네 그렇다고 값어치 하는것두 아니니 속은 기분만 듭니다.",2,False
102336253,1,2020.10.14,매트리스 2개를 샀는데 한개가 지나치게 물러요ㅡㅡ,"매트리스 2개를 샀는데 한개가 지나치게 물러서 발이 폭폭 빠져요
복불복도 아니고 이건뭔가요?",3,False
102336253,1,2020.10.13,배송 사기. 거짓말하는 업체.,"배송 약속 날짜를 두번이나 어김.
전화 온게 없는데 배송문의차 전화했으나 받지않았다며..그래서 배송이 늦어진거라 거짓말을 함.
10/2에 주문한 상품을 10/13에 받음.
배송 최악.
상품은 아직 누워보지 않았음.",1,False
102336253,1,2020.10.05,겉은 멀쩡한대 속은 비어있음,싼가격에 산건데 매트리스 속이 비어있어요 그냥 누워있을수는 있는데 충전재가 없어 단단하지 않아요,2,False
102336253,1,2020.09.20,푹들어가 허리가 아픔 그럴때 뒤집어서 쓰니 훨씬..남,너무너무너무너무 푹푹들어가서 허리가 아파요 초반에 쓸때는 그럭저럭했는데점점점 푹푹들어가 허리랑목이랑 아파요 그래서 뒤집어서 쓰는데 훨씬...낫네요 진짜,1,False
102336253,1,2020.09.20,,"구매한지 9일째

배송은 언제 오려나.. 답답..

빠른 배송을 선호하시거나

당장 필요하다면 진지하게 생각하세요

배송 진짜 답답하네요

판매자 전화해봐야 어차피 똑같은 멘트

물건 판매에 배송 및 사후관리도 같은 범위인데

여기는 메트릭스가 좋은지 어쩐지 오기전에

배송이 너무너무 과하게 느려서 주문취소각입니다

베스트후기들은 다 서울경기 권인지 모르겟는데

배송관련 문의가 대부분인 이유가 다 잇습니다

메트릭스 기다리다 그냥 침대 하나 구매하는게 더 빠르겟네요",2,False
102336253,1,2020.09.20,회사문닫앗나요?받지도않은제품받은걸로나오고문의해도연락없음,,0,False
102336253,1,2020.09.17,,"2년정도 사용했어요...
왠만하면 후기 안남기는데 사용하는 2년동안 잠을 편하게 잔적이 없어요 ... 자고일어나면 허리가 아작날듯이아프고 저랑은 안맞는건지 누우면 엉덩이 부분이 꺼지고..
너무 불편해서 침대사놓고 바닥에서 잔날이 더 많네요 ..
허리가 많이 불편하신 불들 예민하신 분들은 한번 더 고민해보셔야될거같아요.",4,False
102336253,1,2020.09.17,,,0,False
102336253,1,2020.09.16,,배송오지도않았고 연락온것두없는데 배송완료네요 설명좀해보시죠???,0,False
102336253,1,2020.09.15,,"매트리스 배송받기도전에 그냥 환불처리했습니다.
택배기사님의 태도와 언행이 매우 불친절하다고 생각합니다.
통보식 전화와 문자 그리고 내가 원하는 날짜에 배송을 해달라니
많이 불편한 티를 내셨습니다.

구매한뒤 약 10일뒤쯤 전화가왔고 당장 내일간다 배송비는 얼마고 계단비가 발생한다. 길래 당장내일은 힘들것같으니 다음주에 시간 괜찮으시겠냐. 니까 내일못받으면 일정이 어떻게될지모르니 더늦게 배송이될수도있다.... ..?? 구매하고 얼마나기다려야하지 하는생각이 들더군요..

그러면 월요일에 일정잡고 전화주겠다 하시더니 연락없으시고.
밤새일하고와서 자려는데 전화오셔서 오전에간다. 하시더라구요?
그리구 집앞까지만 매트리스놔두고 시공은 안하신다 하시길래 뭔가 기사님마다 후기가 다른느낌이 들었습니다.
도착하시면 일단 전화달라 했지만 역시나 저는 전화를 못받았습니다.

근데 문자가 한통와있더군요. 전화안받으셔서 기다리다 간다. 다음 운임비는 2배 입니다. 라고..
제 잘못입니다. 그래도 이까지오셨으면... 문앞에놔두시지 ...ㅜ

무튼... 저는 13만원 매트리스에 8만원이되는 배송료를 내기 싫어서 환불을했습니다.

가구업체 기사님이 직접배송한다 하니.. 이 글을 읽으신분들은 참고하십시오.

아 물론 환불했을시 3만5천원 기사님께 입금해드렸습니다.",3,False
102336253,1,2020.09.09,,배달 오지도 안았는데. 배송완료라니 ㅜㅜ,3,False
102336253,1,2020.09.09,자도안자서 스프링이 튀어 나왔다 실망해,자도안자서 스프링이 튀어 나왔다 실망해 근데 보기 좋은 것 같해요 다시 교환할게요,2,False
102336253,1,2020.09.08,0,환불 언제 되요,0,False
102336253,1,2020.09.07,,머이딴 곳이다있어 배송기사랑 언쟁이있었고 기사가 시발새끼 그럼 물건다시가져간다라고하며 물건을가져갔기에 고객센터전화하니깐 기사가 화나서 물건가져갔어도 배송비를 내야한다고 환불한다고하면 배송비빼고준다고 말도안되는소리하길래 내가가져가라고한것도아니고 자기기 물건같다놓고 다시가져갔는걸 배송비 35000원 내야한다고 물건다시받기 원하면 배송비 2배로 7만원을내야한다 그러더니 말이되는소릴 해라고 고객센터에 전화하니 모르겠다 알아서해라 그러더니 끊어버림 머이딴말같지도않는곳이다있어,5,False
102336253,1,2020.09.01,팔면 그만인 회사 제품입니다.,"오늘 배송 받아 아직 사용은 못해 봤지만,
복층은 아예 올려 줄 수 없다는 사실을 배송 받으면서 알게 되었네요..
여자 혼자 사는 곳 복층에선 절대 주문하지 마세요.
절대 절대 절대 사지 마세요.
복층은 배송이 안된다고 명시 되어 있지도 않으면서 배송 당일날 와서 안된다고 그냥 던져 놓고 다버리시네요.
여자 혼자 사니 좀 도와 달라는 말에도 무조건 안된다 하시네요.
그렇게 부탁 드렸는데...
고객센터 상담직원분께서도 복층은 배송이 안된다 명시하지 않을걸 인정하면서도 복층까지 배달해드릴 필요는 없는 거라고 말씀하시는데 너무 화가났습니다.
이럴꺼면 배달비용 왜 따로 받나요?!",6,False
102336253,1,2020.08.31,싼 이유가 있음,"딱 가격만큼 합니다
침대의 스프링을 느껴보고 싶으면 사세요
누워서 뒤척일때마다 스프링이 배기고 딱딱함",4,False
102336253,1,2020.08.31,,"다른후기보면 푹신하다는 말이 많던데 ,,이게?ㅋㅋ
바닥에서 자는거랑 똑같음 딱딱 그 자체",2,False
102336253,1,2020.08.29,,배송받지 않았는데 연락도 없고 문의 답글도 없고 화나네요,3,False
102336253,1,2020.08.28,싼게비지떡?,"19일에 주문하고 28일 오늘받았습니다
ㅋㅋㅋㅋ진짜 상품검수라는거는 하고 보내시는지 궁금하네요...
상품평에 이런글 있길래 에이 설마하고 시켰는데ㅋㅋ
이건뭐... 와...
장난하는것도아니고ㅋㅋㅋㅋ 뭐하자는거죠?
배송도 35000원이나 하는데 2층인데 기사님 혼자 못올린다고 사람와야된다하고ㅋㅋㅋ하아ㅋㅋㅋ
뭐 좋은경험했다쳐야하나....",5,False
102336253,1,2020.08.26,,,0,False
102336253,1,2020.08.25,,"이글 보시는 분들이 돈버는겁니다.진짜 사지마세요.특히 디스크있고 앉는게 고통인 분들은 절대 제발 사지마세요.오전에 받고 설치했는데 개비추합니다. 허리 아작나고 싶으시면 사세요.제가 목허리 디스크가 심해서 한달넘게 꼼짝못하고 걷지도 못하고 누워만 지내면서 양말도 못신고 기침살짝만해도 허리칼로 쑤시는 고통을 느낄정도로 아팠다가 병원치료 5년넘게 받아서 일상생활 가능할정도로 많이 좋아졌는데 이거사기전에 매트리스가 많이꺼져서 방바닥에서만 잤어요.오히려 방바닥에 이불깔고 자니 허리가 훨씬좋아져서..허리디스크 심한분들은 알겁니다.푹신한게 얼마나 허리에 안좋은지 눕기만해도 바로 느껴져요.원래있던 침대는 냥이들만 쓰게했는데 2년넘게 쓰니 가장자리가 많이 꺼졌고 침대가꺼지니 냥이들도 가장자리로 점프할때 힘들어하길래 진짜 상품평만보고 이걸로 주문한건데ㅋㅋ사진 보이시나요?손으로 눌렀는데도 저정도 푹푹들어갑니다.발로 밟으면 아예 접힐수준으로 꺼지면서 스프링튕기는소리 나구요.집밖에 버린,몇년써서 꺼져버린 매트리스랑 별차이없어요.심지어 버린 매트리스는 이것처럼 독립스프링도 아니고 더 저렴했고 첨에샀을때 완전 허리도 안아프게 잘받쳐줬어요.제가 허리가 안좋다보니 침대며 어디며 누워만봐도 편한것 쿠션 안좋은걸 바로 느끼는데,이 침대는 누워있어 봤는데도 안좋은게, 허리가 악화될게 확느껴집니다.하드한줄알고 샀는데 이정도로 심하게 푹푹 들어갈줄 모르고 비닐은 괜히 벗겨버려서 전화하니 정상이라고 반품도 안된다네요ㅋㅋ저렇게 손으로만 눌러도 푹푹 들어가고 스프링 튕기는 소리나는게 정상같아 보이시나요 가장자리 부분은 푹푹 들어가서 앉지도 못할정도예요.47키로 여잔데도 이정돈데 몸무게 많이 나가시는 분들은 더 불편할거고 이정도 쿠션가진 침대면 한두달 쓰고 버릴각입니다.글구 배송연락을 무슨 전날 연락주는것도 아니고 아침 8시반에 전화해서 10시쯤온다고 하나요.집에 있었기에 망정이지..매트리스 살때 지금까지 다 안도와줘도 설치해주시고들 갔는데,여긴 나이드신 기사님오셔서 허리아픈데도 설치할때며 비닐벗길때도 제가 도와주고,진짜 이럴거면 배송비는 왜 쳐받는지 모르겠네요.어정쩡한 가격에 배송비포함15만원 가까이 해도 리뷰괜찮은거 보고 샀는데 반품도 안되고 커버가 벗겨지는 형식이 아니어서 도대체 안에 뭔 자재와 스프링이 들어있길래 소리나고 푹푹 꺼지는지 알수도 없습니다.차라리 더 보태서 좋은거살걸..리뷰볼때 별점 낮은순으로 봐야한단얘길 뼈저리게 느끼고 갑니다.제발 베스트 상품평 다 믿지마세요.하..리뷰쓰고 허리 물리치료 받으러 갑니다. 설치한지 17시간 지난후기:저희집 냥이들도 안올라갑니다.두마리다 점프하다가 가장자리에 착지한곳 푹들어가서 삐끗거린후론 안올라갑니다.버린것도 이정도는 아니었는데 냥이들도 안올라가니 미치겠네요..글고 아침낮엔 몰랐는데 가장자리뿐 아니라 사방팔방 다 소리나요.R-2 이제품말고 판매자 다른 상품보면 R-1제품 있는데 그 제품 리뷰에 스마트필터 누르고 별1점 짜리 리뷰들먼저 보세요.같은문제로 저같이 피해보는 소비자가 한두명이 아니네요.스프링이 아무리 달라도 같은회사에서 비슷한 문제가 계속된다면 문제있다고 보는데 정말 이렇게 내구성 저질인 상품은 반품이라도 해주던가 아니 판매안해야 된다고 생각합니다.사진보시면 손으로만 눌렀는데도 푹들어가는데 이런침대는 앉아있을때 허리압력을 더 높여줘서 디스크를 더 악화시킵니다.척추건강에 정말 최악이에요.침대전문가들도 모서리는 꺼짐없이 탄탄해야 된다고 하는데 이런침대는 첨봅니다.리뷰조작을 의심안할수가 없네요.지금보니 베스트 리뷰사진들도 겉모습 찍고 꾸민것만 수두룩하고 매트리스 눌러서 쿠션강도 찍은 사진들은 없는것 같네요.진짜 1480000원줄테니 공짜로 쓰라고해도 안쓸제품입니다.이거 쓰다간 병원비 날리고 몸안좋아지게 생겼어요.",80,False
102336253,1,2020.08.20,,"8월8일에 주문했는데 아직도 배송안됨
13일걸려 배송받았습니다
배송료가 4만원이었으면 처음부터 주문안했을겁니다 개빡치네",2,False
102336253,1,2020.08.19,배송지연은 기본!,"배송지연은 기본!!

배송도 되지 않아서 상품에 대한 후기는 언제 받을지 아직도 모르겠지만 추 후 사용 후 남기도록 하겠습니다.

우선 구매 후 일주일이 지난 현 시점에서도 배송은 되지 않고 문의글을 올려도 답장이 없습니다.

배송비도 몇만원씩 지불해야하는데.. 참 아쉽네요",1,False
102336253,1,2020.08.14,장수돌침대+음식물쓰레기 냄새 최악의 조합,"별 0.00000000000000000000000000000001개도 아까운 내가 살면서 돈 쓴 물건중에 제일 돈 아까운 쓰레기 물건
누가 줘도 절대 안 쓸 거북이등딱지 같은 물건
뭐부터 써야할지 막막하네요
주문 시작부터 물건을 받기까지의 모든 과정이 최악입니다

우선 휴가라서 배송 지연 된 거 이해합니다
그런데 휴가 끝나고 7일이나 지났습니다
기다리는 중에 다른 매트리스를 알아보려고 전화로 배송 문의를 했는데 문자로 연락 준다면서 연락도 며칠 째 안 왔습니다
제가 제 돈 주고 사는데 제가 일일히 전화하면서 제 상품이 잘 오고 있는지 확인해야 하나요? 배송비도 2만원이면서 ㅋㅋ
그리고 나서 문의하기에 환불 요청 하니까 그제서야 전화가 열 몇통이 오면서 바로 보내드리겠다고 하더라고요
일처리가 너무 느리고 직원들 나몰라라하는 태도가 너무 기분 나빴습니다
이건 그렇다 치고 제일 중요한 매트리스 품질에 관련해서 얘기해보자면
장수돌침대를 사도 이거보단 부드러울 거 같네요 ㅋㅋ
바닥에서 자는데 허리 아파서 매트리스를 구매한건데 바닥이 나을 지경이네요
개딱딱하고 제가 올라와도 그냥 평지에 올라온거마냥 매트리스가 미동 하나 없이 그냥 땅입니다
이걸 사실 바에 그냥 바닥에 얇은 이불 깔고 자는 것을 추천합니다
그리고 냄새도 개밥쉰내 납니다 누가 누웠던 거 준 거 같아서 개찝찝해요 ㅋㅋ 진짜 역겨워서 여기서 잠이나 잘 수 있을지 모르겠네요 악의적으로 방구라도 뀌어서 준건지 뭔지 ㅋㅋ
저는 매트리스토퍼 알아보러 갑니다 ㅋㅋ 아 짲응나",4,False
