product_id,ratings,reg_date,article_headline,article_content,help_count,is_photo_review
5026025514,2,2021.04.28,,,0,False
5026025514,3,2021.05.14,,,0,False
5026025514,4,2021.05.26,,,0,False
5026025514,4,2021.05.24,,,0,False
5026025514,4,2021.05.16,,,0,False
5026025514,4,2021.04.12,재구매라 물건은 괜찮아요,도착예정일보다 이틀이나 늦어저서 그게 불인이네요,0,False
5026025514,5,2021.05.30,,,0,False
5026025514,5,2021.05.26,,,0,False
5026025514,5,2021.05.23,푹신푹신 좋아요~,,0,False
5026025514,5,2021.05.23,,엄청편해요ㅋ,0,False
5026025514,5,2021.05.22,수면도감토퍼 매트리스짱!!!,"기존의 사용하던 매트리스가 오래되고 뒤척일때마다
소리가 나서 잠에서 깨고했는데 수면도감 토퍼는 전혀 그러지가 않아서 좋아요~~전기매트도 사용할수 있다고하니까 너무좋네요~잘쓰겠습니다..",0,False
5026025514,5,2021.05.18,,쿠션좋음,0,False
5026025514,5,2021.05.18,,,0,False
5026025514,5,2021.05.17,,,0,False
5026025514,5,2021.05.16,,,0,False
5026025514,5,2021.05.16,,,0,False
5026025514,5,2021.05.16,,,0,False
5026025514,5,2021.05.12,,,0,False
5026025514,5,2021.05.03,부드럽고 좋습니다.,,0,False
5026025514,5,2021.05.02,,,0,False
5026025514,5,2021.05.01,,,0,False
5026025514,5,2021.04.29,푹신푹신해요~~,"처음에 압축된 상태여서 너무 얇다고 생각해서 반품하려고 했는데
하루지나서 부풀더라구요..그래서 사용해봤는데 안깐거보다 낫고
푹신했어요",1,False
5026025514,5,2021.04.26,,,0,False
5026025514,5,2021.04.26,,,0,False
5026025514,5,2021.04.24,,,0,False
5026025514,5,2021.04.21,이것만 기억해,"맨바닥은 11센치
침대는 7센치
끝",0,False
5026025514,5,2021.03.24,,,0,False
5026025514,5,2021.03.19,,요즘 토퍼 종류가 많아서 검색 엄청 해보다가 구매했는데 엄청 편해서 그런지 잠도 잘와요~ 두께도 딱 좋고 색상/크기도 다양하게 나와서 구매하기 넘 편해습니다!! 수면도감 워낙 유명하던데 다 이유가 있엇네용!!,0,False
5026025514,5,2021.03.18,,"아이가 잠잘때 자꾸 굴러다녀 침대에서 바닥으로 내려와서 자고 있어요.
이불만 깔아두니 아이가 자다가도 발로 쿵, 머리도 가끔 쿵 찢기도하구요.
위험해서 매트리스 검색해보다 구입하게 됐는데
적당한 폭신거림과 탄성이 있어 좋네요.
누우면 체형에 맞게 안정적으로 받쳐주고 통기성도 좋아요.
아이와 같이 사용하는데 라돈 걱정도 없고
아이도 잠을 잘 자더라구요. 수면질이 좋아짐이 느껴지더라구요.
구입 잘했어요~",2,False
5026025514,5,2021.03.17,,"집에 어른들 놀러 오실때.. 마땅히 깔고 잘 게 없어서 알아보다가 주문했어요
토퍼가 엄청 폭신하고 두께감도 있어서, 오히려 침대에서 자는것보다
훨씬 더 편안하다고 하시네요 ^^ㅎ 넘 잘 산 것 같아요.
어른 한 명 누우니 충분. 아이들은 둘셋도 눕겠어요",0,False
5026025514,5,2021.03.17,,개인적으로 너무 푹신하면 더 잠을 못자는 타입인데 이건 탄탄히 잡아주고 안정적이어서 좋아요 돌기패턴이 정말 신기하게 체압을 분산시켜 잘 받쳐주네요~커버도 내구성이 뛰어나고 물세탁 가능하니 문제없고 밑에 미끄럼방지있어서 쉽게 안밀려요 침대 없애고 데크 깔고 이 매트리스 하나 더 들일까 생각중입니다 !,2,False
5026025514,5,2021.03.17,,"침대에 토퍼대용으로 사용하려고 구매했어요
커버세탁해서 어제 바로 사용해봤는데 쿠션감도
괜찮고 자고일어났을때 뻐근함도 덜 하더라구요
하루 사용했지만 가격대비 만족스럽네요
어르신들 선물로도 좋을거같아요",0,False
5026025514,5,2021.03.15,좋아요,"마약 매트리스 아닙니까?ㅋㅋ
너무 잠이 솔솔오고 편안하네요
허리도 안아프고..
계속 누워잇고싶어지네요ㅎ
저렴한가격에잘산것같아서기분도좋고
제품도좋아서기분이좋아요
많이파세요",0,False
5026025514,5,2021.03.15,,이사하면서 오래된 매트리스를 없앴어요 침대생활하다가 바닥에서 자니 힘들더라구요 지인이 토퍼 사용해보라고 해서 구매했어요 잠자리가 편하니 숙면에 취할수 있어서 좋아요 스트랩도 같이 와서 보관하기도 편해서 원룸에 사용하기 좋아요,2,False
5026025514,5,2021.03.15,,"쿠션감이 좋아서 누웠을 때 편합니다.
등이나 허리가 편안해서 좋습니다.
수면의 질이 상승했습니다.
잠도 잘 들고 일어났을 때 피곤함이 없어서 마음에 듭니다.
마감도 깔끔하고 견고해서 만족합니다.
사이즈도 딱 맞습니다.
배송도 빨라서 좋습니다.",0,False
5026025514,5,2021.03.15,,침대매트리스가 넘 높아서 정리하고 구매했습니다. 딱 누우면 몸에 싹 감기는 느낌이 넘 좋네요 . 확실히 수면질이 높아진 기분입니다. 요 며칠동안 정말 꿀잠잤어요 ㅋㅋ 가격도 적당하고 커버도 빨수있어서 좋습니다.,0,False
5026025514,5,2021.03.14,,"남편이 갑작스럽게 다른 지방 발령났어요.
숙소들어가는데 매트없어서 부랴부랴 샀네요.
숙소로 보내놨는데 매트 두께도 괜찮고, 사이즈도 괜찮데요.
적응한다고 또 힘들어하는데 매트에서 편히 잤음 좋겠네요.",0,False
5026025514,5,2021.03.13,,이제는 아이들도 꽤 커서 딱딱한 바닥보다는 매트리스에서 자게 해주면 좋을것 같아서 침대도 알아봤었는데 침대도 험하게 굴러다니는 아이들이 떨어질까봐 불안하더라구요. 그러다가 발견한 매트리스... 이왕 쓰는 매트리스 좋은걸로 사서 아이들 쓰게 하자 했는데 통기성도 좋고 저도 한번 누워봤는데 편안해서 잠이 솔솔 오더라구요! 하나 더 사서 침대위에 깔아놓고 저희 부부도 쓸까 싶어요.,1,False
5026025514,5,2021.03.12,,"예전 쓰던 매트리스는 좀 불편하고 뻐근한게 허리도 아파서 이번에 새로 찾다가 주문했는데
토퍼라는 자체가 이렇게 편하게 잘수 있어서 맘에 드네요 자리 옮기거나 변경할때도 가벼워서 편리해요",0,False
5026025514,5,2021.03.12,,"너무 폭신한것도 아니고 정말 몸에 딱 맞는
탄탄함과 푹신함! 그래서 누웠을때 정말 편해요
그리고 사용후 돌돌 말아서 세워두면 공간도 효율적이어서 좋네요
자고 일어나도 찌푸둥하거나 그런느낌없이 개운한 느낌!
덕분에 잠도 잘 자서 컨디션도 좋아져서 좋아요~",0,False
5026025514,5,2021.03.11,,오래된 침대를 버리고 바닥에서 지내보려고 토퍼를 구매했는데 어쩜 완전 꿀잠 잤네요 ㅎ 세상에 어쩜 이리 편하죠 ㅎ두께도 딱이고 몸에 딱 맞춘듯한 편안함입니다 ㅎㅎ 너무 잘산거같아용 잘쓸게요,0,False
5026025514,5,2021.03.07,,"빠르게 배송 왔구요~
멀티 스트랩이 있어서 보관이 편해서 좋아요.
누웠을 때 너무 딱딱하지도 너무 부드럽지도 않고 딱 좋은 것 같아요. 그래서 편안하구 잠 잘와서 좋아요 만족해요",1,False
5026025514,5,2021.03.07,,침대 메트리스가 고장이 나서 새로 바꾸려고 고민하다가 우선 토퍼 사용해보기로해서 주문했는데 이거 완전 적당히 폭신하고 꿀잠와서 넘 좋아요 자리도 많이 차지하지 않아서 방을 더 넓게 쓸수 있어서 만족스러워요,2,False
5026025514,5,2021.03.07,너무 편안해요~,"오~ 아주 탄탄하네요. 누웠을때 너무 부드럽고 편안해서 잠도 잘오고 아침에 일어날때 뻐근하지 않아서 너무 맘에 들어요.
적당히 도톰하고 짱짱하면서 누웠을때 허리를 착 감싸주는게 제일 좋은것 같아요. 착한 가격에 완전 잘 구입한것 같네요. 만족합니다~",2,False
5026025514,5,2021.03.07,,토퍼매트리스 배송 잘받았어요! 이번에 독립하면서 자취방에 살림들 구매중입니다. 침대를 놓을까하다가 공간도 협소한편이라 토퍼매트리스로 구매햇는데 푹신하니 누웠을때 너무 기분이 좋네요 또 돌돌말아서 세워두면 공간차지도 안되고 만족스럽습니다.,1,False
5026025514,5,2021.03.06,,"침대 매트리스 위에 깔았는데 편하게 잘 사용하고 있어요
쿠션이 탄력있고 복원력이 좋아요 허리가 안좋아서 자면서도 여러번 뒤척이는데 토퍼 깐후로 훨씬 낫네요~
뒷면에 미끄럼방지 처리도 되어있어서 밀림도 없어요
가격대비 내구성, 퀄리티가 괜찮아요~",0,False
5026025514,5,2021.03.04,,"바닥에서 자려니 베기고 침대를 사려니 방이 좁고 ㅠㅠ
그래서 고민하다가 구매했는데 정말 딱이네요 ㅎㅎ
두가지 고민거리를 완벽 클리어!너무 마음에 들어요^^푹신푹신해서 잠이 절로 오는거 같네요 ㅎㅎ 진짜 짱 마음에 듬요^^
동생도 자취하는데 하나 사서 보내줘야겠어요!가격대비 퀄리티 굿~!",0,False
5026025514,5,2021.03.04,,"기존에 사용하던 매트리스가 많이 꺼져서 새로 알아보고 있었는데 , 여기 제품이 허리건강에도 좋다고 해서 구매하게됐습니다, 여러 돌기가 효과적으로 체중을 분산시켜줘서 굉장히 편안하게 느껴지더라구요, 수면의 질이 달라진것을 느낍니다, 잘 구매한것 같아요",3,False
5026025514,5,2021.03.04,,가볍게 사용 할 매트리스를 원했는데 11cm는 너무 두꺼운 것 같아서 7cm로 했는데 마음에 드네요. 나중에 옮기거나 보관할 때를 생각해도 7cm가 나은 것 같아요. 매트리스도 편하고 좋아요.,0,False
5026025514,5,2021.03.03,,"자취하면서 침대 놓기에는 마땅하게 놓을 공간이 없고 좁아서 토퍼를 주문하였습니다~!!!
침대처럼 푹신푹신해서 잠자기 편안하고 공간 활용도 높아져서 매우 만족합니다!!! 배송도 빠르게 와서 좋았어요~~~",0,False
5026025514,5,2021.03.02,,"스펀지 요 깔고 자다 보니 아침에 일어나면 허리가 아프더라구요 푹신하면서 복원력도 좋으네요 너무 편안하게 잘 잤어요
안쓸때 보관도 용이하네요
통기성이 좋아 세균 번식 걱정 없어 매우 만족합니다",2,False
5026025514,5,2021.03.02,,"매트리스 두께감 좋고 쿠션감도 너무 편안해요

기존에 쓰던 매트리스가 오래되서 허리도 아프고 불편했는데
너푸 편해서 매일 꿀잠자고 있어요

보관하기도 편리하고 가격 대비 너무 맘에 들어요",1,False
5026025514,5,2021.03.02,편하고 보관하기 좋아요~,"잠자리가 편한하고 숙면을 취할수 있어서 좋네요~
기존 침대 메트리스 딱딱해서 부드러운 이불을 여러개 깔고 누워야했는데 몸에 굴곡에 따라 부드럽게 감싸서 아주 좋아요. 잘 선택한것같아요. 안 쓸때는 돌돌 말아 보관할수 있어서 좋네요",0,False
5026025514,5,2021.03.01,꿀잠,"침대 없애소 두꺼운 매트리스로만 자보려고 구매했는데
완전 만족스러워요
침대 없으니까 공간활용도도 높아지고 겨울에도 보일러기운 느끼며 잘 수 있어서 좋네요^^
가성비도 좋고 허리도 안아파서 잘 산거 같아 뿌듯해요 ㅎㅎ",0,False
5026025514,5,2021.03.01,,토퍼만 바꿔도 수면의 질이 달라진다고 해서 구매했습니다!! 생각보다 유용하네요~ㅎㅎ 확실히 잠도 더 잘오고 포근한 느낌?? 편한게 평소에는 침대위에서 사용하다가 손님오면 내려주고 하니 너무 유용해요~~,1,False
5026025514,5,2021.02.25,,"침대가 오래되어 버리고 방바닥에 얇은 이불 깔고 잤었는데 자고 일어나면 허리가 너무 아파
매트리스 구매했습니다. 푹신푹신하니 잠도 잘오고 너무 만족합니다. 자고 일어나도 허리가 아프지 않고
개운한게 너무 좋아요. 배송도 빠르게 잘왔습니다.",0,False
5026025514,5,2021.02.25,,"아무래도 침대는 낙상 위험이 있어서 할머니가 사용하시기 힘드실거 같아서 찾아보다가 주문했어요.
확실히 누웠을때 포근하고 허리도 편해서 너무 좋아하시네요 ^^
내구성이 좋아서 오래 사용할거 같아요~ 빠른 배송 감사합니다 ^^",1,False
