product_id,ratings,reg_date,article_headline,article_content,help_count,is_photo_review
1312606887,2,2021.04.14,흠이 있네요,"크기나 그런건 좋은데 찍혀서 왔어요
꺼내보니 테이블 위쪽에 찍혀있길래 박스도 봤더니
박스도 그부분이 찢어져있네요
교환 하려니 재고가 없고..
고민이예요",0,False
1312606887,4,2021.02.09,,"책상겸 화장대하려고요
좁은집이라서 공간 안차지하는거로 샀어요
가격대가 다 비스무리한데 배송이 빨랐어요
배송비가 별도로 없는거도 괜찮았고요",0,False
1312606887,5,2021.02.21,,예뻐요. 개인책상으로 쓰고 있습니다.,0,False
1312606887,5,2021.01.03,,"기대이상 나무질이 너무 좋아요
완전 강추합니다",1,False
1312606887,5,2020.10.22,,"필요한 사이즈 찾다가 평이 좋아서 주문했는데 정말 만족합니다.
가격대에 비해 튼튼하고 액자 올려놓을려고 샀는데
나중에 화장대로 사용해도 되겠더라구요~~
만족합니다^^",1,False
