product_id,ratings,reg_date,article_headline,article_content,help_count,is_photo_review
1380634453,1,2020.07.09,,"이거 진짜 사지마세요ㅋㅋ
진짜 조립하는것도 겁나 어렵고 그냥 쌩돈만 날렸네요",7,False
1380634453,1,2020.07.06,다시는 사지않겠습니다,"아니 이건 화장대를 쓰라는건지 화장품만 놓고 쓰라는건지
나사를똑바로 제대로 하면 거울에 제목이 짤린체로
몸통만 보입니다.. 이런물건을 팔다니
진짜 쿠팡산거중에 최악이네요
나사도 그냥 드라이버로안되서 전동드릴빌려가며
오래걸려서 조립햇는데 ㅋㅋ 진짜
이거 조립전에 알았으면 반품인데
화장대 다시 사야겟네여 정말 최악상품이고
판매자님 양심좀 있으세요
뚜껑 조차도 열고닫기 불편해요",4,False
1380634453,1,2020.07.01,쿠팡에서 사놓고 빨리 망가지길 바라는 건 처음,"일단 높이가 낮은데다 거울의 각도가 기본 수직으로밖에 되지 않아서, 고의적으로 불안정하게 나사를 풀어줘야 얼굴이 제대로 보이는 형태입니다.

또한 다리가 상판에 비해 너무 가벼워서 상단을 열 때마다 덜컹거리면서 화장대 전체가 조금씩 움직이게 됩니다. 그래서 열었다 닫았다를 몇 번만 하면 제가 잡아둔 위치보다 뒤로 가게 되네요.

상판을 열기도 불편해서 오늘 다이소에 가서 상판 여는 부분에 손잡이라도 달 생각입니다... 전체적으로 사용하기 너무 불편함이 많네요. 비슷한 가격의 다른 제품 사시길. 저 또한 고장나서 바꾸기만을 기대하며 이번 전셋집에서 2년 쓰렵니다.",7,False
1380634453,5,2020.06.29,,,0,False
1380634453,5,2020.06.07,아주깔끔하고 거울도 크고 예쁘요,,0,False
