product_id,ratings,reg_date,article_headline,article_content,help_count,is_photo_review
1822654442,2,2021.05.08,심하다 싶을 정도의 품질,"이 제품 품질의 악명(?)은 다른 사이트에서 이미 봐서 일부러 중국 직배송이 아니라 국내에서 배송하는 업체 찾았던 건데, 국내 배송임에도 판매자가 상품 검수는 아예 안 하시는 듯 하네요. 보시다시피 '요새도 이런 제품을 파나?' 싶을 정도의 품질입니다.
여튼... 무게가 나가기도 하고 반품하기도 귀찮아서 그냥 쓰기로 했고, 첫 사진처럼 제 방에 두고자 했던 건데 결국 아들 방으로 보냈습니다. ""미안하다 아들아!""
제대로 된 거 다시 찾아봐야겠네요.",0,False
1822654442,3,2021.04.20,,,0,False
1822654442,5,2021.05.30,,,0,False
1822654442,5,2021.04.30,,덕분에 베란다에 멋진 카페가 생겼어요,0,False
1822654442,5,2021.03.15,깔끔하고 튼튼합니다 조립도쉽고요,,0,False
1822654442,5,2020.12.10,튼튼해요..,배송도 빠르고 포장상태도 아주 꼼꼼하게 해주셔서 먼저 감사드려요..그리고 무엇보다 조립하는데 여자가 하기에도 무난해서 좋았고 튼튼하고 이뻐요...,2,False
