product_id,ratings,reg_date,article_headline,article_content,help_count,is_photo_review
86711618,1,2021.04.21,,,0,False
86711618,1,2019.06.25,이렇게 수평 마감인 상품을 배송한다는게...,"먼저 사진을 보시고 구매후기 남깁니다.수평.마감불량..제로..

그리고 무엇보다 아니한건 고객님 바닥 수평 사진 찍어서 같이 보내

달라고 하니...사실 어이가 없네요~

마감불량 이거 한껀으로도 반품 사유가 되는데...,그리고 배송비2만원

드렸어요~그런데 물건이 이렇게 나온다는건 좀 아닌듯 싶어서 ...

글 남깁니다.구매자분들 반품 기준은 1~2주 걸린다고 합니다.

지역마다 틀리니깐 참고 하시길 바랍니다.

2019.07.20일 아직 환불 못받앗네요.한달 다되갑니다.",8,False
86711618,1,2018.08.02,,"일단 배송기간 엄청 오래 걸리네요. 최소 한달 이상입니다.
그것도 전화만 세번 이상했네요
제품 퀄리티는 딱 그 가격 값하는거 같아요.",4,False
86711618,3,2018.11.15,상품은 괜찮 배송은 느림보,배송이 너무너무 느린거 말고는 괜찮습니다,1,False
86711618,5,2020.09.12,,,0,False
86711618,5,2019.01.08,,배송기간 빼고 다좋습니다,1,False
86711618,5,2018.12.24,,,0,False
86711618,5,2018.06.20,,"낮은 프레임을 찾다가 그레이색상을 협탁과 함께 구매했어요
일단 가격이 너무 좋습니다
튼튼하구요
색상이 무거운 그레이라 흰색,네이비,그레이 침대시트를 사용할분들께 추천합니다",1,False
