product_id,ratings,reg_date,article_headline,article_content,help_count,is_photo_review
246279088,4,2021.04.07,화면보다는 별로입니다,"실제 받아보니 화면과 다리 좀 부실해보어요.
디자인과 색깔은 같은데 소재가 플라스틱이라 좀 저렴해보입니다.",0,False
246279088,4,2020.09.14,무난함 이 가격에 또 사라면 망설여짐,"조립하는데 어렵지 않지만 설명이 더 자세히 되어 있다면 편리할것 같습니다
사진보고 유추해서 조립했습니다
핀이라고 해야하나 대체로 잘 끼어지는데 두 개정도가 잘 안 들어가서 끼는데 불편했습니다
완벽히 안 들어가고 조금 튀어 나왔습니다
디자인이나 종합적으로 나쁘지 않지만 이 가격에 또 사라면 글쎄 망설여지네요",2,False
246279088,5,2020.01.14,,,0,False
246279088,5,2019.11.09,,,0,False
246279088,5,2019.10.18,,,0,False
