product_id,ratings,reg_date,article_headline,article_content,help_count,is_photo_review
5059533061,5,2021.05.07,,,0,False
5059533061,5,2021.04.14,좋네요~,"뜯었을때 냄새도 안나고 푹신하고 좋네요.
단점은 너무 좋은 나머지 저희 애기한테 뺐김 ㅠ 올라가서 안내려오네요....",2,False
5059533061,5,2021.04.04,,"자취해서 혼자만 살아서 쇼파를 놓기에는 부담스러워서 빈백 샀어요
이게 제가 편하게 쉬고 싶은 자세로 사용할 수 있어서 엄청 좋네용
자리 차지도 많이 하지 않아서 공간활용도 좋고 색감도 제가 딱 원하던 거라서 더 마음에 들어요
티비 볼때 꼭 여기서만 보게 되네요 ㅎㅎ 요즘 제 최애템 !
한 번 앉으면 일어날 수가 없어요 왜 마약빈백이라는지 알 것 같아용 잘쓰겠습니다잉!",1,False
5059533061,5,2021.03.25,,"부담없이 앉고 기대기 딱 좋네요^^
자취중인데 요런거 하나 들이고 싶었는데
딱 맘에 드는게 눈에 띄어서 바로 구매했더니
실물이 훨씬더 깔끔하고 맘에드네요
색깔도 방분위기랑 너무 잘 어울리구요 ㅎ
무게가 무겁지않아서 차에 싣고 다니면서
캠핑이나 글램핑할때도 참 유용하게 잘쓰일뜻
불멍때릴때 아주 굿일듯용 ㅎㅎ",1,False
