product_id,ratings,reg_date,article_headline,article_content,help_count,is_photo_review
1744427456,1,2021.05.22,얼마나 부실하면 이틀만에 부러짐,이틀만에 아래 부러졌어요,0,False
1744427456,1,2021.05.18,180cm / 80kg 성인 남성 입니다 ^_^,"2개 사용하려고 2개 샀습니다

첫날 하나 둘째날 하나,

합의 2개 몇분 앉아보지도 못하고 부러졌습니다

초등학교때 학교 앞에서 정성들여 만든

저의 달고나가 더 튼튼할 것 같습니다..

의자 위에서 탭댄스라도 췄으면

이해합니다.. 그냥 정자세로 앉았는데도

이게 말이 되나요..

쿠팡에서 많이 구매하지만 원래 리뷰나 후기를 잘 안씁니다

근데 이건 써야할것 같아요.....

지금 이 글을 작성하면서도 폐품스티커까지 사다가 붙혀서 버려야 할 것 같아서 이 돈으로 효도나 할껄 후회가 막심합니다

역시 부모든 고객이든 있을때 잘해야하나 봅니다..

별 하나 주는 것도 불안하네요
별 하나에도 부숴질까봐....

살면서 이런 리뷰, 아니 글 자체를 처음 써봅니다..

아.. 참고로...

가끔 인테리어 겸용으로 의자에 화분 올려두시는 분들도 계시는데 이건 다육이도 못버틸것 같습니다",1,False
1744427456,1,2021.05.11,너무함,이건뭐 유아용도 아니고 너무한거 아님니까? 제몸무게65키로인데 이틀만에 작살남 첫날부터 불안하더니 폭삭주져안네요 제발 이런제품 팔지 말아주세요,1,False
1744427456,1,2021.05.10,사지마세요 정말 약해요,"잘 부러진다는 후기가 있어서 고민하다가 에이 설마 부러지겠어~ 하고 구매했는데 정말 구매하고 하루만에 부러져버리네요...
돈 버리고 성질 버리고 재수없으면 몸까지 버리고싶은거 아니시면 절대 안사는걸 추천드립니다",0,False
1744427456,1,2021.05.03,,의자가 굉장히 빈약하네요. 평 보고 설마 부셔지겠어 하고 샀는데 평범한 남자가 앉는데 두번이나 부셔졌습니다..안전을 고려 하셔야 할 것 같네요.,0,False
1744427456,1,2020.11.29,사지말것,이거 절대 사지 마세요. 하나사고 괜찮겠다 싶어서 한 일주일 뒤엔가 하나 더 샀는데 두번째 산게 한 2주도 안되서 부서져서 환불했구요. 처음 산 애도 그때 그냥 환불했어야 했는데 괜찮겠지하고 쓰다가 결국 두달도 안되어 부서져서 환불도 못하고 버렸네요.,1,False
1744427456,1,2020.10.27,,,0,False
1744427456,1,2020.09.26,무게중심이 측면으로 가지 않도록 정자세로 사용하세요,며칠 썼는데 의자가 무너졌습니다,4,False
1744427456,2,2020.12.16,쿠션이 삐뚤어져있고 앉을때 불안정해요.,"쿠팡체험단 체험기입니다.
물건 고를때 보통 쿠폰이 하나나 둘쯤 남아있으면
신청을 해도 잔여 쿠폰이 없거나 품절이라고 뜨는데..

이 제품은 쿠폰이 하나 남았음에도 체험 신청이 되더라구요.

저는 키가 작아서 찬장이든 어디든 손을 뻗칠때
보조의자가 꼭 필요한 사람입니다.
그간에는 대형마트에서 하나 사서 쓰고 있었는데
십년이 넘어가니..
윗부분의 인조가죽 부분이 찢어지기도 하고
더러워져서 이번 기회에 신청해보았죠.

일단 베이지 색은 은은하고 예뻐요.
그런데..
윗의 쿠션이 삐뚤게 놔진것 같고..
베이지색 커버가 삐뚤게 씌워졌어요
그래서 네모 쿠션 모양이 찌그러져 보이구요
한쪽 모퉁이 쿠션이 다른 쪽 보다 얇아요.

전 정말 아무꺼나 까다롭지 않고 잘 먹고
왠만하면 그냥 쓰는 사람인데..
이건...체험단으로 받은 물건이나
넘 맘에 들지 않아요.
돈주고 샀으면 완전 환불각..ㅜㅜ

게다가 다리 벌어지는 각도가 작아서
앉았을때 안정적이지 않아요.
마루 바닥에서 미끌어지기도 하고...

결론은...
내돈 주고는 절대 안산다..입니다.
잔여쿠폰이 하나 남았는데
신청이 된 이유를 알았네요. 힝~

쿠팡체험단 이벤트로 상품을 무료로 제공 받아 작성한 구매 후기입니다.",3,False
1744427456,3,2021.05.11,금방 부셔지네요 ㅜ,,0,False
1744427456,3,2021.04.11,디자인은 예쁜 편인데 다리부분이랑 전체적으로 좀 약한것,,0,False
1744427456,3,2021.01.01,,"뭔가 사용한 듯한 느낌이 드네요~ 펼칠 때 저렇게 되어있으며 앉으려고하니 조금 흔들리네요ㅠㅠ

아쉬움이 많아요ㅠㅠ 돈 주고 사라고 하면 돈아까울것 같아요 그래도 가볍게 쓰기엔 좋네요~

쿠팡 체험단으로 선정되어 사용 후 작성했습니다

쿠팡체험단 이벤트로 상품을 무료로 제공 받아 작성한 구매 후기입니다.",0,False
1744427456,3,2020.09.29,싼맛에...,"뭔가 박스 자체도 반품한거 다시 받은것 같았구요 ㅋ
기냥 세워놓고 보면 다리가 안맞아서 흔들려요
그리고 이 패브릭 마감이 정말 대충 씌워놓은 느낌
딱 맞는 패브릭 입힌게 아니라...
그리고 앉는부분도 손가락 마디만큼 패였어요.
저는 사실 책상에서 일할때 다리 올리고싶어서 산거라
그냥 쓰지만 외관이나 전체적인 마감 중요하게
생각하시는 분은 비추해요~",1,False
1744427456,4,2021.03.09,,예쁘고 쓰기 편한데 튼튼한건지는 사용해봐야 할듯,1,False
1744427456,4,2021.01.05,,"쿠팡체험단에 채택되어 사용하게 됬어요
저는 너무 기대하던상품이라 계속 배송만 기다렸어요 ..ㅎㅎ
아일랜드식탁에 앉아서 뭘 하고싶은데 마땅한 의자를 못찾아서 이번 기회에 주문 해봤는데 사용하기 좋은거 같아요
색도 딸기우유색? 이라 촌스럽지 않아요
사용안할때는 접어서 넣어두면되서 공간차지도 안하고
괜찮네요 ~ !! 근데 미끄럼방지가 ? 잘 안되는거 같아요
그것만 빼면 좋습니다

쿠팡체험단 이벤트로 상품을 무료로 제공 받아 작성한 구매 후기입니다.",0,False
1744427456,4,2020.12.30,쓸만합니다.,"일단은 예뻐요.
쿠션부분이 핑크베이지이고 다리는 흰색이라 깨끗하고
어디에둬도 따로놀지 않을것같아요.
화면에서 보이는것처럼 베이지는 아니고 핑크빛이 많이 돌아요. 페브릭이고 세탁할수없어서 회색으로 할껄 잠시 후회했지만 그래도 밝은색이 더 이쁘긴한것같아요.

높이는 우리집 식탁의자보다 조금 높네요.
손님왔을때 보조의자로 쓰면 딱 좋을것같아요.
흰색의자 사이에 두니 더 예쁘네요~

접었다폈다 하기는 쉬워요.
펼땐 그냥 펴면되고 접을땐 쿠션아래 동그란 고리를 잡아당기면 걸림장치가 풀리고 그상태로 접어주면 돼요.
의자를 편상태에서 이동할때 의자가 접히면 불편하니까
그런점에선 이런 걸림잠치가 있는게 좋네요.

저렴한 가격만큼 고급스러보이진 않아요.
잠깐잠깐 보조의자로 사용할것이기때문에
사실 비싼건 필요없긴해요~

앉았을때는 흔들리거나 불안하진 않아요.
그런데 그닥 튼튼해보이지도 않아서 몸무게가 많이 나가거나 디딤대로 사용하긴 좀 불안할것같네요.

리뷰를 둘러봤더니 며칠 사용하고 파손됐다는분이 있던데 어떤 부분인지 알겠네요.
용접부위가 허접해보이긴합니다.
안전을 생각해서 조금 더 튼튼하게 만들어야할
필요가 있다고생각합니다.
그래서 별 하나 뺐어요.
이게 최선이었을까요?
안전과 연관되어 있으니 더 아쉽게 느껴집니다.
이 부분만 보완된다면 정말 좋겠네요^^

쿠팡체험단 이벤트로 상품을 무료로 제공 받아 작성한 구매 후기입니다.",0,False
1744427456,4,2020.09.04,,,0,False
1744427456,5,2021.05.09,,,0,False
1744427456,5,2021.04.20,,,0,False
1744427456,5,2021.03.24,,가격대비 튼튼 만족쓰 굿,0,False
1744427456,5,2021.03.07,,,0,False
1744427456,5,2021.02.27,,예뻐요~근데 생각보다 높아요,0,False
1744427456,5,2021.02.22,,"예쁘긴한데 ㅋㅋ 잘 안쓰게 되요 ㅋㅋ
약간 불편한 감도 있어요 ㅋ
급하게 필요해서 산거라 놀러다닐 때 써야겟어요",0,False
1744427456,5,2021.01.22,튼튼하고 어디에 놓아도 어울리는 디자인이에요^^~,,0,False
1744427456,5,2021.01.07,,"-배송
역시 믿고 사용할 수 있는 쿠팡 배송입니다
하루만에 도착하고 상품 문제 없이 도착했네요

-디자인
심플한 화이트에 베이지 색상이여어 어느 장소에
놓아도 잘 어울려요
고정핀으로 되어있어서 고정핀을 빼면
보관할때 부피도 차지하지 않고
고정핀을 고정해놓으면 풀리지 않아서
잘 사용할 수 있습니다

-쿠션 느낌
너무 딱딱하지 않고 너무 푹신하지 않아요
작은 의자여서 너무 푹신했으면 오히려 불편했을거 같은데
적당해서 사용감이 더 좋네요

전체적으로 색상이나 디자인이나 심플하고
마감 처리도 잘 되어서 와서 만족하며 사용중입니다~

쿠팡체험단 이벤트로 상품을 무료로 제공 받아 작성한 구매 후기입니다.",1,False
1744427456,5,2020.12.30,,"이건 제 동료가 체험단 떴을 때 잘못 눌러서
배송빋았어요 ㅋㅋ
자취하고 있구요 ㅎㅎ 사실 제가 필요로했던 물건이
아니였네요

후기 보니 튼튼하지 않다는 후기가 많았는데요
저는 괜찮던데요?

아이들이 쓰기엔 높구요
여자가 앉기에도 약간 높은감이 있어요
전 앉아서 복근 운동 하려구요 ^^

인테리어용도로 딱인것 같아요 화분을 올려 놓으셔도 되구요
캔들을 올리셔도 될 것 같아요

쿠팡체험단 이벤트로 상품을 무료로 제공 받아 작성한 구매 후기입니다.",0,False
1744427456,5,2020.12.21,,"서있을 때 기준으로는 무릎보다 10센치 정도 올라오는 크기네요~^^
식사할때 앉는 의자로도 괜찮고요 쿠션감은 힘있게 받쳐줘서 엉덩이가 아프지 않아요~~^^ 엉덩이 닿는 의자면적 크기는 가로 30센치 세로 30센치 정사각인데 깊숙하게 뒤로 빼지않는 한 불편함 없어요~~
엉덩이가 많이 크신 분들에게는 조금 작게 느껴질 수 있을거 같아 사전에 사이즈 체크 하시는게 좋을거 같아요~^^ 의자를 다시 접을때에 그냥 접히는 줄 알았는데 한 쪽 면에 후크같이 걸린게 있어서 그것을 당겨준 후에 밀듯이 접으면 다시 접히네요~^^
색상이 베이비핑크에 아이보리톤 다리색이라 산뜻하고 사랑스러운 예쁜 색이라 좋아요~~^^ 등받이가 없어서 자꾸 바른 자세로 허리 힘줘서 앉게되어 자세교정도 하게 되는거 같아요~~^^

쿠팡체험단 이벤트로 상품을 무료로 제공 받아 작성한 구매 후기입니다.",6,False
1744427456,5,2020.12.17,■ 귀엽고 예쁩니다,"일반적인 식탁의자보다 5센티정도 높습니다
아일랜드식탁에선 편하게 맞을것 같습니다
일자로 세워 보관할 수 있어 보관은 쉽습니다

상판이 페브릭재질이라 뭐라도 흘리면 낭패겠어요
아예 처음부터 커버를 씌우고 사용하면 좋을거
같네요 색상은 전체적으로 곱고 예쁩니다

씽크대 상부장에 뭐 꺼내려고 밟고 올라가는건
위험할것 같습니다 의자가 높고 다리가 견고하지
않아 자칫 넘어지면 큰일입니다

딸애방에 친구가 놀러오면 옆에 앉으려고 식탁의자
들고 들어가던데 이 의자 넣어주면 될듯 싶네요
가벼워서 어디든 이동이 쉽다는게 장점입니다

이런 종류의 의자는 마트에 가면 종류별로 많이 있습
니다 등받이 있는것도 있고요 그러나 이 가격에
요렇게 예쁜건 찾기 힘들거든요

저는 흰색으로 예쁘게 커버를 만들어주고 싶네요
다행히 전 이런 깨끗한 색상을 좋아해서.....
예쁘게 사용하겠습니다

쿠팡체험단 이벤트로 상품을 무료로 제공 받아 작성한 구매 후기입니다.",0,False
1744427456,5,2020.12.17,,"우선, 후기를 봤을 때 부실하다는 소리가 너무 많아
걱정이 많았습니다.

받아보고나니 생각보다 심플하고 색상도
개인적으로 좋아하는 파스텔 톤이구요.

사진보시면 아시겠지만 근처 포장마차만 가도
저런 유형의 접이식 철제 의자가 많은데요,

접이식이라 정리성에서 1차, 앉아보니 생각보다
튼튼해서 2차 맘에 들었습니다.

쿠션은 가격이 비싼 제품이 아니다보니 큰 쿠션감은 기대 없었는데
앉아보니 적당히 앉을만 하네요.

높이도 제가 생각한 화장대 높이에 딱 맞아서 좋아요.

가성비 제품으로 추천합니다.

---------------------------------------

[2주차 사용기]
매일매일 아침, 저녁으로 사용중입니다.

삐걱거림 하나 없고 튼튼하게 잘 쓰고 있습니다.

쿠팡체험단 이벤트로 상품을 무료로 제공 받아 작성한 구매 후기입니다.",1,False
1744427456,5,2020.12.16,가성비 좋고 이뻐요~,"방금 받자마자 언박싱했는데..
이쁘고 가성비도 좋아요.
이정도 퀄리티라면 족히 이만넌은 넘을것 같구요
저희집처럼 좁은공간에 딱입니다.
간혹 친구들이 놀러왔을때 의자가 없어서 곤란했는데
이 제품은 공간도 많이 차지 안하고 불필요시 접어서
어디 구석에 세워놓아도 되니깐 넘 마음에 듭니다.
감사합니다.잘 사용하겠습니다

쿠팡체험단 이벤트로 상품을 무료로 제공 받아 작성한 구매 후기입니다.",0,False
1744427456,5,2020.11.16,,,0,False
1744427456,5,2020.11.16,,,0,False
1744427456,5,2020.10.08,,,0,False
1744427456,5,2020.09.05,,가볍고 깔끔하고 편해요!!,0,False
1744427456,5,2020.07.30,높이가 적당하고 간편해요,"화장대 의자가 부러져서 급하게 로켓배송으로 구매해봤어요~
근데 배송온거 보니까 너무 맘에 들어요! 베이지 색깔로 골랐는데 약간 핑크느낌도 나서 더 이뻐요ㅜㅜ 다리색깔도 은은해서 방이랑 잘 어울리구 뭣보다 높거나 낮으면 어쩌나 했는데 높이도 딱좋아요ㅎㅎ
딱딱한 의자는 싫어해서 폭신해보이는걸로 골랐는데 선택 잘한거같아요! 그리고 생각보다 앉으니까 튼튼해서 놀랐어욥 올라가서 일어서도 끄떡없음 ㅎ
접었다폈다 하기도 쉬워서 안쓸 때는 접어두고 보조의자로 써도 좋을거 같아요. 저렴한 가격에 잘샀네요~~",2,False
1744427456,5,2020.07.30,보조의자로 최고예요,"방에서 보조의자로 쓰려고 샀는데 사이즈도 딱 맞고 푹신해서 좋아요!!ㅎㅎ 부실할까봐 걱정했는데 생각보다 완전 튼튼하더라구요 근데 가볍기도 가벼워서 이리저리 쓰기 넘 편하네용~~색깔도 화면이랑 똑같아서 벽지랑 다른 가구들이랑 넘 잘어울리구요ㅎㅎ
펴고 접는 것도 완전 쉬워서 안쓸 때는 접어서 벽에다 세워두면 깔끔하고 좋아욤ㅎㅎ 무엇보다 로켓으로 시키니까 바로 다음날 와서 그게 젤 맘에 들었어요ㅋㅋㅋㅋㅋ 생각보다 훨씬 좋아서 의자 더 필요하면 재구매할 생각이예요ㅎㅎ",0,False
