product_id,ratings,reg_date,article_headline,article_content,help_count,is_photo_review
1353237308,3,2021.02.09,,싼티나용ㅠㅠ식탁이 너무 낮아서 일부러 최대한 낮은 의자를 찾아서 구매했는데.....제 화장대의자보다 낮고 작아요ㅋㅋ사이즈 불만은 없지만.. 뒤집어 보았을때 마감의 상태나 천의 질등이...오래는 못 갈거 같네요;;; 커버라도 따로 더 살수있는거 있었으면 좋겠어요,1,False
1353237308,4,2020.11.02,,"생각보다..낮아요
근데 화장만 간단하게 할때 쓰는거라 많이 불편하진 않아용",1,False
1353237308,4,2020.09.22,,비싸네요~~,1,False
1353237308,5,2020.09.06,강츄 원츄!!,"그린색 구매하고 너무 귀엽고 좋아서 보라색도 주문했어요.
소파 발받침용으로 주로 사용하고 딸램스툴로도 쓰고 너무 좋아여.
의자가 낮은편이라 짧은 다리 저한테 딱 좋아요 ㅋ",1,False
1353237308,5,2020.07.01,,"ㅎㅎ 앙증맞고 귀엽네요...
한샘 유로502 샀는데.. 거기 화장대에 40센치 높이의 의자만 사용가능하겠더라고요.
더 높으면 거울에 얼굴이 안보여요..
그래서 38센치인 이 의자를 선택했는데...
딱이네요~
생각보다 앙증맞고 작아보이는데...
사용에 불편함 없이 딱입니다",3,False
1353237308,5,2020.05.20,가볍고 추천합니다,가볍고 원하던 높이라 맘에 들어요 굿!!,2,False
