product_id,ratings,reg_date,article_headline,article_content,help_count,is_photo_review
4388370069,4,2021.04.21,편안하니 좋아요~~ㅋ,편안하니 좋은데 리퍼라고 했는데 녹슨부분이 그대로 있네요~ㅠ,0,False
4388370069,5,2021.05.15,그레이가 품절이라 색상 바꿧어요!,"집에 다른 물건들이 그레이라 고민하다가 주문한건데 품절이라...아쉽긴 했어요ㅠ
그래도 색상 변경 하자마자 바로 배송해 주셔서 바로 받아봣네요.

원래 이사가는 것 때문에 소파도 고민하다가 1년이 넘어버렸는데, 갑자기 접이식에 꽂혀서 찾아보다가 이 제품이 저렴해서 구매해봤어요.

블랙도 깔끔하고, 앉았을때 편해요!근데 허벅지가 조금 불편해서 앉는 부분에 쿠션이나, 두꺼운 방석 하나 깔면 진짜 편하게 앉아서 쉴 수 있을 것 같아요.

이사갈때는 천만 때서 버리거나, 아니면 이삿짐에 포함해도 전혀 부담스럽지 않고, 보관할때 접으니까 좁은 자취방에서더 너무 유용하네요!

추천드랴요!!",0,False
4388370069,5,2021.05.03,,,0,False
4388370069,5,2021.01.06,,,0,False
