product_id,ratings,reg_date,article_headline,article_content,help_count,is_photo_review
2039519829,5,2021.01.17,,,0,False
2039519829,5,2020.12.19,그림도 좋고,"다좋은데 바닥 검정고무가 빠져서 별점많이 뺏어요
문의 넣어놨는데 빨리 받았으면 좋겠네요
그럼 별점 회복시켜드릴게요

네 바로 담날 통째로 한개더와서 포장뜯으니 바로 검정고무스티커가 들어있어서 그것만빼고 회수하게 포장해서 밖에 내놨어요
사실 본품도 내용처럼 노란색 아니고 카키색인거 나중에 발견했지만
더럼 덜 타고 좋을거 같아서 걍 쓰기로 했어요
베란다에서 들어오는 위풍 직격으로 안 맞아서 넘좋고
내집에 품격을 높여줘서 좋고 줌으로 모임할때도 배경으로 딱일것 같아요
미국딸한테 사진보내주고 칭찬들으니 기쁘네요 ㅎㅎ
우리것은 좋은것이야",0,False
2039519829,5,2020.10.04,가격에 비해 고품격이서 좋았어요,,0,False
