product_id,ratings,reg_date,article_headline,article_content,help_count,is_photo_review
1761842666,3,2021.05.18,,,0,False
1761842666,4,2020.12.27,,,0,False
1761842666,4,2020.07.10,,생각했던 분위기랑 조금 차이는 있지만 그런대로 괜찮네요,0,False
1761842666,5,2021.03.23,,,0,False
1761842666,5,2021.01.18,중문설치완료,"배송예정일 보다 일찍 보내주셨어요
주문후 담날 발송하시고 그담날 받았습니다.
전화문의 여러번 드렸는데도 싫은 내색없이 친절히 응대해 주신점 정말 기분좋고 감사드립니다
여자분은 직원분이셨을까요? 남자분은 사장님으로 느껴졌는데 두분다 너무 친절하셨습니다.
상품설명꼼꼼히 잘읽고 센치 정확히 재서 주문서 넣으시면
비싼중문대신 혼자서도 쉽게 설치 가능한 중문이 생김니다.
잠시 머물다 이사할꺼라 저럼한 이 제품으로 결정했는데 촌스러우면 어쩌나 걱정했던 마음이 설치후 어찌나 기분 좋던지요
사장님이 말씀하신대로 이사갈때 간단히 피스풀러서 가져갈수 있겠더라구요
여기가 알아본곳중 젤 저렴한거 같아요
가격대비 아주 훌륭합니다",1,False
1761842666,5,2021.01.12,,좋고 다른데보다 저렴함,0,False
