product_id,ratings,reg_date,article_headline,article_content,help_count,is_photo_review
5399389235,5,2021.05.19,술먹고 사이즈를 재지말자.,"이사오고나서 룸메랑 맥주좀 마시고 사이즈를 쟀다가 23센치나 모자라게 주문해버린 대참사 일어남. 어이없어서 가벽 붙잡고 한참웃다보니
현실로 정신차림ㅋㅋㅋ?ㅋㅋ어떻게하나
진짜실례를 무릎쓰고 아침에 연락오겠지 싶어서 이러이러해서 사이즈가 모자란데 모자란 사이즈 만큼 나무판을 더주문할수있냐고 문자드렸더니 전화옴ㅜㅜ 너무너무 죄송하고 감사했음.
생산부에 연락해서 연락주신다고하셨고 문자랑 전화로 상담해주신결과
나무를 덧대는것 위험하니 판매예정인?(확실치 않음. 기억력짧음) 20센치 정도의 튼튼한 봉을 보내주신다고함.
할렐루야. 딱임 오져씀 구세주셨음. 우리는 원래 다리를 떼버리고 새로보내주신 봉을 끼우고 밑부분을 위로 올려서 천장에 지지했음.
살짝모자란건 1.8센치? 보내주신 검정색 마개를 끼워서 단디단디 하게 고정했음. 이사온집이 중문이 없는 단독주택에 고양이 4마리중 몇먗이 호시탐탐 탈출을 꿈꾸는 빠삐용 1. 빠삐용2. 빠삐용3. (한마리는 공쥬라서 그런거 꿈도안꿈) 라서 방묘문이 절실했음ㅋㅋㅋ
그래서 가벽을 세우고 방묘문을 설치함. 방묘문으로 나무가 살짝휘긴핺지만 버텨줄거라는 근자감을 지니고있음.ㅋㅋㅋㅋ
직원분은 매우 친절하고 제품은 주문제작인데 담날바로 출고되는 K국의 위대한 배송의 힘을 느낄수있음. 택배 기사님 감사합니다.
그리고 나무재질임 나무재질이 왜 좋은지암? 가볍기때문임 철판은 무거움 재위치 잡기가 힘들고 이동도 힘듬. 우리는 우리가 들고 옮길걸 예상해서 나무로 제작함. 나무인데도 예쁘고 타공도 굿이고 타공에거는 핀사면 수납?도간단히 가능함 근데 서비스라고 몇개더 보내주심. 담당자님 천사임 계신곳이 어딘지 몰라서 동서남북으로 절할게요 행복하시고 사는동안 많이버세요.
이거사라 가벽 사려는 사람. 이동이 원할. 디자인예쁨. 배송빠름. 담당자님 칼답. 알겠지?
그래도 밤엔 연락하지말자 나처럼.
애시당초에 술먹고 사이즈 재지말자.
안녕 난설치 끝나서 맥주마시러간다 안뇽~*",5,False
5399389235,5,2021.05.15,,"아주 만족합니다~
주방에 김치냉장고 자리가 없어서
냉장고옆에 김치냉장고 세우고 거실쪽이라
보기 흉해서 이것 저것 고르고 고르다
가벽설치 했는데~거실 분위기도 더 좋아지고
인테리어 효과도 있고 타공판이라 후크로
걸수도 있고 저는 만족합니다",4,False
